Fuel Type Code,Station Name,Street Address,Intersection Directions,City,State,ZIP,Plus4,Station Phone,Status Code,Expected Date,Groups With Access Code,Access Days Time,Cards Accepted,EV Level1 EVSE Num,EV Level2 EVSE Num,EV DC Fast Count,EV Other Info,EV Network,EV Network Web,Geocode Status,Latitude,Longitude,Date Last Confirmed,ID,Updated At,Owner Type Code,Federal Agency ID,Federal Agency Name,Open Date,EV Connector Types
ELEC,Buffalo State - Cleveland Hall,1300 Elmwood Ave,,Buffalo,NY,14222,,716-878-3041,E,,Public,24 hours daily,,,2,,,Non-Networked,,GPS,42.932067,-78.881370,03/14/2024,104734,2024-03-14 18:02:10,P,,,02/01/2018,J1772
ELEC,Niagara Power Vista,5777 Lewiston Rd,,Lewiston,NY,14092,,,E,,Public,24 hours daily,,,6,,,Non-Networked,,GPS,43.140730,-79.037348,08/15/2024,147095,2024-08-15 19:57:12,SG,,,10/01/2019,J1772
ELEC,Hatchet Hardware of Waterford,42 Saratoga Ave,,Waterford,NY,12188,,888-356-8911,E,,Public,24 hours daily,,,2,,,FLO,https://flo.ca/,GPS,42.782254,-73.696148,10/29/2024,165117,2024-10-29 03:32:20,,,,08/11/2020,J1772
ELEC,PEPSICO INC STATION 3,100 E Stevens Ave,,Valhalla,NY,10595,,888-758-4389,E,,Public,24 hours daily,,,2,,,ChargePoint Network,http://www.chargepoint.com/,GPS,41.095104,-73.774660,10/29/2024,175241,2024-10-29 01:12:11,,,,01/27/2021,J1772
ELEC,SUNY BUFFALO PARKER 7,185 Hayes Rd,,Buffalo,NY,14214,,888-758-4389,E,,Public,24 hours daily,,,2,,,ChargePoint Network,http://www.chargepoint.com/,GPS,42.951165,-78.822439,10/29/2024,182224,2024-10-29 01:24:30,,,,01/27/2021,J1772
ELEC,LEVITON MELVILLE 1,201 N Service Rd,BACK PARKING LOT,Melville,NY,11747,,888-758-4389,E,,Public,24 hours daily,,,2,,,ChargePoint Network,http://www.chargepoint.com/,GPS,40.783554,-73.419929,10/29/2024,183197,2024-10-29 01:08:13,,,,01/27/2021,J1772
ELEC,CHEEKTOWAGA BROADWAY #2,3301 Broadway,,Cheektowaga,NY,14227,,888-758-4389,E,,Public,24 hours daily,,,1,,,ChargePoint Network,http://www.chargepoint.com/,GPS,42.902643,-78.753096,10/29/2024,183764,2024-10-29 01:25:03,,,,02/04/2021,J1772
ELEC,SARATOGA CASINO STATION 4,342 Jefferson Street,,Saratoga Springs,NY,12866,,888-758-4389,E,,Public,24 hours daily,,,2,,,ChargePoint Network,http://www.chargepoint.com/,GPS,43.062278,-73.775976,10/29/2024,190794,2024-10-29 01:02:48,,,,06/08/2021,J1772
ELEC,320 Mason Ave,320 Mason Ave,,New York,NY,10305,,888-356-8911,E,,Public,24 hours daily,,,4,,,FLO,https://flo.ca/,GPS,40.584984,-74.088044,10/29/2024,223526,2024-10-29 03:33:24,,,,07/15/2022,J1772
ELEC,NYS Comptroller Office Garage,110 State Street,,Albany,NY,12207,,1-844-623-1001,E,,Public,24 hours daily,,,8,,,LIVINGSTON,https://www.solution.energy,GPS,42.649360,-73.754350,10/29/2024,252716,2024-10-29 04:05:51,,,,12/09/2022,J1772
ELEC,WESTBROOKE WBC LODEN RIGHT,6 Loden Ln,,Rochester,NY,14623,,888-758-4389,E,,Public,24 hours daily,,,2,,,ChargePoint Network,http://www.chargepoint.com/,GPS,43.077368,-77.651570,10/29/2024,257135,2024-10-29 01:58:10,,,,03/26/2023,J1772
ELEC,KOEPPEL HYUNDAI CPE250 2,34- 45 43rd St,,Queens,NY,11101,,888-758-4389,E,,Public,24 hours daily,,,,1,,ChargePoint Network,http://www.chargepoint.com/,GPS,40.754044,-73.919245,10/29/2024,261699,2024-10-29 02:00:49,,,,06/01/2023,CHADEMO J1772COMBO
ELEC,Patchogue - Municipal parking lot,Oak Street,,Patchogue,NY,11772,,888-356-8911,E,,Public,24 hours daily,,,4,,,FLO,https://flo.ca/,GPS,40.766962,-73.012854,10/29/2024,262332,2024-10-29 03:33:55,,,,06/07/2023,J1772
ELEC,CENTERS HEALTHC EV-1,170 Buffalo Avenue,Lot 1,Brooklyn,NY,11213,,888-758-4389,E,,Public,24 hours daily,,,2,,,ChargePoint Network,http://www.chargepoint.com/,GPS,40.673435,-73.926002,10/29/2024,329797,2024-10-29 02:14:43,,,,03/05/2024,J1772
ELEC,TOYOTA MASSAPEQ WEST,3660 NY-27,,Seaford,NY,11783,,888-758-4389,E,,Public,24 hours daily,,,2,,,ChargePoint Network,http://www.chargepoint.com/,GPS,40.673957,-73.497310,10/29/2024,331729,2024-10-29 01:45:00,,,,04/05/2024,J1772
ELEC,Bus Garage,2636 Genesee Street,,Retsof,NY,14539,,1-888-222-6618,E,,Public,,,,2,,,NOODOE,https://www.noodoe.com,GPS,42.830676,-77.888898,10/29/2024,333281,2024-10-29 03:58:24,,,,04/22/2024,J1772
ELEC,2360 Amsterdam Ave - Basement 2,2360 Amsterdam Ave,,New York,NY,10033,,813-492-5220,E,,Public,24 hours daily,A ANDROID_PAY APPLE_PAY D M V,,10,,,EVOKE,https://evokesystems.com/,GPS,40.846036,-73.933078,10/11/2024,356969,2024-10-11 18:09:31,P,,,12/03/2022,J1772
ELEC,HOSELTONCHEVY01 STATION 1,909 Fairport Rd,Near service bay doors,East Rochester,NY,14445,,888-758-4389,E,,Public,24 hours daily,,,2,,,ChargePoint Network,http://www.chargepoint.com/,GPS,43.101796,-77.480894,10/29/2024,203290,2024-10-29 01:36:57,,,,12/30/2021,J1772
ELEC,BURNS MGT CARRIAGE 1,21 Carr Rd,,Saratoga Springs,NY,12866,,888-758-4389,E,,Public,24 hours daily,,,2,,,ChargePoint Network,http://www.chargepoint.com/,GPS,43.131242,-73.752015,10/29/2024,121487,2024-10-29 01:00:55,,,,04/16/2019,J1772
ELEC,GGMC Parking MODA - Tesla Destination,89-14 Parsons Blvd,,Jamaica,NY,11432,,877-798-3752,E,,Public,,,,7,,,Tesla Destination,https://www.tesla.com/destination-charging,200-9,40.705133,-73.801443,07/01/2024,150686,2024-10-16 16:58:41,P,,,10/17/2018,J1772 TESLA
ELEC,Kings Nissan,2758 Coney Island Ave,,Brooklyn,NY,11235,,718-376-0538,E,,Public - Call ahead,Dealership business hours; Nissan vehicle use only,,,1,,,Non-Networked,,200-9,40.589167,-73.960707,02/12/2024,44329,2024-02-12 15:25:05,P,,,11/30/2011,J1772
ELEC,KIA ELMIRA CT-4020-1,951 County Rte 64,,Big Flats,NY,14903,,888-758-4389,E,,Public,24 hours daily,,,2,,,ChargePoint Network,http://www.chargepoint.com/,GPS,42.155190,-76.871370,10/29/2024,206305,2024-10-29 01:37:51,,,,02/12/2022,J1772
ELEC,Auto Outlets of Wolcott,5671 Whiskey Hill Rd,,Wolcott,NY,14590,,,E,,Public,24 hours daily,,,6,,,SWTCH,https://swtchenergy.com/,200-8,43.208490,-76.815210,03/14/2024,251744,2024-03-14 18:02:10,P,,,08/24/2022,J1772
ELEC,Exit 21 (Catskill),370 NY-23,,Catskill,NY,12451,,866-816-7584,E,,Public,24 hours daily,,,2,,,EV Connect,http://evconnect.com/,GPS,42.246692,-73.885289,10/29/2024,168464,2024-10-29 03:09:24,,,,08/17/2020,J1772
ELEC,MOHAWK HARBOR01 STATION #3,220 Harborside Blvd,Parking deck,Schenectady,NY,12308,,888-758-4389,E,,Public,24 hours daily,,,2,,,ChargePoint Network,http://www.chargepoint.com/,GPS,42.825252,-73.931190,10/29/2024,181903,2024-10-29 01:22:30,,,,01/27/2021,J1772
ELEC,Locey Lane,1 Locey Ln,,Central Valley,NY,10917,,866-816-7584,E,,Public,24 hours daily,,,4,,,EV Connect,http://evconnect.com/,GPS,41.315190,-74.135494,10/29/2024,158614,2024-10-29 03:09:13,,,,02/20/2020,J1772
ELEC,Gateway to Mount Beacon,788 Wolcott Ave,,Beacon,NY,12508,,866-816-7584,E,,Public,24 hours daily,,,2,,,EV Connect,http://evconnect.com/,GPS,41.492889,-73.958454,10/29/2024,230953,2024-10-29 03:10:22,,,,09/30/2022,J1772
ELEC,46-71 30th Place,46-71 30th Place,,Long Island City,NY,11101,,888-356-8911,E,,Public,24 hours daily,,,6,,,FLO,https://flo.ca/,GPS,40.743643,-73.936591,10/29/2024,226845,2024-10-29 03:32:39,,,,09/01/2022,J1772
ELEC,OYO Hotel Buena Vista Delhi,18718 State Highway 28,,Delhi,NY,13753,,949-945-2000,E,,Public,24 hours daily,A ACCOUNT_BALANCE ANDROID_PAY APPLE_PAY CREDIT D M V,,2,,,EVGATEWAY,http://evgateway.com/,200-8,42.265190,-74.919680,05/09/2024,334076,2024-05-09 20:32:20,P,,,06/22/2023,J1772
ELEC,Westminster Place - West,7475 Morgan Rd,,Westminster,NY,13090,,1-844-623-1001,E,,Public,24 hours daily,,,10,,,LIVINGSTON,https://www.solution.energy,GPS,43.132300,-76.207760,10/29/2024,350598,2024-10-29 04:06:44,,,,07/16/2024,J1772
ELEC,RIVERHEAD RIVER 2 #1,1947 Old Country Road,Tanger 2 - Suite 906. Three duel level chargers located in the parking lot between Cole Haan and Nike.,Riverhead,NY,11901,,888-758-4389,E,,Public,24 hours daily,,,2,,,ChargePoint Network,http://www.chargepoint.com/,GPS,40.919684,-72.712696,10/29/2024,180156,2024-10-29 00:37:49,,,,01/27/2021,J1772
ELEC,NEW HARTFORD GW-1 1.1,8635 Clinton St,,New Hartford,NY,13413,,888-758-4389,E,,Public,24 hours daily,,,2,,,ChargePoint Network,http://www.chargepoint.com/,GPS,43.092808,-75.316605,10/29/2024,174768,2024-10-29 01:06:34,,,,01/27/2021,J1772
ELEC,Ridgedale Manor - 300's,55 Pennels Dr.,Parking lot behind townhouses 314-320,Greece,NY,14626,,1-844-623-1001,E,,Public,24 hours daily,,,8,,,LIVINGSTON,https://www.solution.energy,GPS,43.212060,-77.707140,10/29/2024,350792,2024-10-29 04:06:45,,,,07/19/2024,J1772
ELEC,Quaker Street Branch Library,133 Bull St,,Delanson,NY,12053,,1-844-623-1001,E,,Public,24 hours daily,,,4,,,LIVINGSTON,https://www.solution.energy,GPS,42.731940,-74.193340,10/29/2024,223250,2024-10-29 04:06:09,,,,02/01/2022,J1772
ELEC,CEB Bldg,1 ResearchCircle,,Niskayuna,NY,12309,,800-663-5633,E,,Public,24 hours daily,,,13,,,Blink Network,http://www.blinkcharging.com/,GPS,42.828910,-73.874200,10/29/2024,148043,2024-10-29 00:09:16,,,,11/01/2018,J1772
ELEC,3 College Rd - Tesla Destination,3 College Rd,,Monsey,NY,10952,,877-798-3752,E,,Public,,,,6,,,Non-Networked,,GPS,41.110744,-74.090188,07/01/2024,358926,2024-10-16 16:58:41,P,,,,J1772
ELEC,ECS Main Office - Parking Lot,55 9th St,,Brooklyn,NY,11215,,813-492-5220,E,,Public,24 hours daily,A ANDROID_PAY APPLE_PAY D M V,,2,,,EVOKE,https://evokesystems.com/,GPS,40.674200,-73.995800,10/11/2024,357057,2024-10-11 18:09:31,P,,,11/30/2021,J1772
ELEC,HVCC - Lot A,80 Vandenburgh Ave,,Troy,NY,12180,,1-844-623-1001,E,,Public,24 hours daily,,,6,,,LIVINGSTON,https://www.solution.energy,GPS,42.696830,-73.687880,10/29/2024,334512,2024-10-29 04:05:25,,,,05/02/2024,J1772
ELEC,2112-2124 NY 7 EV2,2114 NY-7 2114 New York 7,Main Parking Lot EV 2,Troy,NY,12180,,888-758-4389,E,,Public,24 hours daily,,,2,,,ChargePoint Network,http://www.chargepoint.com/,GPS,42.807059,-73.545194,10/29/2024,190055,2024-10-29 01:28:46,,,,05/25/2021,J1772
ELEC,Old Westbury Golf and Country Club - Tesla Destination,270 Wheatley Road,,Old Westbury,NY,11568,,877-798-3752,E,,Public,,,,3,,,Tesla Destination,https://www.tesla.com/destination-charging,200-9,40.802151,-73.601366,07/01/2024,168994,2024-10-16 16:58:41,P,,,12/16/2015,J1772 TESLA
ELEC,LARKIN726RRAMPP LARKIN 3,726 Exchange St,,Buffalo,NY,14210,,888-758-4389,E,,Public,Mon 5:00pm - 10:00pm; Tue 5:00pm - 10:00pm; Wed 5:00pm - 10:00pm; Thu 5:00pm - 10:00pm; Fri 5:00pm - 10:00pm; Sat 8:00am - 10:00pm; Sun 8:00am - 10:00pm,,,2,,,ChargePoint Network,http://www.chargepoint.com/,GPS,42.874883,-78.849816,10/29/2024,182985,2024-10-29 01:00:03,,,,01/27/2021,J1772
ELEC,Pinnacle North,20 North Shore Blvd.,,Canandaigua,NY,14424,,888-998-2546,E,,Public,24 hours daily,,,4,,,Blink Network,http://www.blinkcharging.com/,GPS,42.876493,-77.269362,10/29/2024,200490,2024-10-29 00:13:43,,,,11/01/2021,J1772
ELEC,Pine Brook Fitness,130 Rhodes,,New Rochelle,NY,10801,,1-844-623-1001,E,,Public,24 hours daily,,,2,,,LIVINGSTON,https://www.solution.energy,GPS,40.917540,-73.776620,10/29/2024,334489,2024-10-29 04:06:20,,,,05/02/2024,J1772
ELEC,Hatchet Hardware of Niskayuna,1448 Balltown Road,,Niskayuna,NY,12309,,888-356-8911,E,,Public,24 hours daily,,,6,,,FLO,https://flo.ca/,GPS,42.814289,-73.892131,10/29/2024,171482,2024-10-29 03:33:23,,,,01/27/2021,J1772
ELEC,Gates Express and Deli,2206 Buffalo Rd,,Rochester,NY,14624,,949-945-2000,E,,Public,24 hours daily,A ACCOUNT_BALANCE ANDROID_PAY APPLE_PAY CREDIT D M V,,4,,,EVGATEWAY,http://evgateway.com/,200-8,43.147650,-77.710760,05/09/2024,334123,2024-05-09 20:32:20,P,,,11/10/2023,J1772
ELEC,GreenSpark Solar,317 NY-104,,Ontario,NY,14519,,585-265-2384,E,,Public - Credit card at all times,24 hours daily; priority access given to employees,A D Debit M V,,6,,,Non-Networked,,GPS,43.226726,-77.363446,04/14/2024,226513,2024-04-14 22:11:34,P,,,08/25/2022,J1772
ELEC,NAA NAA 6,2000 Dealer Drive,,Newburgh,NY,12550,,888-758-4389,E,,Public,24 hours daily,,,1,,,ChargePoint Network,http://www.chargepoint.com/,GPS,41.517660,-74.093727,10/29/2024,347840,2024-10-29 02:20:05,,,,06/14/2024,J1772
ELEC,Village of Arcade - Municipal Parking Lot,17 Church St,,Arcade,NY,14009,,585-492-1111,E,,Public,24 hours daily,,,2,,,Non-Networked,,GPS,42.534763,-78.423960,04/14/2024,157963,2024-04-14 22:11:34,P,,,05/15/2020,J1772
ELEC,RRH CARTER 1 FL GW1,1415 Portland Ave,,Rochester,NY,14621,,888-758-4389,E,,Public,24 hours daily,,,2,,,ChargePoint Network,http://www.chargepoint.com/,GPS,43.191475,-77.589269,10/29/2024,174458,2024-10-29 01:03:42,,,,01/27/2021,J1772
ELEC,Icon Parking 101 W 15th - Tesla Destination,101 W 15th St,,New York,NY,10011,,877-798-3752,E,,Public,,,,4,,,Tesla Destination,https://www.tesla.com/destination-charging,200-8,40.738371,-73.996880,07/01/2024,114992,2024-10-16 16:58:41,P,,,08/10/2018,TESLA
ELEC,Village of Voorheesville Public Parking,29 Voorheesville Ave,,Voorheesville,NY,12186,,518-765-2692,E,,Public - Credit card at all times,24 hours daily,A D Debit M V,,2,,,Non-Networked,,GPS,42.651438,-73.928356,03/14/2024,229082,2024-03-14 18:02:10,P,,,09/17/2022,J1772
ELEC,Simon-Simth Haven Mall,313 SMITH HAVEN MALL,,Lake Grove,NY,11755,,833-632-2778,E,,Public,24 hours daily,,,1,3,,Electrify America,https://www.electrifyamerica.com/,GPS,40.862450,-73.128750,10/29/2024,169949,2024-10-29 02:57:15,,,,12/05/2020,J1772 J1772COMBO
ELEC,SGE - St. George Courthouse,54 Central Ave,,Staten Island,NY,10301,,866-816-7584,E,,Public,Mon 6:00am - 10:00pm; Tue 6:00am - 10:00pm; Wed 6:00am - 10:00pm; Thu 6:00am - 10:00pm; Fri 6:00am - 10:00pm; Sat 12:00am - 12:00am; Sun 12:00am - 12:00am,,,3,,,EV Connect,http://evconnect.com/,GPS,40.639469,-74.076912,10/29/2024,65296,2024-10-29 03:08:54,,,,08/08/2016,J1772
ELEC,MHM WALL STREET 4,1 Wall St,Rear of office,Albany,NY,12205,,888-758-4389,E,,Public,24 hours daily,,,2,,,ChargePoint Network,http://www.chargepoint.com/,GPS,42.741673,-73.843315,10/29/2024,235731,2024-10-29 01:46:19,,,,11/05/2022,J1772
ELEC,TWN POUND RIDGE STATION #1,80 Westchester Ave,,Pound Ridge,NY,10576,,888-758-4389,E,,Public,24 hours daily,,,2,,,ChargePoint Network,http://www.chargepoint.com/,GPS,41.190993,-73.553184,10/29/2024,188058,2024-10-29 01:27:54,,,,04/28/2021,J1772
ELEC,STONY BROOK UNV ESS,Campus Dr,,Stony Brook,NY,11790,,888-758-4389,E,,Public,24 hours daily,,,2,,,ChargePoint Network,http://www.chargepoint.com/,GPS,40.914369,-73.125742,10/29/2024,162403,2024-10-29 00:37:06,,,,06/12/2020,J1772
ELEC,STONY BROOK UNV AERTC 1,1000 Innovation Road,,Stony Brook,NY,11790,,888-758-4389,E,,Public,24 hours daily,,,2,,,ChargePoint Network,http://www.chargepoint.com/,GPS,40.904154,-73.134871,10/29/2024,162348,2024-10-29 00:50:39,,,,06/12/2020,J1772
ELEC,MONTANTE SOLAR STATION 1,1277 Delaware Ave,Parking garage first floor,Buffalo,NY,14209,,888-758-4389,E,,Public,24 hours daily,,,2,,,ChargePoint Network,http://www.chargepoint.com/,GPS,42.918166,-78.867129,10/29/2024,217204,2024-10-29 01:43:02,,,,05/08/2022,J1772
ELEC,MOHAWK CHEVY MOHAWKCHEVY3,639 67,,Malta,NY,12020,,888-758-4389,E,,Public,24 hours daily,,,2,,,ChargePoint Network,http://www.chargepoint.com/,GPS,42.968958,-73.811079,10/29/2024,217437,2024-10-29 01:41:40,,,,05/13/2022,J1772
ELEC,The Preston House & Hotel - Tesla Destination,428 E Main St,,Riverhead,NY,11901,,877-798-3752,E,,Public,,,,2,,,Non-Networked,,GPS,40.918929,-72.656716,07/01/2024,359361,2024-10-16 16:58:41,P,,,,J1772
ELEC,30 Becker,30 Becker Rd,,West Henrietta,NY,14586,,1-888-717-4544,E,,Public,24 hours daily,,,10,,,CHARGESMART_EV,https://chargesmartev.com,GPS,43.043757,-77.673904,10/29/2024,347947,2024-10-29 04:09:29,,,,06/14/2024,J1772
ELEC,Bradley Pl Apts - Parking Lot,56 Davis St,,Phoenix,NY,13135,,813-492-5220,E,,Public,24 hours daily,A ANDROID_PAY APPLE_PAY D M V,,2,,,EVOKE,https://evokesystems.com/,GPS,43.234800,-76.300500,10/11/2024,357063,2024-10-11 18:09:31,P,,,11/15/2021,J1772
ELEC,GLPIZZA.COM GL PIZZA LEFT,444 Indian Church Rd,Charger 1 West Parking Area,Buffalo,NY,14224,,888-758-4389,E,,Public,24 hours daily,,,2,,,ChargePoint Network,http://www.chargepoint.com/,GPS,42.854747,-78.789976,10/29/2024,302804,2024-10-29 02:04:42,,,,07/19/2023,J1772
ELEC,VANKLEECKS TIRE VANLKEECKS TIRE,1987 Ulster Ave,,Lake Katrine,NY,12449,,888-758-4389,E,,Public,24 hours daily,,,2,,,ChargePoint Network,http://www.chargepoint.com/,GPS,41.991154,-73.986860,10/29/2024,143464,2024-10-29 01:03:23,,,,08/15/2019,J1772
ELEC,STATE STREET CHARGE 2,422 E State St,,Olean,NY,14760,,888-758-4389,E,,Public,24 hours daily,,,2,,,ChargePoint Network,http://www.chargepoint.com/,GPS,42.077148,-78.424655,10/29/2024,346403,2024-10-29 02:17:05,,,,05/17/2024,J1772
ELEC,Yellowstone Blvd - Garage Floor A,66-36 Yellowstone Blvd,,Forest Hills,NY,11375,,813-492-5220,E,,Public,24 hours daily,A ANDROID_PAY APPLE_PAY D M V,,70,,,EVOKE,https://evokesystems.com/,GPS,40.728588,-73.853577,10/11/2024,357086,2024-10-11 18:09:31,P,,,01/04/2022,J1772
ELEC,THE HYDE STATION 2,153 Warren St,Side parking lot of the Hyde museum,Glens Falls,NY,12801,,888-758-4389,E,,Public,24 hours daily,,,2,,,ChargePoint Network,http://www.chargepoint.com/,GPS,43.310382,-73.634822,10/29/2024,221196,2024-10-29 01:43:19,,,,06/11/2022,J1772
ELEC,Ruge's Chevrolet,3692 Route 44,,Millbrook,NY,12545,,845-444-3039,E,,Public - Call ahead,Dealership business hours; for customer use only,,,1,,,Non-Networked,,200-9,41.791563,-73.659717,03/08/2023,53442,2024-01-31 22:07:01,P,,,10/01/2012,J1772
ELEC,BMWHV HV FAST CHARGER,2066-20 South Rd,By repair bay,Poughkeepsie,NY,12601,,888-758-4389,E,,Public,24 hours daily,,,,1,,ChargePoint Network,http://www.chargepoint.com/,GPS,41.630563,-73.914486,10/29/2024,220961,2024-10-29 01:44:17,,,,06/08/2022,CHADEMO J1772COMBO
ELEC,GREATNECK PLAZA PLAZA CENTER,2 Gussack Plaza,"Village of Great Neck Plaza ""Plaza Centre"" parking garage, follow traffic flow signs back down to street level B, station to the right.",Great Neck,NY,11022,,888-758-4389,E,,Public,24 hours daily,,,2,,,ChargePoint Network,http://www.chargepoint.com/,GPS,40.787424,-73.729999,10/29/2024,250806,2024-10-29 00:47:27,,,,01/17/2023,J1772
ELEC,3500 Dekalb Ave,3500 Dekalb Ave,,Bronx,NY,10467,,888-356-8911,E,,Public,24 hours daily,,,2,,,FLO,https://flo.ca/,GPS,40.882337,-73.880265,10/29/2024,201636,2024-10-29 03:32:17,,,,11/25/2021,J1772
ELEC,EVolve NY Plattsburgh,25 Consumer Square,,Plattsburgh,NY,12901,,833-632-2778,E,,Public,24 hours daily,,,,4,,Electrify America,https://www.electrifyamerica.com/,GPS,44.694080,-73.485290,10/29/2024,202274,2024-10-29 02:56:06,,,,12/09/2021,CHADEMO J1772COMBO
ELEC,COLACINO INUSTR COLACINO 3,126 Harrison Street,Off Harrison St in front of Colacino Industries,Newark,NY,14513,,888-758-4389,E,,Public,24 hours daily,,,2,,,ChargePoint Network,http://www.chargepoint.com/,GPS,43.048900,-77.093970,10/29/2024,174196,2024-10-29 01:04:30,,,,01/27/2021,J1772
ELEC,Holiday Inn Utica (Burrstone Inn),1777 Burrstone Rd,,New Hartford,NY,13413,,866-816-7584,E,,Public,24 hours daily,,,2,,,EV Connect,http://evconnect.com/,GPS,43.094105,-75.284895,10/29/2024,195713,2024-10-29 03:09:02,,,,09/03/2021,J1772
ELEC,HAMPTON INN STATION 4,1120 South Ave,Side of Hampton Inn & Suites,Staten Island,NY,10314,,888-758-4389,E,,Public,24 hours daily,,,2,,,ChargePoint Network,http://www.chargepoint.com/,GPS,40.612678,-74.178885,10/29/2024,181661,2024-10-29 01:21:03,,,,01/27/2021,J1772
ELEC,New Tech Energy,800 Ocean Pkwy,,Brooklyn,NY,11230,,833-692-6787,E,,Public - Credit card at all times,Contact station for hours of availability.,A ANDROID_PAY APPLE_PAY CREDIT D M,,1,,,AMPUP,https://ampup.io/,200-9,40.628872,-73.971992,10/11/2022,230231,2023-02-14 15:54:11,P,,,09/15/2022,J1772
ELEC,The Sherburne News,17 E State St,,Sherburne,NY,13460,,607-674-6071,E,,Public - Credit card at all times,24 hours daily,A D Debit M V,,2,,,Non-Networked,,GPS,42.678484,-75.497735,03/08/2023,197539,2024-01-31 22:07:01,P,,,10/04/2021,J1772
ELEC,George's Island Park,Dutch Street,,Montrose,NY,10548,,888-356-8911,E,,Public,24 hours daily,,,12,,,FLO,https://flo.ca/,GPS,41.236867,-73.938597,10/29/2024,353052,2024-10-29 03:34:37,,,,08/18/2024,J1772
ELEC,TDC Building 6,1483 Military Turnpike,,Plattsburgh,NY,12901,,1-844-623-1001,E,,Public,24 hours daily,,,2,,,LIVINGSTON,https://www.solution.energy,GPS,44.689780,-73.509920,10/29/2024,324870,2024-10-29 04:06:16,,,,11/10/2023,J1772
ELEC,Kendal at Ithaca 1 (South Lot),2230 N Triphammer Rd,,Ithaca,NY,14850,,1-888-717-4544,E,,Public,24 hours daily,,,4,,,CHARGESMART_EV,https://chargesmartev.com,GPS,42.474763,-76.484843,10/29/2024,347357,2024-10-29 04:09:19,,,,06/04/2024,J1772
ELEC,TOB CHARGERS EV STATION 1,1 Independence Hill,,Farmingville,NY,11738,,888-758-4389,E,,Public,24 hours daily,,,2,,,ChargePoint Network,http://www.chargepoint.com/,GPS,40.845511,-73.015725,10/29/2024,185143,2024-10-29 01:22:57,,,,02/18/2021,J1772
ELEC,HEATHERWOOD SUNRIVER,201 Jerusalem Hollow Rd,In front of mailboxes and dog run next to building 4,Manorville,NY,11949,,888-758-4389,E,,Public,24 hours daily,,,2,,,ChargePoint Network,http://www.chargepoint.com/,GPS,40.825446,-72.811230,10/29/2024,308794,2024-10-29 02:07:36,,,,09/09/2023,J1772
ELEC,SIENA COLLEGE FOY HALL EVSE2,Friars Dr,rear parking lot of Foy Hall,Latham,NY,12110,,888-758-4389,E,,Public,24 hours daily,,,2,,,ChargePoint Network,http://www.chargepoint.com/,GPS,42.719470,-73.753160,10/29/2024,193845,2024-10-29 01:31:15,,,,08/13/2021,J1772
ELEC,NORTHTOWN CENTE NORTHTOWN CENTE,1615 Amherst Manor Dr,,Buffalo,NY,14221,,888-758-4389,E,,Public,24 hours daily,,,2,,,ChargePoint Network,http://www.chargepoint.com/,GPS,42.995621,-78.783178,10/29/2024,213340,2024-10-29 01:41:58,,,,04/02/2022,J1772
ELEC,Stevens Manor East,644 Silver Lake-Scotchtown Road,,Middletown,NY,10941,,1-844-623-1001,E,,Public,24 hours daily,,,8,,,LIVINGSTON,https://www.solution.energy,GPS,41.476270,-74.377120,10/29/2024,334473,2024-10-29 04:06:23,,,,05/02/2024,J1772
ELEC,Metro Ford,3601 State St,,Schenectady,NY,12304,,1-844-623-1001,E,,Public,24 hours daily,,,6,2,,LIVINGSTON,https://www.solution.energy,GPS,42.770870,-73.892330,10/29/2024,350369,2024-10-29 04:06:40,,,,07/11/2024,J1772 J1772COMBO
ELEC,Quik Park 82nd Street LLC - Tesla Destination,350 E. 82nd St,,New York,NY,10028,,877-798-3752,E,,Public,,,,3,,,Tesla Destination,https://www.tesla.com/destination-charging,200-9,40.774511,-73.952039,07/01/2024,115108,2024-10-16 16:58:41,P,,,11/20/2015,J1772 TESLA
ELEC,854ELLICOTT 854 ELLICOTT 2,854 Ellicott St,Near main entrance,Buffalo,NY,14203,,888-758-4389,E,,Public,24 hours daily,,,2,,,ChargePoint Network,http://www.chargepoint.com/,GPS,42.901762,-78.867248,10/29/2024,180117,2024-10-29 00:55:33,,,,01/27/2021,J1772
ELEC,KINGSTON VISITORS CENTER,2 Broadway,Free Parking,Kingston,NY,12401,,888-758-4389,E,,Public,24 hours daily,,,2,,,ChargePoint Network,http://www.chargepoint.com/,GPS,41.918516,-73.982758,10/29/2024,162261,2024-10-29 00:54:51,,,,06/12/2020,J1772
ELEC,Icon Parking 205 E 63rd St - Tesla Destination,205 E 63rd St,,Manhattan,NY,10065,,877-798-3752,E,,Public,,,,2,,,Tesla Destination,https://www.tesla.com/destination-charging,200-8,40.763981,-73.964368,07/01/2024,114974,2024-10-16 16:58:41,P,,,10/20/2016,TESLA
ELEC,The Museum on Blue Mountain Lake,9097 NY-30,,Blue Mountain Lake,NY,12812,,1-844-623-1001,E,,Public,24 hours daily,,,4,,,LIVINGSTON,https://www.solution.energy,GPS,43.869120,-74.432220,10/29/2024,324876,2024-10-29 04:05:37,,,,06/21/2023,J1772
ELEC,Middletown Honda Public,520 New York 211,,Middletown,NY,10941,,888-998-2546,E,,Public,24 hours daily,,,1,,,Blink Network,http://www.blinkcharging.com/,GPS,41.460958,-74.374590,10/29/2024,346625,2024-10-29 00:21:27,,,,04/01/2024,J1772
ELEC,TSS ALBANY STATIONS 1 & 2,2 Commerce Park Dr,first pedestal nearest 2nd parking lot entrance,Schenectady,NY,12309,,888-758-4389,E,,Public,24 hours daily,,,2,,,ChargePoint Network,http://www.chargepoint.com/,GPS,42.832880,-73.903920,10/29/2024,183223,2024-10-29 01:08:29,,,,01/27/2021,J1772
ELEC,CITY OF BEACON VAN NYDECK AVE,25 Van Nydeck Ave,,Beacon,NY,12508,,888-758-4389,E,,Public,24 hours daily,,,2,,,ChargePoint Network,http://www.chargepoint.com/,GPS,41.502022,-73.965812,10/29/2024,311057,2024-10-29 02:07:21,,,,09/20/2023,J1772
ELEC,The Westport,500 W 56th St,,New York,NY,10019,,888-998-2546,E,,Public,24 hours daily,,,2,,,Blink Network,http://www.blinkcharging.com/,GPS,40.768211,-73.989479,10/29/2024,257757,2024-10-29 00:06:40,,,,08/03/2022,J1772
ELEC,HVCC Garage Level 2,80 Vandenburgh Ave,,Troy,NY,12180,,1-844-623-1001,E,,Public,24 hours daily,,,4,,,LIVINGSTON,https://www.solution.energy,GPS,42.694870,-73.685900,10/29/2024,223133,2024-10-29 04:04:29,,,,12/02/2021,J1772
ELEC,FC1225 2144 S#2,2144 Brighton Henrietta Town Line Rd,West Parking Location,Rochester,NY,14623,,888-758-4389,E,,Public,24 hours daily,,,2,,,ChargePoint Network,http://www.chargepoint.com/,GPS,43.095162,-77.619940,10/29/2024,235343,2024-10-29 01:50:12,,,,10/28/2022,J1772
ELEC,BEVERWYCK STATION 3,10 Autumn Dr Beverwyck,,Slingerlands,NY,12159,,888-758-4389,E,,Public,24 hours daily,,,2,,,ChargePoint Network,http://www.chargepoint.com/,GPS,42.655716,-73.839830,10/29/2024,164422,2024-10-29 01:16:56,,,,07/22/2020,J1772
ELEC,960 BUSTI 960 BUSTI 1,960 Busti Ave,On exterior wall towards back of building,Buffalo,NY,14213,,888-758-4389,E,,Public,24 hours daily,,,2,,,ChargePoint Network,http://www.chargepoint.com/,GPS,42.908953,-78.900652,10/29/2024,150340,2024-10-29 01:09:39,,,,12/19/2019,J1772
ELEC,SHINEMAN SOUTH LEE HALL 5,7060 NY 104,Lee Hall Charging Station 5,Oswego,NY,13126,,888-758-4389,E,,Public,24 hours daily,,,2,,,ChargePoint Network,http://www.chargepoint.com/,GPS,43.453984,-76.540843,10/29/2024,350576,2024-10-29 02:21:04,,,,07/16/2024,J1772
ELEC,600 RIVER ROAD 600 RIVER,600 River Rd,,North Tonawanda,NY,14120,,888-758-4389,E,,Public,24 hours daily,,,2,,,ChargePoint Network,http://www.chargepoint.com/,GPS,43.035576,-78.887184,10/29/2024,152233,2024-10-29 01:09:35,,,,01/07/2020,J1772
ELEC,122 South Church St.,122 South Church St,,Schenectady,NY,12305,,1-844-623-1001,E,,Public,24 hours daily,,,6,,,LIVINGSTON,https://www.solution.energy,GPS,42.813770,-73.948000,10/29/2024,236640,2024-10-29 04:05:55,,,,10/03/2022,J1772
ELEC,Motel 6 Rochester Aiport,1273 Chili Avenue,,Rochester,NY,14624,,1-888-717-4544,E,,Public,24 hours daily,,,10,,,CHARGESMART_EV,https://chargesmartev.com,GPS,43.138789,-77.668920,10/29/2024,355243,2024-10-29 04:09:31,,,,09/10/2024,J1772
ELEC,Central Ave Hyundai,111 South Central Ave,,Hartsdale,NY,10530,,888-998-2546,E,,Public,24 hours daily,,,,1,,Blink Network,http://www.blinkcharging.com/,GPS,41.016336,-73.802138,10/29/2024,314100,2024-10-29 00:10:23,,,,10/18/2023,J1772COMBO
ELEC,KINGSTON NORTH FRONT ST,75 N Front St,Left side of Parking Lot from Entrance,Kingston,NY,12401,,888-758-4389,E,,Public,24 hours daily,,,2,,,ChargePoint Network,http://www.chargepoint.com/,GPS,41.935392,-74.021881,10/29/2024,325295,2024-10-29 02:11:41,,,,01/12/2024,J1772
ELEC,Hilton Garden Inn - Downtown Ithaca - Tesla Destination,130 E Seneca St,,Ithaca,NY,14850,,877-798-3752,E,,Public,,,,2,,,Tesla Destination,https://www.tesla.com/destination-charging,200-9,42.440502,-76.497331,07/01/2024,114958,2024-10-16 16:58:41,P,,,10/31/2017,TESLA
ELEC,Van Schaick Island,203 Park Ave,,Cohoes,NY,12047,,518-233-2130,E,,Public,24 hours daily,,,1,,,Non-Networked,,200-8,42.767009,-73.689847,03/08/2023,118964,2024-01-31 22:07:01,P,,,01/01/2019,J1772
ELEC,70 Memorial,70 Memorial Plaza,,Pleasantville,NY,10570,,914-806-4100,E,,Public,Contact site for information,A ANDROID_PAY APPLE_PAY CREDIT D M,,28,,,AMPUP,https://ampup.io/,GPS,41.133850,-73.793113,05/09/2024,335331,2024-05-09 20:32:20,P,,,01/08/2024,J1772
ELEC,EXECUTIVE PARK #4,2 Executive Blvd,,Montebello,NY,10901,,888-758-4389,E,,Public,24 hours daily,,,2,,,ChargePoint Network,http://www.chargepoint.com/,GPS,41.120110,-74.116620,10/29/2024,158243,2024-10-29 01:15:38,,,,05/30/2020,J1772
ELEC,Village of Cherry Valley,2 Genesee St,Located near Village Park entrance,Cherry Valley,NY,13320,,607-264-3791,E,,Public,24 hours daily,,,2,,,Non-Networked,,200-9,42.797294,-74.758022,01/10/2023,104135,2023-02-14 15:54:11,P,,,10/04/2018,J1772
ELEC,Sharon Chevrolet (Inside),3687 NY-31,,Liverpool,NY,13090,,1-844-623-1001,E,,Public,24 hours daily,,,3,,,LIVINGSTON,https://www.solution.energy,GPS,43.182180,-76.256990,10/29/2024,223263,2024-10-29 04:05:46,,,,02/09/2022,J1772
ELEC,RMI SPARKY,8700 Knowledge Ln,in the middle of parking lot,Cicero,NY,13039,,888-758-4389,E,,Public,24 hours daily,,,2,,,ChargePoint Network,http://www.chargepoint.com/,GPS,43.189634,-76.126637,10/29/2024,308629,2024-10-29 01:52:29,,,,09/07/2023,J1772
ELEC,Bruno's Bakery and Restaurant Hylan Blvd - Tesla Destination,1650 Hylan Blvd,,Staten Island,NY,10305,,877-798-3752,E,,Public,,,,2,,,Tesla Destination,https://www.tesla.com/destination-charging,200-9,40.588091,-74.089936,07/01/2024,150697,2024-10-16 16:58:41,P,,,08/28/2019,TESLA
ELEC,Schenectady County - 388 Broadway,388 Broadway,,Schenectady,NY,12305,,1-844-623-1001,E,,Public,24 hours daily,,,10,,,LIVINGSTON,https://www.solution.energy,GPS,42.808480,-73.946470,10/29/2024,189502,2024-10-29 04:04:48,,,,02/24/2021,J1772
ELEC,PFIZER PR EV 23,401 N Middletown Rd,,Pearl River,NY,10965,,888-758-4389,E,,Public,24 hours daily,,,2,,,ChargePoint Network,http://www.chargepoint.com/,GPS,41.076748,-74.017992,10/29/2024,323938,2024-10-29 02:13:07,,,,01/05/2024,J1772
ELEC,LUCC,5687 Big Tree Rd,,Lakeville,NY,14480,,866-816-7584,E,,Public,24 hours daily,,,4,,,EV Connect,http://evconnect.com/,GPS,42.836581,-77.710466,10/29/2024,168419,2024-10-29 03:09:22,,,,08/01/2020,J1772
ELEC,Living Roots Wine and Co,8560 County Road 87,,Hammondsport,NY,14840,,1-888-717-4544,E,,Public,24 hours daily,,,2,,,CHARGESMART_EV,https://chargesmartev.com,GPS,42.406355,-77.192530,10/29/2024,333991,2024-10-29 04:09:20,,,,08/08/2023,J1772
ELEC,Comfort Inn Glenmont,37 Rte 9W,,Glenmont,NY,12077,,1-888-717-4544,E,,Public,24 hours daily,,,8,,,CHARGESMART_EV,https://chargesmartev.com,GPS,42.622351,-73.778286,10/29/2024,333804,2024-10-29 04:09:21,,,,04/21/2023,J1772
ELEC,Jones Beach Field 5,1000 Ocean Parkway,,Wantagh,NY,11793,,866-816-7584,E,,Public,24 hours daily,,,2,,,EV Connect,http://evconnect.com/,GPS,40.601141,-73.502518,10/29/2024,230775,2024-10-29 03:08:25,,,,09/30/2022,J1772
ELEC,Chautauqua Institution School of Art - North Lot,54 Palestine Ave,,Chatauqua,NY,14757,,716-357-6250,E,,Public - Credit card at all times,24 hours daily,A D Debit M V,,1,,,Non-Networked,,GPS,42.210705,-79.471833,10/11/2024,226485,2024-10-11 18:09:31,P,,,08/22/2022,J1772
ELEC,Icon Parking 51 W 22nd - Tesla Destination,51 W 22nd St,,New York,NY,10010,,877-798-3752,E,,Public,,,,3,,,Tesla Destination,https://www.tesla.com/destination-charging,200-9,40.742059,-73.992694,07/01/2024,115147,2024-10-16 16:58:41,P,,,01/21/2016,J1772 TESLA
ELEC,123 Everett Road,123 Everett Road,,Albany,NY,12205,,1-844-623-1001,E,,Public,24 hours daily,,,6,,,LIVINGSTON,https://www.solution.energy,GPS,42.695140,-73.771070,10/29/2024,189513,2024-10-29 04:04:40,,,,08/19/2020,J1772
ELEC,Legoland New York Resort ADA,420 Harriman Dr,,Goshen,NY,10924,,1-844-623-1001,E,,Public,24 hours daily,,,2,,,LIVINGSTON,https://www.solution.energy,GPS,41.379000,-74.315320,10/29/2024,223305,2024-10-29 04:04:37,,,,06/09/2022,J1772
ELEC,117 South Main,117 S. Main St,,Syracuse,NY,13212,,1-844-623-1001,E,,Public,24 hours daily,,,2,,,LIVINGSTON,https://www.solution.energy,GPS,43.134710,-76.129190,10/29/2024,223225,2024-10-29 04:04:58,,,,01/26/2022,J1772
ELEC,110 East End Ave,110 East End Ave,,New York,NY,10028,,1-844-623-1001,E,,Public,24 hours daily,,,4,,,LIVINGSTON,https://www.solution.energy,GPS,40.774470,-73.945990,10/29/2024,223281,2024-10-29 04:05:15,,,,04/04/2022,J1772
ELEC,HVCC Garage Ground,80 Vandenburgh Ave,,Troy,NY,12180,,1-844-623-1001,E,,Public,24 hours daily,,,4,,,LIVINGSTON,https://www.solution.energy,GPS,42.694860,-73.685830,10/29/2024,334523,2024-10-29 04:05:34,,,,05/02/2024,J1772
ELEC,NATIONAL GRID CHILIS AMHERST,1145 Niagara Falls Blvd,Chili’s Parking lot,Amherst,NY,14226,,888-758-4389,E,,Public,24 hours daily,,,2,,,ChargePoint Network,http://www.chargepoint.com/,GPS,42.984648,-78.821984,10/29/2024,162214,2024-10-29 00:56:03,,,,06/12/2020,J1772
ELEC,SPOT cowork Rochester - Tesla Destination,21 Goodway Dr,,Rochester,NY,14623,,877-798-3752,E,,Public,,,,4,,,Tesla Destination,https://www.tesla.com/destination-charging,GPS,43.091951,-77.580634,07/01/2024,154441,2024-10-16 16:58:41,P,,,10/11/2019,TESLA
ELEC,OLD STONEHOUSE GUEST PARKING,21 Hathorn Rd,Rear of main parking lot,Warwick,NY,10990,,888-758-4389,E,,Public,24 hours daily,,,2,,,ChargePoint Network,http://www.chargepoint.com/,GPS,41.245842,-74.370384,10/29/2024,193536,2024-10-29 01:28:49,,,,08/06/2021,J1772
ELEC,Icon Parking E 48th Street - Tesla Destination,329 E 48th St,,New York,NY,10017,,877-798-3752,E,,Public,,,,3,,,Tesla Destination,https://www.tesla.com/destination-charging,200-8,40.753079,-73.968032,07/01/2024,115097,2024-10-16 16:58:41,P,,,11/13/2015,J1772 TESLA
ELEC,FIVE-STAR BANK SOUTH CHARGER,6215 Sheridan Dr,South Charger West Parking Lot,Buffalo,NY,14221,,888-758-4389,E,,Public,24 hours daily,,,2,,,ChargePoint Network,http://www.chargepoint.com/,GPS,42.977403,-78.702441,10/29/2024,225162,2024-10-29 01:45:54,,,,08/09/2022,J1772
ELEC,Village of Sherman EV Station,106 Church St,,Sherman,NY,14781,,866-816-7584,E,,Public,24 hours daily,,,,2,,EV Connect,http://evconnect.com/,GPS,42.160110,-79.596012,10/29/2024,311813,2024-10-29 03:12:06,,,,09/28/2023,CHADEMO J1772COMBO
ELEC,AMPHENOL 191 4060 STATION 3,40-60 Delaware Ave,Parking lot,Sidney,NY,13838,,888-758-4389,E,,Public,24 hours daily,,,2,,,ChargePoint Network,http://www.chargepoint.com/,GPS,42.306200,-75.400099,10/29/2024,346485,2024-10-29 02:11:45,,,,05/18/2024,J1772
ELEC,125 Victory Hwy - Tesla Supercharger,125 Victory Hwy,,Painted Post,NY,14870,,877-798-3752,E,,Public,24 hours daily. Please check Tesla's online station map to see if an adapter is required at this location.,,,,10,,Tesla,https://www.tesla.com/supercharger,200-9,42.170757,-77.108063,07/01/2024,102338,2024-08-14 18:58:22,P,,,07/23/2018,TESLA
ELEC,Meadowbrook Apartments West,26 Meadowbrook Dr.,,Slingerlands,NY,12159,,1-844-623-1001,E,,Public,24 hours daily,,,4,,,LIVINGSTON,https://www.solution.energy,GPS,42.651310,-73.850030,10/29/2024,225114,2024-10-29 04:04:32,,,,07/14/2022,J1772
ELEC,5TH AVE RIVER STREET 2,King St & Federal St,,Troy,NY,12180,,888-758-4389,E,,Public,24 hours daily,,,2,,,ChargePoint Network,http://www.chargepoint.com/,GPS,42.735110,-73.688050,10/29/2024,154052,2024-10-29 01:12:34,,,,02/27/2020,J1772
ELEC,North Coast Subaru,105 Glen Street,,Glen Cove,NY,11542,,888-998-2546,E,,Public,24 hours daily,,,1,,,Blink Network,http://www.blinkcharging.com/,GPS,40.864143,-73.626372,10/29/2024,218222,2024-10-29 00:06:56,,,,05/17/2022,J1772
ELEC,Loudon Arms - Pool,16 Old Hickory Dr.,,Albany,NY,12204,,1-844-623-1001,E,,Public,24 hours daily,,,10,,,LIVINGSTON,https://www.solution.energy,GPS,42.674860,-73.749960,10/29/2024,334469,2024-10-29 04:06:26,,,,05/02/2024,J1772
ELEC,MUNICIPAL LOT VOH LOT,20 Payne St,In Village parking lot,Hamilton,NY,13346,,888-758-4389,E,,Public,24 hours daily,,,2,,,ChargePoint Network,http://www.chargepoint.com/,GPS,42.827000,-75.542481,10/29/2024,162367,2024-10-29 00:49:52,,,,06/12/2020,J1772
ELEC,BNE MASTER 5000 MURRAY ST3,2000 Murray Court,,Pearl River,NY,10965,,888-758-4389,E,,Public,24 hours daily,,,2,,,ChargePoint Network,http://www.chargepoint.com/,GPS,41.046192,-74.003316,10/29/2024,220395,2024-10-29 01:44:35,,,,06/01/2022,J1772
ELEC,RRH ST MARYS 2,89 Genesee St,2nd floor on south end of parking garage,Rochester,NY,14611,,888-758-4389,E,,Public,24 hours daily,,,2,,,ChargePoint Network,http://www.chargepoint.com/,GPS,43.149393,-77.636704,10/29/2024,145392,2024-10-29 01:05:13,,,,09/20/2019,J1772
ELEC,MILTON NY SUZANNES EV3,13 Woodthrush Court,Suzannes Playground,Ballston Spa,NY,12020,,888-758-4389,E,,Public,24 hours daily,,,2,,,ChargePoint Network,http://www.chargepoint.com/,GPS,43.042794,-73.855037,10/29/2024,323432,2024-10-29 02:12:03,,,,12/23/2023,J1772
ELEC,Icon 80 Riverside Blvd - Tesla Destination,80 Riverside Blvd,,New York,NY,10069,,877-798-3752,E,,Public,,,,3,,,Tesla Destination,https://www.tesla.com/destination-charging,200-9,40.775374,-73.989687,07/01/2024,115187,2024-10-16 16:58:41,P,,,06/30/2016,J1772 TESLA
ELEC,MTP Parking 41-42 24th Street - Tesla Destination,41-42 24th St,,Long Island City,NY,11101,,877-798-3752,E,,Public,,,,4,,,Tesla Destination,https://www.tesla.com/destination-charging,200-9,40.751556,-73.941406,07/01/2024,122488,2024-10-16 16:58:41,P,,,01/17/2019,TESLA
ELEC,WHEATLAND-CHILI ELEMENTRY1,13 Beckwith Ave,,Scottsville,NY,14546,,888-758-4389,E,,Public,24 hours daily,,,2,,,ChargePoint Network,http://www.chargepoint.com/,GPS,43.025917,-77.748225,10/29/2024,187784,2024-10-29 01:16:57,,,,04/20/2021,J1772
ELEC,Exit 18 (New Paltz),NY State Thruway,,New Paltz,NY,12561,,866-816-7584,E,,Public,24 hours daily,,,2,,,EV Connect,http://evconnect.com/,GPS,41.740234,-74.062195,10/29/2024,167127,2024-10-29 03:09:24,,,,09/21/2020,J1772
ELEC,AECSOLAR STATION 3 AEC,210 Washington Ave extension,Follow Signage for which to utilize - furthest from building unless otherwise marked,Albany,NY,12203,,888-758-4389,E,,Public,24 hours daily,,,2,,,ChargePoint Network,http://www.chargepoint.com/,GPS,42.703342,-73.857040,10/29/2024,192640,2024-10-29 01:30:51,,,,07/08/2021,J1772
ELEC,COMPETITION BMW BMW- PUBLIC,599 Middle Country Rd,"East side of main parking lot, near parts department parking.",Smithtown,NY,11787,,888-758-4389,E,,Public,24 hours daily,,,2,,,ChargePoint Network,http://www.chargepoint.com/,GPS,40.860706,-73.158217,10/29/2024,192571,2024-10-29 00:31:36,,,,07/06/2021,J1772
ELEC,BURNS MGT SGA 3,19 Seward St,,Saratoga Springs,NY,12866,,888-758-4389,E,,Public,24 hours daily,,,2,,,ChargePoint Network,http://www.chargepoint.com/,GPS,43.086973,-73.795807,10/29/2024,180097,2024-10-29 00:59:52,,,,01/27/2021,J1772
ELEC,TOWN OF MORIAH MORIAHEV3,3252 Broad St,,Port Henry,NY,12974,,888-758-4389,E,,Public,24 hours daily,,,2,,,ChargePoint Network,http://www.chargepoint.com/,GPS,44.048405,-73.461130,10/29/2024,214302,2024-10-29 01:39:19,,,,04/20/2022,J1772
ELEC,DEWITT EV 1 CHARGEPOINT,5400 Butternut Drive,Left parking lot,East Syracuse,NY,13057,,888-758-4389,E,,Public,24 hours daily,,,2,,,ChargePoint Network,http://www.chargepoint.com/,GPS,43.045918,-76.049853,10/29/2024,180106,2024-10-29 00:51:33,,,,01/27/2021,J1772
ELEC,U OF R HELEN WOOD HALL,255 Crittenden Blvd,East side of building off Castlemen Rd,Rochester,NY,14620,,888-758-4389,E,,Public,24 hours daily,,,2,,,ChargePoint Network,http://www.chargepoint.com/,GPS,43.120900,-77.625625,10/29/2024,162267,2024-10-29 00:54:28,,,,06/12/2020,J1772
ELEC,CLIENT FACING BMW PUBLIC,543 Tarrytown Rd,Near main entrance,White Plains,NY,10607,,888-758-4389,E,,Public,24 hours daily,,,2,,,ChargePoint Network,http://www.chargepoint.com/,GPS,41.044529,-73.803710,10/29/2024,257922,2024-10-29 00:33:10,,,,04/06/2023,J1772
ELEC,COMFORT- CHARGE STATION 3,4054 ny-9l,,Lake George,NY,12845,,888-758-4389,E,,Public,24 hours daily,,,2,,,ChargePoint Network,http://www.chargepoint.com/,GPS,43.411690,-73.708435,10/29/2024,182158,2024-10-29 01:23:28,,,,01/27/2021,J1772
ELEC,Red Roof Inn,650 Old Front St,,Binghamton,NY,13905,,866-816-7584,E,,Public,24 hours daily,,,2,,,EV Connect,http://evconnect.com/,GPS,42.124430,-75.909169,10/29/2024,184039,2024-10-29 03:09:29,,,,11/18/2020,J1772
ELEC,Rapidpark 351 East 83rd - Tesla Destination,351 E 83rd,,New York,NY,10028,,877-798-3752,E,,Public,,,,3,,,Tesla Destination,https://www.tesla.com/destination-charging,200-8,40.775123,-73.951193,07/01/2024,115110,2024-10-16 16:58:41,P,,,05/24/2018,J1772 TESLA
ELEC,Finger Lakes Hotel - Loomis Housing,6108 Loomis Rd,,Farmington,NY,14425,,1-888-717-4544,E,,Public,24 hours daily,,,10,,,CHARGESMART_EV,https://chargesmartev.com,GPS,42.991212,-77.360562,10/29/2024,350286,2024-10-29 04:09:28,,,,07/10/2024,J1772
ELEC,Gurney's Montauk Resort & Spa - Tesla Destination,290 Old Montauk Hwy,,Montauk,NY,11954,,877-798-3752,E,,Public,,,,3,,,Tesla Destination,https://www.tesla.com/destination-charging,200-9,41.016398,-71.991389,07/01/2024,114979,2024-10-16 16:58:41,P,,,08/08/2016,J1772 TESLA
ELEC,STPETERHOSPITAL EV STATION #4,315 S Manning Blvd,,Albany,NY,12208,,888-758-4389,E,,Public,24 hours daily,,,2,,,ChargePoint Network,http://www.chargepoint.com/,GPS,42.654875,-73.802365,10/29/2024,212978,2024-10-29 01:40:47,,,,03/27/2022,J1772
ELEC,ELLIS CHEVY LVL2 #2,551 E Main St,,Malone,NY,12953,,888-758-4389,E,,Public,24 hours daily,,,2,,,ChargePoint Network,http://www.chargepoint.com/,GPS,44.850010,-74.284450,10/29/2024,222224,2024-10-29 01:45:35,,,,06/30/2022,J1772
ELEC,The Hamlet,56 Marion Ave,,Saratoga Springs,NY,12866,,1-844-623-1001,E,,Public,24 hours daily,,,4,,,LIVINGSTON,https://www.solution.energy,GPS,43.090650,-73.772100,10/29/2024,189519,2024-10-29 04:05:17,,,,07/30/2020,J1772
ELEC,W Brook Ave,14 W Brook Road,,Lake George,NY,12845,,1-844-623-1001,E,,Public,24 hours daily,,,1,,,LIVINGSTON,https://www.solution.energy,GPS,43.417360,-73.712610,10/29/2024,324890,2024-10-29 04:05:31,,,,09/06/2023,J1772
ELEC,STONY BROOK UNV ARENA 1,Gymnasium Rd,,Stony Brook,NY,11790,,888-758-4389,E,,Public,24 hours daily,,,2,,,ChargePoint Network,http://www.chargepoint.com/,GPS,40.917249,-73.127280,10/29/2024,162455,2024-10-29 00:31:46,,,,06/12/2020,J1772
ELEC,Bob Johnson Mazda,3755 West Henrietta Road,,Rochester,NY,14623,,888-998-2546,E,,Public,24 hours daily,,,4,,,Blink Network,http://www.blinkcharging.com/,GPS,43.078957,-77.645007,10/29/2024,197754,2024-10-29 00:19:55,,,,10/14/2021,J1772
ELEC,QPK Design LLP,450 S Salina St.,,Syracuse,NY,13202,,1-844-623-1001,E,,Public,24 hours daily,,,6,,,LIVINGSTON,https://www.solution.energy,GPS,43.045640,-76.152750,10/29/2024,347196,2024-10-29 04:06:35,,,,05/31/2024,J1772
ELEC,Water Treatment Plant,1070 NEPPERHAN AVE,,Yonkers,NY,10703,,866-816-7584,E,,Public,24 hours daily,,,6,,,EV Connect,http://evconnect.com/,GPS,40.961817,-73.871970,10/29/2024,321515,2024-10-29 03:12:14,,,,12/06/2023,J1772
ELEC,Courtyard Syracuse Downtown At Armory Square,300 W Fayette St,,Syracuse,NY,13202,,877-455-3833,E,,Public,24 hours daily,,,,2,,eVgo Network,https://www.evgo.com/,GPS,43.048887,-76.156990,10/28/2024,259510,2024-10-29 00:00:44,,,,04/17/2023,CHADEMO J1772COMBO
ELEC,Icon Parking 240 East Broadway - Tesla Destination,188 Clinton St,,New York,NY,10002,,877-798-3752,E,,Public,,,,3,,,Tesla Destination,https://www.tesla.com/destination-charging,200-8,40.714821,-73.987138,07/01/2024,115035,2024-10-16 16:58:41,P,,,05/24/2018,J1772 TESLA
ELEC,Lorell Professional Building,1476 Deer Park Ave,,North Babylon,NY,11703,,866-816-7584,E,,Public,24 hours daily,,,2,,,EV Connect,http://evconnect.com/,GPS,40.747521,-73.324952,10/29/2024,154899,2024-10-29 03:08:52,,,,04/11/2019,J1772
ELEC,Wag N Wheel Wash,3949 Oneida St,,New Hartford,NY,13413,,1-844-623-1001,E,,Public,24 hours daily,,,6,,,LIVINGSTON,https://www.solution.energy,GPS,43.054390,-75.271660,10/29/2024,324891,2024-10-29 04:04:55,,,,07/06/2023,J1772
ELEC,ADK FOLK SCHOOL STATION 1,51 Main St,,Lake Luzerne,NY,12846,,888-758-4389,E,,Public,24 hours daily,,,2,,,ChargePoint Network,http://www.chargepoint.com/,GPS,43.320377,-73.841870,10/29/2024,163515,2024-10-29 01:15:34,,,,06/20/2020,J1772
ELEC,31 W Tioga St,31 W Tioga St.,,Spencer,NY,14833,,1-844-623-1001,E,,Public,24 hours daily,,,4,,,LIVINGSTON,https://www.solution.energy,GPS,42.209340,-76.494480,10/29/2024,335769,2024-10-29 04:06:33,,,,05/08/2024,J1772
ELEC,Icon Parking E 88th Street - Tesla Destination,536 E 88th St,,New York,NY,10128,,877-798-3752,E,,Public,,,,3,,,Tesla Destination,https://www.tesla.com/destination-charging,200-8,40.776461,-73.944363,07/01/2024,115153,2024-10-16 16:58:41,P,,,11/13/2015,J1772 TESLA
ELEC,Hudson West,6 Hudson West Drive,,Marlboro,NY,12542,,888-998-2546,E,,Public,24 hours daily,,,5,,,Blink Network,http://www.blinkcharging.com/,GPS,41.609552,-73.971496,10/29/2024,346921,2024-10-29 00:21:20,,,,05/29/2024,J1772
ELEC,BEDFORDEV TOWN HALL,321 Bedford Rd.,Bedford Town Hall - side parking lot,Bedford Hills,NY,10507,,888-758-4389,E,,Public,24 hours daily,,,2,,,ChargePoint Network,http://www.chargepoint.com/,GPS,41.239820,-73.699073,10/29/2024,162336,2024-10-29 00:50:56,,,,06/12/2020,J1772
ELEC,DEWITT EV 1 CARRIERPARK#2,1033 Kinne St,,East Syracuse,NY,13057,,888-758-4389,E,,Public,24 hours daily,,,2,,,ChargePoint Network,http://www.chargepoint.com/,GPS,43.080509,-76.078647,10/29/2024,223468,2024-10-29 01:44:20,,,,07/14/2022,J1772
ELEC,Home 2 Suites Queensbury - Tesla Destination,524 Aviation Rd,,Queensbury,NY,12804,,877-798-3752,E,,Public,,,,4,,,Tesla Destination,https://www.tesla.com/destination-charging,200-9,43.328248,-73.681635,07/01/2024,115216,2024-10-16 16:58:41,P,,,07/18/2018,J1772 TESLA
ELEC,Columbus and Dante,240 Dante Avenue,,Tuckahoe,NY,10707,,888-998-2546,E,,Public,24 hours daily,,,6,,,Blink Network,http://www.blinkcharging.com/,GPS,40.957810,-73.821673,10/29/2024,240935,2024-10-29 00:11:59,,,,11/21/2022,J1772
ELEC,HYATT POUGHKEPS HYATT POUGHKEPS,2165 South Rd,,Poughkeepsie,NY,12601,,888-758-4389,E,,Public,24 hours daily,,,2,,,ChargePoint Network,http://www.chargepoint.com/,GPS,41.636660,-73.919620,10/29/2024,143493,2024-10-29 01:03:14,,,,08/15/2019,J1772
ELEC,The Bay Club - Bay Club Bldg 1,2 Bay Club Dr,,Flushing,NY,11360,,813-492-5220,E,,Public,24 hours daily,A ANDROID_PAY APPLE_PAY D M V,,10,,,EVOKE,https://evokesystems.com/,GPS,40.778494,-73.780423,10/11/2024,356949,2024-10-11 18:09:31,P,,,02/09/2022,J1772
ELEC,SU UNIV. GARAGE,1005 Harrison St,Right side after main entrance. Station access subject to garage hours.,Syracuse,NY,13244,,888-758-4389,E,,Public,24 hours daily,,,2,,,ChargePoint Network,http://www.chargepoint.com/,GPS,43.044100,-76.133779,10/29/2024,252952,2024-10-29 01:56:37,,,,02/01/2023,J1772
ELEC,799 SENECA STATION 10,799 Seneca St,,Buffalo,NY,14210,,888-758-4389,E,,Public,Mon 5:00pm - 10:00pm; Tue 5:00pm - 10:00pm; Wed 5:00pm - 10:00pm; Thu 5:00pm - 10:00pm; Fri 5:00pm - 10:00pm; Sat 8:00am - 10:00pm; Sun 8:00am - 10:00pm,,,1,,,ChargePoint Network,http://www.chargepoint.com/,GPS,42.875115,-78.847343,10/29/2024,191252,2024-10-29 01:30:05,,,,06/19/2021,J1772
ELEC,RRH PORTLAND L1,1445 Portland Ave,,Rochester,NY,14621,,888-758-4389,E,,Public,24 hours daily,,,2,,,ChargePoint Network,http://www.chargepoint.com/,GPS,43.192753,-77.585720,10/29/2024,156614,2024-10-29 01:08:19,,,,05/22/2020,J1772
ELEC,BORO PARK BORO CHARGE 8,4915 10th Ave,,Borough Park,NY,11219,,888-758-4389,E,,Public,24 hours daily,,,2,,,ChargePoint Network,http://www.chargepoint.com/,GPS,40.638536,-73.998640,10/29/2024,206915,2024-10-29 01:40:11,,,,02/23/2022,J1772
ELEC,Burger King - Hamburg,5597 Camp Road,,Hamburg,NY,14075,,888-998-2546,E,,Public,24 hours daily,,,2,,,Blink Network,http://www.blinkcharging.com/,GPS,42.734620,-78.838240,10/29/2024,201879,2024-10-29 00:26:36,,,,12/01/2021,J1772
ELEC,HHH STATION ONE STATION 1,55 Vanderbilt Parkway,,Dix Hills,NY,11746,,888-758-4389,E,,Public,24 hours daily,,,2,,,ChargePoint Network,http://www.chargepoint.com/,GPS,40.804055,-73.360060,10/29/2024,237299,2024-10-29 01:34:11,,,,12/08/2022,J1772
ELEC,STOHL STOHL3,3860 California Rd,,Orchard Park,NY,14127,,888-758-4389,E,,Public,24 hours daily,,,1,,,ChargePoint Network,http://www.chargepoint.com/,GPS,42.779439,-78.781273,10/29/2024,180673,2024-10-29 01:17:04,,,,01/27/2021,J1772
ELEC,SUNY BUFFALO JACOBS 3,50 Augspurger Rd,Jacobs A lot,Buffalo,NY,14228,,888-758-4389,E,,Public,24 hours daily,,,2,,,ChargePoint Network,http://www.chargepoint.com/,GPS,42.998860,-78.787320,10/29/2024,171344,2024-10-29 01:24:28,,,,01/16/2021,J1772
ELEC,NAPA Auto Parts,4659 W Ridge Rd.,,Spencerport,NY,14559,,888-998-2546,E,,Public,24 hours daily,,,4,,,Blink Network,http://www.blinkcharging.com/,GPS,43.217882,-77.758291,10/29/2024,201295,2024-10-29 00:19:54,,,,11/17/2021,J1772
ELEC,PFIZER PR EV 05,401 N Middletown Rd,,Pearl River,NY,10965,,888-758-4389,E,,Public,24 hours daily,,,2,,,ChargePoint Network,http://www.chargepoint.com/,GPS,41.076752,-74.018113,10/29/2024,294845,2024-10-29 01:43:56,,,,06/23/2023,J1772
ELEC,Stone Dock Golf Course,12 Stone Dock Road,,High Falls,NY,12440,,1-844-623-1001,E,,Public,24 hours daily,,,4,,,LIVINGSTON,https://www.solution.energy,GPS,41.816270,-74.152140,10/29/2024,351778,2024-10-29 04:06:51,,,,07/30/2024,J1772
ELEC,AMNH-PARKING STATION 1,200 Central Park West,Lower level parking south wall,New York,NY,10024,,888-758-4389,E,,Public,24 hours daily,,,2,,,ChargePoint Network,http://www.chargepoint.com/,GPS,40.781454,-73.973835,10/29/2024,357262,2024-10-29 01:25:57,,,,09/30/2024,J1772
ELEC,Pinnacle City - 1st Floor,111 Kent Ave,,Brooklyn,NY,11249,,813-492-5220,E,,Public,24 hours daily,A ANDROID_PAY APPLE_PAY D M V,,5,,,EVOKE,https://evokesystems.com/,GPS,40.720345,-73.961534,10/11/2024,356902,2024-10-11 18:09:31,P,,,08/21/2022,J1772
ELEC,QFA - Queens Family Court Municipal Garage,150-07 Archer Street,,Queens,NY,11433,,866-816-7584,E,,Public,Mon 7:00am - 9:00pm; Tue 7:00am - 9:00pm; Wed 7:00am - 9:00pm; Thu 7:00am - 9:00pm; Fri 7:00am - 9:00pm; Sat 12:00am - 12:00am; Sun 12:00am - 12:00am,,,3,,,EV Connect,http://evconnect.com/,GPS,40.701647,-73.803843,10/29/2024,123069,2024-10-29 03:08:49,,,,04/01/2019,J1772
ELEC,The Veneto,250 East 53rd Street,,New York,NY,10022,,888-998-2546,E,,Public,24 hours daily,,,2,,,Blink Network,http://www.blinkcharging.com/,GPS,40.756766,-73.967481,10/29/2024,124140,2024-10-29 00:26:27,,,,06/21/2019,J1772
ELEC,Schenectady Metroplex,128 Clinton St,,Schenectady,NY,12305,,1-888-717-4544,E,,Public,24 hours daily,,,4,,,CHARGESMART_EV,https://chargesmartev.com,GPS,42.813196,-73.940158,10/29/2024,347373,2024-10-29 04:09:30,,,,06/04/2024,J1772
ELEC,Staten Island Mall Macys,2655 Richmond Ave.,,Staten Island,NY,10314,,888-264-2208,E,,Public,Mon 6:00am - 11:59pm; Tue 6:00am - 11:59pm; Wed 6:00am - 11:59pm; Thu 6:00am - 11:59pm; Fri 6:00am - 11:59pm; Sat 6:00am - 11:59pm; Sun 6:00am - 11:59pm,,,2,,,SHELL_RECHARGE,https://www.shell.us/motorist/electric-vehicle-charging.html,GPS,40.583139,-74.166332,10/29/2024,166729,2024-10-29 02:51:17,,,,08/31/2020,J1772
ELEC,THE ELMS THE ELMS,1 Bay Rd,,Lake Luzerne,NY,12846,,888-758-4389,E,,Public,24 hours daily,,,2,,,ChargePoint Network,http://www.chargepoint.com/,GPS,43.312741,-73.835249,10/29/2024,190086,2024-10-29 00:58:36,,,,05/26/2021,J1772
ELEC,Standard Parking Pierepoint Plaza - Tesla Destination,300 Cadman,,Brooklyn,NY,11201,,877-798-3752,E,,Public,,,,3,,,Tesla Destination,https://www.tesla.com/destination-charging,GPS,40.695115,-73.990993,07/01/2024,114896,2024-10-16 16:58:41,P,,,05/24/2018,J1772 TESLA
ELEC,Royal Development Manorville Square,287 Wading River Rd,,Manorville,NY,11949,,833-632-2778,E,,Public,24 hours daily,,,,4,,Electrify America,https://www.electrifyamerica.com/,GPS,40.824740,-72.807090,10/29/2024,207917,2024-10-29 02:56:45,,,,03/10/2022,CHADEMO J1772COMBO
ELEC,Ferrario Ford Lincoln,2472 Corning Rd,,Elmira,NY,14903,,607-734-1681,E,,Public - Credit card at all times,24 hours daily,A D Debit M V,,1,,,Non-Networked,,GPS,42.149016,-76.832206,08/15/2024,226525,2024-08-15 19:57:12,P,,,08/25/2022,J1772
ELEC,SUNY NEW PALTZ SUNY NEW PALTZ,98 S Manheim Blvd,,New Paltz,NY,12561,,888-758-4389,E,,Public,24 hours daily,,,2,,,ChargePoint Network,http://www.chargepoint.com/,GPS,41.738917,-74.080123,10/29/2024,162190,2024-10-29 00:56:20,,,,06/12/2020,J1772
ELEC,The Alander,7519 State Route 22,,Copake,NY,12516,,949-945-2000,E,,Public,24 hours daily,A ACCOUNT_BALANCE ANDROID_PAY APPLE_PAY CREDIT D M V,,2,,,EVGATEWAY,http://evgateway.com/,200-8,42.081810,-73.544170,,333962,2024-04-29 18:47:13,P,,,11/30/2023,J1772
ELEC,RIVERTRAIL RIVERTRAIL EV2,79 Woodruff Street,Back right of lot.,Saranac Lake,NY,12983,,888-758-4389,E,,Public,24 hours daily,,,2,,,ChargePoint Network,http://www.chargepoint.com/,GPS,44.329498,-74.129350,10/29/2024,356143,2024-10-29 02:23:22,,,,09/21/2024,J1772
ELEC,Herzog Supply Co,151 Plaza Rd,,Kingston,NY,12401,,866-816-7584,E,,Public,24 hours daily,,,2,,,EV Connect,http://evconnect.com/,GPS,41.936339,-74.017427,10/29/2024,230847,2024-10-29 03:09:20,,,,09/30/2022,J1772
ELEC,Country Manor Building 100,100-700 Stratford Ln,,Middletown,NY,10940,,1-844-623-1001,E,,Public,24 hours daily,,,6,,,LIVINGSTON,https://www.solution.energy,GPS,41.458740,-74.394470,10/29/2024,334428,2024-10-29 04:06:28,,,,05/02/2024,J1772
ELEC,TG EV STATIONS LEFT STATION,35 State Route 299,,Gardiner,NY,12525,,888-758-4389,E,,Public,24 hours daily,,,2,,,ChargePoint Network,http://www.chargepoint.com/,GPS,41.744570,-74.117940,10/29/2024,175242,2024-10-29 01:12:01,,,,01/27/2021,J1772
ELEC,STOLER STOLER LEXUS,2090 Broadhollow Rd,,Farmingdale,NY,11735,,888-758-4389,E,,Public,24 hours daily,,,2,,,ChargePoint Network,http://www.chargepoint.com/,GPS,40.746750,-73.423421,10/29/2024,331167,2024-10-29 02:10:08,,,,03/27/2024,J1772
ELEC,Icon Tower Garage,360S S Warren St,,Syracuse,NY,13202,,315-498-9081,E,,Public - Credit card at all times,24 hours daily,A D Debit M V,,8,,,Non-Networked,,GPS,43.047726,-76.151031,09/14/2022,227074,2024-10-07 15:28:01,P,,,08/26/2022,J1772
ELEC,Storms Ford,721 County Road 39A,,Southampton,NY,11968,,1-888-717-4544,E,,Public,24 hours daily,,,6,8,,CHARGESMART_EV,https://chargesmartev.com,GPS,40.899306,-72.374477,10/29/2024,357617,2024-10-29 04:09:40,,,,10/06/2024,J1772 J1772COMBO
ELEC,JCC of Schenectady,2565 Balltown Rd,,Schenectady,NY,12309,,1-888-717-4544,E,,Public,24 hours daily,,,6,,,CHARGESMART_EV,https://chargesmartev.com,GPS,42.831507,-73.893241,10/29/2024,333723,2024-10-29 04:09:19,,,,11/22/2022,J1772
ELEC,14 Plaza Drive,14 Plaza Drive,,Latham,NY,12110,,1-844-623-1001,E,,Public,24 hours daily,,,2,,,LIVINGSTON,https://www.solution.energy,GPS,42.768650,-73.758890,10/29/2024,223301,2024-10-29 04:04:33,,,,06/06/2022,J1772
ELEC,ISLANDIA CORP STATION 2,100 Corporate Plaza,,Islandia,NY,11749,,888-758-4389,E,,Public,24 hours daily,,,2,,,ChargePoint Network,http://www.chargepoint.com/,GPS,40.807705,-73.177180,10/29/2024,260788,2024-10-29 01:58:59,,,,05/13/2023,J1772
ELEC,Albany Country Club,300 Wormer Rd,,Voorheesville,NY,12186,,1-844-623-1001,E,,Public,24 hours daily,,,6,,,LIVINGSTON,https://www.solution.energy,GPS,42.681810,-73.924410,10/29/2024,223092,2024-10-29 04:05:44,,,,10/28/2021,J1772
ELEC,Towers on the Hudson,2000 6th ave,,Troy,NY,12180,,1-844-623-1001,E,,Public,24 hours daily,,,10,,,LIVINGSTON,https://www.solution.energy,GPS,42.732960,-73.684950,10/29/2024,223112,2024-10-29 04:04:37,,,,10/28/2021,J1772
ELEC,COLE GROUP CEDAR PARK 3,2106 Massachusetts Ave,,Troy,NY,12180,,888-758-4389,E,,Public,24 hours daily,,,2,,,ChargePoint Network,http://www.chargepoint.com/,GPS,42.741401,-73.670819,10/29/2024,236287,2024-10-29 01:49:16,,,,11/18/2022,J1772
ELEC,ESF LOT P22 2,Stadium Place,,Syracuse,NY,13210,,888-758-4389,E,,Public,24 hours daily,,,2,,,ChargePoint Network,http://www.chargepoint.com/,GPS,43.035228,-76.139678,10/29/2024,197197,2024-10-29 01:32:46,,,,10/07/2021,J1772
ELEC,MILTON NY P&R EV1,503 Geyser Rd,Far left charger,Ballston Spa,NY,12020,,888-758-4389,E,,Public,24 hours daily,,,2,,,ChargePoint Network,http://www.chargepoint.com/,GPS,43.044553,-73.853766,10/29/2024,322764,2024-10-29 01:59:26,,,,12/15/2023,J1772
ELEC,SULLIVAN PARK CENTER WAY 1,121 Center Way,,Corning,NY,14830,,888-758-4389,E,,Public,24 hours daily,,,2,,,ChargePoint Network,http://www.chargepoint.com/,GPS,42.153054,-77.053977,10/29/2024,174028,2024-10-29 01:02:11,,,,01/27/2021,J1772
ELEC,New King Holding LLC,10 New King St,,West Harrison,NY,10604,,833-692-6787,E,,Public - Credit card at all times,Contact station for hours of availability.,A ANDROID_PAY APPLE_PAY CREDIT D M,,2,,,AMPUP,https://ampup.io/,200-9,41.083498,-73.714367,10/11/2022,230215,2023-02-14 15:54:11,P,,,09/15/2022,J1772
ELEC,Exit 38 (Liverpool),Unnamed Road,,Bayberry,NY,13088,,866-816-7584,E,,Public,24 hours daily,,,2,,,EV Connect,http://evconnect.com/,GPS,43.114426,-76.214147,10/29/2024,187173,2024-10-29 03:09:36,,,,03/22/2021,J1772
ELEC,Davidson Chevrolet Buick GMC,18549 US-11,,Watertown,NY,13601,,315-221-3721,E,,Public - Credit card at all times,24 hours daily,A D Debit M V,,2,,,Non-Networked,,GPS,43.935950,-75.930779,04/14/2024,227090,2024-04-14 22:11:34,P,,,08/26/2022,J1772
ELEC,2000 Westchester,2000 Westchester Avenue,,Purchase,NY,10577,,888-998-2546,E,,Public,24 hours daily,,,2,,,Blink Network,http://www.blinkcharging.com/,GPS,41.016756,-73.711198,10/29/2024,310097,2024-10-29 00:23:51,,,,04/11/2022,J1772
ELEC,MONROE COUNTY HIGHLAND S1,171 Reservoir Ave Monroe County Parks Office,Parking Lot South of Parks Office at 171 Reservoir Avenue,Rochester,NY,14620,,888-758-4389,E,,Public,24 hours daily,,,2,,,ChargePoint Network,http://www.chargepoint.com/,GPS,43.130883,-77.608427,10/29/2024,319717,2024-10-29 02:10:52,,,,11/14/2023,J1772
ELEC,QUEENSBURY TOWN ACT CTR 2,742 Bay Rd,Rear parking lot of Queensbury activity center,Queensbury,NY,12804,,888-758-4389,E,,Public,24 hours daily,,,2,,,ChargePoint Network,http://www.chargepoint.com/,GPS,43.360590,-73.657050,10/29/2024,181133,2024-10-29 01:18:27,,,,01/27/2021,J1772
ELEC,CITY OF ALBANY 200 H. JOHNSON,200 Henry Johnson Boulevard,,Albany,NY,12210,,888-758-4389,E,,Public,24 hours daily,,,2,,,ChargePoint Network,http://www.chargepoint.com/,GPS,42.662795,-73.758897,10/29/2024,262439,2024-10-29 01:29:07,,,,06/09/2023,J1772
ELEC,"21 Sealey road, Hempstead",21 Sealey Ave,,Hempstead,NY,11550,,888-356-8911,E,,Public,24 hours daily,,,4,,,FLO,https://flo.ca/,GPS,40.713850,-73.631610,10/29/2024,307398,2024-10-29 03:34:05,,,,08/17/2023,J1772
ELEC,VASSAR COLLEGE SOUTH LOT 1,112130 Raymond Ave,,Arlington,NY,12603,,888-758-4389,E,,Public,24 hours daily,,,2,,,ChargePoint Network,http://www.chargepoint.com/,GPS,41.681836,-73.894667,10/29/2024,155289,2024-10-29 01:14:04,,,,04/10/2020,J1772
ELEC,G & M REALTY 2 STATION 4,22-44 Jackson Ave,Parking Garage,LIC,NY,11101,,888-758-4389,E,,Public,24 hours daily,,,2,,,ChargePoint Network,http://www.chargepoint.com/,GPS,40.745344,-73.946180,10/29/2024,223835,2024-10-29 01:46:26,,,,07/21/2022,J1772
ELEC,CORP COMM 3 STATION 9 CC3,Teleport Dr/Corp Commons Bldg,"Parking garage, 2nd Floor",Staten Island,NY,10314,,888-758-4389,E,,Public,24 hours daily,,,2,,,ChargePoint Network,http://www.chargepoint.com/,GPS,40.604082,-74.179499,10/29/2024,252140,2024-10-29 01:21:31,,,,01/26/2023,J1772
ELEC,Woodbury Common - Tesla Supercharger,498 Red Apple Court,,Central Valley,NY,10917,,877-798-3752,E,,Public,24 hours daily. Please check Tesla's online station map to see if an adapter is required at this location.,A D Debit M V,,,12,,Tesla,https://www.tesla.com/supercharger,GPS,41.313038,-74.124907,07/01/2024,257674,2024-08-14 18:58:22,P,,,03/30/2023,TESLA
ELEC,TOWN OF MP TMP STATION 2,1 Town Hall Plaza,,Valhalla,NY,10595,,888-758-4389,E,,Public,24 hours daily,,,1,,,ChargePoint Network,http://www.chargepoint.com/,GPS,41.095986,-73.777545,10/29/2024,238221,2024-10-29 01:02:41,,,,12/16/2022,J1772
ELEC,79 South Ferry Road (US-B99-2XN-2),79 South Ferry Road,,Shelter Island,NY,11964,,866-576-1495,E,,Public,24 hours daily,A ACCOUNT_BALANCE D M V,,1,,,RIVIAN_WAYPOINTS,https://rivian.com/experience/charging,GPS,41.057030,-72.324370,10/29/2024,225919,2024-10-29 03:16:12,,,,08/18/2022,J1772
ELEC,DCEC - N DEPOT DCEC #1,7 Depot St,,Delhi,NY,13753,,888-758-4389,E,,Public,24 hours daily,,,2,,,ChargePoint Network,http://www.chargepoint.com/,GPS,42.271027,-74.919526,10/29/2024,171241,2024-10-29 01:23:35,,,,01/12/2021,J1772
ELEC,ESF MARSHALL HALL 1,121 Esf Campus Dr E,,Syracuse,NY,13210,,888-758-4389,E,,Public,24 hours daily,,,2,,,ChargePoint Network,http://www.chargepoint.com/,GPS,43.034090,-76.136233,10/29/2024,312690,2024-10-29 02:06:47,,,,10/11/2023,J1772
ELEC,TOWN OF RED HK RED HOOK 1,7336 S Broadway,East parking lot,Red Hook,NY,12571,,888-758-4389,E,,Public,24 hours daily,,,2,,,ChargePoint Network,http://www.chargepoint.com/,GPS,41.987127,-73.880399,10/29/2024,171726,2024-10-29 00:49:53,,,,01/27/2021,J1772
ELEC,Hampton Inn Cortland - Tesla Destination,26 River St,,Cortland,NY,13045,,877-798-3752,E,,Public,,,,1,,,Tesla Destination,https://www.tesla.com/destination-charging,200-8,42.607282,-76.163925,07/01/2024,114929,2024-10-16 16:58:41,P,,,05/17/2016,TESLA
ELEC,COLE GROUP BROOKVIEW 2,4 Brookview Ct,,Schenectady,NY,12306,,888-758-4389,E,,Public,24 hours daily,,,2,,,ChargePoint Network,http://www.chargepoint.com/,GPS,42.804824,-74.000142,10/29/2024,237955,2024-10-29 01:53:38,,,,12/14/2022,J1772
ELEC,SIBLEY SQUARE MORTIMER GW FL3,83 Mortimer St,3rd Floor Near Elevator / Stairs,Rochester,NY,14604,,888-758-4389,E,,Public,24 hours daily,,,2,,,ChargePoint Network,http://www.chargepoint.com/,GPS,43.157689,-77.607116,10/29/2024,180132,2024-10-29 00:53:17,,,,01/27/2021,J1772
ELEC,799 SENECA STATION 13,799 Seneca St,,Buffalo,NY,14210,,888-758-4389,E,,Public,Mon 5:00pm - 10:00pm; Tue 5:00pm - 10:00pm; Wed 5:00pm - 10:00pm; Thu 5:00pm - 10:00pm; Fri 5:00pm - 10:00pm; Sat 8:00am - 10:00pm; Sun 8:00am - 10:00pm,,,1,,,ChargePoint Network,http://www.chargepoint.com/,GPS,42.875107,-78.847268,10/29/2024,191449,2024-10-29 01:30:05,,,,06/24/2021,J1772
ELEC,Mohawk Honda Dealership Outside,175 Freemans Bridge Rd,,Scotia,NY,12302,,1-844-623-1001,E,,Public,24 hours daily,,,6,,,LIVINGSTON,https://www.solution.energy,GPS,42.847050,-73.942540,10/29/2024,334508,2024-10-29 04:04:31,,,,05/02/2024,J1772
ELEC,STAYBRIDGE STATION2,39 Wolf Rd,,Albany,NY,12205,,888-758-4389,E,,Public,24 hours daily,,,2,,,ChargePoint Network,http://www.chargepoint.com/,GPS,42.712961,-73.811472,10/29/2024,212941,2024-10-29 00:35:12,,,,03/27/2022,J1772
ELEC,Mill Creek - A,16 Mill Creek Drive,,East Greenbush,NY,12061,,1-844-623-1001,E,,Public,24 hours daily,,,8,,,LIVINGSTON,https://www.solution.energy,GPS,42.613410,-73.702590,10/29/2024,334441,2024-10-29 04:06:27,,,,05/02/2024,J1772
ELEC,FC1225 LATHAM FARMS PR,579 Troy-Schenectady Rd,Latham Farms Planet Fitness Right Charger 2,Latham,NY,12110,,888-758-4389,E,,Public,24 hours daily,,,2,,,ChargePoint Network,http://www.chargepoint.com/,GPS,42.757072,-73.761930,10/29/2024,254202,2024-10-29 01:57:11,,,,02/17/2023,J1772
ELEC,HUDSON PRESERVE BLDG 7 #7,12 Beryl Way,,Watervliet,NY,12189,,888-758-4389,E,,Public,24 hours daily,,,2,,,ChargePoint Network,http://www.chargepoint.com/,GPS,42.732693,-73.723590,10/29/2024,143172,2024-10-29 01:04:46,,,,08/15/2019,J1772
ELEC,NATIONAL GRID KOHLS CLIFTON,54 Crossing Blvd,Near main entrance,Clifton Park,NY,12065,,888-758-4389,E,,Public,24 hours daily,,,2,,,ChargePoint Network,http://www.chargepoint.com/,GPS,42.860939,-73.771285,10/29/2024,162199,2024-10-29 00:56:05,,,,06/12/2020,J1772
ELEC,SAREMBAS STATION 2,86 Congress St,Against brick pillar,Saratoga Springs,NY,12866,,888-758-4389,E,,Public,24 hours daily,,,2,,,ChargePoint Network,http://www.chargepoint.com/,GPS,43.078663,-73.790306,10/29/2024,227531,2024-10-29 01:48:10,,,,09/14/2022,J1772
ELEC,EXECUTIVE PARK #3,2 Executive Blvd,,Montebello,NY,10901,,888-758-4389,E,,Public,24 hours daily,,,2,,,ChargePoint Network,http://www.chargepoint.com/,GPS,41.120160,-74.116720,10/29/2024,175754,2024-10-29 01:15:38,,,,01/27/2021,J1772
ELEC,Akwesasne Mohawk RV Parking,873 State Rt 37,,Hogansburg,NY,13655,,518-358-2222,E,,Public - Credit card at all times,24 hours daily,A D Debit M V,,2,,,Non-Networked,,GPS,44.968385,-74.640549,07/11/2024,227682,2024-07-11 19:05:43,P,,,09/13/2022,J1772
ELEC,SIENA COLLEGE MORRELL EVSE2,Friars Dr,side parking lot of morel science center (faculty members and students only),Latham,NY,12110,,888-758-4389,E,,Public,24 hours daily,,,2,,,ChargePoint Network,http://www.chargepoint.com/,GPS,42.719990,-73.750810,10/29/2024,194627,2024-10-29 01:31:25,,,,08/28/2021,J1772
ELEC,Harrison Place,368 W Main Street,,Malone,NY,12953,,1-844-623-1001,E,,Public,24 hours daily,,,2,,,LIVINGSTON,https://www.solution.energy,GPS,44.848230,-74.294590,10/29/2024,334439,2024-10-29 04:06:28,,,,05/02/2024,J1772
ELEC,MONROE COUNTY WESTFALL EAST,111 Westfall Road Health & Human Services HHS,Parking Lot at 111 Westfall Rd.-Monroe County Health & Social Services,Rochester,NY,14620,,888-758-4389,E,,Public,24 hours daily,,,2,,,ChargePoint Network,http://www.chargepoint.com/,GPS,43.113396,-77.621539,10/29/2024,254365,2024-10-29 01:57:34,,,,02/22/2023,J1772
ELEC,Advantage Honda,559 Middle Country Road,,Saint James,NY,11780,,888-998-2546,E,,Public,24 hours daily,,,,1,,Blink Network,http://www.blinkcharging.com/,GPS,40.861120,-73.160553,10/29/2024,360887,2024-10-29 00:21:19,,,,03/14/2024,J1772COMBO
ELEC,IMPark 302 2nd St - Tesla Destination,302 2nd St,,Brooklyn,NY,11215,,877-798-3752,E,,Public,,,,4,,,Tesla Destination,https://www.tesla.com/destination-charging,200-9,40.674312,-73.984880,07/01/2024,150581,2024-10-16 16:58:41,P,,,03/31/2019,TESLA
ELEC,Courtyard by Marriott Kingston-QBDestinationSiteID37717 - Tesla Destination,500 Frank Sottile Blvd,,Kingston,NY,12401,,877-798-3752,E,,Public,,,,2,,,Tesla Destination,https://www.tesla.com/destination-charging,GPS,41.969690,-73.986387,07/01/2024,250867,2024-10-16 16:58:41,P,,,12/12/2017,TESLA
ELEC,MP 102 LLC MP 102 LLC,1214 Fifth Avenue,,New York,NY,10029,,888-758-4389,E,,Public,24 hours daily,,,2,,,ChargePoint Network,http://www.chargepoint.com/,GPS,40.791267,-73.952039,10/29/2024,162472,2024-10-29 00:31:09,,,,06/12/2020,J1772
ELEC,ABM Parking Services 285 W 50th Street LLC - Tesla Destination,285 W 50th St,,New York,NY,10019,,877-798-3752,E,,Public,,,,3,,,Tesla Destination,https://www.tesla.com/destination-charging,200-8,40.762411,-73.984495,07/01/2024,115078,2024-10-16 16:58:41,P,,,03/10/2016,J1772 TESLA
ELEC,Roosevelt Field - Tesla Supercharger,630 Old Country Road,,Garden City,NY,11530,,877-798-3752,E,,Public,24 hours daily. Please check Tesla's online station map to see if an adapter is required at this location.,A D Debit M V,,,12,,Tesla,https://www.tesla.com/supercharger,GPS,40.741602,-73.613058,07/01/2024,200956,2024-08-14 18:58:22,P,,,11/04/2021,TESLA
ELEC,South Port Shopping Center - Tesla Supercharger,999 Montauk Highway,,Shirley,NY,11967,,877-798-3752,E,,Public,24 hours daily. Please check Tesla's online station map to see if an adapter is required at this location.,A D Debit M V,,,12,,Tesla,https://www.tesla.com/supercharger,GPS,40.805880,-72.859780,07/01/2024,214708,2024-08-14 18:58:22,P,,,04/17/2022,J1772COMBO TESLA
ELEC,PICOTTE 11 CORPORATE 1,11 Corporate Woods Blvd,Behind building 11 East side of parking garage.,Albany,NY,12211,,888-758-4389,E,,Public,24 hours daily,,,2,,,ChargePoint Network,http://www.chargepoint.com/,GPS,42.683460,-73.766840,10/29/2024,180634,2024-10-29 01:16:51,,,,01/27/2021,J1772
ELEC,CHRISTCHURCH STATION 1,7423-74 S Broadway,,Red Hook,NY,12571,,888-758-4389,E,,Public,24 hours daily,,,2,,,ChargePoint Network,http://www.chargepoint.com/,GPS,41.993038,-73.878435,10/29/2024,201775,2024-10-29 01:36:38,,,,11/30/2021,J1772
ELEC,LEX COOP EAST STATION,1678 Hertel Ave,Parking Lot,Buffalo,NY,14216,,888-758-4389,E,,Public,24 hours daily,,,2,,,ChargePoint Network,http://www.chargepoint.com/,GPS,42.947980,-78.845406,10/29/2024,232960,2024-10-29 01:49:54,,,,10/06/2022,J1772
ELEC,UTICA CITY HALL CITY OF UTICA,1 Kennedy Plaza,Off Broadway lot left of clock tower,Utica,NY,13502,,888-758-4389,E,,Public,24 hours daily,,,2,,,ChargePoint Network,http://www.chargepoint.com/,GPS,43.101554,-75.235544,10/29/2024,162311,2024-10-29 00:51:39,,,,06/12/2020,J1772
ELEC,MPG 121 Reade Street - Tesla Destination,121 Reade St,,New York,NY,10013,,877-798-3752,E,,Public,,,,3,,,Tesla Destination,https://www.tesla.com/destination-charging,200-9,40.716268,-74.009491,07/01/2024,115006,2024-10-16 16:58:41,P,,,01/08/2018,J1772 TESLA
ELEC,LIVEWELL GROUP 101 BAXTER CT,101 Baxter Ct,Bldg 100-106,Delmar,NY,12054,,888-758-4389,E,,Public,24 hours daily,,,2,,,ChargePoint Network,http://www.chargepoint.com/,GPS,42.608080,-73.848670,10/29/2024,165398,2024-10-29 01:17:32,,,,08/22/2020,J1772
ELEC,Sylvan Parking 136-33 37th Ave - Tesla Destination,136-33 37th Ave,,Flushing,NY,11354,,877-798-3752,E,,Public,,,,3,,,Tesla Destination,https://www.tesla.com/destination-charging,200-9,40.761959,-73.829813,07/01/2024,150586,2024-10-16 16:58:41,P,,,03/30/2019,TESLA
ELEC,Parker Towers 40 - Garage 40,104-40 Queens Blvd,,Forest Hills,NY,11375,,813-492-5220,E,,Public,24 hours daily,A ANDROID_PAY APPLE_PAY D M V,,20,,,EVOKE,https://evokesystems.com/,GPS,40.723200,-73.850500,10/11/2024,356885,2024-10-11 18:09:31,P,,,11/21/2021,J1772
ELEC,Quik Park Columbia Garage LLC - Tesla Destination,250 W. 97th St,,New York,NY,10025,,877-798-3752,E,,Public,,,,3,,,Tesla Destination,https://www.tesla.com/destination-charging,200-8,40.795624,-73.971961,07/01/2024,115069,2024-10-16 16:58:41,P,,,03/14/2016,J1772 TESLA
ELEC,MTP Parking 568 Union Ave - Tesla Destination,568 Union Ave,,Brooklyn,NY,11211,,877-798-3752,E,,Public,,,,4,,,Tesla Destination,https://www.tesla.com/destination-charging,200-9,40.718054,-73.951847,07/01/2024,122477,2024-10-16 16:58:41,P,,,01/17/2019,TESLA
ELEC,101 E 78th St,101 E 78th St,,New York,NY,10075,,888-356-8911,E,,Public,24 hours daily,,,2,,,FLO,https://flo.ca/,GPS,40.774878,-73.960671,10/29/2024,194170,2024-10-29 03:33:08,,,,08/21/2021,J1772
ELEC,1 WATERLINE STATION#9,10 Riverside Blvd,Waterline 1 garage,New York,NY,10069,,888-758-4389,E,,Public,24 hours daily,,,2,,,ChargePoint Network,http://www.chargepoint.com/,GPS,40.772916,-73.992630,10/29/2024,316934,2024-10-29 01:40:55,,,,11/08/2023,J1772
ELEC,Rapidpark 480 Riverside (120th St) - Tesla Destination,480 Riverside Dr,,New York,NY,10027,,877-798-3752,E,,Public,,,,3,,,Tesla Destination,https://www.tesla.com/destination-charging,200-8,40.811187,-73.963571,07/01/2024,115140,2024-10-16 16:58:41,P,,,01/08/2018,J1772 TESLA
ELEC,Tullys Goodtimes Erie Blvd,2943 Erie Blvd E,,Syracuse,NY,13224,,1-844-623-1001,E,,Public,24 hours daily,,,6,,,LIVINGSTON,https://www.solution.energy,GPS,43.055810,-76.088620,10/29/2024,351526,2024-10-29 04:06:49,,,,07/25/2024,J1772
ELEC,Airport Executive Park,150 Airport Executive Park,,Nanuet,NY,10954,,1-844-623-1001,E,,Public,24 hours daily,,,2,,,LIVINGSTON,https://www.solution.energy,GPS,41.109100,-74.028860,10/29/2024,223091,2024-10-29 04:05:18,,,,12/11/2021,J1772
ELEC,5 FARRELL ROAD TOWN HALL EVSE1,5 Farrell Rd,Parking lot at town of willsboro office building,Willsboro,NY,12996,,888-758-4389,E,,Public,24 hours daily,,,2,,,ChargePoint Network,http://www.chargepoint.com/,GPS,44.370823,-73.395990,10/29/2024,193242,2024-10-29 01:29:56,,,,07/28/2021,J1772
ELEC,LeadCar GMC of Utica,5700 HORATIO ST,,UTICA,NY,13502,,866-816-7584,E,,Public,24 hours daily,,,,1,,EV Connect,http://evconnect.com/,GPS,43.136854,-75.217281,10/29/2024,308827,2024-10-29 03:10:32,,,,09/09/2023,J1772COMBO
ELEC,Mid-Hudson Library System,103 Market St,,Poughkeepsie,NY,12601,,1-844-623-1001,E,,Public,24 hours daily,,,4,,,LIVINGSTON,https://www.solution.energy,GPS,41.700380,-73.930420,10/29/2024,233102,2024-10-29 04:05:49,,,,09/01/2022,J1772
ELEC,TOWN GLENVILLE IM PARK EV2,Indian Meadows Park 1 Jason Morris Way,near playground at bottom of the hill,Glenville,NY,12302,,888-758-4389,E,,Public,24 hours daily,,,2,,,ChargePoint Network,http://www.chargepoint.com/,GPS,42.887606,-73.936799,10/29/2024,175629,2024-10-29 01:14:39,,,,01/27/2021,J1772
ELEC,PV Parking 40-07 73rd St - Tesla Destination,40-07 73rd St,,Woodside,NY,11377,,877-798-3752,E,,Public,,,,4,,,Tesla Destination,https://www.tesla.com/destination-charging,200-9,40.746481,-73.892258,07/01/2024,115251,2024-10-16 16:58:41,P,,,07/06/2018,TESLA
ELEC,Pratt MWP College - Parking Lot,310 Genesee St,,Utica,NY,13502,,813-492-5220,E,,Public,24 hours daily,A ANDROID_PAY APPLE_PAY D M V,,8,,,EVOKE,https://evokesystems.com/,GPS,43.097705,-75.240104,10/11/2024,356992,2024-10-11 18:09:31,P,,,08/29/2022,J1772
ELEC,Standard Parking 1360 Fulton Street - Tesla Destination,1360 Fulton St,,Brooklyn,NY,11216,,877-798-3752,E,,Public,,,,2,,,Tesla Destination,https://www.tesla.com/destination-charging,200-9,40.680168,-73.946022,07/01/2024,114889,2024-10-16 16:58:41,P,,,05/24/2018,TESLA
ELEC,MUNICIPAL BLDG PUBLIC - B,1 Van Wyck St,North side of Municipal Building,Croton-on-Hudson,NY,10520,,888-758-4389,E,,Public,24 hours daily,,,2,,,ChargePoint Network,http://www.chargepoint.com/,GPS,41.208506,-73.887500,10/29/2024,122766,2024-10-29 01:02:13,,,,05/15/2019,J1772
ELEC,"NY DCFC WATER MILL, NY",760 Montauk Hwy,Rear Parking Lot,Water Mill,NY,11976,,888-758-4389,E,,Public,24 hours daily,,,,1,,ChargePoint Network,http://www.chargepoint.com/,GPS,40.911797,-72.353065,10/29/2024,167884,2024-10-29 01:17:33,,,,10/28/2020,CHADEMO J1772COMBO
ELEC,The Point Resort - Tesla Destination,222 Beaverwood Rd,,Saranac Lake,NY,12983,,877-798-3752,E,,Public,,,,3,,,Tesla Destination,https://www.tesla.com/destination-charging,200-9,44.303571,-74.330278,07/01/2024,115233,2024-10-16 16:58:41,P,,,11/03/2014,J1772 TESLA
ELEC,RRH RIEDMAN CAMP 5,100 Kings Hwy S,,Rochester,NY,14617,,888-758-4389,E,,Public,24 hours daily,,,2,,,ChargePoint Network,http://www.chargepoint.com/,GPS,43.202583,-77.574614,10/29/2024,173964,2024-10-29 01:00:13,,,,01/27/2021,J1772
ELEC,St Anns Cherry Ridge - Front Lot,920 Cherry Ridge Blvd,,Webster,NY,14580,,813-492-5220,E,,Public,24 hours daily,A ANDROID_PAY APPLE_PAY D M V,,4,,,EVOKE,https://evokesystems.com/,GPS,43.209180,-77.469737,10/11/2024,357120,2024-10-11 18:09:31,P,,,09/12/2021,J1772
ELEC,BELMONTEASTVIEW CLUB 3,Hoppen Drive,Southside of building 13,Central Islip,NY,11722,,888-758-4389,E,,Public,24 hours daily,,,2,,,ChargePoint Network,http://www.chargepoint.com/,GPS,40.768369,-73.192356,10/29/2024,360568,2024-10-29 02:23:02,,,,10/23/2024,J1772
ELEC,ALBANY COUNTY RAIL TRAIL,839 Kenwood Ave Rail Trail,In Parking lot for Rail bike trail,Slingerlands,NY,12159,,888-758-4389,E,,Public,24 hours daily,,,2,,,ChargePoint Network,http://www.chargepoint.com/,GPS,42.629269,-73.863661,10/29/2024,162134,2024-10-29 00:58:53,,,,06/12/2020,J1772
ELEC,Longhouse Reserve - Tesla Destination,133 Hands Creek Rd,,East Hampton,NY,11937,,877-798-3752,E,,Public,,,,4,,,Tesla Destination,https://www.tesla.com/destination-charging,200-9,40.982212,-72.200115,07/01/2024,150564,2024-10-16 16:58:41,P,,,04/01/2019,TESLA
ELEC,NATIONAL GRID KOHLS AMSTERDAM,Amsterdam Cmns,,Amsterdam,NY,12010,,888-758-4389,E,,Public,24 hours daily,,,2,,,ChargePoint Network,http://www.chargepoint.com/,GPS,42.965599,-74.190194,10/29/2024,307724,2024-10-29 02:07:26,,,,08/23/2023,J1772
ELEC,87-40 Francis Lewis Blvd - Garage,87-40 Francis Lewis Blvd,,Queens,NY,11427,,813-492-5220,E,,Public,24 hours daily,A ANDROID_PAY APPLE_PAY D M V,,42,,,EVOKE,https://evokesystems.com/,GPS,40.722417,-73.761698,10/11/2024,357109,2024-10-11 18:09:31,P,,,06/10/2024,J1772
ELEC,SHELTER ISLAND STATION 1,2-6 E Thomas St,Shelter Island Police Department,Shelter Island,NY,11964,,888-758-4389,E,,Public,24 hours daily,,,2,,,ChargePoint Network,http://www.chargepoint.com/,GPS,41.069794,-72.338548,10/29/2024,162356,2024-10-29 00:50:20,,,,06/12/2020,J1772
ELEC,CITY HALL 12534 CITY HALL 2,542 Warren St,,Hudson,NY,12534,,888-758-4389,E,,Public,24 hours daily,,,2,,,ChargePoint Network,http://www.chargepoint.com/,GPS,42.249110,-73.784680,10/29/2024,174708,2024-10-29 01:08:38,,,,01/27/2021,J1772
ELEC,Ford Charge - Bailey Ford of Plattsburgh,7189 US-9,,Plattsburgh,NY,12901,,888-357-1009,E,,Public,24 hours daily,A D Debit M V,,,4,,FORD_CHARGE,https://www.ford.com/support/category/electric-vehicle/charging/public-charging/,GPS,44.729069,-73.434309,,358295,2024-10-15 18:05:30,P,,,10/08/2024,J1772COMBO
ELEC,REGENERON 47G-03,Tempel Ln,Parking Lot,East Greenbush,NY,12061,,888-758-4389,E,,Public,24 hours daily,,,2,,,ChargePoint Network,http://www.chargepoint.com/,GPS,42.637281,-73.711822,10/29/2024,347996,2024-10-29 02:20:14,,,,06/15/2024,J1772
ELEC,Hillside Shell Service Center,113 Columbus Ave,,Valhalla,NY,10595,,949-945-2000,E,,Public,24 hours daily,A ACCOUNT_BALANCE ANDROID_PAY APPLE_PAY CREDIT D M V,,4,,,EVGATEWAY,http://evgateway.com/,200-8,41.080000,-73.777070,05/09/2024,333882,2024-05-09 20:32:20,P,,,06/22/2023,J1772
ELEC,NEW HARTFORD GW-1 1.3,8635 Clinton St,,New Hartford,NY,13413,,888-758-4389,E,,Public,24 hours daily,,,2,,,ChargePoint Network,http://www.chargepoint.com/,GPS,43.092842,-75.316400,10/29/2024,174764,2024-10-29 01:06:34,,,,01/27/2021,J1772
ELEC,Northeast Bronx YMCA,1250 E 229th St,,Bronx,NY,10466,,347-389-6140,E,,Public - Credit card at all times,24 hours daily; members only,A D Debit M V,,4,,,Non-Networked,,GPS,40.882786,-73.841986,03/14/2024,205826,2024-03-14 18:02:10,P,,,02/04/2022,J1772
ELEC,SUNY BUFFALO JACOBS 7,50 Augspurger Rd,Jacobs A lot,Buffalo,NY,14228,,888-758-4389,E,,Public,24 hours daily,,,2,,,ChargePoint Network,http://www.chargepoint.com/,GPS,42.998864,-78.787049,10/29/2024,182265,2024-10-29 01:24:27,,,,01/27/2021,J1772
ELEC,MPG Parking,475 West 41st St,,New York,NY,10036,,888-998-2546,E,,Public,24 hours daily,,,2,,,Blink Network,http://www.blinkcharging.com/,GPS,40.758967,-73.995189,10/29/2024,251159,2024-10-29 00:18:36,,,,07/27/2022,J1772
ELEC,Revel - Brooklyn Superhub,467 Marcy Ave,,Brooklyn,NY,11206,,949-945-2000,E,,Public,24 hours daily,A D Debit M V,,,25,,REVEL,https://gorevel.com,GPS,40.699334,-73.949665,,358436,2024-10-18 14:57:10,P,,,10/08/2024,CHADEMO J1772COMBO TESLA
ELEC,NATIONAL GRID CHILI'S NIAGARA,1536 Military Rd,Chili’s parking lot near front entrance,Niagara Falls,NY,14304,,888-758-4389,E,,Public,24 hours daily,,,2,,,ChargePoint Network,http://www.chargepoint.com/,GPS,43.094737,-78.973192,10/29/2024,162207,2024-10-29 00:56:04,,,,06/12/2020,J1772
ELEC,PJ VILLAGE BARNUM PARKING,209 Barnum Ave,Directly across from the rocket park,Port Jefferson,NY,11777,,888-758-4389,E,,Public,24 hours daily,,,2,,,ChargePoint Network,http://www.chargepoint.com/,GPS,40.944218,-73.070775,10/29/2024,185740,2024-10-29 01:26:17,,,,03/09/2021,J1772
ELEC,BURNS MGT OXFORD 4,6203 Johnston Rd,"Derbyshire Building, Oxford Heights",Albany,NY,12203,,888-758-4389,E,,Public,24 hours daily,,,2,,,ChargePoint Network,http://www.chargepoint.com/,GPS,42.685296,-73.870736,10/29/2024,173864,2024-10-29 00:55:30,,,,01/27/2021,J1772
ELEC,2nd Precinct,441 Central Park Ave,,Yonkers,NY,10704,,866-816-7584,E,,Public,24 hours daily,,,3,,,EV Connect,http://evconnect.com/,GPS,40.919447,-73.868721,10/29/2024,260293,2024-10-29 03:11:17,,,,05/04/2023,J1772
ELEC,Raymour & Flanigan - Tesla Supercharger,3035 Cropsey Ave,,Brooklyn,NY,11224,,877-798-3752,E,,Public,24 hours daily. Please check Tesla's online station map to see if an adapter is required at this location.,A D Debit M V,,,12,,Tesla,https://www.tesla.com/supercharger,GPS,40.581175,-73.985218,07/01/2024,321155,2024-08-14 18:58:22,P,,,11/30/2023,J1772COMBO TESLA
ELEC,ROCKLAND COUNTY STATION 1,100 Baron Court,,Monsey,NY,10952,,888-758-4389,E,,Public,24 hours daily,,,1,,,ChargePoint Network,http://www.chargepoint.com/,GPS,41.105862,-74.069200,10/29/2024,168261,2024-10-29 01:20:36,,,,11/11/2020,J1772
ELEC,HAMMOCKS CANAND HATC 7000 LEFT,7000 Hammocks Dr,Hammocks at Canandaigua 7000 Lefy,Canandaigua,NY,14424,,888-758-4389,E,,Public,24 hours daily,,,2,,,ChargePoint Network,http://www.chargepoint.com/,GPS,42.880601,-77.297098,10/29/2024,352066,2024-10-29 02:22:39,,,,08/03/2024,J1772
ELEC,2 WEST AVE 2 WEST 1.3,2 West Ave,,Saratoga Springs,NY,12866,,888-758-4389,E,,Public,24 hours daily,,,2,,,ChargePoint Network,http://www.chargepoint.com/,GPS,43.084282,-73.802980,10/29/2024,182001,2024-10-29 01:23:39,,,,01/27/2021,J1772
ELEC,MONROE COUNTY MCC BR W2,1000 East Henrietta Road MCC Parking Lot V,"MCC Brighton Campus Visitors Parking Lot V, North side of Lot",Rochester,NY,14623,,888-758-4389,E,,Public,24 hours daily,,,2,,,ChargePoint Network,http://www.chargepoint.com/,GPS,43.101309,-77.612707,10/29/2024,332704,2024-10-29 02:18:02,,,,04/20/2024,J1772
ELEC,CAR CHARGERS NUMBER 411,140 Nottingham Cir,,Jamesville,NY,13078,,888-758-4389,E,,Public,24 hours daily,,,1,,,ChargePoint Network,http://www.chargepoint.com/,GPS,43.013283,-76.084335,10/29/2024,180991,2024-10-29 01:16:45,,,,01/27/2021,J1772
ELEC,30 Lincoln Plaza - Garage,30 W 63rd St,,New York,NY,10023,,813-492-5220,E,,Public,24 hours daily,A ANDROID_PAY APPLE_PAY D M V,,8,,,EVOKE,https://evokesystems.com/,GPS,40.770600,-73.981700,10/11/2024,356986,2024-10-11 18:09:31,P,,,12/19/2021,J1772
ELEC,Atlantic Honda,1375 Sunrise Highway,,Bay Shore,NY,11706,,888-998-2546,E,,Public,24 hours daily,,,3,,,Blink Network,http://www.blinkcharging.com/,GPS,40.734528,-73.257142,10/29/2024,311684,2024-10-29 00:15:45,,,,08/25/2023,J1772
ELEC,1345 Parking Garage - Tesla Destination,1345 6th Ave,,New York,NY,10105,,877-798-3752,E,,Public,,,,3,,,Tesla Destination,https://www.tesla.com/destination-charging,GPS,40.763510,-73.979364,07/01/2024,115012,2024-10-16 16:58:41,P,,,12/07/2017,J1772 TESLA
ELEC,New York Hilton Midtown - Tesla Destination,1335 Avenue of the Americas,,New York,NY,10019,,877-798-3752,E,,Public,,,,2,,,Tesla Destination,https://www.tesla.com/destination-charging,200-9,40.762234,-73.979036,07/01/2024,115011,2024-10-16 16:58:41,P,,,01/26/2017,TESLA
ELEC,Lia Nissan,2233 Central Ave,,Schenectady,NY,12304,,518-579-2000,E,,Public - Call ahead,Dealership business hours,,,1,,,Non-Networked,,200-9,42.764517,-73.885220,02/12/2024,44192,2024-02-12 15:25:05,P,,,11/30/2011,J1772
ELEC,NAA NAA 2,2000 Dealer Dr Newburgh,,Orange Lake,NY,12550,,888-758-4389,E,,Public,24 hours daily,,,1,,,ChargePoint Network,http://www.chargepoint.com/,GPS,41.516814,-74.096238,10/29/2024,347730,2024-10-29 01:31:43,,,,06/14/2024,J1772
ELEC,854ELLICOTT 134 HIGH ST 7,134 High St,,Buffalo,NY,14203,,888-758-4389,E,,Public,24 hours daily,,,2,,,ChargePoint Network,http://www.chargepoint.com/,GPS,42.901007,-78.863771,10/29/2024,181847,2024-10-29 01:22:54,,,,01/27/2021,J1772
ELEC,HILTONGARDENINN HGI EV,1585 Round Swamp Rd,,Plainview,NY,11803,,888-758-4389,E,,Public,24 hours daily,,,2,,,ChargePoint Network,http://www.chargepoint.com/,GPS,40.782625,-73.442490,10/29/2024,255621,2024-10-29 01:48:45,,,,03/07/2023,J1772
ELEC,HOTEL LOCATION HI&S RIGHT,101 S Union St,Hampton Inn Right Charger Near Main Entrance,Rochester,NY,14607,,888-758-4389,E,,Public,24 hours daily,,,2,,,ChargePoint Network,http://www.chargepoint.com/,GPS,43.152180,-77.599267,10/29/2024,310625,2024-10-29 02:08:17,,,,09/14/2023,J1772
ELEC,Van Schaick Park,Van Schaick Park,,Cohoes,NY,12047,,1-844-623-1001,E,,Public,24 hours daily,,,2,,,LIVINGSTON,https://www.solution.energy,GPS,42.767640,-73.689340,10/29/2024,252711,2024-10-29 04:04:55,,,,11/29/2022,J1772
ELEC,St Tropez Building - Garage,340 E 64th St,,New York,NY,10065,,813-492-5220,E,,Public,24 hours daily,A ANDROID_PAY APPLE_PAY D M V,,10,,,EVOKE,https://evokesystems.com/,GPS,40.763015,-73.960127,10/11/2024,357008,2024-10-11 18:09:31,P,,,12/19/2021,J1772
ELEC,STATION PC STATION PC,356 Villa Roma Rd,,Callicoon,NY,12723,,888-758-4389,E,,Public,24 hours daily,,,2,,,ChargePoint Network,http://www.chargepoint.com/,GPS,41.763774,-74.973885,10/29/2024,162305,2024-10-29 00:52:18,,,,06/12/2020,J1772
ELEC,Jessica Chevrolet,115 W Main St,,Honeoye Falls,NY,14472,,585-624-2818,E,,Public - Credit card at all times,24 hours daily,A D Debit M V,,2,,,Non-Networked,,GPS,42.950095,-77.600749,04/14/2024,226505,2024-04-14 22:11:34,P,,,08/24/2022,J1772
ELEC,Mirror Lake Inn Resort,77 Mirror Lake Dr,,Lake Placid,NY,12946,,518-523-2544,E,,Public - Credit card at all times,24 hours daily; customer use only,A D Debit M V,,3,,,Non-Networked,,GPS,44.293968,-73.982843,03/14/2024,227692,2024-03-14 18:02:10,P,,,09/13/2022,J1772
ELEC,STOHL STOHL4,3860 California Rd,,Orchard Park,NY,14127,,888-758-4389,E,,Public,24 hours daily,,,1,,,ChargePoint Network,http://www.chargepoint.com/,GPS,42.779458,-78.781226,10/29/2024,183810,2024-10-29 01:25:32,,,,02/05/2021,J1772
ELEC,Long Island Aquarium - Tesla Destination,431 E Main St,,Riverhead,NY,11901,,877-798-3752,E,,Public,,,,3,,,Tesla Destination,https://www.tesla.com/destination-charging,GPS,40.918555,-72.656237,07/01/2024,359664,2024-10-16 16:58:41,P,,,,J1772 TESLA
ELEC,Rapidpark 575 1st Avenue - Tesla Destination,575 1st Ave,,New York,NY,10016,,877-798-3752,E,,Public,,,,3,,,Tesla Destination,https://www.tesla.com/destination-charging,200-8,40.742735,-73.974296,07/01/2024,115163,2024-10-16 16:58:41,P,,,06/13/2017,J1772 TESLA
ELEC,Popeyes,3401 Mickle Ave,,Bronx,NY,10469,,888-356-8911,E,,Public,24 hours daily,,,6,,,FLO,https://flo.ca/,GPS,40.876952,-73.845534,10/29/2024,250759,2024-10-29 03:33:28,,,,01/14/2023,J1772
ELEC,Oxford Memorial Library,8 Fort Hill Park,,Oxford,NY,13830,,888-998-2546,E,,Public,24 hours daily,,,2,,,Blink Network,http://www.blinkcharging.com/,GPS,42.440655,-75.596482,10/29/2024,195862,2024-10-29 00:05:15,,,,09/13/2021,J1772
ELEC,100 Rockwood St,100 Rockwood St,,Rochester,NY,14610,,866-816-7584,E,,Public,24 hours daily,,,4,,,EV Connect,http://evconnect.com/,GPS,43.144836,-77.549751,10/29/2024,301760,2024-10-29 03:11:50,,,,06/30/2023,J1772
ELEC,STATION 12345 STATION 3,3948 E River Rd,,West Henrietta,NY,14586,,888-758-4389,E,,Public,24 hours daily,,,2,,,ChargePoint Network,http://www.chargepoint.com/,GPS,43.064021,-77.685189,10/29/2024,306446,2024-10-29 02:06:31,,,,08/05/2023,J1772
ELEC,Scotia Branch  Library,14 Mohawk Ave,,Scotia,NY,12302,,1-844-623-1001,E,,Public,24 hours daily,,,4,,,LIVINGSTON,https://www.solution.energy,GPS,42.824470,-73.959520,10/29/2024,324852,2024-10-29 04:05:39,,,,10/23/2023,J1772
ELEC,PERMA,9 Cornell Road,,Latham,NY,12210,,1-844-623-1001,E,,Public,24 hours daily,,,8,,,LIVINGSTON,https://www.solution.energy,GPS,42.758710,-73.823930,10/29/2024,347943,2024-10-29 04:06:36,,,,06/14/2024,J1772
ELEC,300 East 34th,300 E 34th St,,New York,NY,10016,,1-844-623-1001,E,,Public,24 hours daily,,,4,,,LIVINGSTON,https://www.solution.energy,GPS,40.744370,-73.975610,10/29/2024,334487,2024-10-29 04:06:29,,,,05/02/2024,J1772
ELEC,AMPHENOL 191 STATION 5,191 Delaware Ave,Parking lot of Amphenol Aerospace,Sidney,NY,13838,,888-758-4389,E,,Public,24 hours daily,,,2,,,ChargePoint Network,http://www.chargepoint.com/,GPS,42.307110,-75.400660,10/29/2024,346479,2024-10-29 01:38:18,,,,05/18/2024,J1772
ELEC,Rapidpark 70 Riverside Dr - Tesla Destination,70 Riverside Dr,,New York,NY,10024,,877-798-3752,E,,Public,,,,2,,,Tesla Destination,https://www.tesla.com/destination-charging,200-9,40.784831,-73.982085,07/01/2024,115180,2024-10-16 16:58:41,P,,,10/20/2016,TESLA
ELEC,Shuttleworth Park,65 Crescent Ave,,Amsterdam,NY,12010,,1-844-623-1001,E,,Public,24 hours daily,,,10,,,LIVINGSTON,https://www.solution.energy,GPS,42.960310,-74.172250,10/29/2024,324855,2024-10-29 04:05:42,,,,02/28/2023,J1772
ELEC,BHFV LEFT,2114 Sound Ave,,Baiting Hollow,NY,11933,,888-758-4389,E,,Public,24 hours daily,,,2,,,ChargePoint Network,http://www.chargepoint.com/,GPS,40.956315,-72.755549,10/29/2024,306335,2024-10-29 02:00:57,,,,08/04/2023,J1772
ELEC,Village Dodge Inc,819 NY-66,,Hudson,NY,12534,,518-828-1585,E,,Public - Call ahead,24 hours daily,A D Debit M V,,1,,,Non-Networked,,GPS,42.272530,-73.722516,07/11/2024,229076,2024-07-11 19:05:43,P,,,09/17/2022,J1772
ELEC,Residences at Covered Bridge - Pool,850 Vine St.,,Liverpool,NY,13088,,1-844-623-1001,E,,Public,24 hours daily,,,4,,,LIVINGSTON,https://www.solution.energy,GPS,43.105970,-76.200680,10/29/2024,236637,2024-10-29 04:04:35,,,,10/14/2022,J1772
ELEC,ROCKLAND HYU STATION 2,55 New York 303,Back of Building,West Nyack,NY,10994,,888-758-4389,E,,Public,Mon 5:00pm - 12:00am; Tue 5:00pm - 12:00am; Wed 5:00pm - 12:00am; Thu 5:00pm - 12:00am; Fri 5:00pm - 12:00am; Sat 5:00pm - 12:00am; Sun 5:00pm - 12:00am,,,,1,,ChargePoint Network,http://www.chargepoint.com/,GPS,41.091432,-73.949836,10/29/2024,346709,2024-10-29 02:19:20,,,,05/23/2024,CHADEMO J1772COMBO
ELEC,CORP COMM 3 STATION 2 CC3,Teleport Dr/Corp Commons Bldg,"Parking garage, 3rd Floor",Staten Island,NY,10314,,888-758-4389,E,,Public,24 hours daily,,,2,,,ChargePoint Network,http://www.chargepoint.com/,GPS,40.604154,-74.179546,10/29/2024,252144,2024-10-29 01:21:33,,,,01/26/2023,J1772
ELEC,SUNY CORTLAND NEUBIG 1.2,15 Neubig Rd,Located in front of Neubig Hall in metered parking area.  No parking 2-6 am.  Don't pay meter while charging.  All other rules apply.,Cortland,NY,13045,,888-758-4389,E,,Public,Mon 6:00am - 12:00am; Tue 6:00am - 12:00am; Wed 6:00am - 12:00am; Thu 6:00am - 12:00am; Fri 6:00am - 12:00am; Sat 6:00am - 12:00am; Sun 6:00am - 12:00am,,,2,,,ChargePoint Network,http://www.chargepoint.com/,GPS,42.596090,-76.192400,10/29/2024,183387,2024-10-29 01:18:12,,,,01/27/2021,J1772
ELEC,274 Old Nyack Turnpike Spring Valley NY 10977 - Tesla Destination,274 Old Nyack Turnpike,,Spring Valley,NY,10977,,877-798-3752,E,,Public,,A D Debit M V,,7,,,Tesla Destination,https://www.tesla.com/destination-charging,GPS,41.102167,-74.044930,07/01/2024,348235,2024-10-16 16:58:41,P,,,06/17/2024,J1772
ELEC,Tehan's Plaza - Red Lobster,4581 Commercial Drive,,New Hartford,NY,13413,,1-844-623-1001,E,,Public,24 hours daily,,,8,,,LIVINGSTON,https://www.solution.energy,GPS,43.086220,-75.315780,10/29/2024,189535,2024-10-29 04:04:52,,,,04/30/2021,J1772
ELEC,Icon Parking Independent - Tesla Destination,417 E 71st St,,New York,NY,10021,,877-798-3752,E,,Public,,,,3,,,Tesla Destination,https://www.tesla.com/destination-charging,200-8,40.766708,-73.955483,07/01/2024,115129,2024-10-16 16:58:41,P,,,08/30/2017,J1772 TESLA
ELEC,HAMMOCKS CANAND HATC 4000 RIGHT,4000 Hammocks Drive,Hammocks at Canandaigua 4000 Right,Canandaigua,NY,14424,,888-758-4389,E,,Public,24 hours daily,,,2,,,ChargePoint Network,http://www.chargepoint.com/,GPS,42.880106,-77.298514,10/29/2024,351556,2024-10-29 02:22:03,,,,07/26/2024,J1772
ELEC,Randall Buick GMC Cadillac,5375 THOMAS ROAD,,CANANDAIGUA,NY,14424,,866-816-7584,E,,Public,24 hours daily,,,,3,,EV Connect,http://evconnect.com/,GPS,42.919138,-77.306865,10/29/2024,357950,2024-10-29 03:10:11,,,,10/12/2024,J1772COMBO
ELEC,OMG EV CHARGER EVCHARGER4,656 Co Hwy 33,,Cooperstown,NY,13326,,888-758-4389,E,,Public,24 hours daily,,,2,,,ChargePoint Network,http://www.chargepoint.com/,GPS,42.626130,-74.945080,10/29/2024,205124,2024-10-29 01:37:27,,,,01/21/2022,J1772
ELEC,MILTON NY CCENTER3,310 Northline Rd,Parking Lot,Ballston Spa,NY,12020,,888-758-4389,E,,Public,24 hours daily,,,2,,,ChargePoint Network,http://www.chargepoint.com/,GPS,43.024926,-73.851146,10/29/2024,258942,2024-10-29 01:55:57,,,,04/11/2023,J1772
ELEC,SCHENECTADY ERIE BLVD,154 Erie Blvd,Street parking on Erie Boulevard between State Street and I-890,Schenectady,NY,12305,,888-758-4389,E,,Public,24 hours daily,,,2,,,ChargePoint Network,http://www.chargepoint.com/,GPS,42.813077,-73.945836,10/29/2024,162344,2024-10-29 00:50:53,,,,06/12/2020,J1772
ELEC,35-1 38th St,35-1 38th St,,Long Island City,NY,11101,,888-356-8911,E,,Public,24 hours daily,,,4,,,FLO,https://flo.ca/,GPS,40.755417,-73.923072,10/29/2024,193925,2024-10-29 03:32:21,,,,08/14/2021,J1772
ELEC,Marriott Melville Long Island - Tesla Supercharger,1350  Walt Whitman Road,,Melville,NY,11747,,877-798-3752,E,,Public,24 hours daily. Please check Tesla's online station map to see if an adapter is required at this location.,A D Debit M V,,,12,,Tesla,https://www.tesla.com/supercharger,GPS,40.784718,-73.420924,07/01/2024,218663,2024-08-14 18:58:22,P,,,05/18/2022,TESLA
ELEC,THE ITHACAN D,210 E Green St,Garage,Ithaca,NY,14850,,888-758-4389,E,,Public,24 hours daily,,,2,,,ChargePoint Network,http://www.chargepoint.com/,GPS,42.438936,-76.495958,10/29/2024,311783,2024-10-29 02:09:15,,,,09/28/2023,J1772
ELEC,Tech Fall,"23 Washington Ave ,",,Pleasantville,NY,10570,,866-816-7584,E,,Public,24 hours daily,,,4,,,EV Connect,http://evconnect.com/,GPS,41.135753,-73.791497,10/29/2024,123192,2024-10-29 03:08:34,,,,04/01/2019,J1772
ELEC,Scarsdale Commons,70 Garth Rd,,Scarsdale,NY,10583,,1-844-623-1001,E,,Public,24 hours daily,,,6,,,LIVINGSTON,https://www.solution.energy,GPS,40.986620,-73.809530,10/29/2024,223246,2024-10-29 04:04:32,,,,01/14/2022,J1772
ELEC,3740 Route 104 Williamson NY 14589,3740 Route 104,,Williamson,NY,14589,,866-816-7584,E,,Public,24 hours daily,,,,2,,EV Connect,http://evconnect.com/,GPS,43.232610,-77.203419,10/29/2024,302442,2024-10-29 03:11:52,,,,07/13/2023,J1772COMBO
ELEC,Holiday Inn - Johnstown Back,308 N Comrie Ave,,Johnstown,NY,12095,,1-844-623-1001,E,,Public,24 hours daily,,,2,,,LIVINGSTON,https://www.solution.energy,GPS,43.022370,-74.360240,10/29/2024,236889,2024-10-29 04:05:30,,,,11/01/2022,J1772
ELEC,QUEENSBURY TOWN HOVEY POND 1,21 Lafayette Street,New parking area at hovey pond park,Queensbury,NY,12804,,888-758-4389,E,,Public,24 hours daily,,,2,,,ChargePoint Network,http://www.chargepoint.com/,GPS,43.329655,-73.665280,10/29/2024,165628,2024-10-29 01:19:01,,,,08/28/2020,J1772
ELEC,Associate's Lot,2157 Main St,,Buffalo,NY,14214,,866-816-7584,E,,Public,24 hours daily,,,4,,,EV Connect,http://evconnect.com/,GPS,42.929000,-78.847208,10/29/2024,202630,2024-10-29 03:10:02,,,,12/13/2021,J1772
ELEC,Bridge Street on the Hudson,One Bridge St,,Irvington,NY,10533,,1-844-623-1001,E,,Public,24 hours daily,,,4,,,LIVINGSTON,https://www.solution.energy,GPS,41.040590,-73.873930,10/29/2024,223232,2024-10-29 04:05:48,,,,12/14/2021,J1772
ELEC,Waters View,100 Waters View Circle,,Cohoes,NY,12047,,1-844-623-1001,E,,Public,24 hours daily,,,2,,,LIVINGSTON,https://www.solution.energy,GPS,42.777770,-73.683040,10/29/2024,189540,2024-10-29 04:05:00,,,,01/19/2021,J1772
ELEC,College Plaza,15-109 Middle Country Rd,,Selden,NY,11784,,877-455-3833,E,,Public,24 hours daily,,,,1,,eVgo Network,https://www.evgo.com/,GPS,40.865165,-73.049424,10/28/2024,227977,2024-10-28 23:57:29,,,,03/07/2018,CHADEMO J1772COMBO
ELEC,iPark NYC 333 E 38th NYU - Tesla Destination,333 E 38th St,,New York,NY,10016,,877-798-3752,E,,Public,,,,3,,,Tesla Destination,https://www.tesla.com/destination-charging,200-8,40.746565,-73.971591,07/01/2024,115101,2024-10-16 16:58:41,P,,,12/14/2015,J1772 TESLA
ELEC,Forest Park Elementary,100 Forest Dr.,,Albany,NY,12205,,1-844-623-1001,E,,Public,24 hours daily,,,4,,,LIVINGSTON,https://www.solution.energy,GPS,42.720020,-73.824270,10/29/2024,324805,2024-10-29 04:04:22,,,,09/07/2023,J1772
ELEC,Burger King Farmington NY,1238 State Route 332,,Farmington,NY,14425,,888-998-2546,E,,Public,24 hours daily,,,2,,,Blink Network,http://www.blinkcharging.com/,GPS,42.972609,-77.354868,10/29/2024,164403,2024-10-29 00:11:44,,,,07/21/2020,J1772
ELEC,Dollar Tree - Tesla Supercharger,3159 Silverback Ln,,Painted Post,NY,14870,,877-798-3752,E,,Public,24 hours daily,A D Debit M V,,,12,,Tesla,https://www.tesla.com/supercharger,GPS,42.153785,-77.104896,09/12/2024,354680,2024-09-12 16:47:34,P,,,08/27/2024,TESLA
ELEC,PANYNJ LGATCGARAGE 5-4,Taxi Access Rd LaGuardia Airport,Level 5,Queens,NY,11371,,888-758-4389,E,,Public,24 hours daily,,,1,,,ChargePoint Network,http://www.chargepoint.com/,GPS,40.769470,-73.865591,10/29/2024,331866,2024-10-29 02:17:26,,,,04/06/2024,J1772
ELEC,Rockefeller Univ - Garage Ground Floor,500 E 63rd St,,New York,NY,10065,,813-492-5220,E,,Public,24 hours daily,A ANDROID_PAY APPLE_PAY D M V,,25,,,EVOKE,https://evokesystems.com/,GPS,40.760823,-73.957536,10/11/2024,357046,2024-10-11 18:09:31,P,,,07/07/2022,J1772
ELEC,ICE RINK LIBRARY,9 Division St,,Saugerties,NY,12477,,888-758-4389,E,,Public,24 hours daily,,,2,,,ChargePoint Network,http://www.chargepoint.com/,GPS,42.077730,-73.948650,10/29/2024,149087,2024-10-29 01:08:18,,,,11/12/2019,J1772
ELEC,RidgeWell Fitness - Tesla Destination,3555 Main Street,,Stone Ridge,NY,12484,,877-798-3752,E,,Public,,,,2,,,Non-Networked,,200-9,41.852486,-74.138484,07/01/2024,168549,2024-10-16 16:58:41,P,,,11/20/2018,J1772
ELEC,QUICKLEES#32 PORTER RD 4,6025 Porter Rd,NW Parking Area,Niagara Falls,NY,14304,,888-758-4389,E,,Public,24 hours daily,,,,1,,ChargePoint Network,http://www.chargepoint.com/,GPS,43.107397,-78.994348,10/29/2024,325074,2024-10-29 02:13:35,,,,01/11/2024,CHADEMO J1772COMBO
ELEC,Where Sharon Stays - Tesla Destination,318 Houseman St,,Mayfield,NY,12117,,877-798-3752,E,,Public,,,,1,,,Tesla Destination,https://www.tesla.com/destination-charging,GPS,43.189660,-74.176222,07/01/2024,359093,2024-10-16 16:58:41,P,,,,TESLA
ELEC,St. Mary's of the Assumption,47 Syracuse St.,,Baldwinsville,NY,13027,,1-844-623-1001,E,,Public,24 hours daily,,,6,,,LIVINGSTON,https://www.solution.energy,GPS,43.153180,-76.329830,10/29/2024,223277,2024-10-29 04:05:53,,,,03/16/2022,J1772
ELEC,ANTHEM-ELEVANCE STATION-2,15 Plaza Dr,parking area,Latham,NY,12110,,888-758-4389,E,,Public,24 hours daily,,,2,,,ChargePoint Network,http://www.chargepoint.com/,GPS,42.768831,-73.758521,10/29/2024,226579,2024-10-29 01:13:55,,,,08/26/2022,J1772
ELEC,GARNET HILL LOG HOUSE #2,39 Garnet Hill Rd Section 2,,North River,NY,12856,,888-758-4389,E,,Public,24 hours daily,,,2,,,ChargePoint Network,http://www.chargepoint.com/,GPS,43.712299,-74.107122,10/29/2024,204653,2024-10-29 01:28:22,,,,01/12/2022,J1772
ELEC,WEST HARRISON STATION ONE,85 Lake St,Parking lot,Harrison,NY,10604,,888-758-4389,E,,Public,24 hours daily,,,2,,,ChargePoint Network,http://www.chargepoint.com/,GPS,41.043003,-73.747760,10/29/2024,165336,2024-10-29 01:18:53,,,,08/20/2020,J1772
ELEC,Town of Dekalb,4343 US Highway 11,,DeKalb Junction,NY,13630,,866-816-7584,E,,Public,24 hours daily,,,2,,,EV Connect,http://evconnect.com/,GPS,44.505435,-75.273847,10/29/2024,123109,2024-10-29 03:08:12,,,,04/01/2019,J1772
ELEC,Crossroads Ford,2351 Rte 9W,,Ravena,NY,12143,,1-888-717-4544,E,,Public,24 hours daily,,,6,2,,CHARGESMART_EV,https://chargesmartev.com,GPS,42.475830,-73.819614,10/29/2024,347351,2024-10-29 04:09:14,,,,06/04/2024,J1772 J1772COMBO
ELEC,799 SENECA STATION 7,799 Seneca St,,Buffalo,NY,14210,,888-758-4389,E,,Public,Mon 5:00pm - 10:00pm; Tue 5:00pm - 10:00pm; Wed 5:00pm - 10:00pm; Thu 5:00pm - 10:00pm; Fri 5:00pm - 10:00pm; Sat 8:00am - 10:00pm; Sun 8:00am - 10:00pm,,,1,,,ChargePoint Network,http://www.chargepoint.com/,GPS,42.875098,-78.847577,10/29/2024,191247,2024-10-29 01:30:05,,,,06/19/2021,J1772
ELEC,CNB VICTOR EV STATION 1,61 W Main St,West side parking lot,Victor,NY,14564,,888-758-4389,E,,Public,24 hours daily,,,2,,,ChargePoint Network,http://www.chargepoint.com/,GPS,42.982968,-77.411675,10/29/2024,261264,2024-10-29 01:46:22,,,,05/24/2023,J1772
ELEC,STVIN ST. VINCENT 1,890 Madison Ave,St Vincent parking lot,Albany,NY,12208,,888-758-4389,E,,Public,24 hours daily,,,2,,,ChargePoint Network,http://www.chargepoint.com/,GPS,42.661226,-73.784070,10/29/2024,193751,2024-10-29 01:31:40,,,,08/11/2021,J1772
ELEC,Stans Auto Body Ltd,3130 NY-22,,Patterson,NY,12563,,949-945-2000,E,,Public,24 hours daily,A ACCOUNT_BALANCE ANDROID_PAY APPLE_PAY CREDIT D M V,,6,,,EVGATEWAY,http://evgateway.com/,GPS,41.518063,-73.590925,05/09/2024,333777,2024-05-09 20:32:20,P,,,06/08/2023,J1772
ELEC,449 East 49th Street,449 East 49th Street,,New York,NY,10022,,1-844-623-1001,E,,Public,24 hours daily,,,6,,,LIVINGSTON,https://www.solution.energy,GPS,40.752670,-73.964820,10/29/2024,223258,2024-10-29 04:06:04,,,,02/08/2022,J1772
ELEC,MARINA COURT,422 East Boston Post Road,,Mamaroneck,NY,10543,,888-998-2546,E,,Public,24 hours daily,,,4,,,Blink Network,http://www.blinkcharging.com/,GPS,40.950688,-73.730248,10/29/2024,309905,2024-10-29 00:19:25,,,,10/10/2022,J1772
ELEC,SLSDC - Administration Building,180 Andrews St,,Massena,NY,13662,,,E,,Public,24 hours daily; Drivers must bring their own J1772 cordset for Level 1 charging,,1,,,,Non-Networked,,GPS,44.929771,-74.902773,03/08/2023,184631,2024-01-31 22:07:01,FG,17.0,Department of Transportation,01/15/2021,NEMA515
ELEC,Parkit 200 West End Ave - Tesla Destination,200 West End Ave,,New York,NY,10023,,877-798-3752,E,,Public,,,,5,,,Tesla Destination,https://www.tesla.com/destination-charging,200-9,40.778221,-73.985072,07/01/2024,169014,2024-10-16 16:58:41,P,,,07/08/2015,J1772 TESLA
ELEC,Indian Castle Service Area,NYS Thruway Milepost 210 Eastbound,,Little Falls,NY,13365,,888-557-7099,E,,Public,24 hours daily,ANDROID_PAY APPLE_PAY CREDIT Debit M V,,,4,,APPLEGREEN,https://www.applegreenelectric.com/,GPS,43.016172,-74.804118,08/15/2024,256121,2024-08-15 19:57:12,P,,,03/09/2023,CHADEMO J1772COMBO TESLA
ELEC,WEST HERR AUTO WH FH L3-2 EXPP,5025 Camp Road,,Hamburg,NY,14075,,888-758-4389,E,,Public,24 hours daily,,,,2,,ChargePoint Network,http://www.chargepoint.com/,GPS,42.750530,-78.854869,10/29/2024,355511,2024-10-29 02:24:20,,,,09/12/2024,J1772COMBO
ELEC,HUDSON PRESERVE BLDG 6 #8,913 Beryl Way,,Watervliet,NY,12189,,888-758-4389,E,,Public,24 hours daily,,,2,,,ChargePoint Network,http://www.chargepoint.com/,GPS,42.731922,-73.724144,10/29/2024,143224,2024-10-29 01:04:28,,,,08/15/2019,J1772
ELEC,MARKET 32 EV MALTA EV CHARGE,1 Kendall Way,In front of building,Malta,NY,12020,,888-758-4389,E,,Public,24 hours daily,,,2,,,ChargePoint Network,http://www.chargepoint.com/,GPS,42.973660,-73.794790,10/29/2024,152281,2024-10-29 01:09:51,,,,01/08/2020,J1772
ELEC,REGENERON CHARGE # 2,401 Temple Ln,Building 07,Rensselaer,NY,12144,,888-758-4389,E,,Public,24 hours daily,,,2,,,ChargePoint Network,http://www.chargepoint.com/,GPS,42.637005,-73.717195,10/29/2024,314720,2024-10-29 02:10:02,,,,10/21/2023,J1772
ELEC,SHINEMAN SOUTH SHINEMAN CNTR 1,Centennial Drive,South Parking East Border Station 1 (Left),Oswego,NY,13126,,888-758-4389,E,,Public,24 hours daily,,,2,,,ChargePoint Network,http://www.chargepoint.com/,GPS,43.454253,-76.538066,10/29/2024,352212,2024-10-29 02:23:00,,,,08/08/2024,J1772
ELEC,MONROE COUNTY MCC DT S1,MCC Downtown Campus 321 State Street,MCC Downtown Campus Parking Lot South of Campus - Northwest Corner near N Plymouth Ave and Morrie Silver Way,Rochester,NY,14608,,888-758-4389,E,,Public,24 hours daily,,,2,,,ChargePoint Network,http://www.chargepoint.com/,GPS,43.159396,-77.619112,10/29/2024,323338,2024-10-29 02:12:32,,,,12/22/2023,J1772
ELEC,CONVENIENT MED CONV. MED EV 1,319 Bay Rd Convenient Medical Center,,Queensbury,NY,12804,,888-758-4389,E,,Public,24 hours daily,,,2,,,ChargePoint Network,http://www.chargepoint.com/,GPS,43.331081,-73.652911,10/29/2024,181717,2024-10-29 01:21:59,,,,01/27/2021,J1772
ELEC,30-10 35th Street,30-10 35th Street,,Queens,NY,11103,,888-356-8911,E,,Public,24 hours daily,,,2,,,FLO,https://flo.ca/,GPS,40.765233,-73.918436,10/29/2024,225576,2024-10-29 03:32:33,,,,08/16/2022,J1772
ELEC,FC1225 3144 S#1,3144 S Winton Rd,South side near entrance,Rochester,NY,14623,,888-758-4389,E,,Public,24 hours daily,,,2,,,ChargePoint Network,http://www.chargepoint.com/,GPS,43.090489,-77.580804,10/29/2024,235902,2024-10-29 01:52:04,,,,11/10/2022,J1772
ELEC,COLE GROUP COLONIE EAST 4,173 Doorstone Dr,,Latham,NY,12110,,888-758-4389,E,,Public,24 hours daily,,,2,,,ChargePoint Network,http://www.chargepoint.com/,GPS,42.745510,-73.770770,10/29/2024,154058,2024-10-29 01:10:35,,,,02/27/2020,J1772
ELEC,MILL TOYOTA FRONT LOT,257 N Franklin St,,Hempstead,NY,11550,,888-758-4389,E,,Public,24 hours daily,,,2,,,ChargePoint Network,http://www.chargepoint.com/,GPS,40.714469,-73.630539,10/29/2024,294092,2024-10-29 01:41:21,,,,06/23/2023,J1772
ELEC,NATIONAL GRID KOHLS HUDSON,488 Fairview Ave,,Hudson,NY,12534,,888-758-4389,E,,Public,24 hours daily,,,2,,,ChargePoint Network,http://www.chargepoint.com/,GPS,42.281075,-73.751372,10/29/2024,162177,2024-10-29 00:56:45,,,,06/12/2020,J1772
ELEC,AECSOLAR STATION 4 AEC,210 Washington Ave extension,On Front side as marked - only use as signage illustrates,Albany,NY,12203,,888-758-4389,E,,Public,24 hours daily,,,2,,,ChargePoint Network,http://www.chargepoint.com/,GPS,42.703377,-73.857080,10/29/2024,192638,2024-10-29 01:30:51,,,,07/08/2021,J1772
ELEC,KLV Properties,178 Clizbe Ave,,Amsterdam,NY,12010,,1-844-623-1001,E,,Public,24 hours daily,,,4,,,LIVINGSTON,https://www.solution.energy,GPS,42.953280,-74.172600,10/29/2024,233087,2024-10-29 04:04:51,,,,08/09/2022,J1772
ELEC,The Whiteface Lodge - Tesla Destination,7 Whiteface Inn Ln,,Lake Placid,NY,12946,,877-798-3752,E,,Public,,,,3,,,Tesla Destination,https://www.tesla.com/destination-charging,200-9,44.297078,-74.010977,07/01/2024,114966,2024-10-16 16:58:41,P,,,06/15/2015,J1772 TESLA
ELEC,The Venetian - Garage,431 Avenue P,,Brooklyn,NY,11230,,813-492-5220,E,,Public,24 hours daily,A ANDROID_PAY APPLE_PAY D M V,,20,,,EVOKE,https://evokesystems.com/,GPS,40.609178,-73.971448,10/11/2024,357034,2024-10-11 18:09:31,P,,,04/11/2024,J1772
ELEC,PFIZER PR EV 18,401 N Middletown Rd,,Pearl River,NY,10965,,888-758-4389,E,,Public,24 hours daily,,,2,,,ChargePoint Network,http://www.chargepoint.com/,GPS,41.076748,-74.018045,10/29/2024,323934,2024-10-29 02:13:05,,,,01/05/2024,J1772
ELEC,TSRC SHUTTLE STOP 1,5218 Patrick Rd,,Verona,NY,13478,,888-758-4389,E,,Public,24 hours daily,,,2,,,ChargePoint Network,http://www.chargepoint.com/,GPS,43.115050,-75.589165,10/29/2024,196104,2024-10-29 01:32:59,,,,09/19/2021,J1772
ELEC,Champion Parking 60 East End Avenue - Tesla Destination,60 East End Ave,,New York,NY,10028,,877-798-3752,E,,Public,,,,3,,,Tesla Destination,https://www.tesla.com/destination-charging,200-9,40.772712,-73.947045,07/01/2024,115168,2024-10-16 16:58:41,P,,,01/07/2016,J1772 TESLA
ELEC,Smith Haven Mall Lake Grove NY,2 Smith Haven Mall,,Lake Grove,NY,11755,,888-264-2208,E,,Public,Mon 6:00am - 11:59pm; Tue 6:00am - 11:59pm; Wed 6:00am - 11:59pm; Thu 6:00am - 11:59pm; Fri 6:00am - 11:59pm; Sat 6:00am - 11:59pm; Sun 6:00am - 11:59pm,,,2,,,SHELL_RECHARGE,https://www.shell.us/motorist/electric-vehicle-charging.html,GPS,40.864533,-73.127982,10/29/2024,169476,2024-10-29 02:51:14,,,,11/16/2020,J1772
ELEC,MB OF BUFFALO EV MERC BUFF 1,8185 Main St,,Williamsville,NY,14221,,888-758-4389,E,,Public,24 hours daily,,,2,,,ChargePoint Network,http://www.chargepoint.com/,GPS,42.964532,-78.689779,10/29/2024,202803,2024-10-29 01:37:36,,,,12/18/2021,J1772
ELEC,MARKET 32 EV MARKET 32 CP 1,15 Park Avenue,IN FRONT OF PHARMACY,Clifton Park,NY,12065,,888-758-4389,E,,Public,24 hours daily,,,2,,,ChargePoint Network,http://www.chargepoint.com/,GPS,42.865037,-73.782471,10/29/2024,174933,2024-10-29 01:09:23,,,,01/27/2021,J1772
ELEC,SAVARINO COMPAN 500 SENECA 4,Myrtle St Lot Charger 4 500 Seneca Street,,Buffalo,NY,14204,,888-758-4389,E,,Public,24 hours daily,,,2,,,ChargePoint Network,http://www.chargepoint.com/,GPS,42.878530,-78.857700,10/29/2024,164152,2024-10-29 01:17:29,,,,07/11/2020,J1772
ELEC,500 PEARL 500 PEARL,500 Pearl street,Inside parking garage on 2nd floor,Buffalo,NY,14202,,888-758-4389,E,,Public,24 hours daily,,,2,,,ChargePoint Network,http://www.chargepoint.com/,GPS,42.893581,-78.873877,10/29/2024,153301,2024-10-29 01:11:37,,,,02/05/2020,J1772
ELEC,Chicken Run,5639 State Route 23,,Windham,NY,12496,,1-888-717-4544,E,,Public,24 hours daily,,,8,,,CHARGESMART_EV,https://chargesmartev.com,GPS,42.303950,-74.272293,10/29/2024,334215,2024-10-29 04:09:25,,,,08/10/2023,J1772
ELEC,BNIA BNIA 1,131 Buell Ave,Buell Ave Cell Phone Lot,Cheektowaga,NY,14225,,888-758-4389,E,,Public,24 hours daily,,,2,,,ChargePoint Network,http://www.chargepoint.com/,GPS,42.928322,-78.739182,10/29/2024,326703,2024-10-29 02:06:15,,,,01/26/2024,J1772
ELEC,NATIONAL GRID CENTURY HOUSE,977 Loudon rd,,Cohoes,NY,12047,,888-758-4389,E,,Public,24 hours daily,,,2,,,ChargePoint Network,http://www.chargepoint.com/,GPS,42.771298,-73.752656,10/29/2024,222102,2024-10-29 00:55:55,,,,06/29/2022,J1772
ELEC,BURNS MGT THE SPRINGS #4,60 Weibel Ave,,Saratoga Springs,NY,12866,,888-758-4389,E,,Public,24 hours daily,,,2,,,ChargePoint Network,http://www.chargepoint.com/,GPS,43.094747,-73.743656,10/29/2024,174329,2024-10-29 01:01:30,,,,01/27/2021,J1772
ELEC,Shaheen's Adirondack Inn - Tesla Destination,314 Park St,,Tupper Lake,NY,12986,,877-798-3752,E,,Public,,,,1,,,Tesla Destination,https://www.tesla.com/destination-charging,200-9,44.224692,-74.448849,07/01/2024,122496,2024-10-16 16:58:41,P,,,11/19/2018,TESLA
ELEC,ATRIUM EVCHARGE EV7,451 Clifton Park Center Rd,In parking lot.,Clifton Park,NY,12065,,888-758-4389,E,,Public,24 hours daily,,,2,,,ChargePoint Network,http://www.chargepoint.com/,GPS,42.856287,-73.785683,10/29/2024,225560,2024-10-29 01:41:51,,,,08/16/2022,J1772
ELEC,CITY HALL 12534 CITY HALL 3,542 Warren St,,Hudson,NY,12534,,888-758-4389,E,,Public,24 hours daily,,,2,,,ChargePoint Network,http://www.chargepoint.com/,GPS,42.249016,-73.784650,10/29/2024,149513,2024-10-29 01:08:39,,,,11/26/2019,J1772
ELEC,Price Chopper Plaza,1395 New Scotland Rd,,Slingerlands,NY,12159,,518-478-0688,E,,Public,24 hours daily,,,2,,,Non-Networked,,GPS,42.638663,-73.857186,03/14/2024,72970,2024-03-14 18:02:10,P,,,01/25/2016,J1772
ELEC,NATIONAL GRID COMFORT INN,1 Flint rd,Back of Comfort inn parking lot,Buffalo,NY,14221,,888-758-4389,E,,Public,24 hours daily,,,2,,,ChargePoint Network,http://www.chargepoint.com/,GPS,42.990251,-78.790769,10/29/2024,162246,2024-10-29 00:55:17,,,,06/12/2020,J1772
ELEC,Residence Inn New York Manhattan - Tesla Destination,1717 Broadway,,New York,NY,10019,,877-798-3752,E,,Public,,,,2,,,Tesla Destination,https://www.tesla.com/destination-charging,200-9,40.764261,-73.982974,07/01/2024,115031,2024-10-16 16:58:41,P,,,06/22/2015,J1772 TESLA
ELEC,CORNELL CORNELLSTATION7,176 Hoy Rd,lvl 1 garage,Ithaca,NY,14853,,888-758-4389,E,,Public,24 hours daily,,,2,,,ChargePoint Network,http://www.chargepoint.com/,GPS,42.443450,-76.479503,10/29/2024,302246,2024-10-29 02:05:08,,,,07/08/2023,J1772
ELEC,COLGATE 113 BROAD LOT,113 Broad St,Located at 113 Broad Parking lot south side across from Huntington Gym,Hamilton,NY,13346,,888-758-4389,E,,Public,24 hours daily,,,2,,,ChargePoint Network,http://www.chargepoint.com/,GPS,42.815548,-75.540842,10/29/2024,162445,2024-10-29 00:32:23,,,,06/12/2020,J1772
ELEC,Plattekill Service Area,I-87 - NYS Thruway NB,,Plattekill,NY,12568,,888-557-7099,E,,Public,24 hours daily,ANDROID_PAY APPLE_PAY CREDIT Debit M V,,,6,,APPLEGREEN,https://www.applegreenelectric.com/,GPS,41.577646,-74.085386,08/15/2024,347238,2024-08-15 19:57:12,P,,,05/31/2024,CHADEMO J1772COMBO TESLA
ELEC,SRYMCASSB WILTON 1.2,20 Old Gick Rd,Rear parking lot of wilton YMCA,Saratoga Springs,NY,12866,,888-758-4389,E,,Public,24 hours daily,,,2,,,ChargePoint Network,http://www.chargepoint.com/,GPS,43.105800,-73.749300,10/29/2024,183725,2024-10-29 01:25:23,,,,02/02/2021,J1772
ELEC,Thorpe's GMC,5964 MAIN ST,,TANNERSVILLE,NY,12485,,866-816-7584,E,,Public,24 hours daily,,,,1,,EV Connect,http://evconnect.com/,GPS,42.196035,-74.131107,10/29/2024,254289,2024-10-29 03:10:28,,,,02/21/2023,J1772COMBO
ELEC,REIKART HOUSE JAZZBOLINE 2,5010 Main St,Located behind Jazzboline Restaurant,Amherst,NY,14226,,888-758-4389,E,,Public,24 hours daily,,,2,,,ChargePoint Network,http://www.chargepoint.com/,GPS,42.960133,-78.769670,10/29/2024,150803,2024-10-29 01:10:02,,,,12/26/2019,J1772
ELEC,43 Liftbridge Lane E,43 Liftbridge Ln E,,Fairport,NY,14450,,866-816-7584,E,,Public,24 hours daily,,,1,,,EV Connect,http://evconnect.com/,GPS,43.101839,-77.439452,10/29/2024,82260,2024-10-29 03:09:08,,,,12/27/2019,J1772
ELEC,UEM CAR CHARGER CHARGER 1,9 Pruyns Island Dr,Front parking lot of Umicore,Glens Falls,NY,12801,,888-758-4389,E,,Public,24 hours daily,,,2,,,ChargePoint Network,http://www.chargepoint.com/,GPS,43.296474,-73.644080,10/29/2024,189256,2024-10-29 01:28:10,,,,05/05/2021,J1772
ELEC,Bob Johnson Chevrolet Pulaski,4 Caprara Dr,,Pulaski,NY,13142,,1-888-717-4544,E,,Public,24 hours daily,,,1,2,,CHARGESMART_EV,https://chargesmartev.com,GPS,43.550814,-76.113054,10/29/2024,333821,2024-10-29 04:09:27,,,,08/03/2023,J1772 J1772COMBO
ELEC,TOWN OF FISHKIL STATION 1,807 NY-52,rear parking lot,Fishkill,NY,12524,,888-758-4389,E,,Public,24 hours daily,,,2,,,ChargePoint Network,http://www.chargepoint.com/,GPS,41.526429,-73.922451,10/29/2024,207591,2024-10-29 01:37:31,,,,03/04/2022,J1772
ELEC,Paddocks Landing - Parking Lot,116 State St,,Phoenix,NY,13135,,813-492-5220,E,,Public,24 hours daily,A ANDROID_PAY APPLE_PAY D M V,,2,,,EVOKE,https://evokesystems.com/,GPS,43.231300,-76.302700,10/11/2024,356909,2024-10-11 18:09:31,P,,,11/15/2021,J1772
ELEC,FISHKILL 60 MERRITT-1,60 Merritt Blvd,,Fishkill,NY,12524,,888-758-4389,E,,Public,24 hours daily,,,2,,,ChargePoint Network,http://www.chargepoint.com/,GPS,41.531460,-73.886657,10/29/2024,261049,2024-10-29 01:43:52,,,,05/19/2023,J1772
ELEC,Hyatt House Fishkill,100 Westgate Business Center Drive,,Fishkill,NY,12524,,1-844-623-1001,E,,Public,24 hours daily,,,4,,,LIVINGSTON,https://www.solution.energy,GPS,41.528280,-73.897070,10/29/2024,324829,2024-10-29 04:04:24,,,,08/01/2023,J1772
ELEC,EVolve NY Riverhead,209 EAST AVE,,Riverhead,NY,11901,,833-632-2778,E,,Public,24 hours daily,,,,4,,Electrify America,https://www.electrifyamerica.com/,GPS,40.918880,-72.660440,10/29/2024,221460,2024-10-29 02:56:06,,,,06/17/2022,CHADEMO J1772COMBO
ELEC,Swtch Energy,445 NY 304,,Bardonia,NY,10954,,844-798-2438,E,,Public,24 hours daily,A D Debit M V,,4,,,SWTCH,https://swtchenergy.com/,GPS,41.113802,-73.994880,08/10/2023,303248,2024-01-31 22:07:01,P,,,04/05/2023,J1772
ELEC,Abbe Hall,Lennox Road,,Schenectady,NY,12308,,866-816-7584,E,,Public,24 hours daily,,,4,,,EV Connect,http://evconnect.com/,GPS,42.815708,-73.923732,10/29/2024,156046,2024-10-29 03:08:41,,,,05/01/2020,J1772
ELEC,PFIZER PR EV 11,401 N Middletown Rd,,Pearl River,NY,10965,,888-758-4389,E,,Public,24 hours daily,,,2,,,ChargePoint Network,http://www.chargepoint.com/,GPS,41.077480,-74.016672,10/29/2024,322707,2024-10-29 02:12:02,,,,12/14/2023,J1772
ELEC,Tazza Cafe,186 Katonah Ave,,Katonah,NY,10536,,877-455-3833,E,,Public,24 hours daily,,,,1,,eVgo Network,https://www.evgo.com/,GPS,41.256656,-73.684266,10/28/2024,228597,2024-10-28 23:59:40,,,,12/29/2020,CHADEMO J1772COMBO
ELEC,LIVONIA CSD ES 2,6 Puppy Ln,,Livonia,NY,14487,,888-758-4389,E,,Public,24 hours daily,,,2,,,ChargePoint Network,http://www.chargepoint.com/,GPS,42.815303,-77.664881,10/29/2024,240832,2024-10-29 01:54:56,,,,01/03/2023,J1772
ELEC,Lofts @ JC,128 Grand Avenue,,Johnson City,NY,13790,,1-844-623-1001,E,,Public,24 hours daily,,,4,,,LIVINGSTON,https://www.solution.energy,GPS,42.109950,-75.953540,10/29/2024,324836,2024-10-29 04:06:16,,,,11/13/2023,J1772
ELEC,57ALEXANDER SPACE 316,57 Alexander Street,2nd floor garage,Yonkers,NY,10701,,888-758-4389,E,,Public,24 hours daily,,,1,,,ChargePoint Network,http://www.chargepoint.com/,GPS,40.938986,-73.901825,10/29/2024,349468,2024-10-29 02:10:09,,,,06/27/2024,J1772
ELEC,ESSEX FARMS EVSE3,2496 NY-22,Front parking lot of essex farms,Essex,NY,12936,,888-758-4389,E,,Public,24 hours daily,,,2,,,ChargePoint Network,http://www.chargepoint.com/,GPS,44.308174,-73.374610,10/29/2024,196296,2024-10-29 01:32:59,,,,09/24/2021,J1772
ELEC,600 North Ave Building,600 North Ave,,New Rochelle,NY,10801,,844-798-2438,E,,Public - Credit card at all times,24 hours daily,A D Debit M V,,6,,,SWTCH,https://swtchenergy.com/,GPS,40.922678,-73.788238,04/14/2024,331361,2024-04-14 22:11:34,P,,,03/27/2024,J1772
ELEC,Country Glenn Apartments Office,2155 Bedell Rd,,Grand Island,NY,14072,,1-844-623-1001,E,,Public,24 hours daily,,,2,,,LIVINGSTON,https://www.solution.energy,GPS,43.038760,-78.973150,10/29/2024,223230,2024-10-29 04:04:55,,,,12/22/2021,J1772
ELEC,Island Acura,3350 Sunrise Highway,,Wantagh,NY,11793,,1-888-493-3638,E,,Public,,,,,4,,ZEFNET,https://www.zefenergy.com,GPS,40.671980,-73.505810,10/29/2024,341926,2024-10-29 04:01:36,,,,05/09/2024,J1772COMBO
ELEC,Four Brothers Amenia,4957 Route 22,,Amenia,NY,12501,,888-998-2546,E,,Public,24 hours daily,,,7,,,Blink Network,http://www.blinkcharging.com/,GPS,41.850376,-73.557943,10/29/2024,191222,2024-10-29 00:06:51,,,,06/18/2021,J1772
ELEC,231 E 94th Street,231 E 94th Street,,New York,NY,10128,,1-844-623-1001,E,,Public,24 hours daily,,,4,,,LIVINGSTON,https://www.solution.energy,GPS,40.783510,-73.948880,10/29/2024,223297,2024-10-29 04:04:58,,,,05/23/2022,J1772
ELEC,CITY OF GENEVA CITY HALL #1,47 Castle St,At the rear of the building,Geneva,NY,14456,,888-758-4389,E,,Public,24 hours daily,,,2,,,ChargePoint Network,http://www.chargepoint.com/,GPS,42.867477,-76.982604,10/29/2024,164639,2024-10-29 01:14:23,,,,07/30/2020,J1772
ELEC,K&H STATION 1 KELLY & HAYES,66 Southern Blvd,Parking Lot Left Front of Building,Nesconset,NY,11767,,888-758-4389,E,,Public,24 hours daily,,,2,,,ChargePoint Network,http://www.chargepoint.com/,GPS,40.853892,-73.159923,10/29/2024,162292,2024-10-29 00:52:31,,,,06/12/2020,J1772
ELEC,Chris' Coffee,348 Old Niskayuna Rd,,Latham,NY,12110,,833-692-6787,E,,Public - Credit card at all times,Contact station for hours of availability.,A ANDROID_PAY APPLE_PAY CREDIT D M,,2,,,AMPUP,https://ampup.io/,200-9,42.745366,-73.795604,10/11/2022,229904,2023-02-14 15:54:11,P,,,09/15/2022,J1772
ELEC,Van Antwerp Village,1365 Van Antwerp Village,,Niskayuna,NY,12309,,1-844-623-1001,E,,Public,24 hours daily,,,10,,,LIVINGSTON,https://www.solution.energy,GPS,42.815180,-73.889470,10/29/2024,334445,2024-10-29 04:06:24,,,,05/02/2024,J1772
ELEC,535 Carlton Ave,535 Carlton Ave,,Brooklyn,NY,11238,,1-844-623-1001,E,,Public,24 hours daily,,,4,,,LIVINGSTON,https://www.solution.energy,GPS,40.680920,-73.970760,10/29/2024,225118,2024-10-29 04:04:31,,,,07/08/2022,J1772
ELEC,1741 RT 9 EV 4,1741 U.S. 9,Front of building to the right.,Clifton Park,NY,12065,,888-758-4389,E,,Public,24 hours daily,,,2,,,ChargePoint Network,http://www.chargepoint.com/,GPS,42.869247,-73.773056,10/29/2024,185434,2024-10-29 01:25:43,,,,02/27/2021,J1772
ELEC,GMG DCFC AF 10050#2,1401 Saratoga Rd,Rear of building,Fort Edwards,NY,12831,,888-758-4389,E,,Public,24 hours daily,,,,1,,ChargePoint Network,http://www.chargepoint.com/,GPS,43.252179,-73.669630,10/29/2024,318018,2024-10-29 02:10:05,,,,11/10/2023,CHADEMO J1772COMBO
ELEC,The Forge,44-28 Purves St,,Long Island City,NY,11101,,888-998-2546,E,,Public,24 hours daily,,,2,,,Blink Network,http://www.blinkcharging.com/,GPS,40.746790,-73.941110,10/29/2024,241192,2024-10-29 00:05:11,,,,08/17/2022,J1772
ELEC,1 WATERLINE STATION#1,10 Riverside Blvd,First Station,New York,NY,10069,,888-758-4389,E,,Public,24 hours daily,,,2,,,ChargePoint Network,http://www.chargepoint.com/,GPS,40.772896,-73.992536,10/29/2024,207795,2024-10-29 01:37:51,,,,03/09/2022,J1772
ELEC,"NY DCFC FISHKILL, NY",21 Westage Dr,,Fishkill,NY,12524,,888-758-4389,E,,Public,24 hours daily,,,,1,,ChargePoint Network,http://www.chargepoint.com/,GPS,41.526606,-73.894750,10/29/2024,170742,2024-10-29 01:24:24,,,,01/01/2021,CHADEMO J1772COMBO
ELEC,PANYNJ LGA WEST 4,LGA West Garage LaGuardia Airport,,East Elmhurst,NY,11371,,888-758-4389,E,,Public,24 hours daily,,,1,,,ChargePoint Network,http://www.chargepoint.com/,GPS,40.772977,-73.875474,10/29/2024,180141,2024-10-29 00:52:39,,,,01/27/2021,J1772
ELEC,AAA WESTCENTRAL AAA L2 2,100 International Drive,Along Sheridan Dr. street side of building,Amherst,NY,14221,,888-758-4389,E,,Public,24 hours daily,,,2,,,ChargePoint Network,http://www.chargepoint.com/,GPS,42.978251,-78.730056,10/29/2024,261207,2024-10-29 02:00:32,,,,05/23/2023,J1772
ELEC,Town of Farmington,1744 Maplewood Dr,,Farmington,NY,14425,,,E,,Public,24 hours daily,A ANDROID_PAY APPLE_PAY D M V,,4,,,EVOKE,https://evokesystems.com/,GPS,42.946082,-77.340111,10/11/2024,356944,2024-10-11 18:09:31,P,,,08/08/2024,J1772
ELEC,Jessica Chevrolet,115 West Main Street,,Honeoye Falls,NY,14472,,1-888-717-4544,E,,Public,24 hours daily,,,1,2,,CHARGESMART_EV,https://chargesmartev.com,GPS,42.949734,-77.600752,10/29/2024,347381,2024-10-29 04:09:39,,,,06/04/2024,J1772 J1772COMBO
ELEC,ROCHESTER NY SISTERS CITY 2,10 Fitzhugh St N,level 1 adjacent to the entrance,Rochester,NY,14614,,888-758-4389,E,,Public,24 hours daily,,,2,,,ChargePoint Network,http://www.chargepoint.com/,GPS,43.155933,-77.614075,10/29/2024,145539,2024-10-29 01:06:10,,,,09/26/2019,J1772
ELEC,ROSENBLUM300 3 WINNERS 1,3 Winners Cir,,Albany,NY,12205,,888-758-4389,E,,Public,24 hours daily,,,2,,,ChargePoint Network,http://www.chargepoint.com/,GPS,42.721029,-73.797244,10/29/2024,173998,2024-10-29 01:01:54,,,,01/27/2021,J1772
ELEC,BP3 Springside Development,44 Springside Avenue,,Poughkeepsie,NY,12603,,1-888-717-4544,E,,Public,24 hours daily,,,5,,,CHARGESMART_EV,https://chargesmartev.com,GPS,41.698422,-73.902315,10/29/2024,353495,2024-10-29 04:09:33,,,,08/22/2024,J1772
ELEC,Thacher State Park,830 Thacher Park Road,,Voorheesville,NY,12186,,866-816-7584,E,,Public,24 hours daily,,,2,,,EV Connect,http://evconnect.com/,GPS,42.654887,-74.017182,10/29/2024,123136,2024-10-29 03:08:20,,,,04/01/2019,J1772
ELEC,BVILLELIBRARY STATION 1,33 E Genesee St,,Baldwinsville,NY,13027,,888-758-4389,E,,Public,24 hours daily,,,2,,,ChargePoint Network,http://www.chargepoint.com/,GPS,43.159201,-76.329447,10/29/2024,194966,2024-10-29 01:31:47,,,,09/02/2021,J1772
ELEC,WARRENCOUNTY DPW 5,1380 U.S. 9,,Lake George,NY,12845,,888-758-4389,E,,Public,24 hours daily,,,2,,,ChargePoint Network,http://www.chargepoint.com/,GPS,43.359247,-73.701335,10/29/2024,150255,2024-10-29 01:09:27,,,,12/17/2019,J1772
ELEC,12105 Oswego St,12105 Oswego St,,Wolcott,NY,14590,,866-816-7584,E,,Public,24 hours daily,,,,2,,EV Connect,http://evconnect.com/,GPS,43.221978,-76.810163,10/29/2024,320273,2024-10-29 03:12:22,,,,11/18/2023,J1772COMBO
ELEC,GMC Copley Parking - Tesla Destination,2000 Broadway,,New York,NY,10023,,877-798-3752,E,,Public,,,,3,,,Tesla Destination,https://www.tesla.com/destination-charging,200-9,40.775283,-73.981627,07/01/2024,115044,2024-10-16 16:58:41,P,,,06/22/2017,TESLA
ELEC,Price Chopper,10 Glenwood Ave,,Binghamton,NY,13905,,607-770-7151,E,,Public,24 hours daily,,,2,,,Non-Networked,,200-9,42.107612,-75.935778,03/08/2023,154765,2024-01-31 22:07:01,P,,,09/01/2015,J1772
ELEC,ProPark 29-10 Broadway - Tesla Destination,29-10 Broadway,,Astoria,NY,11106,,877-798-3752,E,,Public,,,,4,,,Tesla Destination,https://www.tesla.com/destination-charging,200-9,40.762332,-73.926968,07/01/2024,150616,2024-10-16 16:58:41,P,,,01/17/2019,TESLA
ELEC,Rocking Horse Ranch Resort,600 US-44,,Highland,NY,12528,,833-692-6787,E,,Public,24 hours daily,A D Debit M V,,4,,,AMPUP,https://ampup.io/,GPS,41.692569,-74.015626,03/08/2023,253773,2024-01-31 22:07:01,P,,,02/07/2023,J1772
ELEC,RPI 1 RPI FLEET,2144 Burdett Ave,,Troy,NY,12180,,888-758-4389,E,,Public,24 hours daily,,,1,,,ChargePoint Network,http://www.chargepoint.com/,GPS,42.732209,-73.671332,10/29/2024,162147,2024-10-29 00:58:07,,,,06/12/2020,J1772
ELEC,City Parking Linc Garage - Tesla Destination,62 Northside Piers,,Brooklyn,NY,11249,,877-798-3752,E,,Public,,,,3,,,Tesla Destination,https://www.tesla.com/destination-charging,200-8,40.719425,-73.963964,07/01/2024,114909,2024-10-16 16:58:41,P,,,06/16/2017,J1772 TESLA
ELEC,PICOTTE 22 CORPORATE 1,22 Corporate Woods Blvd,First floor of parking garage next to 22 corporate woods,Albany,NY,12211,,888-758-4389,E,,Public,24 hours daily,,,2,,,ChargePoint Network,http://www.chargepoint.com/,GPS,42.681602,-73.768196,10/29/2024,181107,2024-10-29 01:19:15,,,,01/27/2021,J1772
ELEC,Evolve NY Quackenbush,25 Orange Street,,Albany,NY,12207,,833-632-2778,E,,Public,24 hours daily,,,,4,,Electrify America,https://www.electrifyamerica.com/,GPS,42.653210,-73.748110,10/29/2024,279337,2024-10-29 02:56:08,,,,06/22/2023,CHADEMO J1772COMBO
ELEC,170 E End Ave,170 E End Ave,,New York,NY,10128,,888-356-8911,E,,Public,24 hours daily,,,2,,,FLO,https://flo.ca/,GPS,40.775792,-73.944015,10/29/2024,194168,2024-10-29 03:33:12,,,,08/21/2021,J1772
ELEC,PEAK POINT APT PEAK POINT EV3,1427 Saratoga Rd,Rear parking lot of Peak Point Apartments,Ballston Spa,NY,12020,,888-758-4389,E,,Public,24 hours daily,,,2,,,ChargePoint Network,http://www.chargepoint.com/,GPS,42.978510,-73.861520,10/29/2024,191435,2024-10-29 01:28:47,,,,06/24/2021,J1772
ELEC,Hampton Inn & Suites Syracuse North,1305 Buckely Road,,Syracuse,NY,13212,,1-844-623-1001,E,,Public,24 hours daily,,,4,,,LIVINGSTON,https://www.solution.energy,GPS,43.095090,-76.172500,10/29/2024,334493,2024-10-29 04:06:31,,,,05/02/2024,J1772
ELEC,Seneca One Tower Garage,178 Washington St.,,Buffalo,NY,14203,,855-223-5351,E,,Public,24 hours daily,A D M V,,2,,,FLASH,https://www.flashparking.com/products/diversify-parking-revenue/ev-charging-as-a-revenue-stream/,GPS,42.879654,-78.875426,10/29/2024,349077,2024-10-29 03:21:03,,,,06/23/2024,J1772
ELEC,854ELLICOTT 589ELLICOTT3 CS,589 Ellicott St,,Buffalo,NY,14203,,888-758-4389,E,,Public,24 hours daily,,,2,,,ChargePoint Network,http://www.chargepoint.com/,GPS,42.896143,-78.868544,10/29/2024,181841,2024-10-29 01:22:57,,,,01/27/2021,J1772
ELEC,CENTERS HEALTHC EV-6,170 Buffalo Ave,,Brooklyn,NY,11213,,888-758-4389,E,,Public,24 hours daily,,,2,,,ChargePoint Network,http://www.chargepoint.com/,GPS,40.673186,-73.925637,10/29/2024,328311,2024-10-29 02:15:04,,,,02/14/2024,J1772
ELEC,GOLDEN ARROW GOLDEN 1.1,2559 Main St,Located in Garage C - Free for guests only,Lake Placid,NY,12946,,888-758-4389,E,,Public,24 hours daily,,,2,,,ChargePoint Network,http://www.chargepoint.com/,GPS,44.287130,-73.984680,10/29/2024,181825,2024-10-29 01:21:39,,,,01/27/2021,J1772
ELEC,799 SENECA STATION 5,799 Seneca St,,Buffalo,NY,14210,,888-758-4389,E,,Public,Mon 5:00pm - 10:00pm; Tue 5:00pm - 10:00pm; Wed 5:00pm - 10:00pm; Thu 5:00pm - 10:00pm; Fri 5:00pm - 10:00pm; Sat 8:00am - 10:00pm; Sun 8:00am - 10:00pm,,,1,,,ChargePoint Network,http://www.chargepoint.com/,GPS,42.875107,-78.847622,10/29/2024,191249,2024-10-29 01:30:05,,,,06/19/2021,J1772
ELEC,LKT SOUTH 3,575  Boices Ln,South Entrance,Kingston,NY,12401,,888-758-4389,E,,Public,24 hours daily,,,2,,,ChargePoint Network,http://www.chargepoint.com/,GPS,41.967292,-74.002728,10/29/2024,235446,2024-10-29 01:51:17,,,,10/29/2022,J1772
ELEC,STATION 4TH FL MOTORGATE #1,688 Main St,Motorgate Garage -Fourth Level,New York,NY,10044,,888-758-4389,E,,Public,24 hours daily,,,2,,,ChargePoint Network,http://www.chargepoint.com/,GPS,40.764429,-73.946793,10/29/2024,169880,2024-10-29 01:21:28,,,,12/03/2020,J1772
ELEC,BEVERWYCK STATION 1,3 Autumn Dr Beverwyck,,Slingerlands,NY,12159,,888-758-4389,E,,Public,24 hours daily,,,2,,,ChargePoint Network,http://www.chargepoint.com/,GPS,42.657418,-73.838337,10/29/2024,180882,2024-10-29 01:17:14,,,,01/27/2021,J1772
ELEC,233 LAKE AVE GROVE 1.5,233 Lake Ave,Rear parking lot of 233 lake ave,Saratoga Springs,NY,12866,,888-758-4389,E,,Public,24 hours daily,,,2,,,ChargePoint Network,http://www.chargepoint.com/,GPS,43.085410,-73.765710,10/29/2024,170449,2024-10-29 01:23:49,,,,12/22/2020,J1772
ELEC,BEDFORD_EV CHERRY STREET,425 Cherry St,,Bedford Hills,NY,10507,,888-758-4389,E,,Public,24 hours daily,,,2,,,ChargePoint Network,http://www.chargepoint.com/,GPS,41.240391,-73.699844,10/29/2024,262283,2024-10-29 01:58:45,,,,06/07/2023,J1772
ELEC,SWTCH Energy,215 Harry Howard Ave,,Hudson,NY,12534,,844-798-2438,E,,Public,24 hours daily,A D Debit M V,,6,,,SWTCH,https://swtchenergy.com/,GPS,42.260104,-73.772553,11/09/2023,313645,2024-01-31 22:07:01,P,,,09/05/2023,J1772
ELEC,City World Ford Service,3858 Boston Rd,,Bronx,NY,10475,,1-888-717-4544,E,,Public,24 hours daily,,,3,,,CHARGESMART_EV,https://chargesmartev.com,GPS,40.881388,-73.836880,10/29/2024,350668,2024-10-29 04:09:35,,,,07/17/2024,J1772
ELEC,Glenmere Mansion - Tesla Destination,634 Pine Hill Rd,,Chester,NY,10918,,877-798-3752,E,,Public,,,,3,,,Tesla Destination,https://www.tesla.com/destination-charging,200-9,41.338916,-74.323495,07/01/2024,114922,2024-10-16 16:58:41,P,,,12/04/2015,J1772 TESLA
ELEC,Rodeway Inn & Suites,654 Elmira Rd,,Ithaca,NY,14850,,1-888-717-4544,E,,Public,24 hours daily,,,4,,,CHARGESMART_EV,https://chargesmartev.com,GPS,42.409888,-76.540448,10/29/2024,334240,2024-10-29 04:09:18,,,,10/10/2023,J1772
ELEC,Phoenix Investors,1701 North St,,Endicott,NY,13760,,866-816-7584,E,,Public,24 hours daily,,,4,,,EV Connect,http://evconnect.com/,GPS,42.104913,-76.043789,10/29/2024,198013,2024-10-29 03:09:07,,,,10/19/2021,J1772
ELEC,HIDDEN CREEK HC 249 RIGHT,253 Charwood Cir,Parking Border Right Charger,Irondequoit,NY,14609,,888-758-4389,E,,Public,24 hours daily,,,2,,,ChargePoint Network,http://www.chargepoint.com/,GPS,43.183770,-77.557365,10/29/2024,257177,2024-10-29 01:59:00,,,,03/28/2023,J1772
ELEC,ARTPARK ARTPARK 4,450 South 4th Street,,Lewiston,NY,14092,,888-758-4389,E,,Public,24 hours daily,,,2,,,ChargePoint Network,http://www.chargepoint.com/,GPS,43.166519,-79.045590,10/29/2024,346713,2024-10-29 02:19:20,,,,05/23/2024,J1772
ELEC,57ALEXANDER SPACE 325,57 Alexander Street,Parking garage,Yonkers,NY,10701,,888-758-4389,E,,Public,24 hours daily,,,1,,,ChargePoint Network,http://www.chargepoint.com/,GPS,40.938988,-73.901766,10/29/2024,349463,2024-10-29 02:10:09,,,,06/27/2024,J1772
ELEC,COLL BROCKPORT SERC LOT V,321 New Campus Dr,Lot V next to SERC Bldg.,Brockport,NY,14420,,888-758-4389,E,,Public,Mon 12:00am - 12:00am; Tue 12:00am - 12:00am; Wed 12:00am - 12:00am; Thu 12:00am - 12:00am; Fri 12:00am - 12:00am; Sat 12:00am - 12:00am; Sun 12:00am - 12:00am,,,2,,,ChargePoint Network,http://www.chargepoint.com/,GPS,43.208461,-77.953998,10/29/2024,183177,2024-10-29 01:06:55,,,,01/27/2021,J1772
ELEC,EPLLC LOCKHEED 3,143 Ocean Channel Way,,Liverpool,NY,13088,,888-758-4389,E,,Public,24 hours daily,,,2,,,ChargePoint Network,http://www.chargepoint.com/,GPS,43.110188,-76.187230,10/29/2024,174519,2024-10-29 01:06:18,,,,01/27/2021,J1772
ELEC,Tuthilltown Spirits - Tesla Destination,14 Gristmill Ln,,Gardiner,NY,12525,,877-798-3752,E,,Public,,,,3,,,Tesla Destination,https://www.tesla.com/destination-charging,200-9,41.686314,-74.176669,07/01/2024,114944,2024-10-16 16:58:41,P,,,02/08/2016,J1772 TESLA
ELEC,57ALEXANDER SPACE 253,57 Alexander Street,,Yonkers,NY,10701,,888-758-4389,E,,Public,24 hours daily,,,1,,,ChargePoint Network,http://www.chargepoint.com/,GPS,40.938970,-73.901780,10/29/2024,333669,2024-10-29 02:10:10,,,,04/27/2024,J1772
ELEC,33-10 Queens Blvd,33-10 Queens Blvd,,Queens,NY,11101,,888-356-8911,E,,Public,24 hours daily,,,4,,,FLO,https://flo.ca/,GPS,40.744363,-73.931120,10/29/2024,204691,2024-10-29 03:33:09,,,,01/12/2022,J1772
ELEC,GGMC The Cove - Tesla Destination,99 Battery Pl,,New York,NY,10280,,877-798-3752,E,,Public,,,,3,,,Tesla Destination,https://www.tesla.com/destination-charging,200-9,40.707738,-74.016845,07/01/2024,115197,2024-10-16 16:58:41,P,,,06/07/2017,J1772 TESLA
ELEC,CDTA LIBERTY SQUARE,202 A 4th St,Liberty Square Mobility Hub,Troy,NY,12180,,888-758-4389,E,,Public,24 hours daily,,,2,,,ChargePoint Network,http://www.chargepoint.com/,GPS,42.725779,-73.689916,10/29/2024,360909,2024-10-29 02:25:59,,,,10/29/2024,J1772
ELEC,TCR TOWNE EV STATION 3,12 California  ave,,Albany,NY,12205,,888-758-4389,E,,Public,24 hours daily,,,2,,,ChargePoint Network,http://www.chargepoint.com/,GPS,42.704114,-73.813740,10/29/2024,169945,2024-10-29 01:23:28,,,,12/05/2020,J1772
ELEC,Greymoor Way - Building 2,1201 Greymoor Way,,Baldwinsville,NY,13027,,1-844-623-1001,E,,Public,24 hours daily,,,4,,,LIVINGSTON,https://www.solution.energy,GPS,43.181940,-76.300020,10/29/2024,223120,2024-10-29 04:05:29,,,,10/28/2021,J1772
ELEC,WHITE PLAINS EVSE 2,1 Maple Ave,,White Plains,NY,10605,,888-758-4389,E,,Public,24 hours daily,,,2,,,ChargePoint Network,http://www.chargepoint.com/,GPS,41.028690,-73.759441,10/29/2024,197208,2024-10-29 01:33:43,,,,10/07/2021,J1772
ELEC,Silos at Elk Street,50 Elk St,,Buffalo,NY,14210,,866-816-7584,E,,Public,24 hours daily,,,4,,,EV Connect,http://evconnect.com/,GPS,42.869842,-78.851491,10/29/2024,230965,2024-10-29 03:10:30,,,,09/30/2022,J1772
ELEC,MARKET 32 EV PEDIATRICEV3,81 Schoolhouse Rd,To the left of building.,Albany,NY,12203,,888-758-4389,E,,Public,24 hours daily,,,2,,,ChargePoint Network,http://www.chargepoint.com/,GPS,42.678916,-73.844846,10/29/2024,175506,2024-10-29 01:13:26,,,,01/27/2021,J1772
ELEC,NYC FLEET DPRWFMARINA-S3,109-5 Marina Rd,,Queens,NY,11368,,888-758-4389,E,,Public,24 hours daily,,,1,,,ChargePoint Network,http://www.chargepoint.com/,GPS,40.760424,-73.856316,10/29/2024,193126,2024-10-29 00:46:47,,,,07/24/2021,J1772
ELEC,100 E 15th St - 100 E 15th St,100 E 15th St,,New York,NY,10003,,813-492-5220,E,,Public,24 hours daily,A ANDROID_PAY APPLE_PAY D M V,,10,,,EVOKE,https://evokesystems.com/,GPS,40.735004,-73.989356,10/11/2024,356879,2024-10-11 18:09:31,P,,,05/21/2024,J1772
ELEC,4. Million Air,16 Jetway Dr,,Albany,NY,12211,,866-816-7584,E,,Public,24 hours daily,,,8,,,EV Connect,http://evconnect.com/,GPS,42.740587,-73.807443,10/29/2024,230929,2024-10-29 03:10:07,,,,09/30/2022,J1772
ELEC,440 White Plains Road LLC,440 White Plains Road,,Eastchester,NY,10709,,888-356-8911,E,,Public,24 hours daily,,,4,,,FLO,https://flo.ca/,GPS,40.957120,-73.813220,10/29/2024,349904,2024-10-29 03:34:34,,,,07/03/2024,J1772
ELEC,iPark 245 East 63rd Street - Tesla Destination,245 East 63rd St,,New York,NY,10025,,877-798-3752,E,,Public,,,,3,,,Tesla Destination,https://www.tesla.com/destination-charging,200-8,40.763320,-73.962938,07/01/2024,115065,2024-10-16 16:58:41,P,,,12/09/2016,J1772 TESLA
ELEC,Village of Canastota,205 S Peterboro St,,Canastota,NY,13032,,315-697-7559,E,,Public,24 hours daily,,,2,,,Non-Networked,,GPS,43.077499,-75.752256,03/08/2023,187159,2024-01-31 22:07:01,P,,,03/22/2021,J1772
ELEC,Brewer and Brewer Towing,214 W Broadway,,Fulton,NY,13069,,949-945-2000,E,,Public,24 hours daily,A ACCOUNT_BALANCE ANDROID_PAY APPLE_PAY CREDIT D M V,,2,,,EVGATEWAY,http://evgateway.com/,200-8,43.315640,-76.420460,05/09/2024,334114,2024-05-09 20:32:20,P,,,12/21/2023,J1772
ELEC,Purity Products,200 Terminal Dr,,Plainview,NY,11803,,949-945-2000,E,,Public,24 hours daily,A ACCOUNT_BALANCE ANDROID_PAY APPLE_PAY CREDIT D M V,,3,,,EVGATEWAY,http://evgateway.com/,200-8,40.792520,-73.470530,05/09/2024,334096,2024-05-09 20:32:20,P,,,11/17/2023,J1772
ELEC,GHMC PARKINGGARAGE1,707 E Main St,PARKING GARAGE 1,Middletown,NY,10940,,888-758-4389,E,,Public,24 hours daily,,,2,,,ChargePoint Network,http://www.chargepoint.com/,GPS,41.441925,-74.368095,10/29/2024,202335,2024-10-29 01:37:12,,,,12/10/2021,J1772
ELEC,Hudson Valley Community College - TEC-SMART Building,345 Hermes Rd,,Malta,NY,12020,,518-629-7075,E,,Public,7am-10pm M-Sat; Drivers must bring their own J1772 cordset for Level 1 charging,,1,,,,Non-Networked,,GPS,42.971670,-73.774182,03/08/2023,36532,2024-01-31 22:07:01,SG,,,10/15/2010,NEMA520
ELEC,Henrietta Jefferson Plaza,400 Jefferson Road,,Rochester,NY,14623,,1-844-623-1001,E,,Public,24 hours daily,,,10,,,LIVINGSTON,https://www.solution.energy,GPS,43.089640,-77.641940,10/29/2024,191103,2024-10-29 04:05:43,,,,10/27/2021,J1772
ELEC,VILLAGEHALL RHINEBECK 2,55 E Market St,,Rhinebeck,NY,12572,,888-758-4389,E,,Public,24 hours daily,,,2,,,ChargePoint Network,http://www.chargepoint.com/,GPS,41.927273,-73.910650,10/29/2024,175155,2024-10-29 01:10:44,,,,01/27/2021,J1772
ELEC,LIVEWELL GROUP 501 DERZEE CT,501 Derzee Ct,Between Bldgs 500 and 600,Delmar,NY,12054,,888-758-4389,E,,Public,24 hours daily,,,2,,,ChargePoint Network,http://www.chargepoint.com/,GPS,42.606190,-73.850716,10/29/2024,165394,2024-10-29 01:17:33,,,,08/22/2020,J1772
ELEC,SUNY BUFFALO JACOBS 4,50 Augspurger Rd,Jacobs A lot,Buffalo,NY,14228,,888-758-4389,E,,Public,24 hours daily,,,2,,,ChargePoint Network,http://www.chargepoint.com/,GPS,42.998863,-78.787254,10/29/2024,182263,2024-10-29 01:24:27,,,,01/27/2021,J1772
ELEC,GENESEO E PARK CENTER,4319 Genesee Valley Plaza Rd,,Geneseo,NY,14454,,888-758-4389,E,,Public,24 hours daily,,,2,,,ChargePoint Network,http://www.chargepoint.com/,GPS,42.798122,-77.783377,10/29/2024,224226,2024-10-29 01:44:16,,,,07/22/2022,J1772
ELEC,73 Starr LLC - Parking Lot,73 Starr St,,Brooklyn,NY,11237,,813-492-5220,E,,Public,24 hours daily,A ANDROID_PAY APPLE_PAY D M V,,4,,,EVOKE,https://evokesystems.com/,GPS,40.701900,-73.926600,10/11/2024,357093,2024-10-11 18:09:31,P,,,04/19/2022,J1772
ELEC,Greymoor Way - Building 9,2101 Drummers Ct,,Baldwinsville,NY,13027,,1-844-623-1001,E,,Public,24 hours daily,,,2,,,LIVINGSTON,https://www.solution.energy,GPS,43.181750,-76.298860,10/29/2024,223125,2024-10-29 04:04:34,,,,10/28/2021,J1772
ELEC,Price Chopper - Tesla Supercharger,1930 Saranac Ave,,Lake Placid,NY,12946,,877-798-3752,E,,Public,24 hours daily. Please check Tesla's online station map to see if an adapter is required at this location.,,,,8,,Tesla,https://www.tesla.com/supercharger,GPS,44.294989,-74.010892,07/01/2024,164170,2024-08-14 18:58:22,P,,,07/10/2020,TESLA
ELEC,PICOTTE 12 CORPORATE 5,12 Corporate Woods Blvd,,Albany,NY,12211,,888-758-4389,E,,Public,24 hours daily,,,2,,,ChargePoint Network,http://www.chargepoint.com/,GPS,42.685658,-73.766685,10/29/2024,181236,2024-10-29 01:19:36,,,,01/27/2021,J1772
ELEC,PANYNJ JFK Y GARAGE 1,JFK Access Rd JFK International Airport,First floor near elevator,Queens,NY,11430,,888-758-4389,E,,Public,24 hours daily,,,2,,,ChargePoint Network,http://www.chargepoint.com/,GPS,40.645659,-73.779481,10/29/2024,174641,2024-10-29 01:06:14,,,,01/27/2021,J1772
ELEC,Amsterdam Municipal Golf Course,158 Upper Van Dyke Ave,,Amsterdam,NY,12010,,1-844-623-1001,E,,Public,24 hours daily,,,10,,,LIVINGSTON,https://www.solution.energy,GPS,42.963120,-74.196760,10/29/2024,324772,2024-10-29 04:05:55,,,,02/28/2023,J1772
ELEC,VOB KENSINGTON 1,15 Kensington Terrace,Parking garage Level 1,Bronxville,NY,10708,,888-758-4389,E,,Public,Mon 3:00pm - 12:00am; Tue 3:00pm - 12:00am; Wed 3:00pm - 12:00am; Thu 3:00pm - 12:00am; Fri 3:00pm - 12:00am; Sat 6:00am - 12:00am; Sun 6:00am - 12:00am,,,2,,,ChargePoint Network,http://www.chargepoint.com/,GPS,40.942543,-73.834410,10/29/2024,165221,2024-10-29 01:18:49,,,,08/14/2020,J1772
ELEC,Yogi Bear's Jellystone Park,299 Kiantone Road,,Jamestown,NY,14701,,1-844-623-1001,E,,Public,24 hours daily,,,4,,,LIVINGSTON,https://www.solution.energy,GPS,42.007350,-79.180350,10/29/2024,324900,2024-10-29 04:06:15,,,,11/01/2023,J1772
ELEC,MEM. PLZ STATION 2,42 Memorial Plaza,,Pleasantville,NY,10570,,888-758-4389,E,,Public,24 hours daily,,,2,,,ChargePoint Network,http://www.chargepoint.com/,GPS,41.134508,-73.792877,10/29/2024,234635,2024-10-29 01:50:54,,,,10/19/2022,J1772
ELEC,WEST HERR AUTO WH EA L2-2,535 Main St,,East Aurora,NY,14052,,888-758-4389,E,,Public,24 hours daily,,,2,,,ChargePoint Network,http://www.chargepoint.com/,GPS,42.767552,-78.614996,10/29/2024,357504,2024-10-29 02:25:20,,,,10/04/2024,J1772
ELEC,SHINEMAN SOUTH SHINEMAN CNTR 3,Centennial Drive,South Park East Border Station 3 (Right),Oswego,NY,13126,,888-758-4389,E,,Public,24 hours daily,,,2,,,ChargePoint Network,http://www.chargepoint.com/,GPS,43.454176,-76.538066,10/29/2024,352214,2024-10-29 02:23:00,,,,08/08/2024,J1772
ELEC,KEELER STATION 04,1077 Troy Schenectady Rd,,Latham,NY,12110,,888-758-4389,E,,Public,24 hours daily,,,2,,,ChargePoint Network,http://www.chargepoint.com/,GPS,42.766866,-73.812303,10/29/2024,190452,2024-10-29 01:28:47,,,,05/31/2021,J1772
ELEC,Patrick Court - Christopher Ct,22 Maplehurst Dr,,Phoenix,NY,13135,,813-492-5220,E,,Public,24 hours daily,A ANDROID_PAY APPLE_PAY D M V,,2,,,EVOKE,https://evokesystems.com/,GPS,43.240600,-76.298200,10/11/2024,356961,2024-10-11 18:09:31,P,,,11/15/2021,J1772
ELEC,Sherman Parking - Tesla Destination,26 S 6th St,,Brooklyn,NY,11211,,877-798-3752,E,,Public,,,,4,,,Tesla Destination,https://www.tesla.com/destination-charging,200-8,40.711023,-73.968134,07/01/2024,122472,2024-10-16 16:58:41,P,,,01/17/2019,TESLA
ELEC,1 Generoso Pope Place,1 Generoso Pope Place,,Tuckahoe,NY,10707,,888-998-2546,E,,Public,24 hours daily,,,4,,,Blink Network,http://www.blinkcharging.com/,GPS,40.950426,-73.828158,10/29/2024,238291,2024-10-29 00:11:59,,,,11/21/2022,J1772
ELEC,Emma Willard,285 Pawling Ave,,Troy,NY,12180,,1-888-717-4544,E,,Public,24 hours daily,,,4,,,CHARGESMART_EV,https://chargesmartev.com,GPS,42.712082,-73.664359,10/29/2024,333750,2024-10-29 04:09:15,,,,04/17/2023,J1772
ELEC,Bob Johnson Chevrolet West,5049 W Ridge Rd,,Spencerport,NY,14559,,1-888-717-4544,E,,Public,24 hours daily,,,1,2,,CHARGESMART_EV,https://chargesmartev.com,GPS,43.217916,-77.794715,10/29/2024,334193,2024-10-29 04:09:28,,,,04/12/2023,J1772 J1772COMBO
ELEC,Reaves Dental,4301 Middle Settlement Rd,,New Hartford,NY,13413,,315-736-0139,E,,Public - Credit card at all times,24 hours daily,A D Debit M V,,4,,,Non-Networked,,GPS,43.073488,-75.343208,06/13/2024,227084,2024-06-13 17:18:06,P,,,08/26/2022,J1772
ELEC,Rapidpark 148 E 33rd Street - Tesla Destination,148 E 33rd St,,New York,NY,10016,,877-798-3752,E,,Public,,,,3,,,Tesla Destination,https://www.tesla.com/destination-charging,200-9,40.745432,-73.979560,07/01/2024,115016,2024-10-16 16:58:41,P,,,06/13/2017,J1772 TESLA
ELEC,SUNY ADIRONDACK SUNY ACC 1.2,640 Bay Rd,North End of SUNY Adirondack campus,Queensbury,NY,12804,,888-758-4389,E,,Public,24 hours daily,,,2,,,ChargePoint Network,http://www.chargepoint.com/,GPS,43.355194,-73.654090,10/29/2024,181425,2024-10-29 01:19:39,,,,01/27/2021,J1772
ELEC,AAA WESTCENTRAL AAA L2 3,100 International Drive,Along Sheridan Dr. street side of building,Amherst,NY,14221,,888-758-4389,E,,Public,24 hours daily,,,2,,,ChargePoint Network,http://www.chargepoint.com/,GPS,42.978246,-78.730189,10/29/2024,261206,2024-10-29 02:00:32,,,,05/23/2023,J1772
ELEC,Nissan City - Port Chester,225 Boston Post Rd,,Port Chester,NY,10573,,914-937-1777,E,,Public - Call ahead,Dealership business hours,,,1,,,Non-Networked,,200-8,40.996310,-73.669360,02/12/2024,44184,2024-02-12 15:25:05,P,,,11/30/2011,J1772
ELEC,WOODLAWN GARAGE WOODLAWN,37 Woodlawn Ave,"1st Floor of parking deck, access from Woodlawn Ave",Saratoga Springs,NY,12866,,888-758-4389,E,,Public,24 hours daily,,,2,,,ChargePoint Network,http://www.chargepoint.com/,GPS,43.084416,-73.786440,10/29/2024,162164,2024-10-29 00:57:08,,,,06/12/2020,J1772
ELEC,SKYVIEW APARTME SKYVIEW ST1,5800 Arlington Ave,,Riverdale,NY,10471,,888-758-4389,E,,Public,24 hours daily,,,2,,,ChargePoint Network,http://www.chargepoint.com/,GPS,40.908720,-73.905883,10/29/2024,171476,2024-10-29 01:24:48,,,,01/27/2021,J1772
ELEC,TRICITYRENTALS 33 NEW SCOTLAND,33 New Scotland Ave,,Albany,NY,12208,,888-758-4389,E,,Public,24 hours daily,,,2,,,ChargePoint Network,http://www.chargepoint.com/,GPS,42.653761,-73.774222,10/29/2024,123417,2024-10-29 01:02:21,,,,05/30/2019,J1772
ELEC,Spook Rock Golf Course,226 Spook Rock Road,,Montebello,NY,10901,,1-844-623-1001,E,,Public,24 hours daily,,,20,,,LIVINGSTON,https://www.solution.energy,GPS,41.126810,-74.098180,10/29/2024,352079,2024-10-29 04:06:52,,,,08/03/2024,J1772
ELEC,Central Parking - Tower 31,9 W 31st Street,,New York,NY,10001,,888-998-2546,E,,Public,24 hours daily,,,2,,,Blink Network,http://www.blinkcharging.com/,GPS,40.747090,-73.986670,10/29/2024,260005,2024-10-29 00:16:33,,,,04/27/2023,J1772
ELEC,Ford Charge - Basil Ford,1540 Walden Ave,,Cheektowaga,NY,14225,,888-357-1009,E,,Public,24 hours daily,A D Debit M V,,,4,,FORD_CHARGE,https://www.ford.com/support/category/electric-vehicle/charging/public-charging/,GPS,42.907622,-78.777920,,358302,2024-10-15 18:05:30,P,,,10/08/2024,J1772COMBO
ELEC,DBI PROPERTIES GTOWN PK LEFT,410 Degeorge Cir,Left Charger Near Fitness Center Main Entrance,Greece,NY,14626,,888-758-4389,E,,Public,24 hours daily,,,2,,,ChargePoint Network,http://www.chargepoint.com/,GPS,43.240781,-77.717639,10/29/2024,311769,2024-10-29 02:09:12,,,,09/28/2023,J1772
ELEC,ORANGEEV TBMP,211 416,,Hamptonburgh,NY,12549,,888-758-4389,E,,Public,24 hours daily,,,2,,,ChargePoint Network,http://www.chargepoint.com/,GPS,41.476929,-74.268630,10/29/2024,261363,2024-10-29 02:03:08,,,,05/25/2023,J1772
ELEC,50 N 5th St - Garage,50 N 5th St,,Brooklyn,NY,11249,,813-492-5220,E,,Public,24 hours daily,A ANDROID_PAY APPLE_PAY D M V,,10,,,EVOKE,https://evokesystems.com/,GPS,40.718585,-73.962318,10/11/2024,357045,2024-10-11 18:09:31,P,,,08/21/2022,J1772
ELEC,ICE RINK TOWN HALL,4 High St,,Saugerties,NY,12477,,888-758-4389,E,,Public,24 hours daily,,,2,,,ChargePoint Network,http://www.chargepoint.com/,GPS,42.081234,-73.958496,10/29/2024,166689,2024-10-29 01:17:12,,,,09/09/2020,J1772
ELEC,PLAINVIEW STATION 2,999 Old Country Rd,,Plainview,NY,11803,,888-758-4389,E,,Public,24 hours daily,,,2,,,ChargePoint Network,http://www.chargepoint.com/,GPS,40.774882,-73.473171,10/29/2024,260387,2024-10-29 01:58:01,,,,05/06/2023,J1772
ELEC,RUDIN 215 E 68TH EV2,215 East 68th Street,,New York,NY,10065,,888-758-4389,E,,Public,24 hours daily,,,2,,,ChargePoint Network,http://www.chargepoint.com/,GPS,40.767293,-73.960852,10/29/2024,358453,2024-10-29 02:20:11,,,,10/16/2024,J1772
ELEC,SRYMCASSB MALTA 1.2,8-10 Medical Park Dr,Rear parking lot of malta YMCA,Ballston Spa,NY,12020,,888-758-4389,E,,Public,24 hours daily,,,2,,,ChargePoint Network,http://www.chargepoint.com/,GPS,42.975710,-73.806220,10/29/2024,182289,2024-10-29 01:24:27,,,,01/27/2021,J1772
ELEC,Lockport Memorial Hospital,6001 Shimer Dr,,Lockport,NY,14094,,866-816-7584,E,,Public,24 hours daily,,,4,,,EV Connect,http://evconnect.com/,GPS,43.148509,-78.705378,10/29/2024,334579,2024-10-29 03:12:49,,,,05/03/2024,J1772
ELEC,James Mitsubishi Greece,3800 W Ridge Rd,,Greece,NY,14626,,585-563-2029,E,,Public - Credit card at all times,24 hours daily,A D Debit M V,,1,,,Non-Networked,,GPS,43.214210,-77.728239,04/14/2024,226499,2024-04-14 22:11:34,P,,,08/24/2022,J1772
ELEC,CMH STATION 4,71 Prospect Ave,Parking garage P2,Hudson,NY,12534,,888-758-4389,E,,Public,24 hours daily,,,2,,,ChargePoint Network,http://www.chargepoint.com/,GPS,42.246365,-73.777420,10/29/2024,220318,2024-10-29 01:40:15,,,,05/28/2022,J1772
ELEC,Sheehy Manor,8 Carondelet Dr,,Watervliet,NY,12189,,1-844-623-1001,E,,Public,24 hours daily,,,4,,,LIVINGSTON,https://www.solution.energy,GPS,42.732050,-73.730640,10/29/2024,236635,2024-10-29 04:05:01,,,,08/29/2022,J1772
ELEC,308 Main Street,308 Main Street,,Groton,NY,13073,,866-816-7584,E,,Public,24 hours daily,,,2,,,EV Connect,http://evconnect.com/,GPS,42.585743,-76.366351,10/29/2024,357882,2024-10-29 03:13:21,,,,10/11/2024,J1772
ELEC,Horizon Ridge - North,100 Horizon View,,East Greenbush,NY,12061,,1-844-623-1001,E,,Public,24 hours daily,,,12,,,LIVINGSTON,https://www.solution.energy,GPS,42.587620,-73.692580,10/29/2024,334483,2024-10-29 04:06:22,,,,05/02/2024,J1772
ELEC,MILTON NY P&R1,503 Geyser Rd,Station 4,Ballston Spa,NY,12020,,888-758-4389,E,,Public,24 hours daily,,,2,,,ChargePoint Network,http://www.chargepoint.com/,GPS,43.044611,-73.853549,10/29/2024,259747,2024-10-29 01:59:25,,,,04/22/2023,J1772
ELEC,U OF R AOC 9,10 Miracle Mile Dr,,Rochester,NY,14623,,888-758-4389,E,,Public,24 hours daily,,,2,,,ChargePoint Network,http://www.chargepoint.com/,GPS,43.081528,-77.633495,10/29/2024,251968,2024-10-29 01:55:30,,,,01/25/2023,J1772
ELEC,NE Bronx YMCA - Parking Lot,1250 E 229th St,,Bronx,NY,10466,,813-492-5220,E,,Public,24 hours daily,A ANDROID_PAY APPLE_PAY D M V,,4,,,EVOKE,https://evokesystems.com/,GPS,40.883000,-73.842100,10/11/2024,356916,2024-10-11 18:09:31,P,,,12/13/2021,J1772
ELEC,Holiday Inn Express Olean - Tesla Destination,101 Main St,,Olean,NY,14760,,877-798-3752,E,,Public,,,,3,,,Tesla Destination,https://www.tesla.com/destination-charging,200-9,42.087666,-78.429127,07/01/2024,115202,2024-10-16 16:58:41,P,,,10/04/2017,J1772 TESLA
ELEC,CITYLIGHTS 5TH FLOOR 1,4-74 48th Ave,Garage Level 5,Queens,NY,11109,,888-758-4389,E,,Public,24 hours daily,,,2,,,ChargePoint Network,http://www.chargepoint.com/,GPS,40.744127,-73.956840,10/29/2024,310610,2024-10-29 02:08:07,,,,09/14/2023,J1772
ELEC,CITY AMSTERDAM EV2,117 Hewitt Street Shuttleworth Park,Shuttleworth Field EV 2,Amsterdam,NY,12010,,888-758-4389,E,,Public,24 hours daily,,,2,,,ChargePoint Network,http://www.chargepoint.com/,GPS,42.960337,-74.172382,10/29/2024,186154,2024-10-29 01:26:22,,,,03/13/2021,J1772
ELEC,BURNS MGT EXCELSIOR 1,2125 Whistler Ct,,Saratoga Springs,NY,12866,,888-758-4389,E,,Public,24 hours daily,,,2,,,ChargePoint Network,http://www.chargepoint.com/,GPS,43.093550,-73.755474,10/29/2024,173903,2024-10-29 01:00:41,,,,01/27/2021,J1772
ELEC,Roessleville Elementary School,100 California Ave,,Albany,NY,12205,,1-844-623-1001,E,,Public,24 hours daily,,,4,,,LIVINGSTON,https://www.solution.energy,GPS,42.704640,-73.812970,10/29/2024,324848,2024-10-29 04:05:32,,,,09/06/2023,J1772
ELEC,Town of Charleston Town Hall Parking Lot,480 Corbin Hill Rd,,Sprakers,NY,12166,,518-922-7661,E,,Public - Credit card at all times,24 hours daily,A D Debit M V,,2,,,Non-Networked,,GPS,42.816872,-74.381614,03/14/2024,229069,2024-03-14 18:02:10,P,,,09/19/2022,J1772
ELEC,2. South Garage,737 Albany Shaker Road,,Albany,NY,12110,,866-816-7584,E,,Public,24 hours daily,,,10,,,EV Connect,http://evconnect.com/,GPS,42.743165,-73.807284,10/29/2024,230874,2024-10-29 03:09:39,,,,09/30/2022,J1772
ELEC,Sunny Side Up Bed and Breakfast - Tesla Destination,26350 Main Rd,,Cutchogue,NY,11935,,877-798-3752,E,,Public,,,,1,,,Tesla Destination,https://www.tesla.com/destination-charging,GPS,41.007076,-72.489491,07/01/2024,359084,2024-10-16 16:58:41,P,,,,TESLA
ELEC,SCCC AMMERMAN 3,College Rd,,Farmingville,NY,11738,,888-758-4389,E,,Public,24 hours daily,,,2,,,ChargePoint Network,http://www.chargepoint.com/,GPS,40.844415,-73.055372,10/29/2024,193748,2024-10-29 01:31:37,,,,08/11/2021,J1772
ELEC,351 E 51st St - Garage 1st Floor,351 E 51st St,,New York,NY,10022,,813-492-5220,E,,Public,24 hours daily,A ANDROID_PAY APPLE_PAY D M V,,10,,,EVOKE,https://evokesystems.com/,GPS,40.754890,-73.966134,10/11/2024,357012,2024-10-11 18:09:31,P,,,01/08/2023,J1772
ELEC,WATERVLIET DOME 2,1300 2nd Ave,On the left,Watervliet,NY,12189,,888-758-4389,E,,Public,24 hours daily,,,2,,,ChargePoint Network,http://www.chargepoint.com/,GPS,42.724018,-73.702685,10/29/2024,195913,2024-10-29 01:32:51,,,,09/15/2021,J1772
ELEC,KOEPPEL HYUNDAI CPE250 1,43-16 35th Ave,,Queens,NY,11101,,888-758-4389,E,,Public,24 hours daily,,,,1,,ChargePoint Network,http://www.chargepoint.com/,GPS,40.754038,-73.919413,10/29/2024,261698,2024-10-29 02:00:48,,,,06/01/2023,CHADEMO J1772COMBO
ELEC,Peconic Lane Community Center,1170 Peconic Ln,,Peconic,NY,11958,,631-765-8251,E,,Public - Credit card at all times,24 hours daily,A D M V,,1,,,Non-Networked,,GPS,41.043700,-72.456800,07/11/2024,80873,2024-07-11 19:05:43,LG,,,11/15/2017,J1772
ELEC,TPWC TPWC 6A,2594 Western Av,Bldg 4,Altamont,NY,12009,,888-758-4389,E,,Public,24 hours daily,,,1,,,ChargePoint Network,http://www.chargepoint.com/,GPS,42.714246,-73.936003,10/29/2024,227767,2024-10-29 01:32:00,,,,09/17/2022,J1772
ELEC,TOWNOFHALFMOON JUSTICE 3,1 Halfmoon Town Plz,Located in Front of Justice Building,Waterford,NY,12188,,888-758-4389,E,,Public,24 hours daily,,,2,,,ChargePoint Network,http://www.chargepoint.com/,GPS,42.853043,-73.724504,10/29/2024,256958,2024-10-29 01:55:11,,,,03/24/2023,J1772
ELEC,TCR TOWNE EV STATION 1,12 California ave,,Albany,NY,12205,,888-758-4389,E,,Public,24 hours daily,,,2,,,ChargePoint Network,http://www.chargepoint.com/,GPS,42.704074,-73.813791,10/29/2024,181867,2024-10-29 01:23:28,,,,01/27/2021,J1772
ELEC,SUNY ADIRONDACK SUNY ACC 1.1,640 Bay Rd,North End of SUNY Adirondack campus,Queensbury,NY,12804,,888-758-4389,E,,Public,24 hours daily,,,2,,,ChargePoint Network,http://www.chargepoint.com/,GPS,43.355225,-73.654090,10/29/2024,167140,2024-10-29 01:19:40,,,,09/26/2020,J1772
ELEC,Best Western University Inn,1020 Ellis Hollow Rd,,Ithaca,NY,14850,,1-888-717-4544,E,,Public,24 hours daily,,,8,,,CHARGESMART_EV,https://chargesmartev.com,GPS,42.438648,-76.461843,10/29/2024,347365,2024-10-29 04:09:24,,,,06/04/2024,J1772
ELEC,Hendrick Hudson Free Library,185 Kings Ferry Road,,Montrose,NY,10548,,800-663-5633,E,,Public,Mon 6:00am - 11:00pm; Tue 6:00am - 11:00pm; Wed 6:00am - 11:00pm; Thu 6:00am - 11:00pm; Fri 6:00am - 11:00pm; Sat 6:00am - 11:00pm; Sun 6:00am - 11:00pm,,,1,,,Blink Network,http://www.blinkcharging.com/,GPS,41.250229,-73.946444,10/29/2024,255237,2024-10-29 00:12:34,,,,10/27/2022,J1772
ELEC,CARBONE SUBARU DELIVERY,5036 Commercial Dr,Recon,Yorkville,NY,13495,,888-758-4389,E,,Public,24 hours daily,,,1,,,ChargePoint Network,http://www.chargepoint.com/,GPS,43.107574,-75.294746,10/29/2024,227347,2024-10-29 01:46:34,,,,09/09/2022,J1772
ELEC,ULSTER COUNTY SUNY ULSTER,491 Cottekill Rd,"Ulster County's fee for public charging is $0.50 per hour, effective 1-1-2020.",Stone Ridge,NY,12484,,888-758-4389,E,,Public,24 hours daily,,,2,,,ChargePoint Network,http://www.chargepoint.com/,GPS,41.851332,-74.130956,10/29/2024,123389,2024-10-29 01:02:40,,,,05/29/2019,J1772
ELEC,SSFLX STATION 1,43 Main St,Openening Mid-July,Hammondsport,NY,14840,,888-758-4389,E,,Public,24 hours daily,,,,1,,ChargePoint Network,http://www.chargepoint.com/,GPS,42.407678,-77.224005,10/29/2024,349607,2024-10-29 01:45:48,,,,06/28/2024,CHADEMO J1772COMBO
ELEC,NW HOSPITAL NWUN,400 Main St.,,Mount Kisco,NY,10549,,888-758-4389,E,,Public,24 hours daily,,,2,,,ChargePoint Network,http://www.chargepoint.com/,GPS,41.197824,-73.724513,10/29/2024,221183,2024-10-29 00:59:28,,,,06/11/2022,J1772
ELEC,GARDEN CHARGERS JOVIA #5,1000 Corporate Dr,Member Parking 2,Westbury,NY,11590,,888-758-4389,E,,Public,24 hours daily,,,2,,,ChargePoint Network,http://www.chargepoint.com/,GPS,40.740231,-73.601034,10/29/2024,145671,2024-10-29 01:06:32,,,,10/01/2019,J1772
ELEC,Parkpro - Beaver Brook Road,6 Beaver Brook Road,,Yulan,NY,12792,,888-998-2546,E,,Public,24 hours daily,,,4,,,Blink Network,http://www.blinkcharging.com/,GPS,41.523061,-74.934083,10/29/2024,252623,2024-10-29 00:18:41,,,,01/05/2023,J1772
ELEC,VAIL VAILE DCFC,606 Bedford Rd,Infront of Service Parking,Bedford Hills,NY,10507,,888-758-4389,E,,Public,24 hours daily,,,,1,,ChargePoint Network,http://www.chargepoint.com/,GPS,41.227331,-73.711697,10/29/2024,325044,2024-10-29 02:11:53,,,,01/11/2024,CHADEMO J1772COMBO
ELEC,330 E 80th St - Garage,330 E 80th St,,New York,NY,10075,,813-492-5220,E,,Public,24 hours daily,A ANDROID_PAY APPLE_PAY D M V,,25,,,EVOKE,https://evokesystems.com/,GPS,40.773622,-73.953250,10/11/2024,357004,2024-10-11 18:09:31,P,,,07/23/2022,J1772
ELEC,SAFETY FUND CHARGER 1,8531 Brewerton Rd,,Cicero,NY,13039,,888-758-4389,E,,Public,24 hours daily,,,1,,,ChargePoint Network,http://www.chargepoint.com/,GPS,43.182350,-76.122900,10/29/2024,302623,2024-10-29 02:05:31,,,,07/15/2023,J1772
ELEC,Eventi Hotel,851 Avenue of the Americas,,New York,NY,10001,,888-998-2546,E,,Public,24 hours daily,,,1,,,Blink Network,http://www.blinkcharging.com/,GPS,40.758681,-73.981350,10/29/2024,213916,2024-10-29 00:19:59,,,,04/13/2022,J1772
ELEC,CORNELL STATION1,37 Forest Home Dr,,Ithaca,NY,14850,,888-758-4389,E,,Public,24 hours daily,,,2,,,ChargePoint Network,http://www.chargepoint.com/,GPS,42.450490,-76.478483,10/29/2024,229269,2024-10-29 01:03:02,,,,09/27/2022,J1772
ELEC,iPark NYC 1025 83rd - Tesla Destination,11 E 83rd St,,New York,NY,10028,,877-798-3752,E,,Public,,,,3,,,Tesla Destination,https://www.tesla.com/destination-charging,200-8,40.779211,-73.960949,07/01/2024,114999,2024-10-16 16:58:41,P,,,08/21/2015,J1772 TESLA
ELEC,NYC FLEET DPRWFMARNA_4_L3,109-5 Marina Rd,,Queens,NY,11368,,888-758-4389,E,,Public,24 hours daily,,,,1,,ChargePoint Network,http://www.chargepoint.com/,GPS,40.760345,-73.855460,10/29/2024,316710,2024-10-29 02:10:03,,,,11/04/2023,CHADEMO J1772COMBO
ELEC,Quik Park West 23rd Street Garage LLC - Tesla Destination,423-431 W 23rd St,,New York,NY,10011,,877-798-3752,E,,Public,,,,3,,,Tesla Destination,https://www.tesla.com/destination-charging,200-8,40.746847,-74.001816,07/01/2024,115133,2024-10-16 16:58:41,P,,,05/21/2015,J1772 TESLA
ELEC,Caprara Honda,23115 NY-12,,Watertown,NY,13601,,1-844-623-1001,E,,Public,24 hours daily,,,2,1,,LIVINGSTON,https://www.solution.energy,GPS,43.998810,-75.919590,10/29/2024,351663,2024-10-29 04:06:50,,,,07/27/2024,J1772 J1772COMBO
ELEC,The Wood Golf,7430 Canton Street Rd,,Baldwinsville,NY,13027,,1-844-623-1001,E,,Public,24 hours daily,,,4,,,LIVINGSTON,https://www.solution.energy,GPS,43.130590,-76.337060,10/29/2024,189539,2024-10-29 04:05:16,,,,03/31/2021,J1772
ELEC,540 WAVERLY 2,540 Waverly Ave,At the ground floor parking garage in the rear,Brooklyn,NY,11238,,888-758-4389,E,,Public,24 hours daily,,,2,,,ChargePoint Network,http://www.chargepoint.com/,GPS,40.681764,-73.965799,10/29/2024,323912,2024-10-29 01:49:16,,,,01/05/2024,J1772
ELEC,Wedgewood West Apartments,2001 E Henrietta Rd,,Rochester,NY,14623,,1-844-623-1001,E,,Public,24 hours daily,,,14,,,LIVINGSTON,https://www.solution.energy,GPS,43.080070,-77.607710,10/29/2024,252729,2024-10-29 04:04:50,,,,12/30/2022,J1772
ELEC,ROCHESTER NY WASH SQ GARAGE2,111 Woodbury Blvd,,Rochester,NY,14607,,888-758-4389,E,,Public,24 hours daily,,,2,,,ChargePoint Network,http://www.chargepoint.com/,GPS,43.152697,-77.603915,10/29/2024,61063,2024-10-29 01:01:34,,,,04/03/2014,J1772
ELEC,TPWC TPWC 13A,2594 Western Av,,Altamont,NY,12009,,888-758-4389,E,,Public,24 hours daily,,,1,,,ChargePoint Network,http://www.chargepoint.com/,GPS,42.714876,-73.933578,10/29/2024,227777,2024-10-29 01:32:08,,,,09/17/2022,J1772
ELEC,Montezuma Winery,2981 US-20,,Seneca Falls,NY,13148,,1-888-717-4544,E,,Public,24 hours daily,,,6,,,CHARGESMART_EV,https://chargesmartev.com,GPS,42.949973,-76.768002,10/29/2024,333761,2024-10-29 04:09:21,,,,04/14/2023,J1772
ELEC,Howard Commons,2368 Lyell Ave,,Rochester,NY,14606,,1-844-623-1001,E,,Public,24 hours daily,,,8,,,LIVINGSTON,https://www.solution.energy,GPS,43.165500,-77.690880,10/29/2024,191107,2024-10-29 04:04:29,,,,05/31/2021,J1772
ELEC,Lincoln Square Garage,179 West 68th,,New York,NY,10023,,888-998-2546,E,,Public,24 hours daily,,,1,,,Blink Network,http://www.blinkcharging.com/,GPS,40.776152,-73.982820,10/29/2024,223392,2024-10-29 00:05:21,,,,07/10/2022,J1772
ELEC,Forge Hill Gardens,201 Caesars Ln,,New Windsor,NY,12553,,1-844-623-1001,E,,Public,24 hours daily,,,8,,,LIVINGSTON,https://www.solution.energy,GPS,41.463640,-74.034180,10/29/2024,324806,2024-10-29 04:05:19,,,,04/17/2023,J1772
ELEC,610 Warren Street - Tesla Destination,610 Warren Street,,Brooklyn,NY,11217,,877-798-3752,E,,Public,,,,6,,,Tesla Destination,https://www.tesla.com/destination-charging,200-9,40.681263,-73.981155,07/01/2024,168558,2024-10-16 16:58:41,P,,,06/16/2017,TESLA
ELEC,Residence of Vista Square,1410 Curry Rd.,,Rotterdam,NY,12306,,1-844-623-1001,E,,Public,24 hours daily,,,4,,,LIVINGSTON,https://www.solution.energy,GPS,42.783150,-73.964240,10/29/2024,223242,2024-10-29 04:05:02,,,,12/27/2021,J1772
ELEC,Main Square,318 Delaware Ave,,Delmar,NY,12054,,1-844-623-1001,E,,Public,24 hours daily,,,6,,,LIVINGSTON,https://www.solution.energy,GPS,42.623480,-73.828990,10/29/2024,189524,2024-10-29 04:05:21,,,,06/30/2021,J1772
ELEC,LIVEWELL GROUP 101 DERZEE CT,101 Derzee Ct,Bldg 101-108,Delmar,NY,12054,,888-758-4389,E,,Public,24 hours daily,,,2,,,ChargePoint Network,http://www.chargepoint.com/,GPS,42.606556,-73.849920,10/29/2024,165393,2024-10-29 01:17:34,,,,08/22/2020,J1772
ELEC,Admirals Cove - Building 2,"1100 Admirals Cove Blvd, Bldg 2",,Haverstraw,NY,10927,,813-492-5220,E,,Public,24 hours daily,A ANDROID_PAY APPLE_PAY D M V,,4,,,EVOKE,https://evokesystems.com/,GPS,41.191432,-73.958954,10/11/2024,356897,2024-10-11 18:09:31,P,,,05/25/2023,J1772
ELEC,CMH STATION 2,67 Prospect Ave,,Hudson,NY,12534,,888-758-4389,E,,Public,24 hours daily,,,2,,,ChargePoint Network,http://www.chargepoint.com/,GPS,42.246461,-73.778774,10/29/2024,207592,2024-10-29 01:38:18,,,,03/04/2022,J1772
ELEC,"Country Inn & Suites By Carlson, Rochester-Pittsford - Tesla Destination",2835 Monroe Ave,,Rochester,NY,14618,,877-798-3752,E,,Public,,,,3,,,Tesla Destination,https://www.tesla.com/destination-charging,200-8,43.111318,-77.548531,07/01/2024,115221,2024-10-16 16:58:41,P,,,09/06/2017,TESLA
ELEC,"Walmart 2104 - Newburgh, NY",1201 Route 300,,Newburgh,NY,12550,,833-632-2778,E,,Public,24 hours daily,,,,4,,Electrify America,https://www.electrifyamerica.com/,GPS,41.497760,-74.073190,10/29/2024,168489,2024-10-29 02:58:31,,,,11/14/2020,CHADEMO J1772COMBO
ELEC,Hampton Run,14 Glenridge Road,,Glenville,NY,12302,,1-844-623-1001,E,,Public,24 hours daily,,,10,,,LIVINGSTON,https://www.solution.energy,GPS,42.864880,-73.929940,10/29/2024,324799,2024-10-29 04:05:32,,,,09/14/2023,J1772
ELEC,26-19 2nd Street,26-19 2nd Street,,Astoria,NY,11102,,888-998-2546,E,,Public,24 hours daily,,,2,,,Blink Network,http://www.blinkcharging.com/,GPS,40.773294,-73.934466,10/29/2024,257491,2024-10-29 00:07:06,,,,12/19/2022,J1772
ELEC,Summit of Halfmoon,29 Sitterly Road,,Clifton Park,NY,12065,,1-844-623-1001,E,,Public,24 hours daily,,,4,,,LIVINGSTON,https://www.solution.energy,GPS,42.851130,-73.760190,10/29/2024,324862,2024-10-29 04:06:18,,,,11/30/2023,J1772
ELEC,Village of Bergen - Municipal Parking,18 Buffalo St,Located in the Village of Bergen Municipal Parking Lot between 16 & 18 Buffalo Street,Bergen,NY,14416,,585-494-1513,E,,Public,24 hours daily,,,2,,,Non-Networked,,GPS,43.085186,-77.943321,05/09/2024,116923,2024-05-09 20:32:20,LG,,,11/19/2018,J1772
ELEC,HOTSARA CHARGER STATION 1,100 Main St,Hotel side parking lot,Saranac Lake,NY,12983,,888-758-4389,E,,Public,24 hours daily,,,2,,,ChargePoint Network,http://www.chargepoint.com/,GPS,44.326862,-74.130150,10/29/2024,149787,2024-10-29 01:04:52,,,,12/07/2019,J1772
ELEC,THE SAGAMORE SAGAMORE 1.5,433 Boathouse Ln,,Bolton,NY,12814,,888-758-4389,E,,Public,24 hours daily,,,2,,,ChargePoint Network,http://www.chargepoint.com/,GPS,43.557020,-73.645120,10/29/2024,175039,2024-10-29 01:11:10,,,,01/27/2021,J1772
ELEC,Hannaford Supermarket - Tesla Supercharger,35  Hannaford Drive,,Red Hook,NY,12571,,877-798-3752,E,,Public,24 hours daily. Please check Tesla's online station map to see if an adapter is required at this location.,A D Debit M V,,,8,,Tesla,https://www.tesla.com/supercharger,GPS,41.979442,-73.882161,07/01/2024,214079,2024-08-14 18:58:22,P,,,04/06/2022,J1772COMBO TESLA
ELEC,MARKET 32 EV MARKET32 EV EG2,501 Columbia Turnpike,In front of store,Rensselaer,NY,12144,,888-758-4389,E,,Public,24 hours daily,,,2,,,ChargePoint Network,http://www.chargepoint.com/,GPS,42.607567,-73.720010,10/29/2024,152320,2024-10-29 01:10:27,,,,01/09/2020,J1772
ELEC,Walkway Over the Hudson,61 Parker Avenue,,Poughkeepsie,NY,12601,,866-816-7584,E,,Public,24 hours daily,,,4,,,EV Connect,http://evconnect.com/,GPS,41.711783,-73.926435,10/29/2024,123117,2024-10-29 03:08:23,,,,04/01/2019,J1772
ELEC,HUDSON PRESERVE BLDG 19 #12,1901 Beryl Way,,Watervliet,NY,12189,,888-758-4389,E,,Public,24 hours daily,,,2,,,ChargePoint Network,http://www.chargepoint.com/,GPS,42.732530,-73.726930,10/29/2024,143244,2024-10-29 01:04:23,,,,08/15/2019,J1772
ELEC,EVCS1 LAFAYETTE AVE 1,31 Niagara St,,Canandaigua,NY,14424,,888-758-4389,E,,Public,24 hours daily,,,2,,,ChargePoint Network,http://www.chargepoint.com/,GPS,42.887570,-77.279229,10/29/2024,316217,2024-10-29 02:06:52,,,,10/28/2023,J1772
ELEC,PICOTTE 80 WOLF 2,80 Wolf Rd,,Colonie,NY,12205,,888-758-4389,E,,Public,24 hours daily,,,2,,,ChargePoint Network,http://www.chargepoint.com/,GPS,42.715424,-73.813460,10/29/2024,147462,2024-10-29 01:07:48,,,,11/02/2019,J1772
ELEC,5. Long Term Parking West,737 Albany Shaker Road,,Albany,NY,12205,,866-816-7584,E,,Public,24 hours daily,,,8,,,EV Connect,http://evconnect.com/,GPS,42.745834,-73.813591,10/29/2024,64131,2024-10-29 03:10:33,,,,06/10/2014,J1772
ELEC,Red Roof Inn Malone - Tesla Destination,42 Finney Blvd,,Malone,NY,12953,,877-798-3752,E,,Public,,,,2,,,Tesla Destination,https://www.tesla.com/destination-charging,200-9,44.847591,-74.300230,07/01/2024,114971,2024-10-16 16:58:41,P,,,04/03/2018,J1772 TESLA
ELEC,2 Lincoln Square,60 West 66th Street,,New York,NY,10023,,888-998-2546,E,,Public,24 hours daily,,,4,,,Blink Network,http://www.blinkcharging.com/,GPS,40.773498,-73.981374,10/29/2024,331697,2024-10-29 00:27:46,,,,04/04/2024,J1772
ELEC,Downtown Plattsburgh Public Parking,13 City Hall Pl,,Plattsburgh,NY,12901,,518-563-7642,E,,Public - Credit card at all times,24 hours daily,A D Debit M V,,2,,,Non-Networked,,GPS,44.698344,-73.452380,03/14/2024,227688,2024-03-14 18:02:10,P,,,09/13/2022,J1772
ELEC,110 MAPLE AVE STATION 1(4021),110 Maple Ave,,Rockville Centre,NY,11570,,888-758-4389,E,,Public,24 hours daily,,,2,,,ChargePoint Network,http://www.chargepoint.com/,GPS,40.658528,-73.639526,10/29/2024,256160,2024-10-29 01:41:02,,,,03/10/2023,J1772
ELEC,OSSINING OPS CENTER,101 Briarcliff-Peekskill Pkwy,,Ossining,NY,10562,,888-758-4389,E,,Public,24 hours daily,,,2,,,ChargePoint Network,http://www.chargepoint.com/,GPS,41.178557,-73.840250,10/29/2024,188106,2024-10-29 01:27:53,,,,04/29/2021,J1772
ELEC,ERIE COUNTY CHESTNUT RIDGE1,6121 Chestnut Ridge Rd,,Orchard Park,NY,14127,,888-758-4389,E,,Public,24 hours daily,,,2,,,ChargePoint Network,http://www.chargepoint.com/,GPS,42.722297,-78.744107,10/29/2024,349179,2024-10-29 02:19:32,,,,06/26/2024,J1772
ELEC,Main Parking Lot,77 Mirror Lake Dr,,Lake Placid,NY,12946,,866-816-7584,E,,Public,24 hours daily,,,12,,,EV Connect,http://evconnect.com/,GPS,44.294225,-73.983083,10/29/2024,322453,2024-10-29 03:12:30,,,,12/09/2023,J1772
ELEC,Walmart 1949 Fredonia,10401 Bennett Road,,Fredonia,NY,14063,,833-632-2778,E,,Public,24 hours daily,,,,4,,Electrify America,https://www.electrifyamerica.com/,GPS,42.453790,-79.311180,10/29/2024,168359,2024-10-29 02:56:23,,,,11/13/2020,CHADEMO J1772COMBO
ELEC,RJCL PARKING 1,9091 NY-22,,Hillsdale,NY,12529,,888-758-4389,E,,Public,24 hours daily,,,2,,,ChargePoint Network,http://www.chargepoint.com/,GPS,42.167957,-73.517820,10/29/2024,166204,2024-10-29 01:18:25,,,,09/04/2020,J1772
ELEC,WHDHIEXWEBSTER EAST BORDER 3,860 Holt Road,East Parking Border Station 3,Webster,NY,14580,,888-758-4389,E,,Public,24 hours daily,,,2,,,ChargePoint Network,http://www.chargepoint.com/,GPS,43.217179,-77.444983,10/29/2024,353986,2024-10-29 02:23:44,,,,08/27/2024,J1772
ELEC,1282 Motor Pkwy - Outdoor Parking Lot,1282 Motor Pkwy,,Islandia,NY,11749,,813-492-5220,E,,Public,24 hours daily,A ANDROID_PAY APPLE_PAY D M V,,4,,,EVOKE,https://evokesystems.com/,GPS,40.804935,-73.194463,10/11/2024,356917,2024-10-11 18:09:31,P,,,07/24/2023,J1772
ELEC,430808  Avalon Rockville Centre I,100 Banks Avenue,,Rockville Centre,NY,11570,,888-998-2546,E,,Public,24 hours daily,,,5,,,Blink Network,http://www.blinkcharging.com/,GPS,40.660576,-73.651920,10/29/2024,309391,2024-10-29 00:12:12,,,,03/06/2019,J1772
ELEC,MONTY'S EVSE EVSE2,555 Lake Shore Rd,Side barn of Montys bay Marina,Ingraham,NY,12992,,888-758-4389,E,,Public,24 hours daily,,,2,,,ChargePoint Network,http://www.chargepoint.com/,GPS,44.819670,-73.400780,10/29/2024,205255,2024-10-29 01:36:43,,,,01/25/2022,J1772
ELEC,MUNICIPAL EVSE PARK STREET 2,50-54 Park St,"Level 2, 3rd Floor",Glens Falls,NY,12801,,888-758-4389,E,,Public,24 hours daily,,,2,,,ChargePoint Network,http://www.chargepoint.com/,GPS,43.307855,-73.644584,10/29/2024,180142,2024-10-29 00:50:49,,,,01/27/2021,J1772
ELEC,COLACINO INUSTR COLACINO 2,126 Harrison St,Off Harrison St in front of Colacino Industries,Newark,NY,14513,,888-758-4389,E,,Public,24 hours daily,,,2,,,ChargePoint Network,http://www.chargepoint.com/,GPS,43.049065,-77.094025,10/29/2024,174197,2024-10-29 01:04:30,,,,01/27/2021,J1772
ELEC,Town of Massena Library,41 Glenn St,,Massena,NY,13662,,315-769-3588 Ext 2,E,,Public - Credit card at all times,24 hours daily,CREDIT Debit,,2,,,AMPUP,https://ampup.io/,200-8,44.931110,-74.890990,12/13/2023,262219,2024-01-31 22:07:01,LG,,,04/03/2023,J1772
ELEC,LeadCar Honda Yorkville,5009 Commercial Drive,,Yorkville,NY,13495,,888-998-2546,E,,Public,24 hours daily,,,,1,,Blink Network,http://www.blinkcharging.com/,GPS,43.105979,-75.297394,10/29/2024,329947,2024-10-29 00:12:05,,,,08/08/2023,J1772COMBO
ELEC,Ithacor - McLean Rd,1033 McLean Rd,,Cortland,NY,13045,,1-888-717-4544,E,,Public,24 hours daily,,,6,,,CHARGESMART_EV,https://chargesmartev.com,GPS,42.582379,-76.206520,10/29/2024,333860,2024-10-29 04:09:18,,,,04/06/2023,J1772
ELEC,TOWNE HYUNDAI 3B,3525 Southwestern Blvd,North side of main building left unit,Orchard Park,NY,14127,,888-758-4389,E,,Public,24 hours daily,,,,1,,ChargePoint Network,http://www.chargepoint.com/,GPS,42.788215,-78.759409,10/29/2024,225170,2024-10-29 01:47:03,,,,08/09/2022,CHADEMO J1772COMBO
ELEC,TCIA Anton Garage Floor 2,1946 Campus Drive,,New Hyde Park,NY,12538,,1-844-623-1001,E,,Public,24 hours daily,,,2,,,LIVINGSTON,https://www.solution.energy,GPS,41.745680,-73.933900,10/29/2024,346665,2024-10-29 04:06:34,,,,05/22/2024,J1772
ELEC,TOWN OF CHESTER SUGARLOAFPACEV2,231 Creamery Pond Rd.,,Chester,NY,10918,,888-758-4389,E,,Public,24 hours daily,,,2,,,ChargePoint Network,http://www.chargepoint.com/,GPS,41.316211,-74.288427,10/29/2024,253800,2024-10-29 01:51:41,,,,02/09/2023,J1772
ELEC,Rockland Country Club,380 Route 9W,,Sparkill,NY,10976,,1-844-623-1001,E,,Public,24 hours daily,,,4,,,LIVINGSTON,https://www.solution.energy,GPS,41.024870,-73.917890,10/29/2024,223294,2024-10-29 04:05:30,,,,05/17/2022,J1772
ELEC,Burger King - Medina,11212 Maple Ridge Rd,,Medina,NY,14103,,888-998-2546,E,,Public,24 hours daily,,,2,,,Blink Network,http://www.blinkcharging.com/,GPS,43.206332,-78.398940,10/29/2024,189052,2024-10-29 00:15:17,,,,04/30/2021,J1772
ELEC,FSA STARBUCKS,201 Old Main Dr,Across Road from Starbucks,Fredonia,NY,14063,,888-758-4389,E,,Public,24 hours daily,,,2,,,ChargePoint Network,http://www.chargepoint.com/,GPS,42.449350,-79.339461,10/29/2024,235868,2024-10-29 01:52:05,,,,11/09/2022,J1772
ELEC,Rapidpark 10 E 30th Street - Tesla Destination,10 E 30th St,,New York,NY,10016,,877-798-3752,E,,Public,,,,3,,,Tesla Destination,https://www.tesla.com/destination-charging,200-9,40.745560,-73.985539,07/01/2024,114984,2024-10-16 16:58:41,P,,,06/13/2017,J1772 TESLA
ELEC,DEER PARK TANGER EV 4,152 The Arches Cir,South side of center between Nike and Neiman Marcus,Deer Park,NY,11729,,888-758-4389,E,,Public,24 hours daily,,,2,,,ChargePoint Network,http://www.chargepoint.com/,GPS,40.762409,-73.305680,10/29/2024,162405,2024-10-29 00:37:04,,,,06/12/2020,J1772
ELEC,Village of Lima,7329 E Main Street,,Lima,NY,14485,,866-816-7584,E,,Public,24 hours daily,,,2,,,EV Connect,http://evconnect.com/,GPS,42.905520,-77.610606,10/29/2024,329738,2024-10-29 03:08:21,,,,03/02/2024,J1772
ELEC,SIENA COLLEGE SIENAHALL EVSE1,Friars Dr.,Front parking lot of Siena hall,Albany,NY,12211,,888-758-4389,E,,Public,24 hours daily,,,2,,,ChargePoint Network,http://www.chargepoint.com/,GPS,42.718662,-73.753850,10/29/2024,193842,2024-10-29 01:31:15,,,,08/13/2021,J1772
ELEC,Nanuet Pavilion - Tesla Destination,28 Smith St,,Nanuet,NY,10954,,877-798-3752,E,,Public,,,,6,,,Tesla Destination,https://www.tesla.com/destination-charging,GPS,41.095642,-73.998753,07/01/2024,359239,2024-10-16 16:58:41,P,,,,J1772 TESLA
ELEC,VILLAGE WARWICK SPRING ST LOT,23 Spring St,,Warwick,NY,10990,,888-758-4389,E,,Public,24 hours daily,,,2,,,ChargePoint Network,http://www.chargepoint.com/,GPS,41.257824,-74.360750,10/29/2024,303757,2024-10-29 02:04:43,,,,07/29/2023,J1772
ELEC,Northeast IS LLC,930 Albany Shaker Rd,,Latham,NY,12110,,1-888-222-6618,E,,Public,,,,4,,,NOODOE,https://www.noodoe.com,GPS,42.761912,-73.815217,10/29/2024,333538,2024-10-29 03:58:35,,,,04/25/2024,J1772
ELEC,142 E 31st St.,142 E 31st St.,,New York,NY,10016,,1-844-623-1001,E,,Public,24 hours daily,,,4,,,LIVINGSTON,https://www.solution.energy,GPS,40.744150,-73.980460,10/29/2024,223267,2024-10-29 04:05:19,,,,02/10/2022,J1772
ELEC,MAGUIRE HYUNDAI CPE250 #1,1910 Alvin Rd,,Grand Island,NY,14072,,888-758-4389,E,,Public,24 hours daily,,,,1,,ChargePoint Network,http://www.chargepoint.com/,GPS,43.011367,-78.968506,10/29/2024,202141,2024-10-29 01:36:56,,,,12/08/2021,CHADEMO J1772COMBO
ELEC,RRH ST MARYS 3,89 Genesee St,2nd floor south side of parking garage,Rochester,NY,14611,,888-758-4389,E,,Public,24 hours daily,,,2,,,ChargePoint Network,http://www.chargepoint.com/,GPS,43.149392,-77.636784,10/29/2024,174451,2024-10-29 01:05:12,,,,01/27/2021,J1772
ELEC,Centre at Huguenot South Tower - Parking Garage 2nd Floor,41 Centre Ave,,New Rochelle,NY,10801,,813-492-5220,E,,Public,24 hours daily,A ANDROID_PAY APPLE_PAY D M V,,12,,,EVOKE,https://evokesystems.com/,GPS,40.908230,-73.785183,10/11/2024,357026,2024-10-11 18:09:31,P,,,06/29/2022,J1772
ELEC,ROCHESTER NY ROC CITY HALL1,30 Church St,City Hall rear lot,Rochester,NY,14614,,888-758-4389,E,,Public,24 hours daily,,,2,,,ChargePoint Network,http://www.chargepoint.com/,GPS,43.156992,-77.614895,10/29/2024,162173,2024-10-29 00:56:51,,,,06/12/2020,J1772
ELEC,OSSINING TOWN CEDAR LANE,Cedar Lane Park 235 Cedar Lane,"Once in Park, follow sign to Arts Center",Ossining,NY,10562,,888-758-4389,E,,Public,24 hours daily,,,2,,,ChargePoint Network,http://www.chargepoint.com/,GPS,41.191609,-73.854692,10/29/2024,162298,2024-10-29 00:52:24,,,,06/12/2020,J1772
ELEC,CORP COMM 3 STATION 5 CC3,Teleport Dr/Corp Commons Bldg,"Parking garage, 3rd Floor",Staten Island,NY,10314,,888-758-4389,E,,Public,24 hours daily,,,2,,,ChargePoint Network,http://www.chargepoint.com/,GPS,40.604322,-74.179683,10/29/2024,252143,2024-10-29 01:21:32,,,,01/26/2023,J1772
ELEC,Hancock House Hotel,137 E Front St,,Hancock,NY,13783,,1-888-717-4544,E,,Public,24 hours daily,,,10,,,CHARGESMART_EV,https://chargesmartev.com,GPS,41.954666,-75.279511,10/29/2024,333930,2024-10-29 04:09:15,,,,10/11/2023,J1772
ELEC,ECONOLODGE ECONOLODGE 1.1,237 W Main St,In Front of building 3,Malone,NY,12953,,888-758-4389,E,,Public,24 hours daily,,,2,,,ChargePoint Network,http://www.chargepoint.com/,GPS,44.848682,-74.306880,10/29/2024,154172,2024-10-29 01:12:38,,,,02/29/2020,J1772
ELEC,Collar City Auto Haus,647 2nd Ave,,Troy,NY,12182,,518-801-1111,E,,Public,24 hours daily,A D Debit M V,,1,,,Non-Networked,,GPS,42.777810,-73.676100,08/15/2024,229083,2024-08-15 19:57:12,P,,,09/17/2022,J1772
ELEC,ARCHER GREEN MI STATION 3,92-23 168th St,,JAMAICA,NY,11433,,888-758-4389,E,,Public,24 hours daily,,,1,,,ChargePoint Network,http://www.chargepoint.com/,GPS,40.705254,-73.791500,10/29/2024,225481,2024-10-29 01:30:07,,,,08/13/2022,J1772
ELEC,CORNELL STATION8,527 College Ave,Hollister hall,Ithaca,NY,14853,,888-758-4389,E,,Public,24 hours daily,,,2,,,ChargePoint Network,http://www.chargepoint.com/,GPS,42.443906,-76.484429,10/29/2024,326447,2024-10-29 02:13:56,,,,01/24/2024,J1772
ELEC,"UBP Riverhead Plaza (Riverhead, NY)",1820 Old Country Road,,Riverhead,NY,11901,,833-632-2778,E,,Public,24 hours daily,,,,4,,Electrify America,https://www.electrifyamerica.com/,GPS,40.924020,-72.708790,10/29/2024,221920,2024-10-29 02:56:49,,,,06/23/2022,CHADEMO J1772COMBO
ELEC,Champion Parking 60 E 8th - Tesla Destination,60-68 E 8th St,,New York,NY,10003,,877-798-3752,E,,Public,,,,3,,,Tesla Destination,https://www.tesla.com/destination-charging,200-9,40.730487,-73.993569,07/01/2024,115172,2024-10-16 16:58:41,P,,,05/21/2015,J1772 TESLA
ELEC,Parkit 310 E 11th Street - Tesla Destination,310 E 11th St,,New York,NY,10003,,877-798-3752,E,,Public,,,,3,,,Tesla Destination,https://www.tesla.com/destination-charging,200-9,40.730017,-73.985512,07/01/2024,115089,2024-10-16 16:58:41,P,,,12/27/2016,J1772 TESLA
ELEC,COLGATE LALLY LN 2,Lally Ln,,Hamilton,NY,13346,,888-758-4389,E,,Public,24 hours daily,,,2,,,ChargePoint Network,http://www.chargepoint.com/,GPS,42.817292,-75.539288,10/29/2024,352144,2024-10-29 02:19:59,,,,08/07/2024,J1772
ELEC,TPWC TPWC 10,2594 Western Av,Bldg 8,Altamont,NY,12009,,888-758-4389,E,,Public,24 hours daily,,,1,,,ChargePoint Network,http://www.chargepoint.com/,GPS,42.714041,-73.935230,10/29/2024,227772,2024-10-29 01:32:01,,,,09/17/2022,J1772
ELEC,EXECUTIVE PARK #1,2 Executive Blvd,,Montebello,NY,10901,,888-758-4389,E,,Public,24 hours daily,,,2,,,ChargePoint Network,http://www.chargepoint.com/,GPS,41.120190,-74.116860,10/29/2024,175755,2024-10-29 01:15:37,,,,01/27/2021,J1772
ELEC,80 Church St,80 Church St,,Hoosick Falls,NY,12090,,1-844-623-1001,E,,Public,24 hours daily,,,4,,,LIVINGSTON,https://www.solution.energy,GPS,42.899940,-73.351340,10/29/2024,223141,2024-10-29 04:06:04,,,,11/06/2021,J1772
ELEC,799 SENECA STATION 6,799 Seneca St,,Buffalo,NY,14210,,888-758-4389,E,,Public,Mon 5:00pm - 10:00pm; Tue 5:00pm - 10:00pm; Wed 5:00pm - 10:00pm; Thu 5:00pm - 10:00pm; Fri 5:00pm - 10:00pm; Sat 8:00am - 10:00pm; Sun 8:00am - 10:00pm,,,1,,,ChargePoint Network,http://www.chargepoint.com/,GPS,42.875076,-78.847686,10/29/2024,191250,2024-10-29 01:30:05,,,,06/19/2021,J1772
ELEC,WHEATLAND-CHILI HIGH SCH #1,940 N Rd,"Front of gym, entrance 25",Scottsville,NY,14546,,888-758-4389,E,,Public,24 hours daily,,,1,,,ChargePoint Network,http://www.chargepoint.com/,GPS,43.027301,-77.763043,10/29/2024,149178,2024-10-29 01:06:40,,,,11/15/2019,J1772
ELEC,Jericho Turnpike Shopping Center - Tesla Supercharger,271 Jericho Turnpike,,Syosset,NY,11791,,877-798-3752,E,,Public,24 hours daily. Please check Tesla's online station map to see if an adapter is required at this location.,A D Debit M V,,,8,,Tesla,https://www.tesla.com/supercharger,GPS,40.811177,-73.506461,07/01/2024,227704,2024-08-14 18:58:22,P,,,09/12/2022,TESLA
ELEC,Broadway Commons Macys,358 N. Broadway Commons,,Hicksville,NY,11801,,888-264-2208,E,,Public,Mon 6:00am - 11:59pm; Tue 6:00am - 11:59pm; Wed 6:00am - 11:59pm; Thu 6:00am - 11:59pm; Fri 6:00am - 11:59pm; Sat 6:00am - 11:59pm; Sun 6:00am - 11:59pm,,,2,,,SHELL_RECHARGE,https://www.shell.us/motorist/electric-vehicle-charging.html,GPS,40.771820,-73.531138,10/29/2024,151794,2024-10-29 02:48:31,,,,09/05/2019,J1772
ELEC,Icon 9-11 Park Ave - Tesla Destination,9 - 11 Park Ave,,New York,NY,10016,,877-798-3752,E,,Public,,,,3,,,Tesla Destination,https://www.tesla.com/destination-charging,200-9,40.747299,-73.981039,07/01/2024,115191,2024-10-16 16:58:41,P,,,06/13/2017,J1772 TESLA
ELEC,FC1225 LATHAM FARMS PL,579 Troy-Schenectady Rd,Latham Farms Planet Fitness Left Charger 1,Latham,NY,12110,,888-758-4389,E,,Public,24 hours daily,,,2,,,ChargePoint Network,http://www.chargepoint.com/,GPS,42.757095,-73.761994,10/29/2024,254203,2024-10-29 01:57:12,,,,02/17/2023,J1772
ELEC,VANKAY PUBLIC STATION 2,5 McCrea Hill Rd,,Ballston Spa,NY,12020,,888-758-4389,E,,Public,24 hours daily,,,2,,,ChargePoint Network,http://www.chargepoint.com/,GPS,42.966560,-73.857687,10/29/2024,186633,2024-10-29 01:25:59,,,,03/27/2021,J1772
ELEC,Arcadian Shopping Center,216 S Highland Ave,,Ossining,NY,10562,,877-455-3833,E,,Public,24 hours daily,,,,1,,eVgo Network,https://www.evgo.com/,GPS,41.143368,-73.862697,10/28/2024,228020,2024-10-28 23:57:35,,,,03/07/2018,CHADEMO J1772COMBO
ELEC,MARKETPLACE SOUTH STATION,1100 Miracle Mile Dr,,Rochester,NY,14623,,888-758-4389,E,,Public,24 hours daily,,,2,,,ChargePoint Network,http://www.chargepoint.com/,GPS,43.081700,-77.637864,10/29/2024,349014,2024-10-29 02:20:10,,,,06/22/2024,J1772
ELEC,EVolve NY Kingston,451 Washington Ave,,Kingston,NY,12401,,833-632-2778,E,,Public,24 hours daily,,,,4,,Electrify America,https://www.electrifyamerica.com/,GPS,41.936910,-74.026190,10/29/2024,320464,2024-10-29 02:56:07,,,,11/22/2023,J1772COMBO
ELEC,GOLD MEDAL HU GOLD MEDAL HU 2,266 Pulaski Road,The charging station is in the back of the building,Greenlawn,NY,11740,,888-758-4389,E,,Public,24 hours daily,,,2,,,ChargePoint Network,http://www.chargepoint.com/,GPS,40.857917,-73.390404,10/29/2024,346155,2024-10-29 02:18:41,,,,05/14/2024,J1772
ELEC,ROSENBLUM300 187 WOLF RD,187 Wolf Rd,,Albany,NY,12205,,888-758-4389,E,,Public,24 hours daily,,,2,,,ChargePoint Network,http://www.chargepoint.com/,GPS,42.722447,-73.800636,10/29/2024,121068,2024-10-29 01:00:51,,,,03/30/2019,J1772
ELEC,East West Tower Garage - Tesla Destination,142-38 37th Ave,,Flushing,NY,11354,,877-798-3752,E,,Public,,,,4,,,Tesla Destination,https://www.tesla.com/destination-charging,200-8,40.762331,-73.825583,07/01/2024,150531,2024-10-16 16:58:41,P,,,08/28/2019,TESLA
ELEC,Syracuse Signal,410 Marcellus St,,Syracuse,NY,13204,,949-945-2000,E,,Public,24 hours daily,A ACCOUNT_BALANCE ANDROID_PAY APPLE_PAY CREDIT D M V,,2,,,EVGATEWAY,http://evgateway.com/,200-8,43.046500,-76.164270,05/09/2024,333832,2024-05-09 20:32:20,P,,,03/03/2020,J1772
ELEC,Discover 97 Parking LLC,750 Columbus Avenue,,New York,NY,10025,,888-998-2546,E,,Public,24 hours daily,,,2,,,Blink Network,http://www.blinkcharging.com/,GPS,40.793416,-73.967719,10/29/2024,190531,2024-10-29 00:11:50,,,,08/28/2019,J1772
ELEC,Swtch Energy,300 McCauley Mtn Rd,,Old Forge,NY,13420,,844-798-2438,E,,Public,24 hours daily,A D Debit M V,,2,,,SWTCH,https://swtchenergy.com/,GPS,43.698227,-74.963509,11/09/2023,313640,2024-01-31 22:07:01,P,,,09/20/2022,J1772
ELEC,ERIE COUNTY STATION ONE,6205 Main St,,Buffalo,NY,14221,,888-758-4389,E,,Public,24 hours daily,,,2,,,ChargePoint Network,http://www.chargepoint.com/,GPS,42.960509,-78.720002,10/29/2024,170241,2024-10-29 01:18:47,,,,12/17/2020,J1772
ELEC,Hempstead Ford Lincoln Pre-owned Department,130 Franklin Ave,,Garden City,NY,11530,,888-356-8911,E,,Public,24 hours daily,,,4,,,FLO,https://flo.ca/,GPS,40.717550,-73.631210,10/29/2024,307128,2024-10-29 03:34:05,,,,08/16/2023,J1772
ELEC,STATION 12345 STATION 2,3948 E River Rd,,West Henrietta,NY,14586,,888-758-4389,E,,Public,24 hours daily,,,2,,,ChargePoint Network,http://www.chargepoint.com/,GPS,43.064021,-77.685254,10/29/2024,307859,2024-10-29 02:06:31,,,,08/25/2023,J1772
ELEC,TMD MAIN LOT CT4000-1,179 Halbert St,,Buffalo,NY,14214,,888-758-4389,E,,Public,24 hours daily,,,2,,,ChargePoint Network,http://www.chargepoint.com/,GPS,42.935327,-78.841594,10/29/2024,233152,2024-10-29 01:49:56,,,,10/08/2022,J1772
ELEC,The Somerset - Garage 1st Floor,1365 York Ave,,New York,NY,10021,,813-492-5220,E,,Public,24 hours daily,A ANDROID_PAY APPLE_PAY D M V,,20,,,EVOKE,https://evokesystems.com/,GPS,40.767348,-73.953832,10/11/2024,356922,2024-10-11 18:09:31,P,,,11/20/2022,J1772
ELEC,GHMC PARKINGGARAGE10,707 E Main St,PARKING GARAGE 10,Middletown,NY,10940,,888-758-4389,E,,Public,24 hours daily,,,2,,,ChargePoint Network,http://www.chargepoint.com/,GPS,41.441810,-74.366616,10/29/2024,204666,2024-10-29 01:37:12,,,,01/12/2022,J1772
ELEC,Greymoor Way - Building 8,1908 Greymoor Way,,Baldwinsville,NY,13027,,1-844-623-1001,E,,Public,24 hours daily,,,2,,,LIVINGSTON,https://www.solution.energy,GPS,43.182170,-76.298230,10/29/2024,223123,2024-10-29 04:05:34,,,,10/28/2021,J1772
ELEC,Paradox Brewery,2781 U.S. 9,,North Hudson,NY,12855,,1-844-623-1001,E,,Public,24 hours daily,,,10,,,LIVINGSTON,https://www.solution.energy,GPS,43.945090,-73.731200,10/29/2024,324841,2024-10-29 04:06:11,,,,10/17/2023,J1772
ELEC,NORTH WOOD STATION 1,700 Warren Rd,,Ithaca,NY,14850,,888-758-4389,E,,Public,24 hours daily,,,2,,,ChargePoint Network,http://www.chargepoint.com/,GPS,42.486806,-76.470601,10/29/2024,162227,2024-10-29 00:55:49,,,,06/12/2020,J1772
ELEC,PRIMA LOFTS LL ALB LOFTS 1.4,1373 Broadway,,Menands,NY,12204,,888-758-4389,E,,Public,24 hours daily,,,2,,,ChargePoint Network,http://www.chargepoint.com/,GPS,42.676277,-73.733406,10/29/2024,175103,2024-10-29 01:11:07,,,,01/27/2021,J1772
ELEC,Catamount Ski,78 Catamount Rd,,Hillsdale,NY,12529,,518-325-3200,E,,Public - Call ahead,10am-5:30pm daily; Drivers must bring their own J1772 cordset for Level 1 charging,,,1,,,Non-Networked,,200-8,42.171859,-73.477728,07/11/2024,85949,2024-07-11 19:05:43,P,,,03/01/2020,J1772
ELEC,STATION 1 @ VIL VICTOR,70 E Main St,In lot next to church,Victor,NY,14564,,888-758-4389,E,,Public,24 hours daily,,,2,,,ChargePoint Network,http://www.chargepoint.com/,GPS,42.981755,-77.408360,10/29/2024,162320,2024-10-29 00:51:33,,,,06/12/2020,J1772
ELEC,211 EV STATIONS STATION-3,211 North Main Street,,Mechanicville,NY,12118,,888-758-4389,E,,Public,24 hours daily,,,2,,,ChargePoint Network,http://www.chargepoint.com/,GPS,42.910776,-73.684430,10/29/2024,350652,2024-10-29 02:21:43,,,,07/17/2024,J1772
ELEC,THOMAS COLE STATION #1,218 Spring St,Rear parking lot,Catskill,NY,12414,,888-758-4389,E,,Public,24 hours daily,,,2,,,ChargePoint Network,http://www.chargepoint.com/,GPS,42.226113,-73.861255,10/29/2024,164835,2024-10-29 01:18:05,,,,08/05/2020,J1772
ELEC,Mt Sinai Gustave Levy Pl - Garage,1425 Madison Ave,,New York,NY,10029,,813-492-5220,E,,Public,24 hours daily,A ANDROID_PAY APPLE_PAY D M V,,28,,,EVOKE,https://evokesystems.com/,GPS,40.790100,-73.953700,10/11/2024,356928,2024-10-11 18:09:31,P,,,09/07/2021,J1772
ELEC,1065 Elton St,1065 Elton St,,Brooklyn,NY,11239,,888-356-8911,E,,Public,24 hours daily,,,4,,,FLO,https://flo.ca/,GPS,40.657441,-73.874619,10/29/2024,196329,2024-10-29 03:32:52,,,,09/24/2021,J1772
ELEC,135 Pinelawn Rd,135 Pinelawn Rd,,Melville,NY,11747,,1-844-623-1001,E,,Public,24 hours daily,,,4,,,LIVINGSTON,https://www.solution.energy,GPS,40.770810,-73.406860,10/29/2024,225122,2024-10-29 04:04:53,,,,07/28/2022,J1772
ELEC,Downtown Parking Lot,11 Main St,,Mount Morris,NY,14510,,866-816-7584,E,,Public,24 hours daily,,,4,,,EV Connect,http://evconnect.com/,GPS,42.727140,-77.874578,10/29/2024,168431,2024-10-29 03:09:26,,,,09/01/2020,J1772
ELEC,SUNY BUFFALO JACOBS 5,50 Augspurger Rd,Jacobs A lot,Buffalo,NY,14228,,888-758-4389,E,,Public,24 hours daily,,,2,,,ChargePoint Network,http://www.chargepoint.com/,GPS,42.998863,-78.787191,10/29/2024,182264,2024-10-29 01:24:27,,,,01/27/2021,J1772
ELEC,Champion Parking W 76th Street - Tesla Destination,205 W 76th St,,New York,NY,10023,,877-798-3752,E,,Public,,,,3,,,Tesla Destination,https://www.tesla.com/destination-charging,200-9,40.781547,-73.980475,07/01/2024,115048,2024-10-16 16:58:41,P,,,08/19/2015,J1772 TESLA
ELEC,LAZ Parking 133-59 Roosevelt Ave - Tesla Destination,133-59 Roosevelt Ave,,Flushing,NY,11354,,877-798-3752,E,,Public,,,,4,,,Tesla Destination,https://www.tesla.com/destination-charging,200-8,40.758956,-73.832331,07/01/2024,150578,2024-10-16 16:58:41,P,,,03/31/2019,TESLA
ELEC,BETHLEHEM EV ADAMS 2 GW,123 Adams St,,Delmar,NY,12054,,888-758-4389,E,,Public,24 hours daily,,,2,,,ChargePoint Network,http://www.chargepoint.com/,GPS,42.623535,-73.835683,10/29/2024,190461,2024-10-29 01:29:06,,,,06/01/2021,J1772
ELEC,Ardsley Service Area,"New York Thruway, Mile Post 6N",,Hastings on Hudson,NY,10706,,888-557-7099,E,,Public,24 hours daily,ANDROID_PAY APPLE_PAY CREDIT M V,,,4,,APPLEGREEN,https://www.applegreenelectric.com/,200-8,40.984990,-73.852960,08/15/2024,350558,2024-08-15 19:57:12,P,,,07/15/2024,CHADEMO J1772COMBO TESLA
ELEC,CJ's Italian Restaurant,353 Old Post Rd,,Rhinebeck,NY,12572,,833-692-6787,E,,Public - Credit card at all times,Contact station for hours of availability.,A ANDROID_PAY APPLE_PAY CREDIT D M,,4,,,AMPUP,https://ampup.io/,200-9,41.958748,-73.896322,10/11/2022,229919,2023-02-14 15:54:11,P,,,09/15/2022,J1772
ELEC,STRONG MUSEUM STRONG L1 #3,1 Manhattan Square Dr,Please note: This is a paid garage. Full parking rate is $10 if not visiting the museum. Parking as a museum guest is $7. Station is at Level 1 of the parking garage,Rochester,NY,14607,,888-758-4389,E,,Public,24 hours daily,,,2,,,ChargePoint Network,http://www.chargepoint.com/,GPS,43.151953,-77.600919,10/29/2024,174554,2024-10-29 01:06:56,,,,01/27/2021,J1772
ELEC,APDC ADMIN LOT PORT 1.3,106 Smith Blvd,Near rear entrance of Albany port district commission.,Albany,NY,12202,,888-758-4389,E,,Public,24 hours daily,,,2,,,ChargePoint Network,http://www.chargepoint.com/,GPS,42.626240,-73.758310,10/29/2024,181003,2024-10-29 01:18:36,,,,01/27/2021,J1772
ELEC,NY CREATES NY CREATES,257 Fuller Road,Within NY CREATES Gated Visitor Lot H,Albany,NY,12203,,888-758-4389,E,,Public,24 hours daily,,,2,,,ChargePoint Network,http://www.chargepoint.com/,GPS,42.690458,-73.833056,10/29/2024,357146,2024-10-29 02:24:43,,,,09/27/2024,J1772
ELEC,COLE GROUP COLONIE EAST 2,12 Doorstone Dr,,Latham,NY,12110,,888-758-4389,E,,Public,24 hours daily,,,2,,,ChargePoint Network,http://www.chargepoint.com/,GPS,42.745613,-73.772060,10/29/2024,154705,2024-10-29 01:10:34,,,,03/25/2020,J1772
ELEC,Stop and Shop 465 Atlantic Ave,465 Atlantic Avenue,,Oceanside,NY,11572,,888-264-2208,E,,Public,Mon 6:00am - 11:59pm; Tue 6:00am - 11:59pm; Wed 6:00am - 11:59pm; Thu 6:00am - 11:59pm; Fri 6:00am - 11:59pm; Sat 6:00am - 11:59pm; Sun 6:00am - 11:59pm,,,2,,,SHELL_RECHARGE,https://www.shell.us/motorist/electric-vehicle-charging.html,GPS,40.639802,-73.652496,10/29/2024,222818,2024-10-29 02:48:07,,,,07/01/2022,J1772
ELEC,Tarrytown House Estate on the Hudson - Tesla Destination,49 E Sunnyside Ln,,Tarrytown,NY,10591,,877-798-3752,E,,Public,,,,2,,,Tesla Destination,https://www.tesla.com/destination-charging,200-8,41.049684,-73.857388,07/01/2024,115242,2024-10-16 16:58:41,P,,,10/31/2016,TESLA
ELEC,The Spur - Tesla Destination,280 Elm Street,,Southampton,NY,11968,,877-798-3752,E,,Public,,,,2,,,Tesla Destination,https://www.tesla.com/destination-charging,200-9,40.895405,-72.388535,07/01/2024,169200,2024-10-16 16:58:41,P,,,07/12/2018,TESLA
ELEC,TOWN OF BABYLON OVERLOOK 1,100 Ocean Pkwy,,Babylon,NY,11702,,888-758-4389,E,,Public,24 hours daily,,,1,,,ChargePoint Network,http://www.chargepoint.com/,GPS,40.633720,-73.333732,10/29/2024,180135,2024-10-29 00:53:12,,,,01/27/2021,J1772
ELEC,Country Glenn Apartments Building 2159,2155 Bedell Rd,,Grand Island,NY,14072,,1-844-623-1001,E,,Public,24 hours daily,,,6,,,LIVINGSTON,https://www.solution.energy,GPS,43.038100,-78.972540,10/29/2024,334454,2024-10-29 04:05:20,,,,05/02/2024,J1772
ELEC,Town of Webster,1350 Chiyoda Dr.,,Webster,NY,14580,,866-816-7584,E,,Public,24 hours daily,,,2,,,EV Connect,http://evconnect.com/,GPS,43.228147,-77.422055,10/29/2024,157944,2024-10-29 03:09:02,,,,05/15/2020,J1772
ELEC,Department of Public Works - Public,1130 Nepperhan Ave,,Yonkers,NY,10703,,866-816-7584,E,,Public,24 hours daily,,,4,,,EV Connect,http://evconnect.com/,GPS,40.964129,-73.871953,10/29/2024,260248,2024-10-29 03:11:23,,,,05/03/2023,J1772
ELEC,Rapidpark 44 State Street - Tesla Destination,44 State St,,Brooklyn,NY,11201,,877-798-3752,E,,Public,,,,3,,,Tesla Destination,https://www.tesla.com/destination-charging,200-8,40.692062,-73.998160,07/01/2024,114905,2024-10-16 16:58:41,P,,,06/13/2017,J1772 TESLA
ELEC,Hampton Bays Town Center - Tesla Supercharger,52 E Montauk Hwy,,Hampton Bays,NY,11946,,877-798-3752,E,,Public,24 hours daily,A D Debit M V,,,12,,Tesla,https://www.tesla.com/supercharger,GPS,40.877940,-72.521028,09/12/2024,353800,2024-09-12 16:47:34,P,,,08/09/2024,J1772COMBO TESLA
ELEC,HUDSON PRESERVE BERYL WAY 5,136 Troy Schdy Rd,Next to building 2,Watervliet,NY,12189,,888-758-4389,E,,Public,24 hours daily,,,2,,,ChargePoint Network,http://www.chargepoint.com/,GPS,42.733020,-73.725890,10/29/2024,143920,2024-10-29 01:05:10,,,,08/21/2019,J1772
ELEC,CAP REP GARAGE 93 NORTH 1.2,93 N Pearl St,"Top floor of parking garage at 93 north pearl street, permit required",Albany,NY,12207,,888-758-4389,E,,Public,24 hours daily,,,2,,,ChargePoint Network,http://www.chargepoint.com/,GPS,42.652630,-73.750390,10/29/2024,183663,2024-10-29 01:25:06,,,,01/30/2021,J1772
ELEC,BETHLEHEM EV ELM PARK PUBGW,261 Elm Ave,,Delmar,NY,12054,,888-758-4389,E,,Public,24 hours daily,,,2,,,ChargePoint Network,http://www.chargepoint.com/,GPS,42.599942,-73.839959,10/29/2024,171219,2024-10-29 01:22:41,,,,01/09/2021,J1772
ELEC,Dell Street Parking/Charging,124 Dell Street,,Syracuse,NY,13210,,888-998-2546,E,,Public,24 hours daily,,,2,,,Blink Network,http://www.blinkcharging.com/,GPS,43.042078,-76.120702,10/29/2024,356228,2024-10-29 00:10:12,,,,01/21/2022,J1772
ELEC,4545 Center Blvd-TF Cornerstone LIC - Tesla Destination,4545 Center Blvd,,Long Island City,NY,11109,,877-798-3752,E,,Public,,,,8,,,Tesla Destination,https://www.tesla.com/destination-charging,200-9,40.747676,-73.956012,07/01/2024,150600,2024-10-16 16:58:41,P,,,03/30/2019,TESLA
ELEC,TNC EVSE TRAIN STATION 4,Chappaqua Train Station,Train station,Chappaqua,NY,10514,,888-758-4389,E,,Public,24 hours daily,,,2,,,ChargePoint Network,http://www.chargepoint.com/,GPS,41.157504,-73.774931,10/29/2024,253699,2024-10-29 01:41:56,,,,02/08/2023,J1772
ELEC,iPark NYC The Carnegie Garage - Tesla Destination,200 E 94th St,,New York,NY,10128,,877-798-3752,E,,Public,,,,3,,,Tesla Destination,https://www.tesla.com/destination-charging,200-9,40.783536,-73.949507,07/01/2024,115043,2024-10-16 16:58:41,P,,,06/24/2015,J1772 TESLA
ELEC,TOWN OF BABYLON TOWN ANNEX 2,281 Phelps Ln,Right side station,North Babylon,NY,11703,,888-758-4389,E,,Public,24 hours daily,,,1,,,ChargePoint Network,http://www.chargepoint.com/,GPS,40.727922,-73.330925,10/29/2024,162276,2024-10-29 00:53:15,,,,06/12/2020,J1772
ELEC,Royal Ford,3964 Waverly Rd,,Owego,NY,13827,,607-687-0424,E,,Public - Credit card at all times,24 hours daily,A D Debit M V,,1,,,Non-Networked,,GPS,42.096025,-76.281042,06/13/2024,227064,2024-06-13 17:18:06,P,,,08/26/2022,J1772
ELEC,TOWN OF MANLIUS TOWN HALL 1,301 brooklea dr,Back Parking Lot,Fayetteville,NY,13066,,888-758-4389,E,,Public,24 hours daily,,,2,,,ChargePoint Network,http://www.chargepoint.com/,GPS,43.032622,-76.012887,10/29/2024,236737,2024-10-29 01:52:44,,,,11/30/2022,J1772
ELEC,Hudson Valley Rail Trail Depot - Tesla Destination,101 New Paltz Rd,,Highland,NY,12528,,877-798-3752,E,,Public,,,,4,,,Tesla Destination,https://www.tesla.com/destination-charging,200-9,41.734107,-73.974399,07/01/2024,114949,2024-10-16 16:58:41,P,,,08/27/2018,J1772 TESLA
ELEC,SWTCH Energy,9 Forest Dr,,Garnerville,NY,10923,,844-798-2438,E,,Public,24 hours daily,A D Debit M V,,4,,,SWTCH,https://swtchenergy.com/,GPS,41.193790,-74.012050,11/09/2023,313654,2024-01-31 22:07:01,P,,,08/23/2023,J1772
ELEC,EVolve NY Richmondville,1168 NY-7,,Richmondville,NY,12149,,833-632-2778,E,,Public,24 hours daily,,,,4,,Electrify America,https://www.electrifyamerica.com/,GPS,42.641890,-74.538960,10/29/2024,279445,2024-10-29 02:56:07,,,,06/22/2023,CHADEMO J1772COMBO
ELEC,RUDIN 215 E 68TH EV7,215 East 68th Street,,New York,NY,10065,,888-758-4389,E,,Public,24 hours daily,,,2,,,ChargePoint Network,http://www.chargepoint.com/,GPS,40.767019,-73.960521,10/29/2024,358458,2024-10-29 02:21:09,,,,10/16/2024,J1772
ELEC,The Lofts at Saratoga Bldg 7,701 North Ave,,Ballston Spa,NY,12020,,949-945-2000,E,,Public,24 hours daily,A ACCOUNT_BALANCE ANDROID_PAY APPLE_PAY CREDIT D M V,,2,,,EVGATEWAY,http://evgateway.com/,200-8,42.984250,-73.862330,05/09/2024,334260,2024-05-09 20:32:20,P,,,04/04/2023,J1772
ELEC,TDC Building 11,613 Route 3,,Plattsburgh,NY,12901,,1-844-623-1001,E,,Public,24 hours daily,,,2,,,LIVINGSTON,https://www.solution.energy,GPS,44.695510,-73.508090,10/29/2024,324866,2024-10-29 04:05:45,,,,10/31/2023,J1772
ELEC,COLLEGIAN HOTEL COLLEGIAN 1:3,1030 E Genesee St,Side parking lot of collegiate suites,Syracuse,NY,13210,,888-758-4389,E,,Public,24 hours daily,,,2,,,ChargePoint Network,http://www.chargepoint.com/,GPS,43.046204,-76.135210,10/29/2024,191387,2024-10-29 01:29:27,,,,06/23/2021,J1772
ELEC,SIBLEY SQUARE MORTIMER FL3CTR,83 Mortimer St,3rd Floor Near Elevator / Stairs,Rochester,NY,14604,,888-758-4389,E,,Public,24 hours daily,,,2,,,ChargePoint Network,http://www.chargepoint.com/,GPS,43.157705,-77.607046,10/29/2024,180131,2024-10-29 00:53:22,,,,01/27/2021,J1772
ELEC,CLOVERWOOD SL CW-1,1 Wheatley Terrace Pittsford,,Brighton,NY,14534,,888-758-4389,E,,Public,24 hours daily,,,2,,,ChargePoint Network,http://www.chargepoint.com/,GPS,43.083794,-77.547647,10/29/2024,328457,2024-10-29 02:12:06,,,,02/15/2024,J1772
ELEC,245 E 90th - Garage,1625 3rd Ave,,New York,NY,10128,,813-492-5220,E,,Public,24 hours daily,A ANDROID_PAY APPLE_PAY D M V,,11,,,EVOKE,https://evokesystems.com/,GPS,40.782305,-73.951186,10/11/2024,356939,2024-10-11 18:09:31,P,,,03/18/2024,J1772
ELEC,Hudson River Crest B&B - Tesla Destination,14  River Crest Road,,Fort Montgomery,NY,10922,,877-798-3752,E,,Public,,,,2,,,Tesla Destination,https://www.tesla.com/destination-charging,GPS,41.339320,-73.975390,07/01/2024,250953,2024-10-16 16:58:41,P,,,03/28/2022,TESLA
ELEC,TOWNEPLACE11735 TOWNE PLACE 1,1 Marriott Plaza,,Farmingdale,NY,11735,,888-758-4389,E,,Public,24 hours daily,,,2,,,ChargePoint Network,http://www.chargepoint.com/,GPS,40.729099,-73.421926,10/29/2024,223703,2024-10-29 01:42:37,,,,07/19/2022,J1772
ELEC,57ALEXANDER SPOT #318,57 Alexander Street,2nd floor garage,Yonkers,NY,10701,,888-758-4389,E,,Public,24 hours daily,,,1,,,ChargePoint Network,http://www.chargepoint.com/,GPS,40.939000,-73.901699,10/29/2024,349467,2024-10-29 02:10:09,,,,06/27/2024,J1772
ELEC,QUICKLEES27 DC FAST 1,204 Oak St,,Batavia,NY,14020,,888-758-4389,E,,Public,24 hours daily,,,,1,,ChargePoint Network,http://www.chargepoint.com/,GPS,43.015034,-78.191600,10/29/2024,228864,2024-10-29 01:48:02,,,,09/22/2022,CHADEMO J1772COMBO
ELEC,QuickChek - Tesla Supercharger,640 Washington Ave.,,Kingston,NY,12401,,877-798-3752,E,,Public,24 hours daily. Please check Tesla's online station map to see if an adapter is required at this location.,,,,8,,Tesla,https://www.tesla.com/supercharger,200-9,41.941893,-74.027428,07/01/2024,102331,2024-08-14 18:58:22,P,,,10/01/2016,TESLA
ELEC,Rapid Park - 204 W 101st 1st Floor,204 W 101st Street,,New York,NY,10025,,1-844-623-1001,E,,Public,24 hours daily,,,4,,,LIVINGSTON,https://www.solution.energy,GPS,40.797430,-73.968700,10/29/2024,334499,2024-10-29 04:06:05,,,,05/02/2024,J1772
ELEC,"Brixmor Parkway Plaza (Carle Place, NY)",207-225 Glen Cove Rd,,Carle Place,NY,11514,,833-632-2778,E,,Public,24 hours daily,,,,4,,Electrify America,https://www.electrifyamerica.com/,GPS,40.748090,-73.616880,10/29/2024,203023,2024-10-29 02:57:29,,,,12/24/2021,CHADEMO J1772COMBO
ELEC,City Square,50 Main Street,,White Plains,NY,10606,,800-663-5633,E,,Public,24 hours daily,,,4,,,Blink Network,http://www.blinkcharging.com/,GPS,41.031399,-73.773596,10/29/2024,195437,2024-10-29 00:16:03,,,,05/04/2015,J1772
ELEC,ROSEWOOD PLAZA STATION 3,New Karner Rd & Watervliet Shaker Rd,,Albany,NY,12205,,888-758-4389,E,,Public,24 hours daily,,,2,,,ChargePoint Network,http://www.chargepoint.com/,GPS,42.742672,-73.839330,10/29/2024,181718,2024-10-29 01:21:35,,,,01/27/2021,J1772
ELEC,391 Weirfield St,391 Weirfield St,,Brooklyn,NY,11237,,949-945-2000,E,,Public,24 hours daily,A ACCOUNT_BALANCE ANDROID_PAY APPLE_PAY CREDIT D M V,,6,,,EVGATEWAY,http://evgateway.com/,200-8,40.696040,-73.906620,05/09/2024,333819,2024-05-09 20:32:20,P,,,06/12/2023,J1772
ELEC,SWTCH Energy Inc.,150 W Genesee St,,Chittenango,NY,13037,,844-798-2438,E,,Public,24 hours daily,A D Debit M V,,2,,,SWTCH,https://swtchenergy.com/,GPS,43.044700,-75.872800,02/12/2024,326000,2024-02-12 21:24:44,P,,,12/13/2023,J1772
ELEC,Snow Ridge Ski Resort,4173 West Road,,Turin,NY,13473,,1-844-623-1001,E,,Public,24 hours daily,,,6,,,LIVINGSTON,https://www.solution.energy,GPS,43.640130,-75.420050,10/29/2024,353494,2024-10-29 04:06:56,,,,08/22/2024,J1772
ELEC,"Littleman Driggs Parking, LLC - Tesla Destination",626 Driggs Ave,,Brooklyn,NY,11211,,877-798-3752,E,,Public,,,,3,,,Tesla Destination,https://www.tesla.com/destination-charging,200-9,40.715033,-73.958595,07/01/2024,114910,2024-10-16 16:58:41,P,,,05/24/2018,J1772 TESLA
ELEC,CAPCOMFCU CHRGPOINT CT4 1,6 Winners Cir,Rear parking lot,Albany,NY,12205,,888-758-4389,E,,Public,24 hours daily,,,2,,,ChargePoint Network,http://www.chargepoint.com/,GPS,42.719104,-73.795364,10/29/2024,185238,2024-10-29 01:23:29,,,,02/20/2021,J1772
ELEC,Mayfair Apts - Garage,207 E. 74th St,,New York,NY,10021,,813-492-5220,E,,Public,24 hours daily,A ANDROID_PAY APPLE_PAY D M V,,20,,,EVOKE,https://evokesystems.com/,GPS,40.770958,-73.958625,10/11/2024,356958,2024-10-11 18:09:31,P,,,07/27/2022,J1772
ELEC,Icon Parking 279 East 65th Street - Tesla Destination,279 E 65th St,,New York,NY,10065,,877-798-3752,E,,Public,,,,3,,,Tesla Destination,https://www.tesla.com/destination-charging,200-8,40.764552,-73.962034,07/01/2024,115077,2024-10-16 16:58:41,P,,,02/28/2018,J1772 TESLA
ELEC,BNE MASTER 4000 MURRAY ST1,4000 Murray Court,,Pearl River,NY,10965,,888-758-4389,E,,Public,24 hours daily,,,2,,,ChargePoint Network,http://www.chargepoint.com/,GPS,41.045877,-74.004013,10/29/2024,217392,2024-10-29 01:43:48,,,,05/12/2022,J1772
ELEC,CENTROTHERM CENTRO F3,400 S Pearl St,Right side of lot as you pull in,Albany,NY,12202,,888-758-4389,E,,Public,24 hours daily,,,1,,,ChargePoint Network,http://www.chargepoint.com/,GPS,42.637775,-73.758928,10/29/2024,187558,2024-10-29 01:16:02,,,,04/13/2021,J1772
ELEC,Dr Katz Dentistry - 629 Ridge Rd Parking Lot,629 Ridge Rd,,Webster,NY,14580,,813-492-5220,E,,Public,24 hours daily,A ANDROID_PAY APPLE_PAY D M V,,2,,,EVOKE,https://evokesystems.com/,GPS,43.195251,-77.601105,10/11/2024,357079,2024-10-11 18:09:31,P,,,05/17/2023,J1772
ELEC,HARMONY MILLS 1 WEST 1,Mohawk St & Cohoes Mills,,Cohoes,NY,12047,,888-758-4389,E,,Public,24 hours daily,,,2,,,ChargePoint Network,http://www.chargepoint.com/,GPS,42.781628,-73.705720,10/29/2024,174734,2024-10-29 01:07:51,,,,01/27/2021,J1772
ELEC,Legend Nissan,268 Jericho Turnpike,,Syosset,NY,11791,,516-496-8181,E,,Public - Call ahead,Dealership business hours,,,1,1,,Non-Networked,,200-8,40.809910,-73.507730,02/12/2024,44203,2024-02-12 15:25:05,P,,,11/30/2011,CHADEMO J1772 J1772COMBO
ELEC,GENESEO W PARK RIGHT,4271 Genesee Valley Plaza Rd,West Parking Area Right Charger,Geneseo,NY,14454,,888-758-4389,E,,Public,24 hours daily,,,2,,,ChargePoint Network,http://www.chargepoint.com/,GPS,42.796997,-77.785406,10/29/2024,224229,2024-10-29 01:44:25,,,,07/22/2022,J1772
ELEC,WHB LANDINGS STATION 2,3017 Mitchell Rd,parking lot 2,Westhampton Beach,NY,11978,,888-758-4389,E,,Public,Mon 8:00am - 5:00pm; Tue 8:00am - 5:00pm; Wed 8:00am - 5:00pm; Thu 8:00am - 5:00pm; Fri 8:00am - 5:00pm; Sat 8:00am - 5:00pm; Sun 8:00am - 5:00pm,,,2,,,ChargePoint Network,http://www.chargepoint.com/,GPS,40.806998,-72.643307,10/29/2024,241247,2024-10-29 01:46:01,,,,01/06/2023,J1772
ELEC,MPG The Shops at Skyview - Tesla Destination,40-24 College Point Blvd,,Flushing,NY,11354,,877-798-3752,E,,Public,,,,3,,,Tesla Destination,https://www.tesla.com/destination-charging,200-9,40.756740,-73.836223,07/01/2024,114939,2024-10-16 16:58:41,P,,,02/22/2018,TESLA
ELEC,854ELLICOTT 134 HIGH ST 6,134 High St,,Buffalo,NY,14203,,888-758-4389,E,,Public,24 hours daily,,,2,,,ChargePoint Network,http://www.chargepoint.com/,GPS,42.901003,-78.863841,10/29/2024,169908,2024-10-29 01:22:55,,,,12/04/2020,J1772
ELEC,"Brixmor Erie Canal Centre (Syracuse, NY)",3469 ERIE BLVD,,Syracuse,NY,13214,,833-632-2778,E,,Public,24 hours daily,,,,4,,Electrify America,https://www.electrifyamerica.com/,GPS,43.046060,-76.066930,10/29/2024,192946,2024-10-29 02:58:46,,,,07/17/2021,CHADEMO J1772COMBO
ELEC,McDonalds #39698,2585 South Road,,Poughkeepsie,NY,12601,,888-998-2546,E,,Public,24 hours daily,,,2,,,Blink Network,http://www.blinkcharging.com/,GPS,41.665087,-73.930520,10/29/2024,258978,2024-10-29 00:13:15,,,,04/11/2023,J1772
ELEC,Mt Sinai Queens - Garage,23-11 30th Rd,,Astoria,NY,11102,,813-492-5220,E,,Public,24 hours daily,A ANDROID_PAY APPLE_PAY D M V,,4,,,EVOKE,https://evokesystems.com/,GPS,40.768523,-73.926527,10/11/2024,356967,2024-10-11 18:09:31,P,,,06/13/2022,J1772
ELEC,The Shelton Condo - Garage,775 Lafayette Ave,,Brooklyn,NY,11221,,813-492-5220,E,,Public,24 hours daily,A ANDROID_PAY APPLE_PAY D M V,,20,,,EVOKE,https://evokesystems.com/,GPS,40.691400,-73.941100,10/11/2024,357097,2024-10-11 18:09:31,P,,,04/19/2022,J1772
ELEC,EVolve NY Albany Lot 3,327 Washington Ave.,,Albany,NY,12206,,833-632-2778,E,,Public,24 hours daily,,,,4,,Electrify America,https://www.electrifyamerica.com/,GPS,42.659820,-73.768520,10/29/2024,357394,2024-10-29 02:56:07,,,,10/02/2024,J1772COMBO
ELEC,Bard College - Barringer House,30 Campus Rd,,Annandale-on-Hudson,NY,12504,,1-844-623-1001,E,,Public,24 hours daily,,,2,,,LIVINGSTON,https://www.solution.energy,GPS,42.025220,-73.906010,10/29/2024,324780,2024-10-29 04:05:28,,,,05/16/2023,J1772
ELEC,JAGUAR ALBANY JLR 2,347 New Karner Rd,,Colonie,NY,12205,,888-758-4389,E,,Public,24 hours daily,,,1,,,ChargePoint Network,http://www.chargepoint.com/,GPS,42.729483,-73.853308,10/29/2024,323116,2024-10-29 00:56:55,,,,12/21/2023,J1772
ELEC,West Herr Nissan,6069 S Transit Rd,,Lockport,NY,14094,,716-625-8889,E,,Public - Call ahead,Dealership business hours,,,1,,,Non-Networked,,200-9,43.128557,-78.696197,02/12/2024,44354,2024-02-12 15:25:05,P,,,11/30/2011,J1772
ELEC,Enterprise 284 Mott St - Underground garage,284 Mott St,,New York,NY,10012,,813-492-5220,E,,Public,24 hours daily,A ANDROID_PAY APPLE_PAY D M V,,4,,,EVOKE,https://evokesystems.com/,GPS,40.724324,-73.994201,10/11/2024,356981,2024-10-11 18:09:31,P,,,02/07/2023,J1772
ELEC,Dover Plains Library - Town Of Dover NY,1797 Route 22,,Wingdale,NY,12594,,855-885-9571,E,,Public,,,,2,,,OpConnect,http://www.opconnect.com/,GPS,41.647880,-73.563420,10/29/2024,189684,2024-10-29 03:04:31,,,,05/14/2021,J1772
ELEC,ADKHOSPITALITY HAMPTON INN 1.3,2133 U.S. 9,Side parking lot of hampton inn lake george,Lake George,NY,12845,,888-758-4389,E,,Public,24 hours daily,,,2,,,ChargePoint Network,http://www.chargepoint.com/,GPS,43.409264,-73.712660,10/29/2024,185361,2024-10-29 01:25:37,,,,02/25/2021,J1772
ELEC,Plum Court Condominiums,526-528 Plum St.,,Syracuse,NY,13204,,1-844-623-1001,E,,Public,24 hours daily,,,4,,,LIVINGSTON,https://www.solution.energy,GPS,43.056120,-76.157400,10/29/2024,233099,2024-10-29 04:04:52,,,,10/06/2022,J1772
ELEC,MAIN LIBRARY SCHENECTADY,99 Clinton St,In lot off of Clinton Street,Schenectady,NY,12305,,888-758-4389,E,,Public,24 hours daily,,,2,,,ChargePoint Network,http://www.chargepoint.com/,GPS,42.815247,-73.937702,10/29/2024,260849,2024-10-29 00:51:33,,,,05/16/2023,J1772
ELEC,HEATHERWOOD HERITAGE SPY RI,303 Arrowhead Lane,Heritage Spy Ring Golf Club Clubhouse,Terryville,NY,11720,,888-758-4389,E,,Public,24 hours daily,,,2,,,ChargePoint Network,http://www.chargepoint.com/,GPS,40.902598,-73.069212,10/29/2024,355924,2024-10-29 02:24:20,,,,09/19/2024,J1772
ELEC,Town of Philipstown - Recreation Center,107 Glynclyffe,,Garrison,NY,10524,,1-844-623-1001,E,,Public,24 hours daily,,,2,,,LIVINGSTON,https://www.solution.energy,GPS,41.367570,-73.951470,10/29/2024,357601,2024-10-29 04:07:01,,,,10/05/2024,J1772
ELEC,Saratoga Automobile Museum - Rear,110 Avenue of the Pines,,Saratoga Springs,NY,12866,,1-844-623-1001,E,,Public,24 hours daily,,,2,,,LIVINGSTON,https://www.solution.energy,GPS,43.057040,-73.804660,10/29/2024,223105,2024-10-29 04:04:43,,,,10/28/2021,J1772
ELEC,Manhattan Beer Distributors,955 9E 149th St,,Bronx,NY,10455,,949-945-2000,E,,Public,24 hours daily,A ACCOUNT_BALANCE ANDROID_PAY APPLE_PAY CREDIT D M V,,2,,,EVGATEWAY,http://evgateway.com/,200-8,40.805490,-73.900490,,334018,2024-10-02 21:08:26,P,,,12/07/2021,J1772
ELEC,NATIONAL GRID JEFFERSON 1,1220 Coffeen street,C LOT,Watertown,NY,13601,,888-758-4389,E,,Public,24 hours daily,,,1,,,ChargePoint Network,http://www.chargepoint.com/,GPS,43.992703,-75.932701,10/29/2024,162251,2024-10-29 00:55:15,,,,06/12/2020,J1772
ELEC,Astoria Central Parking - Tesla Destination,31-57 31st St,,Astoria,NY,11106,,877-798-3752,E,,Public,,,,4,,,Tesla Destination,https://www.tesla.com/destination-charging,200-8,40.762502,-73.924507,07/01/2024,114881,2024-10-16 16:58:41,P,,,07/06/2018,TESLA
ELEC,ERIE COUNTY EMERY,2084 Emery Rd,,South Wales,NY,14139,,888-758-4389,E,,Public,Mon 6:00am - 9:00pm; Tue 6:00am - 9:00pm; Wed 6:00am - 9:00pm; Thu 6:00am - 9:00pm; Fri 6:00am - 9:00pm; Sat 6:00am - 9:00pm; Sun 6:00am - 9:00pm,,,2,,,ChargePoint Network,http://www.chargepoint.com/,GPS,42.715504,-78.595665,10/29/2024,164390,2024-10-29 01:14:01,,,,07/21/2020,J1772
ELEC,"Davidson Ford - Clay, NY",3690 State Route 31,,Liverpool,NY,13090,,315-860-0096,E,,Public,"7:30-7:30 M-F, 8:00-12:00 S",A CREDIT D M V,,,2,,Non-Networked,,200-8,43.181550,-76.256620,09/12/2024,352488,2024-09-12 16:47:34,P,,,07/01/2024,J1772COMBO
ELEC,Ausable Brewing Company,765 Mace Chasm,,Keeseville,NY,12944,,1-844-623-1001,E,,Public,24 hours daily,,,4,,,LIVINGSTON,https://www.solution.energy,GPS,44.503060,-73.447740,10/29/2024,261481,2024-10-29 04:06:06,,,,05/25/2023,J1772
ELEC,AMPHENOL 191 STATION 3,191 Delaware Ave,Parking lot of Amphenol Aerospace,Sidney,NY,13838,,888-758-4389,E,,Public,24 hours daily,,,2,,,ChargePoint Network,http://www.chargepoint.com/,GPS,42.307305,-75.400510,10/29/2024,346476,2024-10-29 01:38:17,,,,05/18/2024,J1772
ELEC,CARMEL CARMEL TOWNHALL,60 McAlpin Ave,,Mahopac,NY,10541,,888-758-4389,E,,Public,24 hours daily,,,2,,,ChargePoint Network,http://www.chargepoint.com/,GPS,41.377190,-73.723964,10/29/2024,261349,2024-10-29 02:02:15,,,,05/25/2023,J1772
ELEC,Summit Senior Life - Eastwyck,1 Eastwyck Cir.,,Rensselaer,NY,12144,,1-844-623-1001,E,,Public,24 hours daily,,,4,,,LIVINGSTON,https://www.solution.energy,GPS,42.652160,-73.688330,10/29/2024,189510,2024-10-29 04:05:48,,,,12/02/2020,J1772
ELEC,"bp, Jericho Turnpike, NY",2298 Jericho Turnpike,,New Hyde Park,NY,11040,,866-816-7584,E,,Public,24 hours daily,,,,2,,BP_PULSE,https://www.bp.com/en_us/united-states/home/what-we-do/customers-and-products/bp-pulse/bp-pulse-products.html,GPS,40.740992,-73.662543,10/29/2024,231033,2024-10-29 03:52:49,,,,09/30/2022,CHADEMO J1772COMBO
ELEC,KENNETH DR Q KENNETH DR 3,375 Kenneth Drive,Station 3 East Parking,Rochester,NY,14623,,888-758-4389,E,,Public,24 hours daily,,,,1,,ChargePoint Network,http://www.chargepoint.com/,GPS,43.059126,-77.644601,10/29/2024,332468,2024-10-29 02:17:00,,,,04/17/2024,CHADEMO J1772COMBO
ELEC,BELMONTEASTVIEW BLD 7,7110 Admission Drive South,,Central Islip,NY,11722,,888-758-4389,E,,Public,24 hours daily,,,2,,,ChargePoint Network,http://www.chargepoint.com/,GPS,40.768066,-73.194925,10/29/2024,360571,2024-10-29 02:23:15,,,,10/23/2024,J1772
ELEC,420 Gates - Garage,420 Gates Ave,,Brooklyn,NY,11216,,813-492-5220,E,,Public,24 hours daily,A ANDROID_PAY APPLE_PAY D M V,,7,,,EVOKE,https://evokesystems.com/,GPS,40.686300,-73.949500,10/11/2024,357031,2024-10-11 18:09:31,P,,,02/26/2022,J1772
ELEC,Brockport Landing,18 N Main St,,Brockport,NY,14420,,1-844-623-1001,E,,Public,24 hours daily,,,8,,,LIVINGSTON,https://www.solution.energy,GPS,43.217270,-77.935880,10/29/2024,223254,2024-10-29 04:04:57,,,,01/25/2022,J1772
ELEC,FAYETTVL LIBRAY ORCHARD 1,288 Orchard St,,Fayetteville,NY,13066,,888-758-4389,E,,Public,Mon 8:00am - 8:00pm; Tue 8:00am - 8:00pm; Wed 8:00am - 8:00pm; Thu 8:00am - 8:00pm; Fri 8:00am - 8:00pm; Sat 8:00am - 8:00pm; Sun 8:00am - 8:00pm,,,2,,,ChargePoint Network,http://www.chargepoint.com/,GPS,43.026026,-76.007024,10/29/2024,194157,2024-10-29 01:31:08,,,,08/21/2021,J1772
ELEC,HIGHWAY ADP2,1003 50,,Ballston,NY,12019,,888-758-4389,E,,Public,24 hours daily,,,2,,,ChargePoint Network,http://www.chargepoint.com/,GPS,42.939473,-73.874559,10/29/2024,204775,2024-10-29 01:38:33,,,,01/14/2022,J1772
ELEC,ESF BAKER LAB 2,1 Forestry Drive West Campus Drive,Baker Lab - Lot P17,Syracuse,NY,13210,,888-758-4389,E,,Public,24 hours daily,,,2,,,ChargePoint Network,http://www.chargepoint.com/,GPS,43.033882,-76.137749,10/29/2024,207787,2024-10-29 01:31:03,,,,03/09/2022,J1772
ELEC,Tony Mangino Mitsubishi,1658 Route 9,,Clifton Park,NY,12065,,518-373-4100,E,,Public,Business hours; priority for Mitsubishi vehicles,,,2,,,Non-Networked,,200-9,42.858085,-73.762909,03/08/2023,98431,2024-01-31 22:07:01,P,,,01/01/2012,J1772
ELEC,300 E 74th St - Main Floor,32 Gramercy Park S,,New York,NY,10003,,813-492-5220,E,,Public,24 hours daily,A ANDROID_PAY APPLE_PAY D M V,,20,,,EVOKE,https://evokesystems.com/,GPS,40.769964,-73.957184,10/11/2024,356997,2024-10-11 18:09:31,P,,,01/17/2023,J1772
ELEC,HARMONY MILLS 1 WEST 1 1.3,100 N Mohawk St,,Cohoes,NY,12047,,888-758-4389,E,,Public,24 hours daily,,,2,,,ChargePoint Network,http://www.chargepoint.com/,GPS,42.781548,-73.705635,10/29/2024,174728,2024-10-29 01:07:51,,,,01/27/2021,J1772
ELEC,BMW Southampton,759 County Rd 39A,,Southampton,NY,11968,,1-888-717-4544,E,,Public,24 hours daily,,,2,4,,CHARGESMART_EV,https://chargesmartev.com,GPS,40.898849,-72.372964,10/29/2024,350796,2024-10-29 04:09:41,,,,07/19/2024,J1772 J1772COMBO
ELEC,Ide Volkswagen of East Rochester,333 N Washington St,,Rochester,NY,14625,,844-798-2438,E,,Public - Credit card at all times,24 hours daily,A D Debit M V,,1,1,,Non-Networked,,GPS,43.120435,-77.486368,08/10/2023,211923,2024-01-31 22:07:01,P,,,03/17/2022,J1772 J1772COMBO
ELEC,ADELPHI UNIV STATION 05,1 South Ave,In Motamed parking garage,Garden City,NY,11530,,888-758-4389,E,,Public,24 hours daily,,,2,,,ChargePoint Network,http://www.chargepoint.com/,GPS,40.719629,-73.650059,10/29/2024,171555,2024-10-29 01:09:27,,,,01/27/2021,J1772
ELEC,Rapidpark 340 94th Street - Tesla Destination,340 E 94th St,,New York,NY,10128,,877-798-3752,E,,Public,,,,3,,,Tesla Destination,https://www.tesla.com/destination-charging,200-8,40.782091,-73.946029,07/01/2024,115104,2024-10-16 16:58:41,P,,,08/23/2017,J1772 TESLA
ELEC,Dino's Tailor Shop,2400 Monroe Av,,Rochester,NY,14618,,888-356-8911,E,,Public,24 hours daily,,,1,,,FLO,https://flo.ca/,GPS,43.118929,-77.556073,10/29/2024,152919,2024-10-29 03:33:21,,,,01/23/2020,J1772
ELEC,PFIZER PR EV 09,401 N Middletown Rd,,Pearl River,NY,10965,,888-758-4389,E,,Public,24 hours daily,,,2,,,ChargePoint Network,http://www.chargepoint.com/,GPS,41.076756,-74.018131,10/29/2024,294852,2024-10-29 01:43:57,,,,06/23/2023,J1772
ELEC,TOPS Friendly Markets,"504 1/2, S Franklin St",,Watkins Glen,NY,14891,,607-535-4064,E,,Public - Credit card at all times,24 hours daily,A D Debit M V,,2,,,Non-Networked,,GPS,42.369679,-76.867458,04/14/2024,226518,2024-04-14 22:11:34,P,,,08/25/2022,J1772
ELEC,NEFJ EV 1,1575 Western Ave,Back of building to the left,Albany,NY,12203,,888-758-4389,E,,Public,Mon 9:00am - 6:00pm; Tue 9:00am - 6:00pm; Wed 9:00am - 6:00pm; Thu 9:00am - 6:00pm; Fri 9:00am - 6:00pm; Sat 9:00am - 6:00pm,,,2,,,ChargePoint Network,http://www.chargepoint.com/,GPS,42.685013,-73.847916,10/29/2024,191761,2024-10-29 01:30:28,,,,07/03/2021,J1772
ELEC,Icon Liberty View Parking - Tesla Destination,400 Murray St,,New York,NY,10016,,877-798-3752,E,,Public,,,,3,,,Tesla Destination,https://www.tesla.com/destination-charging,GPS,40.716079,-74.015929,07/01/2024,115121,2024-10-16 16:58:41,P,,,06/13/2017,J1772 TESLA
ELEC,StuyTown 251 Ave C - Garage 5,251 Avenue C,,New York,NY,10010,,813-492-5220,E,,Public,24 hours daily,A ANDROID_PAY APPLE_PAY D M V,,39,,,EVOKE,https://evokesystems.com/,GPS,40.729400,-73.975500,10/11/2024,356976,2024-10-11 18:09:31,P,,,12/12/2022,J1772
ELEC,RRH ST MARYS 1,89 Genesee St,2nd floor on south end of parking garage,Rochester,NY,14611,,888-758-4389,E,,Public,24 hours daily,,,2,,,ChargePoint Network,http://www.chargepoint.com/,GPS,43.149390,-77.636613,10/29/2024,174454,2024-10-29 01:05:13,,,,01/27/2021,J1772
ELEC,Junius Ponds Travel Plaza,NY State Thruway,,Phelps,NY,14532,,888-557-7099,E,,Public,24 Hours Daily,ANDROID_PAY APPLE_PAY CREDIT Debit M V,,,4,,APPLEGREEN,https://www.applegreenelectric.com/,GPS,42.958789,-76.917450,08/15/2024,320693,2024-08-15 19:57:12,P,,,06/12/2023,CHADEMO J1772COMBO TESLA
ELEC,BELMONTEASTVIEW BUILDING 1,136 Bishop McGann Dr,Near main front entrance,Central Islip,NY,11722,,888-758-4389,E,,Public,24 hours daily,,,2,,,ChargePoint Network,http://www.chargepoint.com/,GPS,40.778230,-73.200360,10/29/2024,310926,2024-10-29 02:05:20,,,,09/19/2023,J1772
ELEC,KINGSTON BUILDING SAFETY,5 Garraghan Dr,Near front entrance of Kingston Building Safety Dept.,Kingston,NY,12401,,888-758-4389,E,,Public,24 hours daily,,,2,,,ChargePoint Network,http://www.chargepoint.com/,GPS,41.921490,-73.984795,10/29/2024,167467,2024-10-29 01:21:01,,,,10/10/2020,J1772
ELEC,BA #1 7 AIRPORT PARK,7 Airport Park Blvd,,Latham,NY,12110,,888-758-4389,E,,Public,24 hours daily,,,2,,,ChargePoint Network,http://www.chargepoint.com/,GPS,42.756546,-73.820110,10/29/2024,143433,2024-10-29 01:03:31,,,,08/15/2019,J1772
ELEC,MARKET CENTER 55 RAILROAD 1.3,55 Railroad Pl,Bottom level of parking garage near Price Chopper limited,Saratoga Springs,NY,12866,,888-758-4389,E,,Public,24 hours daily,,,2,,,ChargePoint Network,http://www.chargepoint.com/,GPS,43.082493,-73.787850,10/29/2024,181898,2024-10-29 01:22:20,,,,01/27/2021,J1772
ELEC,Boralex Hydro Operations,39 Hudson Falls Rd,,South Glens Falls,NY,12803,,866-816-7584,E,,Public,24 hours daily,,,2,,,EV Connect,http://evconnect.com/,GPS,43.295544,-73.595620,10/29/2024,230796,2024-10-29 03:08:41,,,,09/30/2022,J1772
ELEC,Kingston Library,61 Crown Street,,Kingston,NY,12401,,1-888-717-4544,E,,Public,24 hours daily,,,2,,,CHARGESMART_EV,https://chargesmartev.com,GPS,41.934233,-74.022229,10/29/2024,360934,2024-10-29 04:09:38,,,,10/29/2024,J1772
ELEC,Carraway,105 Corporate Park Dr,,West Harrison,NY,10604,,813-492-5220,E,,Public,24 hours daily,A ANDROID_PAY APPLE_PAY D M V,,35,,,EVOKE,https://evokesystems.com/,GPS,41.020900,-73.721300,10/11/2024,356888,2024-10-11 18:09:31,P,,,08/03/2021,J1772
ELEC,Vons Garage LLC,5 Spring Ave,,Troy,NY,12180,,949-945-2000,E,,Public,24 hours daily,A ACCOUNT_BALANCE ANDROID_PAY APPLE_PAY CREDIT D M V,,4,,,EVGATEWAY,http://evgateway.com/,200-8,42.718890,-73.682960,05/09/2024,334182,2024-05-09 20:32:20,P,,,12/21/2023,J1772
ELEC,113 East 84th Street,113 East 84th Street,,New York,NY,10028,,1-844-623-1001,E,,Public,24 hours daily,,,4,,,LIVINGSTON,https://www.solution.energy,GPS,40.778660,-73.957390,10/29/2024,334518,2024-10-29 04:06:27,,,,05/02/2024,J1772
ELEC,Stop and Shop 545 - Farmingdale,55 Motor Avenue,,Farmingdale,NY,11735,,888-264-2208,E,,Public,Mon 6:00am - 11:59pm; Tue 6:00am - 11:59pm; Wed 6:00am - 11:59pm; Thu 6:00am - 11:59pm; Fri 6:00am - 11:59pm; Sat 6:00am - 11:59pm; Sun 6:00am - 11:59pm,,,2,,,SHELL_RECHARGE,https://www.shell.us/motorist/electric-vehicle-charging.html,GPS,40.725928,-73.445760,10/29/2024,220208,2024-10-29 02:49:42,,,,05/20/2022,J1772
ELEC,Supercharge Queens,57-77 Rust Street,,Queens,NY,11378,,1-800-636-0986,E,,Public,,,,,2,,CHARGELAB,http://www.chargelab.co/,GPS,40.721240,-73.912564,10/25/2024,360108,2024-10-25 03:57:51,,,,10/17/2024,J1772COMBO
ELEC,LARKIN726RRAMPP EV ONLY 1,726 Exchange St,,Buffalo,NY,14210,,888-758-4389,E,,Public,Mon 5:00pm - 10:00pm; Tue 5:00pm - 10:00pm; Wed 5:00pm - 10:00pm; Thu 5:00pm - 10:00pm; Fri 5:00pm - 10:00pm; Sat 8:00am - 10:00pm; Sun 8:00am - 10:00pm,,,2,,,ChargePoint Network,http://www.chargepoint.com/,GPS,42.874905,-78.849889,10/29/2024,182981,2024-10-29 01:00:02,,,,01/27/2021,J1772
ELEC,1235 Linden Blvd,1235 Linden Blvd,,Brooklyn,NY,11212,,888-356-8911,E,,Public,24 hours daily,,,4,,,FLO,https://flo.ca/,GPS,40.654381,-73.913436,10/29/2024,195668,2024-10-29 03:33:00,,,,09/08/2021,J1772
ELEC,Gramercy Plaza  - Parking Garage,130 East 18th St,,New York,NY,10003,,888-998-2546,E,,Public,24 hours daily,,,2,,,Blink Network,http://www.blinkcharging.com/,GPS,40.736217,-73.986665,10/29/2024,259868,2024-10-29 00:18:41,,,,08/04/2022,J1772
ELEC,STATION TOR1 CRAWFORD PARK S,122 North Ridge St.,"S. parking lot (EV charging rates starting June 1, 2022 $1.75 an hour)",Rye Brook,NY,10573,,888-758-4389,E,,Public,24 hours daily,,,2,,,ChargePoint Network,http://www.chargepoint.com/,GPS,41.015297,-73.685720,10/29/2024,146604,2024-10-29 01:05:54,,,,10/04/2019,J1772
ELEC,St. Charles Hospital,200 Belle Terre Road,,Port Jefferson,NY,11777,,888-998-2546,E,,Public,24 hours daily,,,2,,,Blink Network,http://www.blinkcharging.com/,GPS,40.946780,-73.060857,10/29/2024,350493,2024-10-29 00:18:31,,,,07/11/2024,J1772
ELEC,Gateway Hudson Valley,1 Amy Kay Pkwy,,Kingston,NY,12401,,1-844-623-1001,E,,Public,24 hours daily,,,2,,,LIVINGSTON,https://www.solution.energy,GPS,41.916660,-74.016790,10/29/2024,334479,2024-10-29 04:06:19,,,,05/02/2024,J1772
ELEC,51 W 56th St - Garage,51 W 56th St,,New York,NY,10019,,813-492-5220,E,,Public,24 hours daily,A ANDROID_PAY APPLE_PAY D M V,,4,,,EVOKE,https://evokesystems.com/,GPS,40.763390,-73.975838,10/11/2024,357050,2024-10-11 18:09:31,P,,,08/22/2023,J1772
ELEC,1019 Route 17M Monroe NY - Tesla Destination,1019 NY-17M,,Monroe,NY,10950,,877-798-3752,E,,Public,,,,6,,,Non-Networked,,GPS,41.341834,-74.201939,07/01/2024,359831,2024-10-16 16:58:41,P,,,,J1772
ELEC,HOLYCROSS HOLY CROSS MONA,1615 Rte 9W,small parking lot next to the buildings,West Park,NY,12493,,888-758-4389,E,,Public,24 hours daily,,,2,,,ChargePoint Network,http://www.chargepoint.com/,GPS,41.802999,-73.957188,10/29/2024,201365,2024-10-29 01:33:02,,,,11/19/2021,J1772
ELEC,James Mitsubishi of Greece,3800 West Ridge Road,,Greece,NY,14626,,888-998-2546,E,,Public,24 hours daily,,,1,,,Blink Network,http://www.blinkcharging.com/,GPS,43.214510,-77.728461,10/29/2024,253295,2024-10-29 00:16:31,,,,02/03/2023,J1772
ELEC,Bob Johnson Chevrolet Greece,1271 W Ridge Rd,,Rochester,NY,14615,,1-888-717-4544,E,,Public,24 hours daily,,,1,4,,CHARGESMART_EV,https://chargesmartev.com,GPS,43.203542,-77.661702,10/29/2024,347369,2024-10-29 04:09:28,,,,06/04/2024,J1772 J1772COMBO
ELEC,CENTROTHERM CENTROL F2,427 S Pearl St,,Albany,NY,12202,,888-758-4389,E,,Public,24 hours daily,,,1,,,ChargePoint Network,http://www.chargepoint.com/,GPS,42.637810,-73.758930,10/29/2024,187554,2024-10-29 01:16:02,,,,04/13/2021,J1772
ELEC,Rochester Institute of Technology - Lot M,1 Lomb Memorial Dr,,Rochester,NY,14623,,585-475-5000,E,,Public,24 hours daily; access restricted to students and staff 5am-5pm; parking pass required,,,2,,,Non-Networked,,200-9,43.087790,-77.674413,03/08/2023,75944,2024-01-31 22:07:01,P,,,01/01/2016,J1772
ELEC,LPCL STATION 2,30 Lake Placid Club Way,Behind Registration Building,Lake Placid,NY,12946,,888-758-4389,E,,Public,24 hours daily,,,2,,,ChargePoint Network,http://www.chargepoint.com/,GPS,44.283149,-73.979463,10/29/2024,174120,2024-10-29 01:02:33,,,,01/27/2021,J1772
ELEC,Mechanicville Public Library,190 N Main St.,,Mechanicville,NY,12118,,1-844-623-1001,E,,Public,24 hours daily,,,2,,,LIVINGSTON,https://www.solution.energy,GPS,42.908910,-73.683280,10/29/2024,223270,2024-10-29 04:04:46,,,,02/16/2022,J1772
ELEC,Tops Friendly Market - Tesla Supercharger,16 John J Wagner Way,,Lagrangeville,NY,12540,,877-798-3752,E,,Public,24 hours daily. Please check Tesla's online station map to see if an adapter is required at this location.,A D Debit M V,,,12,,Tesla,https://www.tesla.com/supercharger,GPS,41.668459,-73.794117,07/01/2024,346540,2024-08-14 18:58:22,P,,,05/16/2024,J1772COMBO TESLA
ELEC,Crystal Towers - Upper Garage,20 Old Mamaroneck Road,,White Plains,NY,10605,,888-998-2546,E,,Public,24 hours daily,,,2,,,Blink Network,http://www.blinkcharging.com/,GPS,41.022335,-73.761947,10/29/2024,200441,2024-10-29 00:21:35,,,,11/02/2021,J1772
ELEC,Holiday Inn Hotel & Suites Rochester - Marketplace - Tesla Destination,800 Jefferson Rd,,Rochester,NY,14623,,877-798-3752,E,,Public,,,,3,,,Tesla Destination,https://www.tesla.com/destination-charging,200-8,43.087805,-77.616345,07/01/2024,115226,2024-10-16 16:58:41,P,,,01/17/2018,J1772 TESLA
ELEC,J Russell Group,2524 NY-5,,Stanley,NY,14561,,833-692-6787,E,,Public - Credit card at all times,24 hours daily,A D Debit M V,,2,,,AMPUP,https://ampup.io/,GPS,42.861244,-77.121581,09/14/2023,308425,2024-01-31 22:07:01,P,,,08/31/2023,J1772
ELEC,Holiday Inn Express Cheektowaga NE,83 Anderson Rd,,Cheektowaga,NY,14225,,1-888-717-4544,E,,Public,24 hours daily,,,10,,,CHARGESMART_EV,https://chargesmartev.com,GPS,42.906452,-78.770852,10/29/2024,352947,2024-10-29 04:09:34,,,,08/16/2024,J1772
ELEC,HWS COLLEGES MEDBERY LOT,311 Pulteney St,,Geneva,NY,14456,,888-758-4389,E,,Public,24 hours daily,,,2,,,ChargePoint Network,http://www.chargepoint.com/,GPS,42.860090,-76.984375,10/29/2024,170029,2024-10-29 00:53:01,,,,12/10/2020,J1772
ELEC,EAST SYR CAMPUS TR19 WEST,6304 Carrier Pkwy,TR19,East Syracuse,NY,13057,,888-758-4389,E,,Public,24 hours daily,,,2,,,ChargePoint Network,http://www.chargepoint.com/,GPS,43.083319,-76.084711,10/29/2024,250568,2024-10-29 01:54:41,,,,01/12/2023,J1772
ELEC,Rapidpark 254 W 79th Street - Tesla Destination,254 W 79th St,,New York,NY,10024,,877-798-3752,E,,Public,,,,3,,,Tesla Destination,https://www.tesla.com/destination-charging,200-8,40.784110,-73.980641,07/01/2024,115072,2024-10-16 16:58:41,P,,,06/13/2017,J1772 TESLA
ELEC,MONROE COUNTY WEBSTER S1,1105 Lake Rd Webster Park,Southwest Area of Parking Lot at SW corner of Lake Road and Holt Road,Webster,NY,14580,,888-758-4389,E,,Public,24 hours daily,,,2,,,ChargePoint Network,http://www.chargepoint.com/,GPS,43.259656,-77.448204,10/29/2024,327571,2024-10-29 02:14:41,,,,02/06/2024,J1772
ELEC,Rosegate Apartments,11 Maxwell Drive,,Clifton Park,NY,12065,,1-844-623-1001,E,,Public,24 hours daily,,,4,,,LIVINGSTON,https://www.solution.energy,GPS,42.868420,-73.782820,10/29/2024,191112,2024-10-29 04:04:37,,,,11/08/2021,J1772
ELEC,Johnson Park Green Living - Johnson Park Green Living,6 Johnson Park,,Utica,NY,13501,,813-492-5220,E,,Public,24 hours daily,A ANDROID_PAY APPLE_PAY D M V,,2,,,EVOKE,https://evokesystems.com/,GPS,43.092197,-75.236598,10/11/2024,357071,2024-10-11 18:09:31,P,,,05/02/2024,J1772
ELEC,Sanford Plaza Apartments,14454 Sanford Ave,,Flushing,NY,11355,,1-800-636-0986,E,,Public,,,,4,,,CHARGELAB,http://www.chargelab.co/,GPS,40.759243,-73.818509,10/25/2024,360689,2024-10-25 03:58:40,,,,10/24/2024,J1772
ELEC,Audi New Rochelle,2 Harrison st,,New Rochelle,NY,10802,,888-998-2546,E,,Public,24 hours daily,,,2,,,Blink Network,http://www.blinkcharging.com/,GPS,40.912149,-73.778915,10/29/2024,262576,2024-10-29 00:13:16,,,,04/11/2022,J1772
ELEC,Regeneron Troy,1 Global View,,Troy,NY,12180,,833-692-6787,E,,Public - Credit card at all times,24 hours daily,A ANDROID_PAY APPLE_PAY CREDIT D M,,8,,,AMPUP,https://ampup.io/,200-9,42.682259,-73.704710,03/08/2023,230714,2024-01-31 22:07:01,P,,,09/15/2022,J1772
ELEC,TOK EVSE TOWN OF KINDERH,3211 Church St,,Valatie,NY,12184,,888-758-4389,E,,Public,24 hours daily,,,2,,,ChargePoint Network,http://www.chargepoint.com/,GPS,42.415531,-73.676855,10/29/2024,162133,2024-10-29 00:59:27,,,,06/12/2020,J1772
ELEC,U OF R GOERGEN CENTER,730 Library Rd,At service entrance on Library Rd.,Rochester,NY,14627,,888-758-4389,E,,Public,24 hours daily,,,2,,,ChargePoint Network,http://www.chargepoint.com/,GPS,43.129952,-77.629051,10/29/2024,162266,2024-10-29 00:54:29,,,,06/12/2020,J1772
ELEC,STONELEIGH CHARGEPOINT1,76 Stoneleigh Plaza,Available to public at $0.75 per kWh,Bronxville,NY,10708,,888-758-4389,E,,Public,24 hours daily,,,2,,,ChargePoint Network,http://www.chargepoint.com/,GPS,40.943350,-73.836205,10/29/2024,235768,2024-10-29 01:31:37,,,,11/06/2022,J1772
ELEC,THERMAL QUICK AG EV1,11 Sitterly Rd,Pull in on the right.,Clifton Park,NY,12065,,888-758-4389,E,,Public,24 hours daily,,,2,,,ChargePoint Network,http://www.chargepoint.com/,GPS,42.850567,-73.757180,10/29/2024,181636,2024-10-29 01:15:42,,,,01/27/2021,J1772
ELEC,194-20 Fresh Meadows,194-20 64th Ave,,,NY,11365,,1-888-222-6618,E,,Public,,,,10,,,NOODOE,https://www.noodoe.com,GPS,40.740396,-73.779427,10/29/2024,355687,2024-10-29 03:59:00,,,,09/13/2024,J1772
ELEC,The Garrison and Highlands Country Club - Tesla Destination,1 Snakehill Rd,,Garrison,NY,10524,,877-798-3752,E,,Public,,,,2,,,Tesla Destination,https://www.tesla.com/destination-charging,200-8,41.385216,-73.916711,07/01/2024,114945,2024-10-16 16:58:41,P,,,08/04/2016,TESLA
ELEC,Tower Willows at Cornwall,52 Willow Ave,,Cornwall,NY,12518,,1-844-623-1001,E,,Public,24 hours daily,,,4,,,LIVINGSTON,https://www.solution.energy,GPS,41.438410,-74.035070,10/29/2024,324880,2024-10-29 04:04:52,,,,04/27/2023,J1772
ELEC,iPark 1510 Lex Garage Corp. - Tesla Destination,116 E 98th St,,New York,NY,10029,,877-798-3752,E,,Public,,,,3,,,Tesla Destination,https://www.tesla.com/destination-charging,200-9,40.787402,-73.950546,07/01/2024,115003,2024-10-16 16:58:41,P,,,02/06/2017,TESLA
ELEC,TOYOTA ELMIRA CT4020-1,1074 County Road 64,,Elmira,NY,14903,,888-758-4389,E,,Public,24 hours daily,,,2,,,ChargePoint Network,http://www.chargepoint.com/,GPS,42.157911,-76.861924,10/29/2024,213097,2024-10-29 01:41:24,,,,03/31/2022,J1772
ELEC,Town of Cortlandt - Town Hall Parking Lot,1 Heady St.,,Cortlandt Manor,NY,10567,,888-356-8911,E,,Public,24 hours daily,,,4,,,FLO,https://flo.ca/,GPS,41.310056,-73.904250,10/29/2024,346178,2024-10-29 03:34:29,,,,05/14/2024,J1772
ELEC,East Greenbush Motor Vehicles,225 Columbia Tpke,,Rensselaer,NY,12144,,844-798-2438,E,,Public - Credit card at all times,24 hours daily,A D Debit M V,,2,,,SWTCH,https://swtchenergy.com/,GPS,42.617214,-73.731457,05/03/2023,257688,2024-01-31 22:07:01,P,,,03/30/2023,J1772
ELEC,Great Swamp Conservancy,8375 N Main St,,Canastota,NY,13032,,888-363-7662,E,,Public - Credit card at all times,24 hours daily,A D Debit M V,,6,,,Non-Networked,,GPS,43.119547,-75.788745,04/14/2024,227080,2024-04-14 22:11:34,P,,,08/26/2022,J1772
ELEC,ROCHESTER NY COURT ST 1,194 Court St,Level 1 Adjacent to entrance on right side,Rochester,NY,14604,,888-758-4389,E,,Public,24 hours daily,,,2,,,ChargePoint Network,http://www.chargepoint.com/,GPS,43.154074,-77.606985,10/29/2024,171691,2024-10-29 01:06:11,,,,01/27/2021,J1772
ELEC,Della Mitsubishi,7 Della Drive,,Plattsburgh,NY,12901,,888-998-2546,E,,Public,24 hours daily,,,1,,,Blink Network,http://www.blinkcharging.com/,GPS,44.695991,-73.516784,10/29/2024,312243,2024-10-29 00:22:09,,,,10/04/2023,J1772
ELEC,Woodlawn Branch Library,2 Sanford St.,,Schenectady,NY,12304,,1-844-623-1001,E,,Public,24 hours daily,,,4,,,LIVINGSTON,https://www.solution.energy,GPS,42.779920,-73.904690,10/29/2024,223249,2024-10-29 04:04:31,,,,03/03/2022,J1772
ELEC,The Woods Inn,148 NY-28,,Inlet,NY,13360,,844-798-2438,E,,Public - Credit card at all times,24 hours daily,A D Debit M V,,2,,,SWTCH,https://swtchenergy.com/,GPS,43.753421,-74.795691,05/03/2023,211922,2024-01-31 22:07:01,P,,,03/17/2022,J1772
ELEC,Maguire Chevrolet,35 Cinema Dr,,Ithaca,NY,14850,,607-272-9292,E,,Public - Call ahead,Dealership business hours,,,2,1,,Non-Networked,,GPS,42.480929,-76.477605,03/14/2024,117739,2024-03-14 18:02:10,P,,,01/01/2019,J1772 J1772COMBO
ELEC,Enterprise Parking 219 E 69th St - Tesla Destination,219 E 69th St,,New York,NY,10065,,877-798-3752,E,,Public,,,,3,,,Tesla Destination,https://www.tesla.com/destination-charging,200-9,40.767342,-73.960835,07/01/2024,168757,2024-10-16 16:58:41,P,,,12/09/2016,J1772 TESLA
ELEC,Cherry Street Parking Ramp,15 West 5th Street,,Jamestown,NY,14701,,866-816-7584,E,,Public,24 hours daily,,,2,,,EV Connect,http://evconnect.com/,GPS,42.097747,-79.243142,10/29/2024,94845,2024-10-29 03:08:49,,,,07/22/2015,J1772
ELEC,Levittown Ford Service Department,3195 Hempstead Turnpike,,Levittown,NY,11756,,888-998-2546,E,,Public,24 hours daily,,,2,,,Blink Network,http://www.blinkcharging.com/,GPS,40.726421,-73.517905,10/29/2024,321009,2024-10-29 00:10:00,,,,09/01/2023,J1772
ELEC,BURNS MGT HV 5,222 Heritage Rd,,Guilderland,NY,12203,,888-758-4389,E,,Public,24 hours daily,,,2,,,ChargePoint Network,http://www.chargepoint.com/,GPS,42.692405,-73.885424,10/29/2024,121688,2024-10-29 00:59:57,,,,04/25/2019,J1772
ELEC,BRYANT SCHOOL #1,107 E Avenue Extension,Back Parking Lot of Apartment Building,Hornell,NY,14843,,888-758-4389,E,,Public,24 hours daily,,,2,,,ChargePoint Network,http://www.chargepoint.com/,GPS,42.319230,-77.650432,10/29/2024,313787,2024-10-29 02:09:32,,,,10/17/2023,J1772
ELEC,1ST FLOOR UNIT HYUNDAI DCFC #1,125 East Main Street,,New Rochelle,NY,10801,,888-758-4389,E,,Public,24 hours daily,,,,1,,ChargePoint Network,http://www.chargepoint.com/,GPS,40.918033,-73.768438,10/29/2024,325489,2024-10-29 02:13:28,,,,01/17/2024,CHADEMO J1772COMBO
ELEC,Apple Honda,1375 Old Country Road,,Riverhead,NY,11901,,888-998-2546,E,,Public,24 hours daily,,,2,,,Blink Network,http://www.blinkcharging.com/,GPS,40.927544,-72.686350,10/29/2024,335655,2024-10-29 00:17:25,,,,05/06/2024,J1772
ELEC,Turner Parking Ramp,1 Perkins Dr.,,Buffalo,NY,14202,,866-816-7584,E,,Public,24 hours daily,,,8,,,EV Connect,http://evconnect.com/,GPS,42.885850,-78.879561,10/29/2024,104729,2024-10-29 03:08:46,,,,04/01/2018,J1772
ELEC,LKT WEST 3,575 Boices Ln,West Entrance,Kingston,NY,12401,,888-758-4389,E,,Public,24 hours daily,,,2,,,ChargePoint Network,http://www.chargepoint.com/,GPS,41.967917,-74.003872,10/29/2024,235439,2024-10-29 01:51:16,,,,10/29/2022,J1772
ELEC,OLYMPIC SPORTS SPORTS 7,Bob Run Rd,,Lake Placid,NY,12946,,888-758-4389,E,,Public,24 hours daily,,,2,,,ChargePoint Network,http://www.chargepoint.com/,GPS,44.220506,-73.923843,10/29/2024,182113,2024-10-29 01:23:59,,,,01/27/2021,J1772
ELEC,Icon Parking 111 8th Ave Parking - Tesla Destination,385 W 15th St,,New York,NY,10011,,877-798-3752,E,,Public,,,,4,,,Tesla Destination,https://www.tesla.com/destination-charging,200-8,40.741515,-74.004608,07/01/2024,115114,2024-10-16 16:58:41,P,,,01/24/2017,TESLA
ELEC,210 HANCOCK STATION 1,423 1st St,,Ithaca,NY,14850,,888-758-4389,E,,Public,24 hours daily,,,2,,,ChargePoint Network,http://www.chargepoint.com/,GPS,42.448275,-76.503354,10/29/2024,162304,2024-10-29 00:52:19,,,,06/12/2020,J1772
ELEC,HARMONY MILLS 1 WEST 1 1.2,Mohawk St & Cohoes Mills,,Cohoes,NY,12047,,888-758-4389,E,,Public,24 hours daily,,,2,,,ChargePoint Network,http://www.chargepoint.com/,GPS,42.781580,-73.705696,10/29/2024,149627,2024-10-29 01:07:51,,,,11/28/2019,J1772
ELEC,Hudson Square,1000 Hudson Square,,Cohoes,NY,12047,,1-844-623-1001,E,,Public,24 hours daily,,,4,,,LIVINGSTON,https://www.solution.energy,GPS,42.766840,-73.687260,10/29/2024,189522,2024-10-29 04:04:44,,,,12/16/2020,J1772
ELEC,YAPHANK RETAIL CENTER,410 Princeton Rd,,Yaphank,NY,11980,,888-758-4389,E,,Public,24 hours daily,,,2,,,ChargePoint Network,http://www.chargepoint.com/,GPS,40.846910,-72.897800,10/29/2024,311521,2024-10-29 01:57:03,,,,09/24/2023,J1772
ELEC,57ALEXANDER SPACE 256,57 Alexander Street,,Yonkers,NY,10701,,888-758-4389,E,,Public,24 hours daily,,,1,,,ChargePoint Network,http://www.chargepoint.com/,GPS,40.939100,-73.901910,10/29/2024,349473,2024-10-29 02:10:10,,,,06/27/2024,J1772
ELEC,Tetta's Market,2082 County Road 3,,Olivebridge,NY,12461,,888-998-2546,E,,Public,24 hours daily,,,2,,,Blink Network,http://www.blinkcharging.com/,GPS,41.892718,-74.287032,10/29/2024,320783,2024-10-29 00:07:03,,,,11/25/2023,J1772
ELEC,Rotterdam Mall,93 W Campbell Rd,,Schenectady,NY,12306,,1-844-623-1001,E,,Public,24 hours daily,,,10,,,LIVINGSTON,https://www.solution.energy,GPS,42.809410,-73.988850,10/29/2024,189531,2024-10-29 04:05:29,,,,07/08/2022,J1772
ELEC,REGENERON 17-JB-G3-02,Tempel Ln,,East Greenbush,NY,12061,,888-758-4389,E,,Public,24 hours daily,,,2,,,ChargePoint Network,http://www.chargepoint.com/,GPS,42.637296,-73.711975,10/29/2024,347263,2024-10-29 02:19:16,,,,06/01/2024,J1772
ELEC,WATERVLIET PARK 3,28 Selke Dr,On the right,Watervliet,NY,12189,,888-758-4389,E,,Public,24 hours daily,,,2,,,ChargePoint Network,http://www.chargepoint.com/,GPS,42.729649,-73.698620,10/29/2024,202126,2024-10-29 01:32:52,,,,12/08/2021,J1772
ELEC,Aviation Mall - Tesla Supercharger,578 Aviation Road,,Queensbury,NY,12804,,877-798-3752,E,,Public,24 hours daily. Please check Tesla's online station map to see if an adapter is required at this location.,,,,8,,Tesla,https://www.tesla.com/supercharger,200-8,43.328388,-73.679992,07/01/2024,102342,2024-08-14 18:58:22,P,,,07/15/2016,TESLA
ELEC,CITY AMSTERDAM P&RB EV 4,201 Locust Ave Park and Recreation Building,Park and Recreation Parking EV 4,Amsterdam,NY,12010,,888-758-4389,E,,Public,24 hours daily,,,2,,,ChargePoint Network,http://www.chargepoint.com/,GPS,42.948395,-74.179050,10/29/2024,188108,2024-10-29 01:27:55,,,,04/29/2021,J1772
ELEC,Hampton Inn and Suites,7637 NY-96,,Victor,NY,14564,,1-844-623-1001,E,,Public,24 hours daily,,,4,,,LIVINGSTON,https://www.solution.energy,GPS,43.022070,-77.441140,10/29/2024,324818,2024-10-29 04:06:07,,,,04/18/2023,J1772
ELEC,Saratoga National Bank,171 S Broadway,,Saratoga Springs,NY,12866,,1-844-623-1001,E,,Public,24 hours daily,,,4,,,LIVINGSTON,https://www.solution.energy,GPS,43.072110,-73.788410,10/29/2024,236646,2024-10-29 04:04:36,,,,10/28/2022,J1772
ELEC,Stevens Manor West,644 Silver Lake-Scotchtown Road,,Middletown,NY,10941,,1-844-623-1001,E,,Public,24 hours daily,,,8,,,LIVINGSTON,https://www.solution.energy,GPS,41.476280,-74.379570,10/29/2024,334530,2024-10-29 04:06:22,,,,05/02/2024,J1772
ELEC,U.S.B.STATION#1 U.S.B STATION#3,180 Schwenk Dr,,Kingston,NY,12401,,888-758-4389,E,,Public,24 hours daily,,,2,,,ChargePoint Network,http://www.chargepoint.com/,GPS,41.936927,-74.024779,10/29/2024,193448,2024-10-29 01:31:44,,,,08/03/2021,J1772
ELEC,Niagara Falls International Airport,2035 Niagara Falls Blvd,Located in parking lot 1 in front of the terminal,Niagara Falls,NY,14304,,716-855-7300,E,,Public,24 hours daily,,,2,,,Non-Networked,,200-9,43.101378,-78.941072,09/14/2023,63478,2024-01-31 22:07:01,P,,,09/19/2014,J1772
ELEC,GGMC Parking Battery Place - Tesla Destination,50 Battery Pl,,New York,NY,10280,,877-798-3752,E,,Public,,,,3,,,Tesla Destination,https://www.tesla.com/destination-charging,200-9,40.706965,-74.017971,07/01/2024,115143,2024-10-16 16:58:41,P,,,02/22/2018,J1772 TESLA
ELEC,HOTEL INN AT THE FALL,50 Red Oaks Mill Rd,In rear lot,Poughkeepsie,NY,12603,,888-758-4389,E,,Public,24 hours daily,,,2,,,ChargePoint Network,http://www.chargepoint.com/,GPS,41.654736,-73.870968,10/29/2024,162326,2024-10-29 00:51:27,,,,06/12/2020,J1772
ELEC,MONTANTE SOLAR STATION 3,1277 Delaware Ave,Parking Garage / Ground Floor,Buffalo,NY,14209,,888-758-4389,E,,Public,24 hours daily,,,2,,,ChargePoint Network,http://www.chargepoint.com/,GPS,42.918320,-78.867070,10/29/2024,217200,2024-10-29 01:43:01,,,,05/08/2022,J1772
ELEC,DENNY’S / RED ROOF INN,100 Marginal Rd.,,Herkimer,NY,13350,,833-632-2778,E,,Public,24 hours daily,,,,4,,Electrify America,https://www.electrifyamerica.com/,GPS,43.018810,-74.991880,10/29/2024,170367,2024-10-29 02:56:37,,,,12/18/2020,CHADEMO J1772COMBO
ELEC,57ALEXANDER SPACE 56,57 Alexander St,,Yonkers,NY,10701,,888-758-4389,E,,Public,24 hours daily,,,1,,,ChargePoint Network,http://www.chargepoint.com/,GPS,40.939187,-73.901933,10/29/2024,349460,2024-10-29 02:08:42,,,,06/27/2024,J1772
ELEC,Salamanca City Hall,225 Wildwood Ave,,Salamanca,NY,14779,,716-945-4620,E,,Public,24 hours daily,,,1,,,Non-Networked,,GPS,42.157913,-78.708146,03/14/2024,157959,2024-03-14 18:02:10,P,,,05/15/2020,J1772
ELEC,Clemson Bros Brewery - Tesla Destination,22 Cottage St,,Middletown,NY,10940,,877-798-3752,E,,Public,,,,3,,,Tesla Destination,https://www.tesla.com/destination-charging,200-9,41.447217,-74.415744,07/01/2024,114975,2024-10-16 16:58:41,P,,,07/18/2018,TESLA
ELEC,HARBOR HOUSE HOC 8,3 Davenport Avenue,Spots 25 and 26,New Rochelle,NY,10805,,888-758-4389,E,,Public,24 hours daily,,,2,,,ChargePoint Network,http://www.chargepoint.com/,GPS,40.905896,-73.773536,10/29/2024,303843,2024-10-29 02:05:44,,,,08/01/2023,J1772
ELEC,Home2 Suites by Hilton Oswego - Tesla Destination,252 NY-104,,Oswego,NY,13126,,877-798-3752,E,,Public,,,,3,,,Tesla Destination,https://www.tesla.com/destination-charging,GPS,43.460210,-76.482239,07/01/2024,115206,2024-10-16 16:58:41,P,,,05/17/2018,J1772 TESLA
ELEC,STPETERHOSPITAL EV STATION #7,315 S Manning Blvd,,Albany,NY,12208,,888-758-4389,E,,Public,24 hours daily,,,2,,,ChargePoint Network,http://www.chargepoint.com/,GPS,42.654755,-73.802514,10/29/2024,212982,2024-10-29 01:40:48,,,,03/27/2022,J1772
ELEC,MILTON NY P&R EV5,503 Geyser Rd,Station 5,Ballston Spa,NY,12020,,888-758-4389,E,,Public,24 hours daily,,,2,,,ChargePoint Network,http://www.chargepoint.com/,GPS,43.044648,-73.853468,10/29/2024,323479,2024-10-29 01:59:26,,,,12/26/2023,J1772
ELEC,OLYMPIC SPORTS SPORTS 2,Bob Run Rd,,Lake Placid,NY,12946,,888-758-4389,E,,Public,24 hours daily,,,2,,,ChargePoint Network,http://www.chargepoint.com/,GPS,44.220392,-73.923811,10/29/2024,182107,2024-10-29 01:24:00,,,,01/27/2021,J1772
ELEC,TRADITION CBG TRADITION CHVY2,808 W Union St,West Parking Lot near Building #2,Newark,NY,14513,,888-758-4389,E,,Public,24 hours daily,,,,1,,ChargePoint Network,http://www.chargepoint.com/,GPS,43.047283,-77.114858,10/29/2024,224512,2024-10-29 01:45:56,,,,07/28/2022,CHADEMO J1772COMBO
ELEC,UHS WMC UNITED HEALTH,40 Arch St,,Johnson City,NY,13790,,888-758-4389,E,,Public,24 hours daily,,,2,,,ChargePoint Network,http://www.chargepoint.com/,GPS,42.114000,-75.957310,10/29/2024,195825,2024-10-29 01:24:59,,,,09/11/2021,J1772
ELEC,Town of Westport,34 State Rt. 9N,,Westport,NY,12993,,1-844-623-1001,E,,Public,24 hours daily,,,,2,,LIVINGSTON,https://www.solution.energy,GPS,44.181880,-73.432560,10/29/2024,334460,2024-10-29 04:04:57,,,,05/02/2024,J1772COMBO
ELEC,TOWNE TV EV 1,3125-3133 Carman Rd,Front Parking Lot EV 1,Schenectady,NY,12303,,888-758-4389,E,,Public,24 hours daily,,,2,,,ChargePoint Network,http://www.chargepoint.com/,GPS,42.762775,-73.940010,10/29/2024,192933,2024-10-29 01:30:50,,,,07/17/2021,J1772
ELEC,652 Albany Shaker Rd,652 Albany Shaker Rd,,Albany,NY,12211,,1-844-623-1001,E,,Public,24 hours daily,,,2,,,LIVINGSTON,https://www.solution.energy,GPS,42.725870,-73.793670,10/29/2024,225125,2024-10-29 04:04:49,,,,06/30/2022,J1772
ELEC,CITY OF ALBANY SWINBURNE P. 1,Swinburne Park 809 Clinton Avenue,,Albany,NY,12206,,888-758-4389,E,,Public,24 hours daily,,,2,,,ChargePoint Network,http://www.chargepoint.com/,GPS,42.671187,-73.775727,10/29/2024,262444,2024-10-29 01:31:38,,,,06/09/2023,J1772
ELEC,ULSTER COUNTY POOL,214 Libertyville Rd,"Ulster County's fee for public charging is $0.50 per hour, effective 1-1-2020.",New Paltz,NY,12561,,888-758-4389,E,,Public,24 hours daily,,,2,,,ChargePoint Network,http://www.chargepoint.com/,GPS,41.723953,-74.117600,10/29/2024,147504,2024-10-29 01:07:47,,,,11/05/2019,J1772
ELEC,Central Avenue Nissan,1919 Central Park Ave,,Yonkers,NY,10710,,,E,,Public - Call ahead,Dealership business hours; Nissan use only; contact 914-961-3900 for more information,,,1,1,,Non-Networked,,GPS,40.964447,-73.840117,02/12/2024,49678,2024-02-12 15:25:05,P,,,04/05/2016,CHADEMO J1772
ELEC,HIGHWAY DEPT STATION 2,409 Bockes Rd,Near main entrance,Porter Corners,NY,12859,,888-758-4389,E,,Public,24 hours daily,,,2,,,ChargePoint Network,http://www.chargepoint.com/,GPS,43.145451,-73.881645,10/29/2024,262925,2024-10-29 02:04:30,,,,06/20/2023,J1772
ELEC,TOWN OF CHESTER SUGARLOAFPACEV1,231 Creamery Pond Rd,,Chester,NY,10918,,888-758-4389,E,,Public,24 hours daily,,,2,,,ChargePoint Network,http://www.chargepoint.com/,GPS,41.316238,-74.289177,10/29/2024,253844,2024-10-29 01:51:41,,,,02/10/2023,J1772
ELEC,Skyline Tower Garage,23-15 44th Rd,,Queens,NY,11101,,718-551-2483,E,,Public - Call ahead,24 hours daily,A ANDROID_PAY APPLE_PAY Cash CREDIT D Debit M V,,4,,,Non-Networked,,200-8,40.748480,-73.944500,08/15/2024,348990,2024-09-03 20:55:50,P,,,04/25/2024,J1772
ELEC,MAIN 2ND FLOOR 2 NGW,1133 414 Parking Garage,"2nd floor of parking garage, at front wall, near casino entrance",Tyre,NY,13165,,888-758-4389,E,,Public,24 hours daily,,,2,,,ChargePoint Network,http://www.chargepoint.com/,GPS,42.970877,-76.843774,10/29/2024,180149,2024-10-29 00:45:43,,,,01/27/2021,J1772
ELEC,Montauk Yacht Club Resort & Marina - Tesla Destination,32 Star Island Rd,,Montauk,NY,11954,,877-798-3752,E,,Public,,,,2,,,Tesla Destination,https://www.tesla.com/destination-charging,200-9,41.068775,-71.933361,07/01/2024,114980,2024-10-16 16:58:41,P,,,06/27/2014,TESLA
ELEC,BRT STATION 1,6401 6th Ave,,Sunset Park,NY,11220,,888-758-4389,E,,Public,24 hours daily,,,2,,,ChargePoint Network,http://www.chargepoint.com/,GPS,40.635570,-74.016280,10/29/2024,220960,2024-10-29 01:43:54,,,,06/08/2022,J1772
ELEC,TICONDEROGA TOWER AVE,1494 Mccormick St,,Ticonderoga,NY,12883,,888-758-4389,E,,Public,24 hours daily,,,2,,,ChargePoint Network,http://www.chargepoint.com/,GPS,43.849277,-73.422200,10/29/2024,154560,2024-10-29 01:13:23,,,,03/19/2020,J1772
ELEC,Philmont Village Library,101 Main St,,Philmont,NY,12565,,833-692-6787,E,,Public - Credit card at all times,Contact station for hours of availability.,A ANDROID_PAY APPLE_PAY CREDIT D M,,2,,,AMPUP,https://ampup.io/,200-8,42.247558,-73.652490,10/11/2022,230219,2023-02-14 15:54:11,P,,,09/15/2022,J1772
ELEC,Highrise Parking,210 W 71st Street,,New York,NY,10023,,888-998-2546,E,,Public,24 hours daily,,,1,,,Blink Network,http://www.blinkcharging.com/,GPS,40.777905,-73.982299,10/29/2024,257528,2024-10-29 00:21:36,,,,10/17/2022,J1772
ELEC,Harvest Inn Hotel - Tesla Destination,95 Boniface Dr,,Pine Bush,NY,12566,,877-798-3752,E,,Public,,,,6,,,Non-Networked,,GPS,41.601012,-74.299097,07/01/2024,358828,2024-10-16 16:58:41,P,,,,J1772
ELEC,NATIONAL GRID DIEFENDORF HALL,Diefendorf Loop,In parking lot of Diefendorf Hall,Buffalo,NY,14215,,888-758-4389,E,,Public,24 hours daily,,,2,,,ChargePoint Network,http://www.chargepoint.com/,GPS,42.952295,-78.817859,10/29/2024,162373,2024-10-29 00:48:37,,,,06/12/2020,J1772
ELEC,Dimension Fabricators,2000 7th Street,,Scotia,NY,12302,,866-816-7584,E,,Public,24 hours daily,,,4,,,EV Connect,http://evconnect.com/,GPS,42.842358,-73.995330,10/29/2024,166331,2024-10-29 03:09:17,,,,05/12/2020,J1772
ELEC,Bliss Construction,6770 Main Street,,Williamsville,NY,14221,,888-998-2546,E,,Public,24 hours daily,,,2,,,Blink Network,http://www.blinkcharging.com/,GPS,42.965953,-78.700984,10/29/2024,197546,2024-10-29 00:11:52,,,,10/08/2021,J1772
ELEC,WCS NS1 SOUTHERN,2300 Southern Blvd,,Bronx,NY,10460,,888-758-4389,E,,Public,24 hours daily,,,2,,,ChargePoint Network,http://www.chargepoint.com/,GPS,40.850625,-73.881132,10/29/2024,162156,2024-10-29 00:57:25,,,,06/12/2020,J1772
ELEC,VILLAGE WALDEN STATION 1,Municipal parking lot,,Walden,NY,12586,,888-758-4389,E,,Public,24 hours daily,,,2,,,ChargePoint Network,http://www.chargepoint.com/,GPS,41.560337,-74.188909,10/29/2024,331510,2024-10-29 02:16:43,,,,04/02/2024,J1772
ELEC,The Shops at Atlas Park - Tesla Supercharger,8000 Cooper Avenue,,Glendale,NY,11385,,877-798-3752,E,,Public,24 hours daily. Please check Tesla's online station map to see if an adapter is required at this location.,,,,10,,Tesla,https://www.tesla.com/supercharger,200-9,40.707998,-73.866983,07/01/2024,149312,2024-08-14 18:58:22,P,,,09/30/2019,TESLA
ELEC,ARMORY EV ARMORYCJDR EVC2,960 Central Avenue,on west side of building,Albany,NY,12205,,888-758-4389,E,,Public,Mon 6:00am - 7:00pm; Tue 6:00am - 7:00pm; Wed 6:00am - 7:00pm; Thu 6:00am - 7:00pm; Fri 6:00am - 7:00pm; Sat 6:00am - 7:00pm,,,2,,,ChargePoint Network,http://www.chargepoint.com/,GPS,42.682384,-73.794020,10/29/2024,350143,2024-10-29 02:14:50,,,,07/09/2024,J1772
ELEC,Koffman Southern Tier Incubator,120 Hawley St,,Binghamton,NY,13901,,1-888-717-4544,E,,Public,24 hours daily,,,8,,,CHARGESMART_EV,https://chargesmartev.com,GPS,42.097741,-75.907335,10/29/2024,333899,2024-10-29 04:09:20,,,,12/20/2022,J1772
ELEC,"Walgreens - Brooklyn, NY #15097",589 Prospect Avenue,,Brooklyn,NY,11215,,800-663-5633,E,,Public,24 hours daily,,,1,,,Blink Network,http://www.blinkcharging.com/,GPS,40.656780,-73.977760,10/29/2024,194845,2024-10-29 00:07:26,,,,08/04/2017,J1772
ELEC,IKEA USA BROOKLYN 4,1 Beard St,,Red Hook,NY,11231,,888-758-4389,E,,Public,24 hours daily,,,1,,,ChargePoint Network,http://www.chargepoint.com/,GPS,40.671404,-74.011655,10/29/2024,252887,2024-10-29 01:40:54,,,,02/01/2023,J1772
ELEC,Broadway Commons Showcase Cinema,358 N. Broadway Commons,,Hicksville,NY,11801,,888-264-2208,E,,Public,Mon 6:00am - 11:59pm; Tue 6:00am - 11:59pm; Wed 6:00am - 11:59pm; Thu 6:00am - 11:59pm; Fri 6:00am - 11:59pm; Sat 6:00am - 11:59pm; Sun 6:00am - 11:59pm,,,2,,,SHELL_RECHARGE,https://www.shell.us/motorist/electric-vehicle-charging.html,GPS,40.773399,-73.533195,10/29/2024,152208,2024-10-29 02:48:31,,,,01/20/2020,J1772
ELEC,GGMC Parking 350 W 43rd Street Garage - Tesla Destination,350 West 43rd St,,New York,NY,10036,,877-798-3752,E,,Public,,,,3,,,Tesla Destination,https://www.tesla.com/destination-charging,200-9,40.758586,-73.991341,07/01/2024,115109,2024-10-16 16:58:41,P,,,01/21/2016,J1772 TESLA
ELEC,CHARGEPOINT_NEW PE,1400 Washington Ave,PE Lot,Albany,NY,12222,,888-758-4389,E,,Public,24 hours daily,,,2,,,ChargePoint Network,http://www.chargepoint.com/,GPS,42.683368,-73.828487,10/29/2024,308051,2024-10-29 02:07:33,,,,08/29/2023,J1772
ELEC,"Mirbeau Inn & Spa, Skaneateles - Tesla Destination",851 Genesee Street Rd,,Skaneateles,NY,13152,,877-798-3752,E,,Public,,,,3,,,Tesla Destination,https://www.tesla.com/destination-charging,200-9,42.945065,-76.442674,07/01/2024,115238,2024-10-16 16:58:41,P,,,05/26/2015,J1772 TESLA
ELEC,VOEASTROCHESTER EDMUND LYON PAR,700 Main Street,Edmund Lyon Park Parking Lot,East Rochester,NY,14445,,888-758-4389,E,,Public,24 hours daily,,,2,,,ChargePoint Network,http://www.chargepoint.com/,GPS,43.108936,-77.486534,10/29/2024,223419,2024-10-29 01:45:28,,,,07/13/2022,J1772
ELEC,Bear Metal Works,39 Scoville Avenue,,Buffalo,NY,14206,,866-816-7584,E,,Public,24 hours daily,,,4,,,EV Connect,http://evconnect.com/,GPS,42.873786,-78.827735,10/29/2024,155026,2024-10-29 03:09:04,,,,08/08/2019,J1772
ELEC,RPI 1 B-LOT,71 Albright Ct,,Troy,NY,12180,,888-758-4389,E,,Public,24 hours daily,,,2,,,ChargePoint Network,http://www.chargepoint.com/,GPS,42.731358,-73.669075,10/29/2024,143578,2024-10-29 01:01:14,,,,08/15/2019,J1772
ELEC,1-4 STATION 4,103 Broad St,Rear parking lot,Waterford,NY,12188,,888-758-4389,E,,Public,24 hours daily,,,2,,,ChargePoint Network,http://www.chargepoint.com/,GPS,42.791046,-73.679800,10/29/2024,238517,2024-10-29 01:53:04,,,,12/21/2022,J1772
ELEC,American Homes Syracuse,8765 Brewerton Rd,,Clay,NY,13029,,1-844-623-1001,E,,Public,24 hours daily,,,6,,,LIVINGSTON,https://www.solution.energy,GPS,43.194610,-76.126700,10/29/2024,189505,2024-10-29 04:06:10,,,,10/22/2020,J1772
ELEC,1 PAC Way,1 PAC Way,,Lancaster,NY,14086,,866-816-7584,E,,Public,24 hours daily,,,2,,,EV Connect,http://evconnect.com/,GPS,42.900434,-78.671910,10/29/2024,335708,2024-10-29 03:12:37,,,,05/07/2024,J1772
ELEC,70 HATFIELD STATION 2,70 Hatfield Ln,,Goshen,NY,10924,,888-758-4389,E,,Public,24 hours daily,,,2,,,ChargePoint Network,http://www.chargepoint.com/,GPS,41.397684,-74.342212,10/29/2024,197068,2024-10-29 01:32:32,,,,10/02/2021,J1772
ELEC,CITYOFGLEN COVE PULASKI ST GARG,9 Glen Street,"Pulaski Street Parking Garage located behind City Hall, ground floor level, center of lot",Glen Cove,NY,11542,,888-758-4389,E,,Public,24 hours daily,,,2,,,ChargePoint Network,http://www.chargepoint.com/,GPS,40.864321,-73.631261,10/29/2024,162350,2024-10-29 00:50:39,,,,06/12/2020,J1772
ELEC,Prime Parking Systems - 155 E 68th Street - Tesla Destination,155 E 68th St,,New York,NY,10065,,877-798-3752,E,,Public,,,,3,,,Tesla Destination,https://www.tesla.com/destination-charging,200-8,40.767743,-73.963665,07/01/2024,115024,2024-10-16 16:58:41,P,,,07/23/2015,J1772 TESLA
ELEC,Farmers Market Pavilion,27 Airport Road,,Malone,NY,12953,,866-816-7584,E,,Public,24 hours daily,,,2,,,EV Connect,http://evconnect.com/,GPS,44.848490,-74.327675,10/29/2024,123091,2024-10-29 03:08:15,,,,04/01/2019,J1772
ELEC,CANDLE CANDLEWOOD #1,3605 NY-434,Near Main Entrance,Vestal,NY,13850,,888-758-4389,E,,Public,Mon 7:00am - 9:00pm; Tue 7:00am - 9:00pm; Wed 7:00am - 9:00pm; Thu 7:00am - 9:00pm; Fri 7:00am - 9:00pm; Sat 7:00am - 9:00pm; Sun 7:00am - 9:00pm,,,2,,,ChargePoint Network,http://www.chargepoint.com/,GPS,42.097171,-75.985701,10/29/2024,222457,2024-10-29 01:09:31,,,,07/02/2022,J1772
ELEC,Mohawk Honda Collision Center Outside,25 Saratoga Rd,,Schenectady,NY,12302,,1-844-623-1001,E,,Public,24 hours daily,,,6,,,LIVINGSTON,https://www.solution.energy,GPS,42.851210,-73.943100,10/29/2024,223235,2024-10-29 04:04:40,,,,12/29/2021,J1772
ELEC,CLARKSTOWN TOC 9 AND 10,10 Maple Avenue,,New City,NY,10956,,888-758-4389,E,,Public,24 hours daily,,,2,,,ChargePoint Network,http://www.chargepoint.com/,GPS,41.146557,-73.987511,10/29/2024,322230,2024-10-29 02:11:44,,,,12/07/2023,J1772
ELEC,Montauk Manor,236 Edgemere Street,,Montauk,NY,11954,,800-663-5633,E,,Public,24 hours daily,,,2,,,Blink Network,http://www.blinkcharging.com/,GPS,41.048379,-71.949387,10/29/2024,191333,2024-10-29 00:22:15,,,,08/07/2014,J1772
ELEC,10 Airline Drive,10 Airline Drive,,Albany,NY,12205,,1-888-717-4544,E,,Public,24 hours daily,,,4,,,CHARGESMART_EV,https://chargesmartev.com,GPS,42.735936,-73.818724,10/29/2024,347348,2024-10-29 04:09:11,,,,06/04/2024,J1772
ELEC,Cortese CDJR,2400 W Henrietta Rd,,Rochester,NY,14623,,1-888-717-4544,E,,Public,24 hours daily,,,2,4,,CHARGESMART_EV,https://chargesmartev.com,GPS,43.103551,-77.627335,10/29/2024,351942,2024-10-29 04:09:42,,,,08/01/2024,J1772 J1772COMBO
ELEC,BUTCHER BLOCK BUTCHER BLOCK 1,15 Booth Dr,,Plattsburgh,NY,12901,,888-758-4389,E,,Public,24 hours daily,,,2,,,ChargePoint Network,http://www.chargepoint.com/,GPS,44.697120,-73.498215,10/29/2024,170148,2024-10-29 01:23:23,,,,12/15/2020,J1772
ELEC,GGMC Belltel Car Park - Tesla Destination,356 Bridge St,,Brooklyn,NY,11201,,877-798-3752,E,,Public,,,,3,,,Tesla Destination,https://www.tesla.com/destination-charging,200-8,40.692579,-73.985252,07/01/2024,114901,2024-10-16 16:58:41,P,,,03/21/2017,J1772 TESLA
ELEC,SCHOTTLAND YMCA SCHOTTLAND N 1,2300 West Jefferson Road,Near Main Entrance,Pittsford,NY,14534,,888-758-4389,E,,Public,24 hours daily,,,2,,,ChargePoint Network,http://www.chargepoint.com/,GPS,43.088900,-77.544434,10/29/2024,346781,2024-10-29 02:19:06,,,,05/24/2024,J1772
ELEC,The Dorm Hotel,518 Stewart Ave,,Ithaca,NY,14850,,607-319-4611,E,,Public - Credit card at all times,24 hours daily,A D Debit M V,,1,,,Non-Networked,,GPS,42.444236,-76.489962,04/14/2024,226520,2024-04-14 22:11:34,P,,,08/25/2022,J1772
ELEC,MAINLOT MAIN LOT LEFT 1,181 E Fairmount Ave,Main Lot Left,Lakewood,NY,14750,,888-758-4389,E,,Public,24 hours daily,,,,1,,ChargePoint Network,http://www.chargepoint.com/,GPS,42.098102,-79.314180,10/29/2024,231094,2024-10-29 01:48:58,,,,10/01/2022,CHADEMO J1772COMBO
ELEC,DELLA MAZDA WEST PARKING,92 Quaker Rd,,Queensbury,NY,12804,,888-758-4389,E,,Public,24 hours daily,,,1,,,ChargePoint Network,http://www.chargepoint.com/,GPS,43.330627,-73.665250,10/29/2024,259682,2024-10-29 01:59:42,,,,04/21/2023,J1772
ELEC,1570 East Ave,1570 East Ave,,Rochester,NY,14610,,866-816-7584,E,,Public,24 hours daily,,,2,,,EV Connect,http://evconnect.com/,GPS,43.148527,-77.562079,10/29/2024,329048,2024-10-29 03:12:45,,,,02/23/2024,J1772
ELEC,JAMESTOWN BPU PREND.4TH #1,325 E 4th St,Corner of 4th and Prendergast Ave,Jamestown,NY,14701,,888-758-4389,E,,Public,24 hours daily,,,,1,,ChargePoint Network,http://www.chargepoint.com/,GPS,42.097733,-79.237680,10/29/2024,214312,2024-10-29 01:42:42,,,,04/20/2022,CHADEMO J1772COMBO
ELEC,COLE GROUP RIVERHILL 2,185 Van Renesselaer,,Menands,NY,12204,,888-758-4389,E,,Public,24 hours daily,,,2,,,ChargePoint Network,http://www.chargepoint.com/,GPS,42.683196,-73.740408,10/29/2024,233249,2024-10-29 01:49:21,,,,10/11/2022,J1772
ELEC,Town Hall,159 Pantigo Road,,East Hampton,NY,11937,,866-816-7584,E,,Public,24 hours daily,,,6,,,EV Connect,http://evconnect.com/,GPS,40.969547,-72.172070,10/29/2024,163947,2024-10-29 03:08:58,,,,06/26/2020,J1772
ELEC,Nissan of Westbury,939 Old Country Rd,,Westbury,NY,11590,,516-338-5600,E,,Public - Call ahead,Dealership business hours,,,1,1,,Non-Networked,,200-8,40.754470,-73.562170,02/12/2024,44212,2024-02-12 15:25:05,P,,,11/30/2011,CHADEMO J1772
ELEC,BURNS MGT SHERWOOD 1,19-21 Wells St,,Saratoga Springs,NY,12866,,888-758-4389,E,,Public,24 hours daily,,,2,,,ChargePoint Network,http://www.chargepoint.com/,GPS,43.087137,-73.792150,10/29/2024,120967,2024-10-29 01:00:45,,,,03/27/2019,J1772
ELEC,SARATOGA CASINO STATION 5,342 Jefferson St,,Saratoga Springs,NY,12866,,888-758-4389,E,,Public,24 hours daily,,,2,,,ChargePoint Network,http://www.chargepoint.com/,GPS,43.062423,-73.775923,10/29/2024,190791,2024-10-29 01:02:47,,,,06/08/2021,J1772
ELEC,"Sylvan Parking 23-25 31st St, Astoria - Tesla Destination",23-25 31st St,,Astoria,NY,11105,,877-798-3752,E,,Public,,,,4,,,Tesla Destination,https://www.tesla.com/destination-charging,200-9,40.773640,-73.913520,07/01/2024,150585,2024-10-16 16:58:41,P,,,03/30/2019,TESLA
ELEC,Saranac Lake - 3 Main St,3 Main Street,,Saranac Lake,NY,12983,,866-816-7584,E,,Public,24 hours daily,,,2,,,EV Connect,http://evconnect.com/,GPS,44.324241,-74.131946,10/29/2024,123097,2024-10-29 03:08:24,,,,04/01/2019,J1772
ELEC,WATERVLIET MUSEUM 1,1501 1st Ave,Far right charger,Watervliet,NY,12189,,888-758-4389,E,,Public,24 hours daily,,,2,,,ChargePoint Network,http://www.chargepoint.com/,GPS,42.726239,-73.701389,10/29/2024,205370,2024-10-29 01:32:51,,,,01/27/2022,J1772
ELEC,Jeffrey Gardens Public Access,47-14 217th St,,Bayside,NY,11361,,781-312-8846,E,,Public - Credit card at all times,24 hours daily,CREDIT,,1,,,AMPED_UP,https://www.ampedup.net,200-8,40.757170,-73.763970,10/11/2024,310515,2024-10-11 18:09:31,J,,,06/05/2023,J1772
ELEC,Superior Ink,400 W 12th St,,New York,NY,10014,,888-998-2546,E,,Public,24 hours daily,,,2,,,Blink Network,http://www.blinkcharging.com/,GPS,40.737537,-74.009830,10/29/2024,124147,2024-10-29 00:26:27,,,,06/21/2019,J1772
ELEC,Town of Veteran,4049 Watkins Rd,Located in the back on white outbuilding; near the parking spaces reserved for electric vehicles,Millport,NY,14864,,607-739-1476,E,,Public,24 hours daily,,,2,,,Non-Networked,,200-9,42.250834,-76.838332,03/14/2024,99950,2024-03-14 18:02:10,LG,,,07/01/2018,J1772
ELEC,CORNELL STATION12,Ellis Hollow Road,booth field,East Ithaca,NY,14850,,888-758-4389,E,,Public,24 hours daily,,,2,,,ChargePoint Network,http://www.chargepoint.com/,GPS,42.436194,-76.454501,10/29/2024,326306,2024-10-29 02:13:35,,,,01/23/2024,J1772
ELEC,NYS ORDA GORE MOUNTAIN 3,793 Peaceful Valley Rd,,North Creek,NY,12853,,888-758-4389,E,,Public,24 hours daily,,,2,,,ChargePoint Network,http://www.chargepoint.com/,GPS,43.671111,-74.007596,10/29/2024,174097,2024-10-29 01:02:38,,,,01/27/2021,J1772
ELEC,Mont Pleasant Branch Library,1036 Crane St.,,Schenectady,NY,12303,,1-844-623-1001,E,,Public,24 hours daily,,,4,,,LIVINGSTON,https://www.solution.energy,GPS,42.798070,-73.947330,10/29/2024,223285,2024-10-29 04:05:24,,,,03/30/2022,J1772
ELEC,Standard Parking 2 Metrotech - Tesla Destination,8 Metrotech Ctr S,,Brooklyn,NY,11201,,877-798-3752,E,,Public,,,,3,,,Tesla Destination,https://www.tesla.com/destination-charging,200-8,40.693122,-73.985696,07/01/2024,114914,2024-10-16 16:58:41,P,,,05/24/2018,J1772 TESLA
ELEC,5TH AVE RIVER STREET 4,King St &amp; Federal St,,Troy,NY,12180,,888-758-4389,E,,Public,24 hours daily,,,2,,,ChargePoint Network,http://www.chargepoint.com/,GPS,42.735077,-73.687950,10/29/2024,154336,2024-10-29 01:12:34,,,,03/06/2020,J1772
ELEC,Highland Animal Hospital,14 Gertrude Dr,,Central Square,NY,13036,,315-591-2911,E,,Public,Contact site for information,A ANDROID_PAY APPLE_PAY CREDIT D M,,2,,,AMPUP,https://ampup.io/,GPS,43.280000,-76.140000,12/13/2023,319376,2024-01-31 22:07:01,P,,,07/27/2023,J1772
ELEC,Woodland Pond Lot 2,100 Woodland Pond Cir,,New Paltz,NY,12561,,1-844-623-1001,E,,Public,24 hours daily,,,2,,,LIVINGSTON,https://www.solution.energy,GPS,41.756500,-74.062890,10/29/2024,324897,2024-10-29 04:06:13,,,,10/31/2023,J1772
ELEC,Center Park 250 Albany - Tesla Destination,250 Albany St,,Manhattan,NY,10280,,877-798-3752,E,,Public,,,,4,,,Tesla Destination,https://www.tesla.com/destination-charging,200-8,40.709803,-74.015771,07/01/2024,150574,2024-10-16 16:58:41,P,,,03/31/2019,TESLA
ELEC,Angola Travel Plaza West,447 I-90,,Angola,NY,14006,,866-816-7584,E,,Public,24 hours daily,,,,1,,EV Connect,http://evconnect.com/,GPS,42.635738,-78.990494,10/29/2024,190279,2024-10-29 03:09:22,,,,03/04/2021,CHADEMO J1772COMBO
ELEC,Village of Wappingers Falls,2 Mill St,,Wappinger Falls,NY,12590,,1-844-623-1001,E,,Public,24 hours daily,,,2,,,LIVINGSTON,https://www.solution.energy,GPS,41.598810,-73.919420,10/29/2024,357292,2024-10-29 04:07:00,,,,10/01/2024,J1772
ELEC,PENN YAN PUBLIC STATION 3,214 Main Street,,Penn Yan,NY,14527,,888-758-4389,E,,Public,24 hours daily,,,2,,,ChargePoint Network,http://www.chargepoint.com/,GPS,42.663972,-77.056995,10/29/2024,333633,2024-10-29 02:18:12,,,,04/26/2024,J1772
ELEC,SARATOGA HONDA OUTDOOR CHARGER,3402 U.S. 9,,Saratoga Springs,NY,12866,,888-758-4389,E,,Public,24 hours daily,,,2,,,ChargePoint Network,http://www.chargepoint.com/,GPS,43.057525,-73.787014,10/29/2024,223818,2024-10-29 01:01:50,,,,07/21/2022,J1772
ELEC,CAYUGA MED CTR. CAYUGA MEDICAL,101 Dates Dr,,Ithaca,NY,14850,,888-758-4389,E,,Public,24 hours daily,,,2,,,ChargePoint Network,http://www.chargepoint.com/,GPS,42.468963,-76.538457,10/29/2024,186535,2024-10-29 01:10:05,,,,03/24/2021,J1772
ELEC,NATIONAL GRID VENT CLIFTON,1220 NY-146,,Clifton Park,NY,12065,,888-758-4389,E,,Public,24 hours daily,,,2,,,ChargePoint Network,http://www.chargepoint.com/,GPS,42.869606,-73.823986,10/29/2024,162198,2024-10-29 00:56:05,,,,06/12/2020,J1772
ELEC,SNYDERPARK OAK CT. 2,49 Oak Ct,,Buffalo,NY,14226,,888-758-4389,E,,Public,24 hours daily,,,2,,,ChargePoint Network,http://www.chargepoint.com/,GPS,42.971850,-78.785300,10/29/2024,252023,2024-10-29 01:56:08,,,,01/25/2023,J1772
ELEC,GENESEO W PARK LEFT,4271 Genesee Valley Plaza Rd,West Parking Area Left Charger,Geneseo,NY,14454,,888-758-4389,E,,Public,24 hours daily,,,2,,,ChargePoint Network,http://www.chargepoint.com/,GPS,42.796947,-77.785236,10/29/2024,224225,2024-10-29 01:44:15,,,,07/22/2022,J1772
ELEC,GGMC Parking Connaught - Tesla Destination,300 E 54th St,,New York,NY,10022,,877-798-3752,E,,Public,,,,3,,,Tesla Destination,https://www.tesla.com/destination-charging,200-9,40.757146,-73.966135,07/01/2024,115082,2024-10-16 16:58:41,P,,,12/28/2016,J1772 TESLA
ELEC,Nyack Hospital - Parking Lot,160 N Midlane Ave,,Nyack,NY,10960,,813-492-5220,E,,Public,24 hours daily,A ANDROID_PAY APPLE_PAY D M V,,4,,,EVOKE,https://evokesystems.com/,GPS,41.095200,-73.926200,10/11/2024,356935,2024-10-11 18:09:31,P,,,05/16/2023,J1772
ELEC,TOWN OF BABYLON TANNER PARK 1,Tanner Park,East side station,Amityville,NY,11701,,888-758-4389,E,,Public,24 hours daily,,,1,,,ChargePoint Network,http://www.chargepoint.com/,GPS,40.656891,-73.396250,10/29/2024,162280,2024-10-29 00:52:45,,,,06/12/2020,J1772
ELEC,Tarrytown Metro North Train Station,4173 Green Street,,Tarrytown,NY,10591,,866-816-7584,E,,Public,24 hours daily,,,5,,,EV Connect,http://evconnect.com/,GPS,41.075921,-73.865021,10/29/2024,65271,2024-10-29 03:08:23,,,,11/01/2014,J1772
ELEC,PICOTTE 12 CORPORATE 1,12 Corporate Woods Blvd,Near main entrance of 12 corporate woods,Albany,NY,12211,,888-758-4389,E,,Public,24 hours daily,,,2,,,ChargePoint Network,http://www.chargepoint.com/,GPS,42.685856,-73.766365,10/29/2024,181235,2024-10-29 01:19:36,,,,01/27/2021,J1772
ELEC,Quaker Crossing,3420 Amelia Dr,,Orchard Park,NY,14127,,1-844-623-1001,E,,Public,24 hours daily,,,,4,,LIVINGSTON,https://www.solution.energy,GPS,42.790330,-78.782670,10/29/2024,347587,2024-10-29 04:06:35,,,,06/07/2024,J1772COMBO
ELEC,Russell Sage Jr. College,140 New Scotland Ave,,Albany,NY,12208,,1-844-623-1001,E,,Public,24 hours daily,,,4,,,LIVINGSTON,https://www.solution.energy,GPS,42.651430,-73.782380,10/29/2024,223220,2024-10-29 04:05:00,,,,11/23/2021,J1772
ELEC,STATION TOR1 CRAWFORD PARK N,122 N Ridge St,"N. parking lot (EV charging rate starting June 1, 2022 $1.75 an hour)",Rye Brook,NY,10573,,888-758-4389,E,,Public,24 hours daily,,,2,,,ChargePoint Network,http://www.chargepoint.com/,GPS,41.015065,-73.686638,10/29/2024,145318,2024-10-29 01:05:55,,,,09/17/2019,J1772
ELEC,160 W 84th St,160 W 84th St,,Manhattan,NY,10024,,888-356-8911,E,,Public,24 hours daily,,,2,,,FLO,https://flo.ca/,GPS,40.786312,-73.975690,10/29/2024,222579,2024-10-29 03:33:01,,,,07/07/2022,J1772
ELEC,HOTEL LOCATION MTFRM 2 RIGHT,1299 NY-332,North end of Microtel,Farmington,NY,14425,,888-758-4389,E,,Public,24 hours daily,,,2,,,ChargePoint Network,http://www.chargepoint.com/,GPS,42.972976,-77.352115,10/29/2024,240964,2024-10-29 01:54:22,,,,01/06/2023,J1772
ELEC,81 Columbia Turnpike Garage,81 Columbia Turnpike,,Rensselaer,NY,12144,,833-692-6787,E,,Public - Credit card at all times,Contact station for hours of availability.,A ANDROID_PAY APPLE_PAY CREDIT D M,,4,,,AMPUP,https://ampup.io/,200-9,42.626592,-73.740328,10/11/2022,229924,2023-02-14 15:54:11,P,,,09/15/2022,J1772
ELEC,McCauley Mountain Ski & Mountain Bike Center,300 Mc Cauley Rd,,Old Forge,NY,13420,,844-798-2438,E,,Public - Credit card at all times,24 hours daily,A D Debit M V,,2,,,SWTCH,https://swtchenergy.com/,GPS,43.698207,-74.963499,05/03/2023,257681,2024-01-31 22:07:01,P,,,03/30/2023,J1772
ELEC,City Parking Garment One Garage - Tesla Destination,155 E 34th St,,New York,NY,10016,,877-798-3752,E,,Public,,,,3,,,Tesla Destination,https://www.tesla.com/destination-charging,200-9,40.746022,-73.978693,07/01/2024,115023,2024-10-16 16:58:41,P,,,06/16/2017,J1772 TESLA
ELEC,VIC AND CAMPUS SUGAR SHACK 1.2,8023 NY-30,Next to sugar shack at VIC center,Paul Smiths,NY,12970,,888-758-4389,E,,Public,24 hours daily,,,2,,,ChargePoint Network,http://www.chargepoint.com/,GPS,44.448670,-74.258100,10/29/2024,175414,2024-10-29 01:13:57,,,,01/27/2021,J1772
ELEC,Dandy Mini Mart - Tesla Supercharger,1055 County Rd 64,,Elmira,NY,14903,,877-798-3752,E,,Public,24 hours daily,A D Debit M V,,,12,,Tesla,https://www.tesla.com/supercharger,GPS,42.158897,-76.863334,10/11/2024,356064,2024-10-11 18:09:31,P,,,09/17/2024,TESLA
ELEC,Veteran's Park Pool,Locust Ave,,Amsterdam,NY,12010,,1-844-623-1001,E,,Public,24 hours daily,,,10,,,LIVINGSTON,https://www.solution.energy,GPS,42.946740,-74.181450,10/29/2024,324886,2024-10-29 04:06:08,,,,03/20/2023,J1772
ELEC,GHMC PARKINGGARAGE6,707 E Main St,PARKING GARAGE 6,Middletown,NY,10940,,888-758-4389,E,,Public,24 hours daily,,,2,,,ChargePoint Network,http://www.chargepoint.com/,GPS,41.441845,-74.366816,10/29/2024,202336,2024-10-29 01:37:12,,,,12/10/2021,J1772
ELEC,The Mill at Water Mill - Tesla Supercharger,760 Montauk Highway,,Water Mill,NY,11976,,877-798-3752,E,,Public,24 hours daily. Please check Tesla's online station map to see if an adapter is required at this location.,,,,8,,Tesla,https://www.tesla.com/supercharger,GPS,40.911877,-72.353105,07/01/2024,169303,2024-08-14 18:58:22,P,,,11/09/2020,TESLA
ELEC,Hamilton Parking Garage,365 Hamilton Ave,Near entrance from EJ Conroy Dr,White Plains,NY,10601,,914-422-1310,E,,Public,24 hours daily; pay lot,,,3,,,Non-Networked,,200-9,41.034121,-73.766241,03/08/2023,65274,2024-01-31 22:07:01,SG,,,07/23/2014,J1772
ELEC,Excel Parking 87-10 Northern Blvd - Tesla Destination,87-10 Northern Blvd,,Jackson Heights,NY,11372,,877-798-3752,E,,Public,,,,4,,,Tesla Destination,https://www.tesla.com/destination-charging,200-9,40.755839,-73.880656,07/01/2024,122482,2024-10-16 16:58:41,P,,,01/17/2019,TESLA
ELEC,Gridworks,15 Liebich Lane,,Halfmoon,NY,12065,,1-844-623-1001,E,,Public,24 hours daily,,,4,,,LIVINGSTON,https://www.solution.energy,GPS,42.903040,-73.757020,10/29/2024,346976,2024-10-29 04:06:35,,,,05/30/2024,J1772
ELEC,Burritt Motors,340 NY 104,,Oswego,NY,13126,,855-885-9571,E,,Public,,,,4,,,OpConnect,http://www.opconnect.com/,GPS,43.462265,-76.472697,10/29/2024,303880,2024-10-29 03:04:53,,,,08/01/2023,J1772
ELEC,NYSERDA,4 Computer Drive West,,Albany,NY,12205,,888-356-8911,E,,Public,24 hours daily,,,4,,,FLO,https://flo.ca/,GPS,42.719125,-73.809943,10/29/2024,194027,2024-10-29 03:32:44,,,,08/18/2021,J1772
ELEC,MUNICIPAL EVSE COOL INSURING,1 Civic Center Plaza,,Glens Falls,NY,12801,,888-758-4389,E,,Public,24 hours daily,,,2,,,ChargePoint Network,http://www.chargepoint.com/,GPS,43.307785,-73.641884,10/29/2024,155384,2024-10-29 01:14:26,,,,04/15/2020,J1772
ELEC,1223 NY-300 (US-HAE-P7H-2C),1223 NY-300,,Newburgh,NY,12550,,866-576-1495,E,,Public,24 hours daily; for Rivian use only,A ACCOUNT_BALANCE D M V,,,1,,RIVIAN_ADVENTURE,https://rivian.com/experience/charging,GPS,41.501000,-74.072530,10/29/2024,330363,2024-10-29 03:18:02,,,,03/13/2024,J1772COMBO
ELEC,Ford Charge - Davidson Ford of Clay,3690 NY-31,,Liverpool,NY,13090,,888-357-1009,E,,Public,24 hours daily,A D Debit M V,,,4,,FORD_CHARGE,https://www.ford.com/support/category/electric-vehicle/charging/public-charging/,GPS,43.181519,-76.256216,,358299,2024-10-15 18:05:30,P,,,10/08/2024,J1772COMBO
ELEC,The Lakeshore at LOSO Building 3,6477 Lakeshore Rd,,Cicero,NY,13039,,1-844-623-1001,E,,Public,24 hours daily,,,2,,,LIVINGSTON,https://www.solution.energy,GPS,43.197380,-76.075060,10/29/2024,334503,2024-10-29 04:06:23,,,,05/02/2024,J1772
ELEC,PBMC NE CAMPUS 1,1235 Ostrander Ave,,Riverhead,NY,11901,,888-758-4389,E,,Public,24 hours daily,,,2,,,ChargePoint Network,http://www.chargepoint.com/,GPS,40.935867,-72.672310,10/29/2024,261061,2024-10-29 02:01:47,,,,05/19/2023,J1772
ELEC,Village of Dryden,16 South Street,,Dryden,NY,13053,,866-816-7584,E,,Public,24 hours daily,,,2,,,EV Connect,http://evconnect.com/,GPS,42.489514,-76.298039,10/29/2024,230851,2024-10-29 03:09:27,,,,09/30/2022,J1772
ELEC,AUTOWORLD KIA STATION 1,2520 Hempstead Turnpike,,East Meadow,NY,11554,,888-758-4389,E,,Public,24 hours daily,,,2,,,ChargePoint Network,http://www.chargepoint.com/,GPS,40.723663,-73.542769,10/29/2024,212205,2024-10-29 01:33:36,,,,03/23/2022,J1772
ELEC,Central Parking 200 Chambers - Tesla Destination,200 Chambers St,,New York,NY,10007,,877-798-3752,E,,Public,,,,3,,,Tesla Destination,https://www.tesla.com/destination-charging,200-9,40.716256,-74.012543,07/01/2024,115038,2024-10-16 16:58:41,P,,,01/09/2018,J1772 TESLA
ELEC,Silo Ridge - Tesla Destination,4651 Highway 22,,Amenia,NY,12501,,877-798-3752,E,,Public,,,,1,,,Tesla Destination,https://www.tesla.com/destination-charging,200-9,41.841447,-73.573197,07/01/2024,169104,2024-10-16 16:58:41,P,,,10/21/2015,TESLA
ELEC,MUNICIPAL EVSE MURRAY STREET,39 Murray St,,Glens Falls,NY,12801,,888-758-4389,E,,Public,24 hours daily,,,2,,,ChargePoint Network,http://www.chargepoint.com/,GPS,43.303196,-73.648670,10/29/2024,155245,2024-10-29 01:14:16,,,,04/08/2020,J1772
ELEC,Moreau Recreational Park,19 Jan Avenue,,Moreau,NY,12828,,866-816-7584,E,,Public,24 hours daily,,,2,,,EV Connect,http://evconnect.com/,GPS,43.271655,-73.627399,10/29/2024,230810,2024-10-29 03:08:56,,,,09/30/2022,J1772
ELEC,Starbucks - Tesla Supercharger,485  County Road 111,,Manorville,NY,11949,,877-798-3752,E,,Public,24 hours daily. Please check Tesla's online station map to see if an adapter is required at this location.,A D Debit M V,,,12,,Tesla,https://www.tesla.com/supercharger,GPS,40.871646,-72.798975,07/01/2024,216369,2024-08-14 18:58:22,P,,,04/24/2022,TESLA
ELEC,Tanger - Deer Park,152 The Arches Cir,,Deer Park,NY,11729,,855-900-7584,E,,Public,24 hours daily,,,9,,,SHELL_RECHARGE,https://www.shell.us/motorist/electric-vehicle-charging.html,GPS,40.764287,-73.305477,10/29/2024,346942,2024-10-29 02:46:31,,,,05/30/2024,J1772
ELEC,Southern Hills Veterinary Hospital,38 Clinton St,,Tully,NY,13159,,315-696-6699,E,,Public - Credit card at all times,24 hours daily,A D Debit M V,,1,,,Non-Networked,,GPS,42.798279,-76.107485,05/09/2024,227069,2024-05-09 20:32:20,P,,,08/26/2022,J1772
ELEC,DASSAI PARKING DASSAI PARKING,5 St Andrew Rd,,Hyde Park,NY,12538,,888-758-4389,E,,Public,24 hours daily,,,2,,,ChargePoint Network,http://www.chargepoint.com/,GPS,41.761985,-73.928726,10/29/2024,298818,2024-10-29 01:55:28,,,,06/29/2023,J1772
ELEC,RRH RIEDMAN CAMP2,100 Kings Hwy S,Rear of Building,Rochester,NY,14617,,888-758-4389,E,,Public,24 hours daily,,,1,,,ChargePoint Network,http://www.chargepoint.com/,GPS,43.201899,-77.574545,10/29/2024,173959,2024-10-29 01:00:14,,,,01/27/2021,J1772
ELEC,ROCHESTER NY PUBLC MARKET,39 Trinidad St,"Public Market Parking Lot off Trinidad St, across the street from the Public Market",Rochester,NY,14605,,888-758-4389,E,,Public,24 hours daily,,,2,,,ChargePoint Network,http://www.chargepoint.com/,GPS,43.166030,-77.591324,10/29/2024,62307,2024-10-29 01:05:59,,,,06/28/2014,J1772
ELEC,Four Brothers Dover Plains,3189 Route 22,,Dover Plains,NY,12522,,888-998-2546,E,,Public,24 hours daily,,,3,,,Blink Network,http://www.blinkcharging.com/,GPS,41.742215,-73.582737,10/29/2024,201193,2024-10-29 00:23:15,,,,11/16/2021,J1772
ELEC,QUICKLEES22 DCFC1,5744 Co Rd 20,,Belmont,NY,14813,,888-758-4389,E,,Public,24 hours daily,,,,1,,ChargePoint Network,http://www.chargepoint.com/,GPS,42.254369,-78.061025,10/29/2024,229204,2024-10-29 01:46:23,,,,09/24/2022,CHADEMO J1772COMBO
ELEC,Eastview Mall - Tesla Supercharger,7979 Pittsford Victor Rd,,Victor,NY,14564,,877-798-3752,E,,Public,24 hours daily. Please check Tesla's online station map to see if an adapter is required at this location.,,,,8,,Tesla,https://www.tesla.com/supercharger,200-8,43.028655,-77.440128,07/01/2024,102348,2024-08-14 18:58:22,P,,,09/01/2017,TESLA
ELEC,FLEETWOODGARAGE STATION ONE,42 Broad St W,Parking deck 2,Mount Vernon,NY,10552,,888-758-4389,E,,Public,24 hours daily,,,2,,,ChargePoint Network,http://www.chargepoint.com/,GPS,40.925940,-73.837150,10/29/2024,171343,2024-10-29 01:24:39,,,,01/16/2021,J1772
ELEC,SFUSA SFUSA-NY1,18 Wood Rd,Front Parking Lot,Round Lake,NY,12151,,888-758-4389,E,,Public,24 hours daily,,,2,,,ChargePoint Network,http://www.chargepoint.com/,GPS,42.906996,-73.782576,10/29/2024,260472,2024-10-29 02:01:48,,,,05/07/2023,J1772
ELEC,3474 Putnam Place,3474 Putnam Place,,Bronx,NY,10467,,888-356-8911,E,,Public,24 hours daily,,,2,,,FLO,https://flo.ca/,GPS,40.879413,-73.875485,10/29/2024,191506,2024-10-29 03:32:28,,,,06/25/2021,J1772
ELEC,iPark 200 West Garage Corp. - Tesla Destination,220 W 26th St,,New York,NY,10001,,877-798-3752,E,,Public,,,,3,,,Tesla Destination,https://www.tesla.com/destination-charging,200-9,40.746304,-73.995064,07/01/2024,115055,2024-10-16 16:58:41,P,,,11/02/2017,J1772 TESLA
ELEC,STONY BROOK UNV LAKE DRIVE,Lake Dr,,Stony Brook,NY,11790,,888-758-4389,E,,Public,24 hours daily,,,2,,,ChargePoint Network,http://www.chargepoint.com/,GPS,40.911831,-73.121521,10/29/2024,162456,2024-10-29 00:31:46,,,,06/12/2020,J1772
ELEC,Radha Krishna Corp / Quality Inn,454 James St,,Syracuse,NY,13203,,866-816-7584,E,,Public,24 hours daily,,,4,,,EV Connect,http://evconnect.com/,GPS,43.052463,-76.146717,10/29/2024,230833,2024-10-29 03:09:13,,,,09/30/2022,J1772
ELEC,1-4 STATION 5,103 Broad St,In parking lot,Waterford,NY,12188,,888-758-4389,E,,Public,24 hours daily,,,2,,,ChargePoint Network,http://www.chargepoint.com/,GPS,42.791120,-73.679780,10/29/2024,238529,2024-10-29 01:54:45,,,,12/21/2022,J1772
ELEC,RRH 1,8103 Oak Orchard Rd,Near shipping and receiving rear,Batavia,NY,14020,,888-758-4389,E,,Public,24 hours daily,,,2,,,ChargePoint Network,http://www.chargepoint.com/,GPS,43.020244,-78.190699,10/29/2024,357643,2024-10-29 02:09:08,,,,10/08/2024,J1772
ELEC,S.A.N.Y. PARKING 1,160 School Ln,,Frankfort,NY,13340,,888-758-4389,E,,Public,24 hours daily,,,1,,,ChargePoint Network,http://www.chargepoint.com/,GPS,43.076120,-75.169070,10/29/2024,180881,2024-10-29 01:17:54,,,,01/27/2021,J1772
ELEC,The Lofts at Saratoga BLVD Clubhouse,17 Lofts Wy,,Malta,NY,12020,,949-945-2000,E,,Public,24 hours daily,A ACCOUNT_BALANCE ANDROID_PAY APPLE_PAY CREDIT D M V,,6,,,EVGATEWAY,http://evgateway.com/,200-8,42.967870,-73.794770,05/09/2024,334062,2024-05-09 20:32:20,P,,,07/19/2023,J1772
ELEC,PFIZER PR EV 19,401 N Middletown Rd,,Pearl River,NY,10965,,888-758-4389,E,,Public,24 hours daily,,,2,,,ChargePoint Network,http://www.chargepoint.com/,GPS,41.076748,-74.018024,10/29/2024,323945,2024-10-29 02:13:09,,,,01/05/2024,J1772
ELEC,NORDEN LOFTS NORDEN LOFTS 1,121 Westmoreland Ave,East side of bldg.,White Plains,NY,10606,,888-758-4389,E,,Public,24 hours daily,,,2,,,ChargePoint Network,http://www.chargepoint.com/,GPS,41.027494,-73.777716,10/29/2024,162258,2024-10-29 00:54:57,,,,06/12/2020,J1772
ELEC,Bristol Plaza - Garage,200 E 65th St,,New York,NY,10065,,813-492-5220,E,,Public,24 hours daily,A ANDROID_PAY APPLE_PAY D M V,,8,,,EVOKE,https://evokesystems.com/,GPS,40.764955,-73.963483,10/11/2024,356952,2024-10-11 18:09:31,P,,,06/26/2023,J1772
ELEC,SPRINGVALLEYAPT 1.2,92 High Rock Ave,On road side in front of apartments,Saratoga Springs,NY,12866,,888-758-4389,E,,Public,24 hours daily,,,2,,,ChargePoint Network,http://www.chargepoint.com/,GPS,43.085308,-73.780610,10/29/2024,182245,2024-10-29 01:17:14,,,,01/27/2021,J1772
ELEC,COUNTRY CLUB COUNTRY CLUB #1,250 Northwood Dr,Station is located in second lot on left off Northwood Drive,Buffalo,NY,14221,,888-758-4389,E,,Public,24 hours daily,,,2,,,ChargePoint Network,http://www.chargepoint.com/,GPS,42.979509,-78.718321,10/29/2024,164609,2024-10-29 01:18:13,,,,07/29/2020,J1772
ELEC,Fairfield Inn by Marriott Binghamton - Tesla Destination,864 Upper Front St,,Binghamton,NY,13905,,877-798-3752,E,,Public,,,,3,,,Tesla Destination,https://www.tesla.com/destination-charging,200-8,42.130530,-75.905421,07/01/2024,114885,2024-10-16 16:58:41,P,,,10/23/2017,J1772 TESLA
ELEC,BRISTOL MTN BRISTOL MNT 4,5662 New York 64,West Border North Parking Charger 4,Canandaigua,NY,14424,,888-758-4389,E,,Public,24 hours daily,,,2,,,ChargePoint Network,http://www.chargepoint.com/,GPS,42.745876,-77.403586,10/29/2024,323323,2024-10-29 02:12:19,,,,12/22/2023,J1772
ELEC,iPark NYC 555 West Garage Corp. - Tesla Destination,549 W 23rd St,,New York,NY,10011,,877-798-3752,E,,Public,,,,3,,,Tesla Destination,https://www.tesla.com/destination-charging,200-9,40.749296,-74.006017,07/01/2024,150502,2024-10-16 16:58:41,P,,,06/24/2015,J1772 TESLA
ELEC,NOCO Energy Level 2 Chargers,2440 Sheridan Dr,,Tonawanda,NY,14150,,781-718-0286,E,,Public,Business hours,CREDIT Debit,,4,,,AMPUP,https://ampup.io/,GPS,42.981040,-78.843805,09/12/2024,355038,2024-09-12 16:47:34,P,,,08/13/2024,J1772
ELEC,Comfort Inn Binghamton,1000 Upper Front Street,,Binghamton,NY,13905,,1-844-623-1001,E,,Public,24 hours daily,,,4,,,LIVINGSTON,https://www.solution.energy,GPS,42.141670,-75.903550,10/29/2024,324791,2024-10-29 04:04:41,,,,06/06/2023,J1772
ELEC,KINGSTON PRINCE STREET,476 Broadway,Fees collected at this EV station are for electric usage only. Users must also pay metered parking fee at separate kiosk. Paid Parking $.75 per hour 9am-6pm Mon-Sat,Kingston,NY,12401,,888-758-4389,E,,Public,24 hours daily,,,2,,,ChargePoint Network,http://www.chargepoint.com/,GPS,41.927624,-73.998820,10/29/2024,260118,2024-10-29 02:01:23,,,,04/29/2023,J1772
ELEC,SUNY Schenectady - School of Music,78 Washington Ave,,Schenectady,NY,12305,,1-844-623-1001,E,,Public,24 hours daily,,,6,,,LIVINGSTON,https://www.solution.energy,GPS,42.814950,-73.952310,10/29/2024,223109,2024-10-29 04:04:46,,,,10/29/2021,J1772
ELEC,COMMCTR 59 N PUTT3,59 N Putt Corners Rd,,New Paltz,NY,12561,,888-758-4389,E,,Public,24 hours daily,,,2,,,ChargePoint Network,http://www.chargepoint.com/,GPS,41.747807,-74.064644,10/29/2024,202955,2024-10-29 01:36:56,,,,12/23/2021,J1772
ELEC,The Lakeshore at LOSO Building 5,6477 Lakeshore Rd,,Cicero,NY,13039,,1-844-623-1001,E,,Public,24 hours daily,,,2,,,LIVINGSTON,https://www.solution.energy,GPS,43.197380,-76.075060,10/29/2024,334433,2024-10-29 04:06:23,,,,05/02/2024,J1772
ELEC,Homewood Suites Schenectady,2A Freemans Bridge Road,,Schenectady,NY,12302,,1-888-717-4544,E,,Public,24 hours daily,,,14,,,CHARGESMART_EV,https://chargesmartev.com,GPS,42.832139,-73.930383,10/29/2024,360279,2024-10-29 04:09:45,,,,10/18/2024,J1772
ELEC,ABM Parking 866 UN Plaza - Tesla Destination,430 E 49th St,,New York,NY,10017,,877-798-3752,E,,Public,,,,3,,,Tesla Destination,https://www.tesla.com/destination-charging,200-8,40.752641,-73.965187,07/01/2024,115136,2024-10-16 16:58:41,P,,,04/18/2018,J1772 TESLA
ELEC,JLR FREEPORT SHOP 01,174 W Sunrise Hwy,,Freeport,NY,11520,,888-758-4389,E,,Public,24 hours daily,,,1,,,ChargePoint Network,http://www.chargepoint.com/,GPS,40.656484,-73.590183,10/29/2024,351322,2024-10-29 00:56:59,,,,07/23/2024,J1772
ELEC,MPG 543 W 110th Street Garage - Tesla Destination,543 W 110th St,,New York,NY,10025,,877-798-3752,E,,Public,,,,3,,,Tesla Destination,https://www.tesla.com/destination-charging,200-9,40.803963,-73.966032,07/01/2024,115157,2024-10-16 16:58:41,P,,,03/21/2017,J1772 TESLA
ELEC,Culinary Arts Center at Auburn Watson - Tesla Destination,3295 Walden Ave,,Depew,NY,14043,,877-798-3752,E,,Public,,,,2,,,Tesla Destination,https://www.tesla.com/destination-charging,200-9,42.911924,-78.694689,07/01/2024,114933,2024-10-16 16:58:41,P,,,08/15/2016,J1772 TESLA
ELEC,Nissan - Garden City,316 N Franklin St,,Hempstead,NY,11550,,,E,,Public - Call ahead,Dealership business hours; contact 516-483-4400 for more information,,,1,1,,Non-Networked,,GPS,40.716930,-73.630152,02/12/2024,44346,2024-02-12 15:25:05,P,,,11/30/2011,CHADEMO J1772
ELEC,101 Lake Ave,101 Lake Ave,,Blasdell,NY,14219,,866-816-7584,E,,Public,24 hours daily,,,4,,,EV Connect,http://evconnect.com/,GPS,42.797468,-78.828937,10/29/2024,316524,2024-10-29 03:12:13,,,,11/02/2023,J1772
ELEC,Walgreens,589 Prospect Ave,,Brooklyn,NY,11215,,877-455-3833,E,,Public,24 hours daily,,,,1,,eVgo Network,https://www.evgo.com/,GPS,40.656459,-73.977527,10/28/2024,228330,2024-10-28 23:58:38,,,,03/07/2018,CHADEMO J1772COMBO
ELEC,Ruge's Chevrolet,3692 Route 44,,Millbrook,NY,12545,,888-998-2546,E,,Public,Mon 7:00am - 7:00pm; Tue 7:00am - 7:00pm; Wed 7:00am - 7:00pm; Thu 7:00am - 7:00pm; Fri 7:00am - 7:00pm; Sat 7:00am - 7:00pm; Sun 12:00am - 12:00am,,,1,,,Blink Network,http://www.blinkcharging.com/,GPS,41.791720,-73.695000,10/29/2024,309213,2024-10-29 00:09:58,,,,03/30/2023,J1772
ELEC,BORO PARK BORO CHARGE 1,4915 10th Ave,,Borough Park,NY,11219,,888-758-4389,E,,Public,24 hours daily,,,2,,,ChargePoint Network,http://www.chargepoint.com/,GPS,40.638583,-73.998687,10/29/2024,206908,2024-10-29 01:40:10,,,,02/23/2022,J1772
ELEC,SUNY BUFFALO PARKER 1,185 Hayes Rd,,Buffalo,NY,14214,,888-758-4389,E,,Public,24 hours daily,,,2,,,ChargePoint Network,http://www.chargepoint.com/,GPS,42.951099,-78.822518,10/29/2024,182228,2024-10-29 01:24:30,,,,01/27/2021,J1772
ELEC,MONROE COUNTY CITYPL W1,121 Fitzhugh St N CityPlace Mapco Parking Lot,MAPCO Parking Lot on west side of N Fitzhugh St in the southwest area of the Lot,Rochester,NY,14614,,888-758-4389,E,,Public,24 hours daily,,,2,,,ChargePoint Network,http://www.chargepoint.com/,GPS,43.155888,-77.615213,10/29/2024,259346,2024-10-29 02:00:22,,,,04/14/2023,J1772
ELEC,80 N Main St Public Parking lot,80 N Main St,,Fairport,NY,14450,,866-816-7584,E,,Public,24 hours daily,,,6,,,EV Connect,http://evconnect.com/,GPS,43.104334,-77.440979,10/29/2024,94576,2024-10-29 03:09:05,,,,12/27/2019,J1772
ELEC,Edgewater Apts and Townhomes - Parking lot,84 Lehigh Station Rd,,West Henrietta,NY,14586,,813-492-5220,E,,Public,24 hours daily,A ANDROID_PAY APPLE_PAY D M V,,10,,,EVOKE,https://evokesystems.com/,GPS,43.058747,-77.685654,10/11/2024,357103,2024-10-11 18:09:31,P,,,09/25/2023,J1772
ELEC,Icon Parking - Claridge 87 Parking,200-206 E 88th Street,,New York,NY,10128,,888-998-2546,E,,Public,24 hours daily,,,1,,,Blink Network,http://www.blinkcharging.com/,GPS,40.779687,-73.952595,10/29/2024,257516,2024-10-29 00:14:47,,,,07/24/2022,J1772
ELEC,Wegmans Pittsford DCFC,3195 Monroe Ave.,,Rochester,NY,14618,,888-264-2208,E,,Public,Mon 6:00am - 11:59pm; Tue 6:00am - 11:59pm; Wed 6:00am - 11:59pm; Thu 6:00am - 11:59pm; Fri 6:00am - 11:59pm; Sat 6:00am - 11:59pm; Sun 6:00am - 11:59pm,,,,2,,SHELL_RECHARGE,https://www.shell.us/motorist/electric-vehicle-charging.html,GPS,43.105367,-77.543447,10/29/2024,225849,2024-10-29 02:52:23,,,,08/05/2022,J1772COMBO
ELEC,MAPLEWOODCC CHARGER 2,100 Daniel Drive,East Lot North Border Charger 2,Webster,NY,14580,,888-758-4389,E,,Public,24 hours daily,,,2,,,ChargePoint Network,http://www.chargepoint.com/,GPS,43.213520,-77.433067,10/29/2024,240976,2024-10-29 01:54:58,,,,01/06/2023,J1772
ELEC,LKT SOUTH 1,575 Boices Ln,South Entrance,Kingston,NY,12401,,888-758-4389,E,,Public,24 hours daily,,,2,,,ChargePoint Network,http://www.chargepoint.com/,GPS,41.967211,-74.002480,10/29/2024,235444,2024-10-29 01:51:17,,,,10/29/2022,J1772
ELEC,BURNS MGT BROOM SHOP 4,4 Broom Shop Ln,New apartment complex 6 Broomshop lane,Latham,NY,12110,,888-758-4389,E,,Public,24 hours daily,,,2,,,ChargePoint Network,http://www.chargepoint.com/,GPS,42.739843,-73.790080,10/29/2024,193394,2024-10-29 01:28:54,,,,07/31/2021,J1772
ELEC,BRENNAN GMC STATION 2,383 State Route 3,,Plattsburgh,NY,12901,,888-758-4389,E,,Public,24 hours daily,,,2,,,ChargePoint Network,http://www.chargepoint.com/,GPS,44.696214,-73.486265,10/29/2024,347398,2024-10-29 02:14:03,,,,06/05/2024,J1772
ELEC,305 Legend Dr - Building 3,9 Beekman Ave,,Sleepy Hollow,NY,10591,,813-492-5220,E,,Public,24 hours daily,A ANDROID_PAY APPLE_PAY D M V,,10,,,EVOKE,https://evokesystems.com/,GPS,41.085558,-73.869390,10/11/2024,357114,2024-10-11 18:09:31,P,,,05/13/2022,J1772
ELEC,HOMEWOODSUITES HWS1,40 Westbury Ave,,Carle Place,NY,11514,,888-758-4389,E,,Public,24 hours daily,,,2,,,ChargePoint Network,http://www.chargepoint.com/,GPS,40.749033,-73.619126,10/29/2024,319909,2024-10-29 02:11:03,,,,11/16/2023,J1772
ELEC,Putnam Hospital B,670 Stoneleigh Ave,,Carmel Hamlet,NY,10512,,1-888-717-4544,E,,Public,24 hours daily,,,2,,,CHARGESMART_EV,https://chargesmartev.com,GPS,41.382439,-73.661625,10/29/2024,347360,2024-10-29 04:09:23,,,,06/04/2024,J1772
ELEC,NORDEN LOFTS NORDEN LOFTS 2,121 Westmoreland Ave,West side of bldg,White Plains,NY,10606,,888-758-4389,E,,Public,24 hours daily,,,2,,,ChargePoint Network,http://www.chargepoint.com/,GPS,41.027322,-73.778019,10/29/2024,180125,2024-10-29 00:54:56,,,,01/27/2021,J1772
ELEC,250 Vesey,250 Vesey St,,New York,NY,10281,,833-692-6787,E,,Public - Credit card at all times,Contact station for hours of availability.,A ANDROID_PAY APPLE_PAY CREDIT D M,,2,,,AMPUP,https://ampup.io/,200-9,40.714113,-74.015810,10/11/2022,229903,2023-02-14 15:54:11,P,,,09/15/2022,J1772
ELEC,TOWNEPLACE INSIDE RIGHT,4265 Genesee St,Parking Lot,Cheektowaga,NY,14225,,888-758-4389,E,,Public,24 hours daily,,,2,,,ChargePoint Network,http://www.chargepoint.com/,GPS,42.930107,-78.728801,10/29/2024,307554,2024-10-29 00:31:08,,,,08/20/2023,J1772
ELEC,5 Palisades,5 Palisades Drive,,Albany,NY,12205,,1-844-623-1001,E,,Public,24 hours daily,,,6,,,LIVINGSTON,https://www.solution.energy,GPS,42.688560,-73.773490,10/29/2024,189529,2024-10-29 04:04:37,,,,08/19/2020,J1772
ELEC,BRITE LEFT,7647 Co Rd 42,Left Charger Near Main Entrance,Victor,NY,14564,,888-758-4389,E,,Public,24 hours daily,,,2,,,ChargePoint Network,http://www.chargepoint.com/,GPS,43.006385,-77.457446,10/29/2024,311110,2024-10-29 02:08:41,,,,09/20/2023,J1772
ELEC,TOWN OF MP TMP STATION 1,1 Town Hall Plaza,,Valhalla,NY,10595,,888-758-4389,E,,Public,24 hours daily,,,2,,,ChargePoint Network,http://www.chargepoint.com/,GPS,41.095997,-73.777598,10/29/2024,238222,2024-10-29 01:02:41,,,,12/16/2022,J1772
ELEC,Storm King Tavern and Golf Club - Tesla Destination,18 Ridge Rd,,Cornwall,NY,12518,,877-798-3752,E,,Public,,,,2,,,Tesla Destination,https://www.tesla.com/destination-charging,200-9,41.429539,-74.028420,07/01/2024,114928,2024-10-16 16:58:41,P,,,05/11/2017,TESLA
ELEC,854ELLICOTT 134 HIGH ST 5,134 High St,,Buffalo,NY,14203,,888-758-4389,E,,Public,24 hours daily,,,2,,,ChargePoint Network,http://www.chargepoint.com/,GPS,42.900856,-78.863837,10/29/2024,181843,2024-10-29 01:22:58,,,,01/27/2021,J1772
ELEC,NATIONAL GRID KOHLS ALBANY,1814 Central Ave,,Albany,NY,12205,,888-758-4389,E,,Public,24 hours daily,,,2,,,ChargePoint Network,http://www.chargepoint.com/,GPS,42.729741,-73.851066,10/29/2024,162203,2024-10-29 00:56:05,,,,06/12/2020,J1772
ELEC,FOODBANK LATHAM PARKING FOUR,959 Albany Shaker Rd Regional Food Bank - Lat,,Latham,NY,12110,,888-758-4389,E,,Public,24 hours daily,,,2,,,ChargePoint Network,http://www.chargepoint.com/,GPS,42.764587,-73.814445,10/29/2024,180891,2024-10-29 01:17:12,,,,01/27/2021,J1772
ELEC,Hotel Trilogy,661 Albany Shaker Rd,,Albany,NY,12110,,1-888-717-4544,E,,Public,24 hours daily,,,6,,,CHARGESMART_EV,https://chargesmartev.com,GPS,42.729567,-73.796632,10/29/2024,334244,2024-10-29 04:09:25,,,,06/22/2023,J1772
ELEC,Glendale Home,59 Hetcheltown Rd,,Schenectady,NY,12302,,1-844-623-1001,E,,Public,24 hours daily,,,4,,,LIVINGSTON,https://www.solution.energy,GPS,42.875250,-73.910080,10/29/2024,236642,2024-10-29 04:04:43,,,,10/15/2022,J1772
ELEC,Circle K - Tesla Supercharger,5755 NY-80,,Tully,NY,13159,,877-798-3752,E,,Public,24 hours daily. Please check Tesla's online station map to see if an adapter is required at this location.,A D Debit M V,,,12,,Tesla,https://www.tesla.com/supercharger,GPS,42.800068,-76.121841,07/01/2024,254097,2024-08-14 18:58:22,P,,,02/15/2023,TESLA
ELEC,PFIZER PR EV 24,401 N Middletown Rd,,Pearl River,NY,10965,,888-758-4389,E,,Public,24 hours daily,,,2,,,ChargePoint Network,http://www.chargepoint.com/,GPS,41.076748,-74.017970,10/29/2024,323939,2024-10-29 02:13:07,,,,01/05/2024,J1772
ELEC,GGMC Parking 75 Smith St Garage - Tesla Destination,75 Smith St,,Brooklyn,NY,11201,,877-798-3752,E,,Public,,,,3,,,Tesla Destination,https://www.tesla.com/destination-charging,200-9,40.689016,-73.988672,07/01/2024,114913,2024-10-16 16:58:41,P,,,11/13/2015,J1772 TESLA
ELEC,ISLANDIA CORP STATION 1,300 Corporate Plaza,Back side of building,Islandia,NY,11749,,888-758-4389,E,,Public,24 hours daily,,,2,,,ChargePoint Network,http://www.chargepoint.com/,GPS,40.807037,-73.178090,10/29/2024,260787,2024-10-29 01:58:59,,,,05/13/2023,J1772
ELEC,Icon Parking 515 E 72nd Street - Tesla Destination,515 E 72nd St,,New York,NY,10021,,877-798-3752,E,,Public,,,,3,,,Tesla Destination,https://www.tesla.com/destination-charging,GPS,40.766545,-73.952920,07/01/2024,250866,2024-10-16 16:58:41,P,,,11/02/2017,J1772 TESLA
ELEC,TIME WARNER TIME WARNER,1021 Highbridge Rd,station is located along the west side of the building off Highbridge road,Schenectady,NY,12303,,888-758-4389,E,,Public,24 hours daily,,,2,,,ChargePoint Network,http://www.chargepoint.com/,GPS,42.769329,-73.928738,10/29/2024,162473,2024-10-29 00:31:03,,,,06/12/2020,J1772
ELEC,E 47th Street - Tesla Supercharger,212 East 47th Street,,New York,NY,10017,,877-798-3752,E,,Public,24 hours daily. Please check Tesla's online station map to see if an adapter is required at this location.,,,,4,,Tesla,https://www.tesla.com/supercharger,200-9,40.753356,-73.971685,07/01/2024,102336,2024-08-14 18:58:22,P,,,07/23/2018,TESLA
ELEC,Icon Parking 30 W 63rd St - Tesla Destination,30 W 63rd St,,New York,NY,10023,,877-798-3752,E,,Public,,,,2,,,Tesla Destination,https://www.tesla.com/destination-charging,200-9,40.770772,-73.981795,07/01/2024,115081,2024-10-16 16:58:41,P,,,10/20/2016,TESLA
ELEC,TOH STATION 2,94 Lenox Road,,Huntington Station,NY,11746,,888-758-4389,E,,Public,24 hours daily,,,2,,,ChargePoint Network,http://www.chargepoint.com/,GPS,40.853093,-73.408885,10/29/2024,360901,2024-10-29 02:25:51,,,,10/29/2024,J1772
ELEC,PEPSICO INC STATION 1,50 E Stevens Ave,,Valhalla,NY,10595,,888-758-4389,E,,Public,24 hours daily,,,2,,,ChargePoint Network,http://www.chargepoint.com/,GPS,41.096363,-73.775380,10/29/2024,152440,2024-10-29 01:09:37,,,,01/15/2020,J1772
ELEC,NYE Ford,1479 Genesee St.,,Oneida,NY,13421,,1-888-717-4544,E,,Public,24 hours daily,,,6,6,,CHARGESMART_EV,https://chargesmartev.com,GPS,43.076155,-75.684092,10/29/2024,333949,2024-10-29 04:09:36,,,,10/25/2023,J1772 J1772COMBO
ELEC,Vision Nissan,785 Ridge Rd,,Webster,NY,14580,,585-787-2000,E,,Public - Call ahead,Dealership business hours,,,1,,,Non-Networked,,200-9,43.204065,-77.478237,02/12/2024,44208,2024-02-12 15:25:05,P,,,11/30/2011,J1772
ELEC,GMC Parking Narragansett - Tesla Destination,124 E 63rd St,,New York,NY,10065,,877-798-3752,E,,Public,,,,3,,,Tesla Destination,https://www.tesla.com/destination-charging,200-9,40.775800,-73.950870,07/01/2024,115007,2024-10-16 16:58:41,P,,,08/10/2017,J1772 TESLA
ELEC,CHARGEPOINT_NEW ETEC,State Campus Building 8,,Albany,NY,12203,,888-758-4389,E,,Public,24 hours daily,,,2,,,ChargePoint Network,http://www.chargepoint.com/,GPS,42.678963,-73.808570,10/29/2024,311869,2024-10-29 01:31:03,,,,09/29/2023,J1772
ELEC,GMG DCFC AF 10050#3,1401 Saratoga Rd,,Fort Edwards,NY,12831,,888-758-4389,E,,Public,24 hours daily,,,,1,,ChargePoint Network,http://www.chargepoint.com/,GPS,43.252129,-73.669606,10/29/2024,318019,2024-10-29 02:10:08,,,,11/10/2023,CHADEMO J1772COMBO
ELEC,City World Ford Parts,3305 Boston Rd,,Bronx,NY,10469,,1-888-717-4544,E,,Public,24 hours daily,,,1,,,CHARGESMART_EV,https://chargesmartev.com,GPS,40.873930,-73.853391,10/29/2024,350669,2024-10-29 04:09:35,,,,07/17/2024,J1772
ELEC,Target Latham #T1915,675 Troy Schenectady Rd,,Latham,NY,12110,,877-455-3833,E,,Public,24 hours daily,,,,6,,eVgo Network,https://www.evgo.com/,GPS,42.755686,-73.771672,10/28/2024,312668,2024-10-28 23:59:51,,,,10/10/2023,J1772COMBO
ELEC,RRH RIEDMAN CAMP4,100 Kings Hwy S,Rear of Building,Rochester,NY,14617,,888-758-4389,E,,Public,24 hours daily,,,1,,,ChargePoint Network,http://www.chargepoint.com/,GPS,43.202045,-77.574595,10/29/2024,173965,2024-10-29 01:00:13,,,,01/27/2021,J1772
ELEC,iPark NYC Central Harlem Garage Corp. - Tesla Destination,49 W 116th St,,New York,NY,10026,,877-798-3752,E,,Public,,,,3,,,Tesla Destination,https://www.tesla.com/destination-charging,200-8,40.801550,-73.948499,07/01/2024,115141,2024-10-16 16:58:41,P,,,05/27/2016,J1772 TESLA
ELEC,Tullys Goodtimes 7N,311 7 N St,,Liverpool,NY,13088,,1-844-623-1001,E,,Public,24 hours daily,,,6,,,LIVINGSTON,https://www.solution.energy,GPS,43.089900,-76.168320,10/29/2024,351527,2024-10-29 04:06:49,,,,07/25/2024,J1772
ELEC,PEPSICO INC STATION 2,100 E Stevens Ave,,Valhalla,NY,10595,,888-758-4389,E,,Public,24 hours daily,,,2,,,ChargePoint Network,http://www.chargepoint.com/,GPS,41.095215,-73.774750,10/29/2024,154053,2024-10-29 01:12:10,,,,02/27/2020,J1772
ELEC,iPark NYC 250 West Parking - Tesla Destination,250 W 19th St,,New York,NY,10011,,877-798-3752,E,,Public,,,,3,,,Tesla Destination,https://www.tesla.com/destination-charging,200-8,40.742407,-73.999351,07/01/2024,115068,2024-10-16 16:58:41,P,,,05/21/2015,J1772 TESLA
ELEC,Newark DPW - Parking Lot,100 Wood Ln,,Newark,NY,14513,,813-492-5220,E,,Public,24 hours daily,A ANDROID_PAY APPLE_PAY D M V,,6,,,EVOKE,https://evokesystems.com/,GPS,43.037800,-77.101300,10/11/2024,356882,2024-10-11 18:09:31,P,,,02/16/2022,J1772
ELEC,PLAZA HONDA PUBLIC LEVEL 3,2705 Nostrand Avenue,For Public Use,Brooklyn,NY,11210,,888-758-4389,E,,Public,24 hours daily,,,,1,,ChargePoint Network,http://www.chargepoint.com/,GPS,40.618355,-73.945087,10/29/2024,324389,2024-10-29 02:12:43,,,,01/09/2024,CHADEMO J1772COMBO
ELEC,COLE GROUP CEDAR PARK 2,2102 Massachusetts Ave,,Troy,NY,12180,,888-758-4389,E,,Public,24 hours daily,,,2,,,ChargePoint Network,http://www.chargepoint.com/,GPS,42.741949,-73.670383,10/29/2024,236289,2024-10-29 01:51:05,,,,11/18/2022,J1772
ELEC,HIGHWAY DEPT STATION 3,409 Bockes Rd,Near main entrance,Porter Corners,NY,12859,,888-758-4389,E,,Public,24 hours daily,,,2,,,ChargePoint Network,http://www.chargepoint.com/,GPS,43.145455,-73.881655,10/29/2024,262926,2024-10-29 02:04:31,,,,06/20/2023,J1772
ELEC,MONTY'S EVSE EVSE1,562 Lake Shore Rd,Front entrance to pier at Montys Bay Marina,West Chazy,NY,12992,,888-758-4389,E,,Public,24 hours daily,,,2,,,ChargePoint Network,http://www.chargepoint.com/,GPS,44.820103,-73.400340,10/29/2024,206887,2024-10-29 01:36:44,,,,02/23/2022,J1772
ELEC,HIGHWAY DEPT STATION 7,409 Bockes Rd,Side of building.,Porter Corners,NY,12859,,888-758-4389,E,,Public,24 hours daily,,,2,,,ChargePoint Network,http://www.chargepoint.com/,GPS,43.145501,-73.881717,10/29/2024,262928,2024-10-29 02:04:31,,,,06/20/2023,J1772
ELEC,Oakdale Commons Shopping Mall - Tesla Supercharger,511 Reynolds Rd,,Johnson City,NY,13790,,877-798-3752,E,,Public,24 hours daily,A D Debit M V,,,12,,Tesla,https://www.tesla.com/supercharger,GPS,42.130988,-75.973033,,360293,2024-10-18 14:46:56,P,,,10/14/2024,TESLA
ELEC,SUNY NEW PALTZ STATION 1,33 Southside Ave,,New Paltz,NY,12561,,888-758-4389,E,,Public,24 hours daily,,,2,,,ChargePoint Network,http://www.chargepoint.com/,GPS,41.741585,-74.088317,10/29/2024,122787,2024-10-29 01:02:12,,,,05/16/2019,J1772
ELEC,303 W 66th St Apts - 303 W 66th RMA,303 W 66th St,,New York,NY,10023,,813-492-5220,E,,Public,24 hours daily,A ANDROID_PAY APPLE_PAY D M V,,12,,,EVOKE,https://evokesystems.com/,GPS,40.776554,-73.987640,10/11/2024,356991,2024-10-11 18:09:31,P,,,06/05/2024,J1772
ELEC,Deer Valley Building 20,11 Farnsworth Dr.,,Guilderland,NY,12084,,1-844-623-1001,E,,Public,24 hours daily,,,4,,,LIVINGSTON,https://www.solution.energy,GPS,42.680170,-73.868370,10/29/2024,223274,2024-10-29 04:05:36,,,,04/11/2022,J1772
ELEC,Standard Parking 15 Metrotech - Tesla Destination,15 Metrotech Ctr S,,Brooklyn,NY,11201,,877-798-3752,E,,Public,,,,3,,,Tesla Destination,https://www.tesla.com/destination-charging,200-8,40.693999,-73.983809,07/01/2024,114890,2024-10-16 16:58:41,P,,,05/24/2018,J1772 TESLA
ELEC,Icon Parking 55 W 14th Street - Tesla Destination,55 W 14th St,,New York,NY,10011,,877-798-3752,E,,Public,,,,3,,,Tesla Destination,https://www.tesla.com/destination-charging,200-9,40.737122,-73.996119,07/01/2024,115159,2024-10-16 16:58:41,P,,,04/30/2016,J1772 TESLA
ELEC,MILTON NY SUZANNES EV1,13 Woodthrush Court,Suzannes Playground,Ballston Spa,NY,12020,,888-758-4389,E,,Public,24 hours daily,,,2,,,ChargePoint Network,http://www.chargepoint.com/,GPS,43.042968,-73.855013,10/29/2024,323434,2024-10-29 02:12:03,,,,12/23/2023,J1772
ELEC,SUNY BUFFALO PARKER 6,185 Hayes Rd,,Buffalo,NY,14214,,888-758-4389,E,,Public,24 hours daily,,,2,,,ChargePoint Network,http://www.chargepoint.com/,GPS,42.951019,-78.822603,10/29/2024,182223,2024-10-29 01:24:31,,,,01/27/2021,J1772
ELEC,ATRIUM EVCHARGE EV10,451 Clifton Park Center Rd,In parking lot.,Clifton Park,NY,12065,,888-758-4389,E,,Public,24 hours daily,,,2,,,ChargePoint Network,http://www.chargepoint.com/,GPS,42.855974,-73.785474,10/29/2024,225559,2024-10-29 01:41:51,,,,08/16/2022,J1772
ELEC,Evolve NY Rensselaer,621 3rd Ave Ext,,Rensselaer,NY,12144,,833-632-2778,E,,Public,24 hours daily,,,,6,,Electrify America,https://www.electrifyamerica.com/,GPS,42.645650,-73.700190,10/29/2024,327249,2024-10-29 02:56:08,,,,02/01/2024,J1772COMBO
ELEC,125-10 Queens Blvd Garage - Tesla Destination,123 83rd Ave,,Kew Gardens,NY,11415,,877-798-3752,E,,Public,,,,4,,,Tesla Destination,https://www.tesla.com/destination-charging,GPS,40.711905,-73.826773,07/01/2024,122483,2024-10-16 16:58:41,P,,,11/30/2018,TESLA
ELEC,MTP 625 W 57th Street - Tesla Destination,625 W 57th St,,New York,NY,10019,,877-798-3752,E,,Public,,,,3,,,Tesla Destination,https://www.tesla.com/destination-charging,200-9,40.771080,-73.993142,07/01/2024,115176,2024-10-16 16:58:41,P,,,06/13/2017,TESLA
ELEC,STRONG MUSEUM STRONG L1 #4,1 Manhattan Square Dr,Please note: This is a paid garage. Full parking rate is $10 if not visiting the museum. Parking as a museum guest is $7. Station is at Level 1 of the parking garage,Rochester,NY,14607,,888-758-4389,E,,Public,Mon 8:00am - 5:00pm; Tue 8:00am - 5:00pm; Wed 8:00am - 5:00pm; Thu 8:00am - 5:00pm; Fri 8:00am - 8:00pm; Sat 8:00am - 8:00pm; Sun 8:00am - 5:00pm,,,2,,,ChargePoint Network,http://www.chargepoint.com/,GPS,43.151898,-77.600937,10/29/2024,146983,2024-10-29 01:06:56,,,,10/16/2019,J1772
ELEC,FOX TS PARKING LOT,188 Grant Avenue,,Auburn,NY,13021,,888-758-4389,E,,Public,24 hours daily,,,2,,,ChargePoint Network,http://www.chargepoint.com/,GPS,42.946845,-76.547764,10/29/2024,335679,2024-10-29 02:18:31,,,,05/07/2024,J1772
ELEC,22 Russel St.,22 Russell St,,White Plains,NY,10606,,888-356-8911,E,,Public,24 hours daily,,,4,,,FLO,https://flo.ca/,GPS,41.037140,-73.781060,10/29/2024,257807,2024-10-29 03:33:34,,,,04/01/2023,J1772
ELEC,87-50 204th St - Level 1,87-50 204th St,,Queens,NY,11423,,813-492-5220,E,,Public,24 hours daily,A ANDROID_PAY APPLE_PAY D M V,,53,,,EVOKE,https://evokesystems.com/,GPS,40.721904,-73.762449,10/11/2024,357110,2024-10-11 18:09:31,P,,,06/11/2024,J1772
ELEC,THE STANTON ALGONQUIN,33 1/2 S Goodman St,At north side of garage,Rochester,NY,14607,,888-758-4389,E,,Public,24 hours daily,,,2,,,ChargePoint Network,http://www.chargepoint.com/,GPS,43.151319,-77.590041,10/29/2024,261365,2024-10-29 02:03:11,,,,05/25/2023,J1772
ELEC,Green Team Lighting LLC,810 Genesee Turnpike,,Chittenango,NY,13037,,888-363-7662,E,,Public - Credit card at all times,24 hours daily,A D Debit M V,,2,,,Non-Networked,,GPS,43.053989,-75.862285,10/11/2024,227076,2024-10-11 18:09:31,P,,,08/26/2022,J1772
ELEC,THE SAGAMORE SAGAMORE 1.2,433 Boathouse Ln,,Bolton,NY,12814,,888-758-4389,E,,Public,24 hours daily,,,2,,,ChargePoint Network,http://www.chargepoint.com/,GPS,43.557070,-73.645260,10/29/2024,153089,2024-10-29 01:11:11,,,,01/28/2020,J1772
ELEC,1240 Morrison Ave,1240 Morrison Ave,,Bronx,NY,10472,,949-945-2000,E,,Public,24 hours daily,A ACCOUNT_BALANCE ANDROID_PAY APPLE_PAY CREDIT D M V,,3,,,EVGATEWAY,http://evgateway.com/,200-8,40.830510,-73.874370,05/09/2024,333911,2024-05-09 20:32:20,P,,,01/29/2024,J1772
ELEC,Shults Nissan,311 Fluvanna Ave,,Jamestown,NY,14701,,716-484-2780,E,,Public - Call ahead,Dealership business hours,,,1,,,Non-Networked,,200-9,42.115661,-79.253776,02/12/2024,49932,2024-02-12 15:25:05,P,,,10/25/2012,J1772
ELEC,Dalewood Shopping Center,371 North Central Avenue,,Hartsdale,NY,10530,,833-632-2778,E,,Public,24 hours daily,,,1,3,,Electrify America,https://www.electrifyamerica.com/,GPS,41.032200,-73.787090,10/29/2024,167890,2024-10-29 02:57:25,,,,10/28/2020,J1772 J1772COMBO
ELEC,Town of Ashford,9377 Route 240,,West Valley,NY,14171,,716-942-6016,E,,Public,24 hours daily; Drivers must bring their own J1772 cordset for Level 1 charging,,2,,,,Non-Networked,,200-9,42.406807,-78.612777,03/14/2024,92004,2024-03-14 18:02:10,LG,,,02/01/2018,NEMA520
ELEC,Ford Charge - Warren Ford,3711 Main St,,Warrensburg,NY,12885,,888-357-1009,E,,Public,24 hours daily,A D Debit M V,,,2,,FORD_CHARGE,https://www.ford.com/support/category/electric-vehicle/charging/public-charging/,GPS,43.489838,-73.765041,,358294,2024-10-15 18:05:30,P,,,10/08/2024,J1772COMBO
ELEC,SURGERY PARKING 1(LEFT),7785 N State St,,Lowville,NY,13367,,888-758-4389,E,,Public,24 hours daily,,,2,,,ChargePoint Network,http://www.chargepoint.com/,GPS,43.795795,-75.500077,10/29/2024,321230,2024-10-29 02:11:29,,,,12/01/2023,J1772
ELEC,BMW S. ALBANY STATION 01,521-641 US-9W,,Glenmont,NY,12077,,888-758-4389,E,,Public,24 hours daily,,,2,,,ChargePoint Network,http://www.chargepoint.com/,GPS,42.588972,-73.797298,10/29/2024,162451,2024-10-29 00:32:02,,,,06/12/2020,J1772
ELEC,Marshall Square Apartments,10 Marshall Road,,Wappinger Falls,NY,12590,,1-844-623-1001,E,,Public,24 hours daily,,,4,,,LIVINGSTON,https://www.solution.energy,GPS,41.590220,-73.904010,10/29/2024,324838,2024-10-29 04:04:23,,,,09/27/2023,J1772
ELEC,Amazon Fresh at Kohls Center DCFC,3620 Long Beach Road,,Oceanside,NY,11572,,888-264-2208,E,,Public,Mon 8:00am - 10:00pm; Tue 8:00am - 10:00pm; Wed 8:00am - 10:00pm; Thu 8:00am - 10:00pm; Fri 8:00am - 10:00pm; Sat 8:00am - 10:00pm; Sun 8:00am - 10:00pm,,,,1,,SHELL_RECHARGE,https://www.shell.us/motorist/electric-vehicle-charging.html,GPS,40.622106,-73.641826,10/29/2024,222353,2024-10-29 02:50:07,,,,06/25/2022,J1772COMBO
ELEC,EVolve NY Binghamton,33 South Washington,,Binghamton,NY,13903,,833-632-2778,E,,Public,24 hours daily,,,,4,,Electrify America,https://www.electrifyamerica.com/,GPS,42.090370,-75.913550,10/29/2024,203302,2024-10-29 02:56:10,,,,12/30/2021,CHADEMO J1772COMBO
ELEC,EVCHARGE BEACH LOT,Taughannock State Park Access Rd,Southwest corner of the swimming area parking lot,Trumansburg,NY,14886,,888-758-4389,E,,Public,24 hours daily,,,2,,,ChargePoint Network,http://www.chargepoint.com/,GPS,42.544649,-76.596445,10/29/2024,162328,2024-10-29 00:51:22,,,,06/12/2020,J1772
ELEC,CT4020-HD-GW COURT LOT,7559 Court St,,Elizabethtown,NY,12932,,888-758-4389,E,,Public,24 hours daily,,,2,,,ChargePoint Network,http://www.chargepoint.com/,GPS,44.215187,-73.594240,10/29/2024,143486,2024-10-29 01:03:17,,,,08/15/2019,J1772
ELEC,Montefiore Nyack Hospital,160 North Midland Ave,,Nyack,NY,10960,,888-356-8911,E,,Public,24 hours daily,,,8,,,FLO,https://flo.ca/,GPS,41.096790,-73.925698,10/29/2024,259533,2024-10-29 03:33:38,,,,04/18/2023,J1772
ELEC,OSULLIVANS MOTEL,410 Canada St,,Lake George,NY,12845,,888-758-4389,E,,Public,24 hours daily,,,2,,,ChargePoint Network,http://www.chargepoint.com/,GPS,43.429993,-73.711860,10/29/2024,201987,2024-10-29 01:36:49,,,,12/03/2021,J1772
ELEC,Elm Ave,1 Research Circle,,Niskayuna,NY,12309,,800-663-5633,E,,Public,24 hours daily,,,11,,,Blink Network,http://www.blinkcharging.com/,GPS,42.825583,-73.879337,10/29/2024,148044,2024-10-29 00:16:03,,,,11/01/2018,J1772
ELEC,Park Kwik - 110 Livingston - Tesla Destination,110 Livingston St,,Brooklyn,NY,11201,,877-798-3752,E,,Public,,,,4,,,Tesla Destination,https://www.tesla.com/destination-charging,200-9,40.690987,-73.990131,07/01/2024,169008,2024-10-16 16:58:41,P,,,10/11/2019,J1772 TESLA
ELEC,Standard Parking 910 5th Avenue - Tesla Destination,910 5th Ave,,New York,NY,10021,,877-798-3752,E,,Public,,,,3,,,Tesla Destination,https://www.tesla.com/destination-charging,GPS,40.772175,-73.966370,07/01/2024,358856,2024-10-16 16:58:41,P,,,,J1772 TESLA
ELEC,Rapidpark 124 W 20th Street - Tesla Destination,124 W 20th St,,New York,NY,10011,,877-798-3752,E,,Public,,,,3,,,Tesla Destination,https://www.tesla.com/destination-charging,200-9,40.741554,-73.995403,07/01/2024,115008,2024-10-16 16:58:41,P,,,06/16/2017,J1772 TESLA
ELEC,112 W State St,112 W State St,,Olean,NY,14760,,866-816-7584,E,,Public,24 hours daily,,,5,,,EV Connect,http://evconnect.com/,GPS,42.078104,-78.430852,10/29/2024,346044,2024-10-29 03:12:57,,,,05/10/2024,J1772
ELEC,ESSEX FARMS EVSE1,2496 NY-22,Front parking lot of essex farms,Essex,NY,12936,,888-758-4389,E,,Public,24 hours daily,,,2,,,ChargePoint Network,http://www.chargepoint.com/,GPS,44.307780,-73.374540,10/29/2024,196297,2024-10-29 01:32:59,,,,09/24/2021,J1772
ELEC,PFIZER PR EV 10,401 N Middletown Rd,,Pearl River,NY,10965,,888-758-4389,E,,Public,24 hours daily,,,2,,,ChargePoint Network,http://www.chargepoint.com/,GPS,41.076777,-74.018077,10/29/2024,294847,2024-10-29 01:43:56,,,,06/23/2023,J1772
ELEC,SULLIVAN COUNTY SULLIVAN 1,14 Sturgis Rd,Rear parking lot by DMV,Monticello,NY,12701,,888-758-4389,E,,Public,24 hours daily,,,2,,,ChargePoint Network,http://www.chargepoint.com/,GPS,41.659580,-74.690820,10/29/2024,174492,2024-10-29 01:05:04,,,,01/27/2021,J1772
ELEC,799 SENECA STATION 2,799 Seneca St,,Buffalo,NY,14210,,888-758-4389,E,,Public,Mon 5:00pm - 10:00pm; Tue 5:00pm - 10:00pm; Wed 5:00pm - 10:00pm; Thu 5:00pm - 10:00pm; Fri 5:00pm - 10:00pm; Sat 8:00am - 10:00pm; Sun 8:00am - 10:00pm,,,1,,,ChargePoint Network,http://www.chargepoint.com/,GPS,42.875115,-78.847547,10/29/2024,191243,2024-10-29 01:30:04,,,,06/19/2021,J1772
ELEC,SRYMCASSB MALTA 1.4,8-10 Medical Park Dr,Rear parking lot of malta YMCA,Ballston Spa,NY,12020,,888-758-4389,E,,Public,24 hours daily,,,2,,,ChargePoint Network,http://www.chargepoint.com/,GPS,42.975723,-73.806080,10/29/2024,182288,2024-10-29 01:24:27,,,,01/27/2021,J1772
ELEC,115 Fort Washington Ave,115 Fort Washington Ave,,New York,NY,10032,,888-356-8911,E,,Public,24 hours daily,,,2,,,FLO,https://flo.ca/,GPS,40.839756,-73.943345,10/29/2024,200474,2024-10-29 03:32:09,,,,11/03/2021,J1772
ELEC,Albany Parking Authority - Quackenbush Garage,25 Orange St,,Albany,NY,12207,,866-816-7584,E,,Public,24 hours daily,,,9,,,EV Connect,http://evconnect.com/,GPS,42.654190,-73.747363,10/29/2024,185448,2024-10-29 03:09:09,,,,05/20/2019,J1772
ELEC,Classic Lanes,1840 Military Rd,,Buffalo,NY,14217,,1-888-717-4544,E,,Public,24 hours daily,,,4,,,CHARGESMART_EV,https://chargesmartev.com,GPS,42.987739,-78.884537,10/29/2024,347375,2024-10-29 04:09:32,,,,06/04/2024,J1772
ELEC,The Andover - Garage,1675 York Ave,,New York,NY,10128,,813-492-5220,E,,Public,24 hours daily,A ANDROID_PAY APPLE_PAY D M V,,20,,,EVOKE,https://evokesystems.com/,GPS,40.777778,-73.946111,10/11/2024,356942,2024-10-11 18:09:31,P,,,03/06/2023,J1772
ELEC,Hampton Inn & Suites Cazenovia,25 Lakers Ln,,Cazenovia,NY,13035,,315-655-7666,E,,Public,24 hours daily,A D Debit M V,,1,,,Non-Networked,,GPS,42.924457,-75.841164,07/11/2024,229071,2024-07-11 19:05:43,P,,,09/19/2022,J1772
ELEC,Nissan of Staten Island,1976 Hylan Blvd,,Staten Island,NY,10306,,718-447-3800,E,,Public,Dealership business hours,,,1,,,Non-Networked,,200-9,40.581432,-74.097694,02/12/2024,99500,2024-02-12 15:25:05,P,,,06/28/2018,J1772
ELEC,iPark NYC 88th Street Garage - Tesla Destination,101 W 88th St,,New York,NY,10024,,877-798-3752,E,,Public,,,,3,,,Tesla Destination,https://www.tesla.com/destination-charging,200-8,40.788008,-73.971611,07/01/2024,114993,2024-10-16 16:58:41,P,,,06/22/2015,J1772 TESLA
ELEC,CONVENIENT MED CONV. MED EV 2,319 Bay Rd Convenient Medical Center,,Queensbury,NY,12804,,888-758-4389,E,,Public,24 hours daily,,,2,,,ChargePoint Network,http://www.chargepoint.com/,GPS,43.331068,-73.652991,10/29/2024,168351,2024-10-29 01:22:00,,,,11/13/2020,J1772
ELEC,Parkit 575 Washington - Tesla Destination,575 Washington St,,New York,NY,10014,,877-798-3752,E,,Public,,,,6,,,Tesla Destination,https://www.tesla.com/destination-charging,200-9,40.729364,-74.008513,07/01/2024,115164,2024-10-16 16:58:41,P,,,06/01/2015,J1772 TESLA
ELEC,Butterfield Condominium,10 Julia Ln,,Cold Spring,NY,10516,,844-798-2438,E,,Public - Credit card at all times,24 hours daily,A D Debit M V,,4,,,SWTCH,https://swtchenergy.com/,GPS,41.418200,-73.949303,04/14/2024,331362,2024-04-14 22:11:34,P,,,03/27/2024,J1772
ELEC,FURNACE POINT FPEV2,96 Furnace Point Rd,,Westport,NY,12993,,888-758-4389,E,,Public,24 hours daily,,,2,,,ChargePoint Network,http://www.chargepoint.com/,GPS,44.193295,-73.426910,10/29/2024,211840,2024-10-29 01:40:53,,,,03/17/2022,J1772
ELEC,STEET TOYOTA INVENTORY SIDE,310 N Comrie Ave,,Johnstown,NY,12095,,888-758-4389,E,,Public,24 hours daily,,,2,,,ChargePoint Network,http://www.chargepoint.com/,GPS,43.023804,-74.360032,10/29/2024,217225,2024-10-29 01:43:43,,,,05/08/2022,J1772
ELEC,715 NY-304 - Tesla Destination,715 NY-304,,Bardonia,NY,10954,,877-798-3752,E,,Public,,,,6,,,Non-Networked,,GPS,41.120237,-73.993440,07/01/2024,359740,2024-10-16 16:58:41,P,,,,J1772
ELEC,EV-1NE JF NORTH,Mather Dr,,Centereach,NY,11720,,888-758-4389,E,,Public,24 hours daily,,,2,,,ChargePoint Network,http://www.chargepoint.com/,GPS,40.901609,-73.075718,10/29/2024,217448,2024-10-29 01:43:48,,,,05/13/2022,J1772
ELEC,GrandeVille at Malta Mail and Dog Spa,1 Landau Blvd,,Malta,NY,12020,,1-844-623-1001,E,,Public,24 hours daily,,,6,,,LIVINGSTON,https://www.solution.energy,GPS,42.964920,-73.795360,10/29/2024,252717,2024-10-29 04:06:18,,,,12/13/2022,J1772
ELEC,Bidleman Ford,305 Grant Ave,,Auburn,NY,13021,,315-252-7255,E,,Public - Credit card at all times,24 hours daily,A D Debit M V,,1,,,Non-Networked,,GPS,42.956043,-76.544178,05/09/2024,227071,2024-05-09 20:32:20,P,,,08/26/2022,J1772
ELEC,277 Park Avenue,277 Park Avenue,,New York,NY,10172,,866-816-7584,E,,Public,24 hours daily,,,20,,,EV Connect,http://evconnect.com/,GPS,40.755190,-73.974142,10/29/2024,198016,2024-10-29 03:09:41,,,,10/19/2021,J1772
ELEC,CDTA TRAIN STATION,443 East St,,Rensselaer,NY,12144,,888-758-4389,E,,Public,24 hours daily,,,2,,,ChargePoint Network,http://www.chargepoint.com/,GPS,42.640590,-73.740738,10/29/2024,162189,2024-10-29 00:56:20,,,,06/12/2020,J1772
ELEC,Sap Bush Hollow Farm Store & Cafe,832 W. Fulton Rd,,Fulton,NY,12194,,1-844-623-1001,E,,Public,24 hours daily,,,4,,,LIVINGSTON,https://www.solution.energy,GPS,42.563590,-74.459860,10/29/2024,346731,2024-10-29 04:06:34,,,,05/23/2024,J1772
ELEC,SUNY CORTLAND PROF STUD 1.3,5 Folmer Dr,Located behind building along Pashley Drive Extension. Permit A parking until 5 pm. NO Parking 2-6 am,Cortland,NY,13045,,888-758-4389,E,,Public,Mon 5:00pm - 12:00am; Tue 5:00pm - 12:00am; Wed 5:00pm - 12:00am; Thu 5:00pm - 12:00am; Fri 5:00pm - 12:00am; Sat 6:00am - 12:00am; Sun 6:00am - 12:00am,,,2,,,ChargePoint Network,http://www.chargepoint.com/,GPS,42.588924,-76.196929,10/29/2024,183388,2024-10-29 01:18:12,,,,01/27/2021,J1772
ELEC,Fairview Apartments West,100 Fairview Square,,Ithaca,NY,14850,,1-844-623-1001,E,,Public,24 hours daily,,,8,,,LIVINGSTON,https://www.solution.energy,GPS,42.439960,-76.476150,10/29/2024,347946,2024-10-29 04:06:37,,,,06/14/2024,J1772
ELEC,26 Century Hill Dr,26 Century Hill Dr,,Latham,NY,12110,,1-844-623-1001,E,,Public,24 hours daily,,,2,,,LIVINGSTON,https://www.solution.energy,GPS,42.770950,-73.759090,10/29/2024,223302,2024-10-29 04:05:41,,,,06/06/2022,J1772
ELEC,Bokman Chevrolet,81 S Main St,,Wellsville,NY,14895,,585-593-4150,E,,Public - Credit card at all times,24 hours daily,A D Debit M V,,1,,,Non-Networked,,GPS,42.118569,-77.941288,10/11/2024,226524,2024-10-11 18:09:31,P,,,08/25/2022,J1772
ELEC,RIVERTRAIL RIVERTRAIL EV1,79 Woodruff Street,Back right of lot.,Saranac Lake,NY,12983,,888-758-4389,E,,Public,24 hours daily,,,2,,,ChargePoint Network,http://www.chargepoint.com/,GPS,44.329499,-74.129461,10/29/2024,356144,2024-10-29 02:23:22,,,,09/21/2024,J1772
ELEC,Riverwood Tech,4545 East River Road,,West Henrietta,NY,14586,,866-816-7584,E,,Public,24 hours daily,,,6,,,EV Connect,http://evconnect.com/,GPS,43.056551,-77.693216,10/29/2024,230789,2024-10-29 03:08:37,,,,09/30/2022,J1772
ELEC,Davidson Ford,18621 US-11,,Watertown,NY,13601,,315-873-3388,E,,Public - Credit card at all times,24 hours daily,A D Debit M V,,1,,,Non-Networked,,GPS,43.936846,-75.928898,04/14/2024,227091,2024-04-14 22:11:34,P,,,08/26/2022,J1772
ELEC,The Lofts at Saratoga - Bldg 3,18 Lofts Way,,Malta,NY,12020,,1-888-717-4544,E,,Public,24 hours daily,,,2,,,CHARGESMART_EV,https://chargesmartev.com,GPS,42.969026,-73.795558,10/29/2024,347352,2024-10-29 04:09:17,,,,06/04/2024,J1772
ELEC,TOB CHARGERS EV STATION 2,1 Independence Hill,,Farmingville,NY,11738,,888-758-4389,E,,Public,24 hours daily,,,2,,,ChargePoint Network,http://www.chargepoint.com/,GPS,40.845462,-73.015757,10/29/2024,185144,2024-10-29 01:22:57,,,,02/18/2021,J1772
ELEC,Macerich Fashion Outlets of Niagara Falls,1805 Fashion Outlets Blvd,,Niagara Falls,NY,14304,,833-632-2778,E,,Public,24 hours daily,,,,4,,Electrify America,https://www.electrifyamerica.com/,GPS,43.097350,-78.982360,10/29/2024,236034,2024-10-29 02:58:00,,,,11/12/2022,J1772COMBO
ELEC,Nassau Community College,One Education Drive,,Garden City,NY,11530,,866-816-7584,E,,Public,24 hours daily,,,6,,,EV Connect,http://evconnect.com/,GPS,40.730794,-73.591287,10/29/2024,123145,2024-10-29 03:08:34,,,,04/01/2019,J1772
ELEC,Tehan's Plaza - Hannaford,4605 Commercial Drive,,New Hartford,NY,13413,,1-844-623-1001,E,,Public,24 hours daily,,,8,,,LIVINGSTON,https://www.solution.energy,GPS,43.087860,-75.315620,10/29/2024,189536,2024-10-29 04:04:38,,,,04/30/2021,J1772
ELEC,Econolodge,543 Aviation Road,,Queensbury,NY,12804,,1-844-623-1001,E,,Public,24 hours daily,,,6,,,LIVINGSTON,https://www.solution.energy,GPS,43.330070,-73.679910,10/29/2024,223095,2024-10-29 04:05:53,,,,10/28/2021,J1772
ELEC,ESF LOT P22 1,Stadium Place,,Syracuse,NY,13210,,888-758-4389,E,,Public,24 hours daily,,,2,,,ChargePoint Network,http://www.chargepoint.com/,GPS,43.035251,-76.139692,10/29/2024,197196,2024-10-29 01:32:45,,,,10/07/2021,J1772
ELEC,ULSTER COUNTY UCAT 1,1 Danny Circle,Front Parking Lot,Kingston,NY,12401,,888-758-4389,E,,Public,24 hours daily,,,2,,,ChargePoint Network,http://www.chargepoint.com/,GPS,41.917861,-74.016960,10/29/2024,322887,2024-10-29 02:12:10,,,,12/16/2023,J1772
ELEC,Candlewood Gardens,34 Candlewood Gardens,,Baldwinsville,NY,13027,,1-844-623-1001,E,,Public,24 hours daily,,,10,,,LIVINGSTON,https://www.solution.energy,GPS,43.164710,-76.324830,10/29/2024,350374,2024-10-29 04:06:42,,,,07/11/2024,J1772
ELEC,Harbec,358 Timothy Ln,,Ontario,NY,14519,,833-692-6787,E,,Public - Credit card at all times,Contact station for hours of availability.,A ANDROID_PAY APPLE_PAY CREDIT D M,,10,,,AMPUP,https://ampup.io/,200-9,43.226684,-77.361389,10/11/2022,229932,2023-02-14 15:54:11,P,,,09/15/2022,J1772
ELEC,31-99 33rd St,31-99 33rd St,,Astoria,NY,11106,,888-356-8911,E,,Public,24 hours daily,,,2,,,FLO,https://flo.ca/,GPS,40.761412,-73.923755,10/29/2024,193926,2024-10-29 03:33:16,,,,08/14/2021,J1772
ELEC,HAMPTON INN STATION 5,1120 South Ave,Side of Hampton Inn & Suites,Staten Island,NY,10314,,888-758-4389,E,,Public,24 hours daily,,,2,,,ChargePoint Network,http://www.chargepoint.com/,GPS,40.612706,-74.179076,10/29/2024,181664,2024-10-29 01:21:03,,,,01/27/2021,J1772
ELEC,Ramboll Americas,7600 Morgan Road,,Liverpool,NY,13090,,888-998-2546,E,,Public,24 hours daily,,,1,,,Blink Network,http://www.blinkcharging.com/,GPS,43.137448,-76.204093,10/29/2024,310296,2024-10-29 00:26:02,,,,05/18/2022,J1772
ELEC,MONROE COUNTY MCC BR W1,1000 East Henrietta Road MCC Parking Lot V,"MCC Brighton Campus Visitors Parking Lot V, North side of Lot",Rochester,NY,14623,,888-758-4389,E,,Public,24 hours daily,,,2,,,ChargePoint Network,http://www.chargepoint.com/,GPS,43.101324,-77.612609,10/29/2024,332705,2024-10-29 02:18:02,,,,04/20/2024,J1772
ELEC,NEW SHOWROOM,1055 E Jericho Turnpike,West side of bldg,Huntington,NY,11743,,888-758-4389,E,,Public,24 hours daily,,,2,,,ChargePoint Network,http://www.chargepoint.com/,GPS,40.835537,-73.369803,10/29/2024,162149,2024-10-29 00:57:49,,,,06/12/2020,J1772
ELEC,TSS ALBANY STATIONS 3 & 4,2 Commerce Park Dr,second pedestal nearest 2nd parking lot entrance,Schenectady,NY,12309,,888-758-4389,E,,Public,24 hours daily,,,2,,,ChargePoint Network,http://www.chargepoint.com/,GPS,42.832916,-73.903890,10/29/2024,183224,2024-10-29 01:08:29,,,,01/27/2021,J1772
ELEC,Castellani Art Museum - Niagara University,5795 Lewiston Rd,,Niagara University,NY,14109,,716-286-8200,E,,Public,24 hours daily,,,2,,,Non-Networked,,GPS,43.136934,-79.036462,03/14/2024,147097,2024-03-14 18:02:10,P,,,01/01/2019,J1772
ELEC,CORP COMM 3 STATION 3 CC3,Teleport Dr/Corp Commons Bldg,"Parking Garage, 2nd Floor",Staten Island,NY,10314,,888-758-4389,E,,Public,24 hours daily,,,2,,,ChargePoint Network,http://www.chargepoint.com/,GPS,40.604086,-74.179358,10/29/2024,252135,2024-10-29 01:21:30,,,,01/26/2023,J1772
ELEC,IBEW LU86 STATION IBEW,2300 E River Rd,,Rochester,NY,14623,,888-758-4389,E,,Public,24 hours daily,,,2,,,ChargePoint Network,http://www.chargepoint.com/,GPS,43.096887,-77.676742,10/29/2024,162168,2024-10-29 00:57:01,,,,06/12/2020,J1772
ELEC,Village Crest Apartments - West,510 Maloney Road,,Poughkeepsie,NY,12603,,1-844-623-1001,E,,Public,24 hours daily,,,8,,,LIVINGSTON,https://www.solution.energy,GPS,41.641860,-73.872170,10/29/2024,324889,2024-10-29 04:05:50,,,,10/26/2023,J1772
ELEC,SCHENECTADY CITY HALL,500-530 Liberty St,Corner of Clinton and Liberty outside of Schenectady City Hall,Schenectady,NY,12305,,888-758-4389,E,,Public,24 hours daily,,,2,,,ChargePoint Network,http://www.chargepoint.com/,GPS,42.814348,-73.939017,10/29/2024,162342,2024-10-29 00:50:53,,,,06/12/2020,J1772
ELEC,Mohawk Valley Welcome Center,I90 Westbound Milepost 187,,Fultonville,NY,12072,,855-900-7584,E,,Public,24 hours daily,,,,1,,SHELL_RECHARGE,https://www.shell.us/motorist/electric-vehicle-charging.html,GPS,42.916275,-74.446342,10/29/2024,165567,2024-10-29 02:44:04,,,,08/27/2020,CHADEMO J1772COMBO
ELEC,35 N Main St.,35 N. Main St.,,Gloversville,NY,12078,,1-844-623-1001,E,,Public,24 hours daily,,,6,,,LIVINGSTON,https://www.solution.energy,GPS,43.051660,-74.345140,10/29/2024,223239,2024-10-29 04:05:03,,,,03/01/2022,J1772
ELEC,SKIDMORE PALAMOUNTAIN 2,Perimeter Rd,,Saratoga Springs,NY,12866,,888-758-4389,E,,Public,24 hours daily,,,2,,,ChargePoint Network,http://www.chargepoint.com/,GPS,43.098194,-73.783683,10/29/2024,227644,2024-10-29 00:55:55,,,,09/16/2022,J1772
ELEC,79 South Ferry Road (US-B99-2XN-1),79 South Ferry Road,,Shelter Island,NY,11964,,866-576-1495,E,,Public,24 hours daily,A ACCOUNT_BALANCE D M V,,1,,,RIVIAN_WAYPOINTS,https://rivian.com/experience/charging,GPS,41.057060,-72.324480,10/29/2024,225918,2024-10-29 03:16:12,,,,08/18/2022,J1772
ELEC,William Henry Miller Inn - Tesla Destination,303 N Aurora St,,Ithaca,NY,14850,,877-798-3752,E,,Public,,,,1,,,Tesla Destination,https://www.tesla.com/destination-charging,200-9,42.441678,-76.495340,07/01/2024,114959,2024-10-16 16:58:41,P,,,03/08/2016,TESLA
ELEC,C&P REAL ESTATE STATION 1,99 Seaview Blvd,3rd Floor North Roof Parking Deck,Port Washington,NY,11050,,888-758-4389,E,,Public,24 hours daily,,,2,,,ChargePoint Network,http://www.chargepoint.com/,GPS,40.814360,-73.665670,10/29/2024,328473,2024-10-29 02:14:00,,,,02/15/2024,J1772
ELEC,TPWC TPWC 11A,2594 Western Av,Bldg 12,Altamont,NY,12009,,888-758-4389,E,,Public,24 hours daily,,,1,,,ChargePoint Network,http://www.chargepoint.com/,GPS,42.714348,-73.934726,10/29/2024,227774,2024-10-29 01:32:01,,,,09/17/2022,J1772
ELEC,AT LABS ATL STATION 4,22 Corporate Dr,,Clifton Park,NY,12065,,888-758-4389,E,,Public,24 hours daily,,,2,,,ChargePoint Network,http://www.chargepoint.com/,GPS,42.848106,-73.758224,10/29/2024,213549,2024-10-29 01:35:35,,,,04/07/2022,J1772
ELEC,Greymoor Way - Building 14,2608 Pipers Ct,,Baldwinsville,NY,13027,,1-844-623-1001,E,,Public,24 hours daily,,,2,,,LIVINGSTON,https://www.solution.energy,GPS,43.180980,-76.300080,10/29/2024,223129,2024-10-29 04:05:54,,,,10/28/2021,J1772
ELEC,FEHBOCES FEH BOCES,23 Huskie Ln,,Malone,NY,12953,,888-758-4389,E,,Public,24 hours daily,,,2,,,ChargePoint Network,http://www.chargepoint.com/,GPS,44.841328,-74.281940,10/29/2024,170502,2024-10-29 01:24:05,,,,12/24/2020,J1772
ELEC,LIVEWELL GROUP 2490 POND VIEW,2581-2575 Pond View,,Castleton-on-Hudson,NY,12033,,888-758-4389,E,,Public,24 hours daily,,,2,,,ChargePoint Network,http://www.chargepoint.com/,GPS,42.583511,-73.671522,10/29/2024,190838,2024-10-29 01:27:39,,,,06/09/2021,J1772
ELEC,POUGHEEPSIE EV POUGHKEEPSIE 3,197 main st,Muncipal parking lot on the corner of Main St &  East-West Arterial,Poughkeepsie,NY,12601,,888-758-4389,E,,Public,Mon 12:00am - 12:00am; Tue 12:00am - 12:00am; Wed 12:00am - 12:00am; Thu 12:00am - 12:00am; Fri 12:00am - 12:00am; Sat 12:00am - 12:00am; Sun 12:00am - 12:00am,,,2,,,ChargePoint Network,http://www.chargepoint.com/,GPS,41.704998,-73.931040,10/29/2024,183109,2024-10-29 01:04:38,,,,01/27/2021,J1772
ELEC,PATCHVILLAGE PATCHOGUE,14 Baker St,,Patchogue,NY,11772,,888-758-4389,E,,Public,24 hours daily,,,2,,,ChargePoint Network,http://www.chargepoint.com/,GPS,40.761692,-73.012230,10/29/2024,152239,2024-10-29 01:07:24,,,,01/07/2020,J1772
ELEC,CARMEL REDMILLS REALTY,575 S Lake Blvd,,Mahopac Falls,NY,10542,,888-758-4389,E,,Public,24 hours daily,,,2,,,ChargePoint Network,http://www.chargepoint.com/,GPS,41.374869,-73.763594,10/29/2024,261352,2024-10-29 02:02:51,,,,05/25/2023,J1772
ELEC,1350 EGGERT RD EGGERT (1),1350 Eggert Rd,,Buffalo,NY,14226,,888-758-4389,E,,Public,24 hours daily,,,2,,,ChargePoint Network,http://www.chargepoint.com/,GPS,42.965328,-78.804684,10/29/2024,154369,2024-10-29 01:13:05,,,,03/07/2020,J1772
ELEC,SAVARINO COMPAN BRL 6,BRL Parking Lot 4th from building 1 South Str,,Buffalo,NY,14204,,888-758-4389,E,,Public,24 hours daily,,,2,,,ChargePoint Network,http://www.chargepoint.com/,GPS,42.863679,-78.868118,10/29/2024,164153,2024-10-29 01:17:29,,,,07/11/2020,J1772
ELEC,Manhattan Parking 110 LLC - Tesla Destination,543 W 110th St,,New York,NY,10025,,877-798-3752,E,,Public,,,,3,,,Tesla Destination,https://www.tesla.com/destination-charging,200-9,40.803934,-73.966049,07/01/2024,150722,2024-10-16 16:58:41,P,,,02/06/2017,J1772 TESLA
ELEC,67-76 Booth St - 67-76 Booth Street,67-76 Booth St,,Queens,NY,11375,,813-492-5220,E,,Public,24 hours daily,A ANDROID_PAY APPLE_PAY D M V,,10,,,EVOKE,https://evokesystems.com/,GPS,40.724533,-73.852131,10/11/2024,357089,2024-10-11 18:09:31,P,,,06/03/2024,J1772
ELEC,COLACINO INUSTR COLACINO 1,126 Harrison St,"Off Harrison St, in front of Colacino Industries",Newark,NY,14513,,888-758-4389,E,,Public,24 hours daily,,,2,,,ChargePoint Network,http://www.chargepoint.com/,GPS,43.049100,-77.094025,10/29/2024,143218,2024-10-29 01:04:31,,,,08/15/2019,J1772
ELEC,NATIONAL GRID SUNY IT,Campus Loop Rd,SUNY IT Student center parking lot C,Utica,NY,13502,,888-758-4389,E,,Public,24 hours daily,,,2,,,ChargePoint Network,http://www.chargepoint.com/,GPS,43.135329,-75.227342,10/29/2024,162236,2024-10-29 00:55:22,,,,06/12/2020,J1772
ELEC,T F Brown's Restaurant,214 Main St,,Batavia,NY,14020,,585-343-1547,E,,Public - Credit card at all times,24 hours daily,A D Debit M V,,2,,,Non-Networked,,GPS,42.996234,-78.180205,05/09/2024,226495,2024-05-09 20:32:20,P,,,08/24/2022,J1772
ELEC,Alexander CSD,3314 Buffalo St,,Alexander,NY,14005,,1-888-717-4544,E,,Public,24 hours daily,,,4,,,CHARGESMART_EV,https://chargesmartev.com,GPS,42.900820,-78.262245,10/29/2024,333786,2024-10-29 04:09:12,,,,10/23/2023,J1772
ELEC,Gauthier's Saranac Lake Inn,488 Lake Flower Ave,,Saranac Lake,NY,12983,,1-844-623-1001,E,,Public,24 hours daily,,,4,,,LIVINGSTON,https://www.solution.energy,GPS,44.314720,-74.119630,10/29/2024,223226,2024-10-29 04:04:59,,,,12/11/2021,J1772
ELEC,CORNELL STATION11,Ellis Hollow Road,booth field,East Ithaca,NY,14850,,888-758-4389,E,,Public,24 hours daily,,,2,,,ChargePoint Network,http://www.chargepoint.com/,GPS,42.436257,-76.454587,10/29/2024,326305,2024-10-29 02:13:35,,,,01/23/2024,J1772
ELEC,Northville Waterfront Park,412 S Main St,,Northville,NY,12134,,615-743-3090,E,,Public - Credit card at all times,24 hours daily,A D Debit M V,,2,,,Non-Networked,,GPS,43.221527,-74.169122,03/14/2024,229067,2024-03-14 18:02:10,P,,,09/19/2022,J1772
ELEC,Staples Plaza - Tesla Supercharger,3379 Crompond Road,,Yorktown Heights,NY,10589,,877-798-3752,E,,Public,24 hours daily. Please check Tesla's online station map to see if an adapter is required at this location.,,,,12,,Tesla,https://www.tesla.com/supercharger,200-8,41.290501,-73.832487,07/01/2024,149366,2024-08-14 18:58:22,P,,,09/30/2019,TESLA
ELEC,Rapidpark 205 W 101st Street - Tesla Destination,205 W 101st Street,,New York,NY,10025,,877-798-3752,E,,Public,,,,3,,,Tesla Destination,https://www.tesla.com/destination-charging,200-9,40.797603,-73.968503,07/01/2024,169060,2024-10-16 16:58:41,P,,,11/03/2020,J1772 TESLA
ELEC,IRVING CROUSE HEALTH 2,701 Irving Avenue,Station is on the first entrance on ramp,Syracuse,NY,13210,,888-758-4389,E,,Public,24 hours daily,,,2,,,ChargePoint Network,http://www.chargepoint.com/,GPS,43.042242,-76.137333,10/29/2024,346502,2024-10-29 02:18:59,,,,05/18/2024,J1772
ELEC,FIVE-STAR BANK NORTH CHARGER,6215 Sheridan Dr,North Charger West Parking Lot,Buffalo,NY,14221,,888-758-4389,E,,Public,24 hours daily,,,2,,,ChargePoint Network,http://www.chargepoint.com/,GPS,42.977447,-78.702482,10/29/2024,225163,2024-10-29 01:45:55,,,,08/09/2022,J1772
ELEC,SPOT cowork,21 Goodway Drive,,Henrietta,NY,14623,,866-816-7584,E,,Public,24 hours daily,,,6,,,EV Connect,http://evconnect.com/,GPS,43.091767,-77.580578,10/29/2024,230835,2024-10-29 03:09:14,,,,09/30/2022,J1772
ELEC,Capital Region BOCES North,925 Watervliet Shaker Road,,Albany,NY,12205,,1-844-623-1001,E,,Public,24 hours daily,,,4,,,LIVINGSTON,https://www.solution.energy,GPS,42.744400,-73.823580,10/29/2024,334528,2024-10-29 04:04:43,,,,05/02/2024,J1772
ELEC,STPETERHOSPITAL EV STATION #8,315 S Manning Blvd,,Albany,NY,12208,,888-758-4389,E,,Public,24 hours daily,,,2,,,ChargePoint Network,http://www.chargepoint.com/,GPS,42.654665,-73.802580,10/29/2024,212977,2024-10-29 01:40:47,,,,03/27/2022,J1772
ELEC,Nannen Arboretum,28 Parkside Dr,,Ellicottville,NY,14731,,716-699-2377,E,,Public,24 hours daily,,,2,,,Non-Networked,,GPS,42.283144,-78.669294,05/09/2024,157960,2024-05-09 20:32:20,P,,,05/15/2020,J1772
ELEC,CGCC PAC Lot,4400 NY-23,,Hudson,NY,12534,,1-844-623-1001,E,,Public,24 hours daily,,,10,,,LIVINGSTON,https://www.solution.energy,GPS,42.218040,-73.816080,10/29/2024,324788,2024-10-29 04:05:45,,,,06/12/2023,J1772
ELEC,RRH CARTER 2 FL NG3,1415 Portland Ave,"2nd Floor, East Side, Near Elevator",Rochester,NY,14621,,888-758-4389,E,,Public,24 hours daily,,,2,,,ChargePoint Network,http://www.chargepoint.com/,GPS,43.191539,-77.588742,10/29/2024,145395,2024-10-29 01:03:46,,,,09/20/2019,J1772
ELEC,NATIONAL GRID BUFFALO STATE,1300 Elmwood Ave,,Buffalo,NY,14222,,888-758-4389,E,,Public,24 hours daily,,,2,,,ChargePoint Network,http://www.chargepoint.com/,GPS,42.931359,-78.879109,10/29/2024,162136,2024-10-29 00:58:53,,,,06/12/2020,J1772
ELEC,MARKET 32 EV MARKET32 SAR SP,3045 rt 50,In front of building.,Saratoga Springs,NY,12866,,888-758-4389,E,,Public,24 hours daily,,,2,,,ChargePoint Network,http://www.chargepoint.com/,GPS,43.102972,-73.742407,10/29/2024,154240,2024-10-29 01:09:51,,,,03/03/2020,J1772
ELEC,WW BMW WWBMW 2,125 NY-59,Front left unit,Nanuet,NY,10954,,888-758-4389,E,,Public,24 hours daily,,,2,,,ChargePoint Network,http://www.chargepoint.com/,GPS,41.107337,-74.037243,10/29/2024,224589,2024-10-29 01:00:33,,,,07/29/2022,J1772
ELEC,5TH AVE RIVER STREET 1,King St & Federal St,,Troy,NY,12180,,888-758-4389,E,,Public,24 hours daily,,,2,,,ChargePoint Network,http://www.chargepoint.com/,GPS,42.735123,-73.688090,10/29/2024,175239,2024-10-29 01:12:34,,,,01/27/2021,J1772
ELEC,Poland Town Court,3593 Church St,,Kennedy,NY,14747,,716-267-3809,E,,Public - Credit card at all times,24 hours daily,A D Debit M V,,1,,,Non-Networked,,GPS,42.158311,-79.101438,03/14/2024,226487,2024-03-14 18:02:10,P,,,08/22/2022,J1772
ELEC,NYE CDJR,1553 Upper Lenox Avenue,,Oneida,NY,13421,,1-888-717-4544,E,,Public,24 hours daily,,,1,4,,CHARGESMART_EV,https://chargesmartev.com,GPS,43.077597,-75.687416,10/29/2024,334036,2024-10-29 04:09:30,,,,10/24/2023,J1772 J1772COMBO
ELEC,Riverview East - Garage,251 E 32nd St,,New York,NY,10016,,813-492-5220,E,,Public,24 hours daily,A ANDROID_PAY APPLE_PAY D M V,,4,,,EVOKE,https://evokesystems.com/,GPS,40.743800,-73.976900,10/11/2024,356977,2024-10-11 18:09:31,P,,,01/13/2022,J1772
ELEC,SWL SARANAC 1.3,234 Lake Flower Ave,Lake side in new parking lot of hotel,Saranac Lake,NY,12983,,888-758-4389,E,,Public,24 hours daily,,,2,,,ChargePoint Network,http://www.chargepoint.com/,GPS,44.322690,-74.123240,10/29/2024,169509,2024-10-29 01:21:37,,,,11/26/2020,J1772
ELEC,TIOGA HOTEL CASINO 2,NY-17,,Nichols,NY,13812,,888-758-4389,E,,Public,24 hours daily,,,2,,,ChargePoint Network,http://www.chargepoint.com/,GPS,42.024254,-76.410740,10/29/2024,180147,2024-10-29 00:49:30,,,,01/27/2021,J1772
ELEC,TOWN OF MORIAH MORIAHEV1,3258 Broad St,Parking lot next to Moriah Post office,Port Henry,NY,12974,,888-758-4389,E,,Public,24 hours daily,,,2,,,ChargePoint Network,http://www.chargepoint.com/,GPS,44.048466,-73.460976,10/29/2024,214259,2024-10-29 01:39:19,,,,04/19/2022,J1772
ELEC,APDC ADMIN LOT PORT 1.2,106 Smith Blvd,Near rear entrance of Albany port district commission.,Albany,NY,12202,,888-758-4389,E,,Public,24 hours daily,,,2,,,ChargePoint Network,http://www.chargepoint.com/,GPS,42.626232,-73.758250,10/29/2024,165222,2024-10-29 01:18:36,,,,08/14/2020,J1772
ELEC,Clearwater Beach - Clearwater Beach Parking,1875 Ocean Blvd,,Atlantic Beach,NY,11509,,813-492-5220,E,,Public,24 hours daily,A ANDROID_PAY APPLE_PAY D M V,,4,,,EVOKE,https://evokesystems.com/,GPS,40.586664,-73.732595,10/11/2024,356948,2024-10-11 18:09:31,P,,,07/23/2022,J1772
ELEC,Factory House Condominium - Crescent St,42-60 Crescent St,,Queens,NY,11101,,813-492-5220,E,,Public,24 hours daily,A ANDROID_PAY APPLE_PAY D M V,,10,,,EVOKE,https://evokesystems.com/,GPS,40.749177,-73.942084,10/11/2024,357033,2024-10-11 18:09:31,P,,,08/15/2023,J1772
ELEC,The Fern Lodge - Tesla Destination,46 Fiddlehead Bay Rd,,Chestertown,NY,12817,,877-798-3752,E,,Public,,,,2,,,Tesla Destination,https://www.tesla.com/destination-charging,200-9,43.625261,-73.849046,07/01/2024,114923,2024-10-16 16:58:41,P,,,11/03/2017,TESLA
ELEC,Paumanok Vineyards - Tesla Destination,1074 Main Rd (Route 25),,Aquebogue,NY,11931,,877-798-3752,E,,Public,,,,1,,,Tesla Destination,https://www.tesla.com/destination-charging,GPS,40.948767,-72.603648,07/01/2024,114880,2024-10-16 16:58:41,P,,,03/30/2017,TESLA
ELEC,PANYNJ LGA WEST 3,LGA West Garage LaGuardia Airport,,East Elmhurst,NY,11371,,888-758-4389,E,,Public,24 hours daily,,,1,,,ChargePoint Network,http://www.chargepoint.com/,GPS,40.773009,-73.875324,10/29/2024,162287,2024-10-29 00:52:40,,,,06/12/2020,J1772
ELEC,Icon Parking 202 E 18th Street - Tesla Destination,202 E 18th St,,Manhattan,NY,10003,,877-798-3752,E,,Public,,,,2,,,Tesla Destination,https://www.tesla.com/destination-charging,200-8,40.735496,-73.985024,07/01/2024,150570,2024-10-16 16:58:41,P,,,03/31/2019,TESLA
ELEC,Home2 Suites by Hilton Middletown - Tesla Destination,600 Route 211 E,,Middletown,NY,10941,,877-798-3752,E,,Public,,,,2,,,Tesla Destination,https://www.tesla.com/destination-charging,200-9,41.463118,-74.369714,07/01/2024,114976,2024-10-16 16:58:41,P,,,12/05/2016,TESLA
ELEC,TOWN OF BABYLON TOWN ANNEX 1,281 Phelps Ln,Left side station,North Babylon,NY,11703,,888-758-4389,E,,Public,24 hours daily,,,1,,,ChargePoint Network,http://www.chargepoint.com/,GPS,40.728081,-73.330953,10/29/2024,180133,2024-10-29 00:52:45,,,,01/27/2021,J1772
ELEC,EVCS1 CANANDAIGUA,105 S Main St,Municipal parking lot.,Canandaigua,NY,14424,,888-758-4389,E,,Public,24 hours daily,,,2,,,ChargePoint Network,http://www.chargepoint.com/,GPS,42.886636,-77.279259,10/29/2024,162360,2024-10-29 00:50:04,,,,06/12/2020,J1772
ELEC,233 LAKE AVE GROVE 1.1,233 Lake Ave,,Saratoga Springs,NY,12866,,888-758-4389,E,,Public,24 hours daily,,,2,,,ChargePoint Network,http://www.chargepoint.com/,GPS,43.085484,-73.765660,10/29/2024,182060,2024-10-29 01:23:39,,,,01/27/2021,J1772
ELEC,GHMC PARKINGGARAGE3,707 E Main St,PARKING GARAGE 3,Middletown,NY,10940,,888-758-4389,E,,Public,24 hours daily,,,2,,,ChargePoint Network,http://www.chargepoint.com/,GPS,41.441870,-74.367001,10/29/2024,202332,2024-10-29 01:37:11,,,,12/10/2021,J1772
ELEC,ERIE COUNTY ISLEVIEW,800 Niagara St,,Tonawanda,NY,14150,,888-758-4389,E,,Public,Mon 6:00am - 9:00pm; Tue 6:00am - 9:00pm; Wed 6:00am - 9:00pm; Thu 6:00am - 9:00pm; Fri 6:00am - 9:00pm; Sat 6:00am - 9:00pm; Sun 6:00am - 9:00pm,,,2,,,ChargePoint Network,http://www.chargepoint.com/,GPS,43.010323,-78.907524,10/29/2024,164077,2024-10-29 01:13:57,,,,07/09/2020,J1772
ELEC,Saratoga Auto Museum - Tesla Destination,110 Ave of the Pines,,Saratoga Springs,NY,12866,,877-798-3752,E,,Public,,,,2,,,Tesla Destination,https://www.tesla.com/destination-charging,200-8,43.057279,-73.804334,07/01/2024,115234,2024-10-16 16:58:41,P,,,08/14/2014,TESLA
ELEC,MB OF BUFFALO DC MERC BUFF 2,8185 Main St,"Due to construction, station will be unavailable.",Williamsville,NY,14221,,888-758-4389,E,,Public,24 hours daily,,,,1,,ChargePoint Network,http://www.chargepoint.com/,GPS,42.964533,-78.689716,10/29/2024,202804,2024-10-29 01:37:37,,,,12/18/2021,CHADEMO J1772COMBO
ELEC,AUCITON DIRECT AUCTIONDIRECT1,6520 96,,Victor,NY,14564,,888-758-4389,E,,Public,24 hours daily,,,2,,,ChargePoint Network,http://www.chargepoint.com/,GPS,42.976358,-77.387104,10/29/2024,251806,2024-10-29 01:44:53,,,,01/25/2023,J1772
ELEC,TONAWANDA YPR GOLF DOME 2,175 Brompton Rd,,Tonawanda,NY,14150,,888-758-4389,E,,Public,24 hours daily,,,2,,,ChargePoint Network,http://www.chargepoint.com/,GPS,43.002537,-78.840620,10/29/2024,174770,2024-10-29 01:08:08,,,,01/27/2021,J1772
ELEC,WEST HERR AUTO WH SR L2-3,4400 W Ridge Rd,,Rochester,NY,14626,,888-758-4389,E,,Public,24 hours daily,,,1,,,ChargePoint Network,http://www.chargepoint.com/,GPS,43.216470,-77.745837,10/29/2024,352399,2024-10-29 02:23:05,,,,08/10/2024,J1772
ELEC,CHEEKTOWAGA BROADWAY #3,3301 Broadway,,Cheektowaga,NY,14227,,888-758-4389,E,,Public,24 hours daily,,,1,,,ChargePoint Network,http://www.chargepoint.com/,GPS,42.902649,-78.753210,10/29/2024,183765,2024-10-29 01:25:04,,,,02/04/2021,J1772
ELEC,Atlantic Center - Tesla Supercharger,625 Atlantic Avenue B12,,Brooklyn,NY,11217,,877-798-3752,E,,Public,24 hours daily. Please check Tesla's online station map to see if an adapter is required at this location.,,,,12,,Tesla,https://www.tesla.com/supercharger,200-9,40.683715,-73.974337,07/01/2024,149300,2024-08-14 18:58:22,P,,,09/30/2019,TESLA
ELEC,Quik Park West 57 LLC - Tesla Destination,9 W 57th St,,New York,NY,10019,,877-798-3752,E,,Public,,,,3,,,Tesla Destination,https://www.tesla.com/destination-charging,200-9,40.764259,-73.974972,07/01/2024,115193,2024-10-16 16:58:41,P,,,05/21/2015,J1772 TESLA
ELEC,MOHAWK HARBOR01 STATION #4,200 Harborside Dr,Parking deck,Schenectady,NY,12305,,888-758-4389,E,,Public,24 hours daily,,,2,,,ChargePoint Network,http://www.chargepoint.com/,GPS,42.824318,-73.931979,10/29/2024,181904,2024-10-29 01:22:25,,,,01/27/2021,J1772
ELEC,Icon Parking 150 E 58th Street - Tesla Destination,150 E 58th St,,New York,NY,10155,,877-798-3752,E,,Public,,,,3,,,Tesla Destination,https://www.tesla.com/destination-charging,200-9,40.761390,-73.968269,07/01/2024,115019,2024-10-16 16:58:41,P,,,04/30/2016,J1772 TESLA
ELEC,CITY HALL 12534 CITY HALL 1,542 Warren St,,Hudson,NY,12534,,888-758-4389,E,,Public,24 hours daily,,,2,,,ChargePoint Network,http://www.chargepoint.com/,GPS,42.249100,-73.784690,10/29/2024,174709,2024-10-29 01:08:38,,,,01/27/2021,J1772
ELEC,Forrest Pointe - South,1 Forrest Pointe Drive,,East Greenbush,NY,12061,,1-844-623-1001,E,,Public,24 hours daily,,,8,,,LIVINGSTON,https://www.solution.energy,GPS,42.610060,-73.716030,10/29/2024,324797,2024-10-29 04:06:11,,,,10/12/2023,J1772
ELEC,imPark 101 Bedford Ave - Tesla Destination,101 Bedford Ave,,Brooklyn,NY,11211,,877-798-3752,E,,Public,,,,3,,,Tesla Destination,https://www.tesla.com/destination-charging,200-9,40.719751,-73.954866,07/01/2024,114918,2024-10-16 16:58:41,P,,,01/09/2018,J1772 TESLA
ELEC,Burdick Nissan,5885 E Circle Dr,,Cicero,NY,13039,,315-458-8915,E,,Public - Call ahead,Dealership business hours,,,1,,,Non-Networked,,200-9,43.147147,-76.114274,02/12/2024,44331,2024-02-12 15:25:05,P,,,11/30/2011,J1772
ELEC,46-54 Angle St,46-54 Angle St,,Buffalo,NY,14214,,866-816-7584,E,,Public,24 hours daily,,,4,,,EV Connect,http://evconnect.com/,GPS,42.953818,-78.833144,10/29/2024,329578,2024-10-29 03:12:46,,,,02/29/2024,J1772
ELEC,HOTEL LOCATION HIPF 1 RIGHT,950 Panorama Trail S,Upper East Side Right Charger,Rochester,NY,14625,,888-758-4389,E,,Public,24 hours daily,,,2,,,ChargePoint Network,http://www.chargepoint.com/,GPS,43.125002,-77.487737,10/29/2024,240778,2024-10-29 01:55:00,,,,01/02/2023,J1772
ELEC,Kimball Ave,41 Kimball Ave,,Yonkers,NY,10704,,866-816-7584,E,,Public,24 hours daily,,,2,,,EV Connect,http://evconnect.com/,GPS,40.904619,-73.867704,10/29/2024,333690,2024-10-29 03:11:24,,,,04/27/2024,J1772
ELEC,1170 Ocean Ave - Garage,1170 Ocean Ave,,Brooklyn,NY,11230,,813-492-5220,E,,Public,24 hours daily,A ANDROID_PAY APPLE_PAY D M V,,8,,,EVOKE,https://evokesystems.com/,GPS,40.633884,-73.958535,10/11/2024,356910,2024-10-11 18:09:31,P,,,10/20/2022,J1772
ELEC,EV BEVERLY1 FLEET 1,660 E Jericho Turnpike,Fleet Charger,Huntington Station,NY,11746,,888-758-4389,E,,Public,24 hours daily,,,1,,,ChargePoint Network,http://www.chargepoint.com/,GPS,40.833581,-73.386120,10/29/2024,347744,2024-10-29 02:12:47,,,,06/14/2024,J1772
ELEC,1223 NY-300 (US-HAE-P7H-1B),1223 NY-300,,Newburgh,NY,12550,,866-576-1495,E,,Public,24 hours daily; for Rivian use only,A ACCOUNT_BALANCE D M V,,,1,,RIVIAN_ADVENTURE,https://rivian.com/experience/charging,GPS,41.501070,-74.072390,10/29/2024,330359,2024-10-29 03:18:01,,,,03/13/2024,J1772COMBO
ELEC,JLR MT KISCO CPF 50 1,299 Kisco Ave,,Mount Kisco,NY,10549,,888-758-4389,E,,Public,24 hours daily,,,1,,,ChargePoint Network,http://www.chargepoint.com/,GPS,41.219025,-73.725280,10/29/2024,357741,2024-10-29 02:05:34,,,,10/10/2024,J1772
ELEC,COOPERS CORNER CAR CHARGE STAT,11 Mill Rd,Parking Lot,New Rochelle,NY,10804,,888-758-4389,E,,Public,24 hours daily,,,2,,,ChargePoint Network,http://www.chargepoint.com/,GPS,40.954884,-73.797253,10/29/2024,335725,2024-10-29 01:59:26,,,,05/08/2024,J1772
ELEC,HAMILTON EDU CAMPUS SAFETY 1,Campus Safety Office,"Charges for use of station will begin on August 12th, 2024. $0.20 Kwh for the first 4 hours. An idling fee of $5.00 will be charged over the 5th hour and every hour after.",Clinton,NY,13323,,888-758-4389,E,,Public,24 hours daily,,,2,,,ChargePoint Network,http://www.chargepoint.com/,GPS,43.051196,-75.408482,10/29/2024,349132,2024-10-29 02:20:41,,,,06/25/2024,J1772
ELEC,Rapidpark 210 W 102nd Street - Tesla Destination,210 W 102st St,,New York,NY,10025,,877-798-3752,E,,Public,,,,3,,,Tesla Destination,https://www.tesla.com/destination-charging,200-9,40.798108,-73.968204,07/01/2024,115051,2024-10-16 16:58:41,P,,,08/17/2017,J1772 TESLA
ELEC,FISHKILL SUMLAND,1399 Rt 52,,Fishkill,NY,12524,,888-758-4389,E,,Public,24 hours daily,,,2,,,ChargePoint Network,http://www.chargepoint.com/,GPS,41.539739,-73.886332,10/29/2024,261054,2024-10-29 01:49:01,,,,05/19/2023,J1772
ELEC,SUNY WCC LOT 3 STATION A,75 Grasslands Rd,,Valhalla,NY,10595,,888-758-4389,E,,Public,24 hours daily,,,2,,,ChargePoint Network,http://www.chargepoint.com/,GPS,41.067482,-73.789428,10/29/2024,252924,2024-10-29 01:42:37,,,,02/01/2023,J1772
ELEC,MONROE COUNTY STADIUM N1,One Morrie Silver Way Innovative Stadium,Parking Lot at Innovative Stadium,Rochester,NY,14608,,888-758-4389,E,,Public,24 hours daily,,,2,,,ChargePoint Network,http://www.chargepoint.com/,GPS,43.157324,-77.621761,10/29/2024,260862,2024-10-29 02:02:00,,,,05/16/2023,J1772
ELEC,Marbletown Community Center,3562 Main St,Located in the parking lot,Stone Ridge,NY,12484,,845-687-7500 x170,E,,Public,24 hours daily,,,2,,,Non-Networked,,GPS,41.852574,-74.139946,03/07/2022,86200,2024-02-20 20:35:14,LG,,,07/01/2017,J1772
ELEC,iPark NYC 183 E 73rd Street - Tesla Destination,184 E 73rd St,,New York,NY,10021,,877-798-3752,E,,Public,,,,3,,,Tesla Destination,https://www.tesla.com/destination-charging,200-8,40.770601,-73.960531,07/01/2024,115034,2024-10-16 16:58:41,P,,,04/30/2016,J1772 TESLA
ELEC,Center Moriches,313 Frowein Rd,,Center Moriches,NY,11934,,866-816-7584,E,,Public,24 hours daily,,,4,,,EV Connect,http://evconnect.com/,GPS,40.804923,-72.807673,10/29/2024,123099,2024-10-29 03:08:22,,,,04/01/2019,J1772
ELEC,Ridgedale Manor - 113-133,55 Pennels Dr.,Along Pennels Drive in between buildings 417-437 and 113-133,Greece,NY,14626,,1-844-623-1001,E,,Public,24 hours daily,,,8,,,LIVINGSTON,https://www.solution.energy,GPS,43.214650,-77.707260,10/29/2024,350795,2024-10-29 04:06:48,,,,07/19/2024,J1772
ELEC,Kendal at Ithaca 3,2230 N Triphammer Rd,,Ithaca,NY,14850,,1-888-717-4544,E,,Public,24 hours daily,,,2,,,CHARGESMART_EV,https://chargesmartev.com,GPS,42.473960,-76.487761,10/29/2024,334127,2024-10-29 04:09:19,,,,01/20/2023,J1772
ELEC,ROSENBLUM300 300 GREAT OAKS,300 Great Oaks Blvd,,Albany,NY,12203,,888-758-4389,E,,Public,24 hours daily,,,2,,,ChargePoint Network,http://www.chargepoint.com/,GPS,42.680984,-73.846759,10/29/2024,118995,2024-10-29 01:00:31,,,,03/08/2019,J1772
ELEC,King Thiel Senior Community,17 Elks Ln,,Latham,NY,12110,,1-844-623-1001,E,,Public,24 hours daily,,,4,,,LIVINGSTON,https://www.solution.energy,GPS,42.726450,-73.741790,10/29/2024,236897,2024-10-29 04:04:45,,,,11/28/2022,J1772
ELEC,8101 NY-68,8101 NY-68,,Ogdensburg,NY,13669,,866-816-7584,E,,Public,24 hours daily,,,6,,,EV Connect,http://evconnect.com/,GPS,44.680164,-75.516847,10/29/2024,357255,2024-10-29 03:12:38,,,,09/29/2024,J1772
ELEC,Monroe Community College - Lot P,1000 E Henrietta Rd,,Rochester,NY,14623,,585-292-2000,E,,Public,24 hours daily; employees only; 4 hour limit,A D Debit M V,,2,,,Non-Networked,,GPS,43.102332,-77.608205,04/14/2024,226504,2024-04-14 22:11:34,P,,,08/24/2022,J1772
ELEC,Stewart's Shops - Tesla Supercharger,647 Mariaville Rd,,Rotterdam,NY,12306,,877-798-3752,E,,Public,24 hours daily. Please check Tesla's online station map to see if an adapter is required at this location.,A D Debit M V,,,8,,Tesla,https://www.tesla.com/supercharger,GPS,42.793260,-74.004921,07/01/2024,257675,2024-08-14 18:58:22,P,,,03/30/2023,TESLA
ELEC,Parkit 221 Thompson Street - Tesla Destination,221 Thompson St,,New York,NY,10012,,877-798-3752,E,,Public,,,,3,,,Tesla Destination,https://www.tesla.com/destination-charging,200-9,40.729234,-73.999013,07/01/2024,115056,2024-10-16 16:58:41,P,,,11/13/2015,J1772 TESLA
ELEC,The Horizon at Fleetwood - 550 Locust Upper Garage,550 Locust St,,Mount Vernon,NY,10552,,813-492-5220,E,,Public,24 hours daily,A ANDROID_PAY APPLE_PAY D M V,,4,,,EVOKE,https://evokesystems.com/,GPS,40.923326,-73.841540,10/11/2024,357059,2024-10-11 18:09:31,P,,,02/22/2022,J1772
ELEC,WEST HERR AUTO WH TC L2-3,2435 NY-332,,Canandaigua,NY,14424,,888-758-4389,E,,Public,24 hours daily,,,2,,,ChargePoint Network,http://www.chargepoint.com/,GPS,42.914363,-77.299764,10/29/2024,256967,2024-10-29 01:56:37,,,,03/24/2023,J1772
ELEC,Madison Towers,60 Presidential Plaza,,Syracuse,NY,13202,,1-844-623-1001,E,,Public,24 hours daily,,,4,,,LIVINGSTON,https://www.solution.energy,GPS,43.046010,-76.143340,10/29/2024,357187,2024-10-29 04:07:00,,,,09/27/2024,J1772
ELEC,HARLEY SCHOOL HARLEY 1,1981 Clover St,Near Peckham wellness entrance,Rochester,NY,14618,,888-758-4389,E,,Public,24 hours daily,,,2,,,ChargePoint Network,http://www.chargepoint.com/,GPS,43.120600,-77.548985,10/29/2024,188099,2024-10-29 01:27:33,,,,04/29/2021,J1772
ELEC,Parkright 257 Gold Street - Tesla Destination,257 Gold St,,Brooklyn,NY,11201,,877-798-3752,E,,Public,,,,3,,,Tesla Destination,https://www.tesla.com/destination-charging,200-9,40.696848,-73.983071,07/01/2024,114895,2024-10-16 16:58:41,P,,,11/13/2015,J1772 TESLA
ELEC,Private Dealer Use Station (L2),18 Union Street,,Sidney,NY,13838,,1-888-222-6618,E,,Public,,,,1,,,NOODOE,https://www.noodoe.com,GPS,42.312325,-75.395229,10/29/2024,355029,2024-10-29 03:58:57,,,,09/05/2024,J1772
ELEC,EPLLC LOCKHEED 2,497 Electronics Pkwy,,Liverpool,NY,13088,,888-758-4389,E,,Public,24 hours daily,,,2,,,ChargePoint Network,http://www.chargepoint.com/,GPS,43.110046,-76.188230,10/29/2024,145764,2024-10-29 01:06:18,,,,10/03/2019,J1772
ELEC,Canasawacta Country Club,261 County Road 44,,Norwich,NY,13815,,1-888-717-4544,E,,Public,24 hours daily,,,8,,,CHARGESMART_EV,https://chargesmartev.com,GPS,42.566448,-75.543443,10/29/2024,333729,2024-10-29 04:09:13,,,,04/14/2023,J1772
ELEC,STONY BROOK UNV ADMIN 1,100 Nicolls Road,,Stony Brook,NY,11790,,888-758-4389,E,,Public,24 hours daily,,,2,,,ChargePoint Network,http://www.chargepoint.com/,GPS,40.914648,-73.119684,10/29/2024,181140,2024-10-29 00:50:40,,,,01/27/2021,J1772
ELEC,419 Stuyvesant Ave,419 Stuyvesant Ave,,Brooklyn,NY,11233,,888-356-8911,E,,Public,24 hours daily,,,2,,,FLO,https://flo.ca/,GPS,40.679727,-73.931347,10/29/2024,202930,2024-10-29 03:32:08,,,,12/22/2021,J1772
ELEC,LANDMARK ALBANY LANDMARK ALBANY,100 Sandidge Way,Front apartment building parking lot of 100 sandidge way,Albany,NY,12203,,888-758-4389,E,,Public,24 hours daily,,,2,,,ChargePoint Network,http://www.chargepoint.com/,GPS,42.687836,-73.833130,10/29/2024,169976,2024-10-29 01:23:24,,,,12/08/2020,J1772
ELEC,BRI - Bay Ridge Municipal Parking Garage,8501 5th Ave,,Brooklyn,NY,11209,,866-816-7584,E,,Public,Mon 8:00am - 10:00pm; Tue 8:00am - 10:00pm; Wed 8:00am - 10:00pm; Thu 8:00am - 10:00pm; Fri 8:00am - 10:00pm; Sat 12:00am - 12:00am; Sun 12:00am - 12:00am,,,5,,,EV Connect,http://evconnect.com/,GPS,40.621698,-74.025670,10/29/2024,65288,2024-10-29 03:08:47,,,,06/01/2015,J1772
ELEC,MICHAELSGRP MICHAELS GROUP2,1 Marion's way,To the left of garage,Mechanicville,NY,12118,,888-758-4389,E,,Public,24 hours daily,,,2,,,ChargePoint Network,http://www.chargepoint.com/,GPS,42.957663,-73.789273,10/29/2024,195768,2024-10-29 01:31:58,,,,09/10/2021,J1772
ELEC,Price Chopper,1060 Madison Ave,,Albany,NY,12208,,518-438-6241,E,,Public,24 hours daily; maximum stay of 2 hours,,,2,,,Non-Networked,,200-9,42.664671,-73.790463,03/08/2023,68579,2024-01-31 22:07:01,P,,,05/01/2015,J1772
ELEC,The Lofts at Saratoga - Maintenance Bldg,18 Lofts Way,,Malta,NY,12020,,1-888-717-4544,E,,Public,24 hours daily,,,4,,,CHARGESMART_EV,https://chargesmartev.com,GPS,42.968269,-73.793842,10/29/2024,333727,2024-10-29 04:09:16,,,,04/04/2023,J1772
ELEC,Parkash 4769 LLC - 4769 White Plains,4769 White Plains Road,,Bronx,NY,10470,,888-998-2546,E,,Public,24 hours daily,,,7,,,Blink Network,http://www.blinkcharging.com/,GPS,40.905461,-73.849791,10/29/2024,241222,2024-10-29 00:17:14,,,,08/05/2022,J1772
ELEC,Brighton Memorial Library,2300 Elmwood Ave,,Rochester,NY,14618,,585-784-5300,E,,Public,24 hours daily,,,2,,,Non-Networked,,200-9,43.127059,-77.575573,03/08/2023,149107,2024-01-31 22:07:01,LG,,,09/26/2016,J1772
ELEC,CHARGE OWASCO STATION 1,2 Bristol Ave,,Auburn,NY,13021,,888-758-4389,E,,Public,24 hours daily,,,2,,,ChargePoint Network,http://www.chargepoint.com/,GPS,42.918320,-76.544980,10/29/2024,202294,2024-10-29 01:02:06,,,,12/10/2021,J1772
ELEC,MHM WALL STREET 2,1 Wall St,Rear of office,Albany,NY,12205,,888-758-4389,E,,Public,24 hours daily,,,2,,,ChargePoint Network,http://www.chargepoint.com/,GPS,42.741604,-73.843380,10/29/2024,235733,2024-10-29 01:46:20,,,,11/05/2022,J1772
ELEC,West Genesee Athletic Club,6415 Pottery RD,,Warens,NY,13164,,1-844-623-1001,E,,Public,24 hours daily,,,2,,,LIVINGSTON,https://www.solution.energy,GPS,43.080330,-76.284060,10/29/2024,223135,2024-10-29 04:05:54,,,,11/18/2021,J1772
ELEC,AAA WESTCENTRAL AAA L2 4,100 International Drive,Along Sheridan Dr. street side of building,Amherst,NY,14221,,888-758-4389,E,,Public,24 hours daily,,,2,,,ChargePoint Network,http://www.chargepoint.com/,GPS,42.978249,-78.730125,10/29/2024,261208,2024-10-29 02:00:32,,,,05/23/2023,J1772
ELEC,National Grid - Syracuse Office Center,300 Erie Blvd W,"In customer parking lot, access off of Genesee Street",Syracuse,NY,13202,,315-474-1511,E,,Public,"8am-5pm M-F, 24 hours Sat-Sun",,,1,,,Non-Networked,,200-9,43.051581,-76.157208,01/09/2024,123603,2024-01-31 22:07:01,T,,,03/01/2019,J1772
ELEC,Municipal Marina & Campground,302 Marina Dr,,Montour Falls,NY,14865,,866-816-7584,E,,Public,24 hours daily,,,4,,,EV Connect,http://evconnect.com/,GPS,42.355437,-76.852614,10/29/2024,350047,2024-10-29 03:13:11,,,,07/06/2024,J1772
ELEC,G & M REALTY 2 STATION 5,22-44 Jackson Ave,Parking Garage,LIC,NY,11101,,888-758-4389,E,,Public,24 hours daily,,,2,,,ChargePoint Network,http://www.chargepoint.com/,GPS,40.745355,-73.946250,10/29/2024,223836,2024-10-29 01:46:26,,,,07/21/2022,J1772
ELEC,The Franciscan Villa,6900 Buckley Rd,,Syracuse,NY,13212,,1-844-623-1001,E,,Public,24 hours daily,,,4,,,LIVINGSTON,https://www.solution.energy,GPS,43.104280,-76.162060,10/29/2024,324873,2024-10-29 04:04:58,,,,09/22/2023,J1772
ELEC,COLE GROUP HIGHLAND 1,20 Eastview Dr,,Watervliet,NY,12189,,888-758-4389,E,,Public,24 hours daily,,,2,,,ChargePoint Network,http://www.chargepoint.com/,GPS,42.736084,-73.718287,10/29/2024,260038,2024-10-29 02:01:10,,,,04/28/2023,J1772
ELEC,411 West 55th St,411 W 55th St,,New York,NY,10019,,1-844-623-1001,E,,Public,24 hours daily,,,4,,,LIVINGSTON,https://www.solution.energy,GPS,40.767090,-73.987330,10/29/2024,223115,2024-10-29 04:05:35,,,,12/22/2021,J1772
ELEC,Towne Chrysler Dodge Jeep,5130 Camp Road,,Hamburg,NY,14075,,888-998-2546,E,,Public,24 hours daily,,,1,1,,Blink Network,http://www.blinkcharging.com/,GPS,42.747088,-78.854571,10/29/2024,320309,2024-10-29 00:28:11,,,,06/28/2023,J1772 J1772COMBO
ELEC,Waters Edge - Runabout Lane,300 Starboard Side Ln,,Webster,NY,14580,,1-844-623-1001,E,,Public,24 hours daily,,,4,,,LIVINGSTON,https://www.solution.energy,GPS,43.175270,-77.515690,10/29/2024,324892,2024-10-29 04:05:15,,,,04/01/2023,J1772
ELEC,Matcha Electric,140 58th St,,Brooklyn,NY,11220,,617-286-4722,E,,Public,24 hours daily,A ANDROID_PAY APPLE_PAY CREDIT D Debit M V,,2,,,MATCHA,https://www.matchaelectric.com,GPS,40.646000,-74.024806,07/11/2024,346620,2024-07-11 19:05:43,P,,,05/15/2024,J1772
ELEC,VIL OF LEWISTO ACADEMY PARK,895 Center St,,Lewiston,NY,14092,,888-758-4389,E,,Public,24 hours daily,,,2,,,ChargePoint Network,http://www.chargepoint.com/,GPS,43.172174,-79.032076,10/29/2024,302470,2024-10-29 01:58:59,,,,07/14/2023,J1772
ELEC,NC LEXUS LATHAM STATION 2,999 Loudon Rd,,Cohoes,NY,12047,,888-758-4389,E,,Public,24 hours daily,,,2,,,ChargePoint Network,http://www.chargepoint.com/,GPS,42.771822,-73.752720,10/29/2024,331738,2024-10-29 02:06:36,,,,04/05/2024,J1772
ELEC,Manhattan Plaza,427 W 42nd St,,New York,NY,10036,,888-998-2546,E,,Public,24 hours daily,,,2,,,Blink Network,http://www.blinkcharging.com/,GPS,40.759223,-73.992703,10/29/2024,164442,2024-10-29 00:26:28,,,,06/19/2019,J1772
ELEC,383 Court St,383 Court St,,Brooklyn,NY,11231,,888-356-8911,E,,Public,24 hours daily,,,2,,,FLO,https://flo.ca/,GPS,40.680484,-73.996719,10/29/2024,194646,2024-10-29 03:33:09,,,,08/28/2021,J1772
ELEC,50 Front,50 Front St,,Binghamton,NY,13905,,949-945-2000,E,,Public,24 hours daily,A ACCOUNT_BALANCE ANDROID_PAY APPLE_PAY CREDIT D M V,,4,,,EVGATEWAY,http://evgateway.com/,200-8,42.095450,-75.917990,05/09/2024,334186,2024-05-09 20:32:20,P,,,12/31/2023,J1772
ELEC,COM1-1 COM1-2,365 W 25th St,Back parking,New York,NY,10001,,888-758-4389,E,,Public,24 hours daily,,,,1,,ChargePoint Network,http://www.chargepoint.com/,GPS,40.747434,-74.000085,10/29/2024,313672,2024-10-29 01:43:53,,,,10/14/2023,CHADEMO J1772COMBO
ELEC,New York Hemp Oil,37 Huntington St.,,Cortland,NY,13045,,1-844-623-1001,E,,Public,24 hours daily,,,4,,,LIVINGSTON,https://www.solution.energy,GPS,42.593000,-76.176030,10/29/2024,347197,2024-10-29 04:06:35,,,,05/31/2024,J1772
ELEC,CITY OF ALBANY CITY HALL,City Hall 77 Corning Place,,Albany,NY,12207,,888-758-4389,E,,Public,24 hours daily,,,2,,,ChargePoint Network,http://www.chargepoint.com/,GPS,42.651389,-73.754273,10/29/2024,262440,2024-10-29 01:29:18,,,,06/09/2023,J1772
ELEC,GMC Parking Garage - 200 Central,200 Central Park South,,New York,NY,10019,,888-998-2546,E,,Public,24 hours daily,,,1,,,Blink Network,http://www.blinkcharging.com/,GPS,40.766719,-73.979533,10/29/2024,190107,2024-10-29 00:06:50,,,,05/26/2021,J1772
ELEC,854ELLICOTT 854 ELLICOTT 4,854 Ellicott St,Near main entrance,Buffalo,NY,14203,,888-758-4389,E,,Public,24 hours daily,,,2,,,ChargePoint Network,http://www.chargepoint.com/,GPS,42.901748,-78.867401,10/29/2024,180118,2024-10-29 00:55:33,,,,01/27/2021,J1772
ELEC,New York Hemp Oil,185 S Main St,,Cortland,NY,13045,,800-663-5633,E,,Public,24 hours daily,,,1,,,Blink Network,http://www.blinkcharging.com/,GPS,42.592477,-76.179663,10/29/2024,238317,2024-10-29 00:09:31,,,,11/02/2022,J1772
ELEC,TOWN OF RED HK RED HOOK 2,7336 S Broadway,East Parking Lot,Red Hook,NY,12571,,888-758-4389,E,,Public,24 hours daily,,,2,,,ChargePoint Network,http://www.chargepoint.com/,GPS,41.987163,-73.880399,10/29/2024,171727,2024-10-29 00:49:07,,,,01/27/2021,J1772
ELEC,Homewood Suites Syracuse/Liverpool,275 Elwood Davis Rd,,Liverpool,NY,13088,,1-844-623-1001,E,,Public,24 hours daily,,,4,,,LIVINGSTON,https://www.solution.energy,GPS,43.097900,-76.177560,10/29/2024,334494,2024-10-29 04:06:31,,,,05/02/2024,J1772
ELEC,EVolve NY Goldens Bridge,22 NY-138,,Goldens Bridge,NY,10526,,833-632-2778,E,,Public,24 hours daily,,,,6,,Electrify America,https://www.electrifyamerica.com/,GPS,41.294010,-73.674800,10/29/2024,279336,2024-10-29 02:56:08,,,,06/22/2023,CHADEMO J1772COMBO
ELEC,MARKET 32 EV MARKET 32 EG CH,501 COLUMBIA PLAZA,In front of building,Rensselaer,NY,12144,,888-758-4389,E,,Public,24 hours daily,,,2,,,ChargePoint Network,http://www.chargepoint.com/,GPS,42.607573,-73.719919,10/29/2024,152319,2024-10-29 01:10:28,,,,01/09/2020,J1772
ELEC,4th Precinct,53 Shonnard Place,,Yonkers,NY,10703,,866-816-7584,E,,Public,24 hours daily,,,1,,,EV Connect,http://evconnect.com/,GPS,40.951580,-73.888161,10/29/2024,261577,2024-10-29 03:11:24,,,,05/27/2023,J1772
ELEC,GGMC Parking 8 E 33rd St Garage - Tesla Destination,325 East 5th Ave,,New York,NY,10016,,877-798-3752,E,,Public,,,,3,,,Tesla Destination,https://www.tesla.com/destination-charging,200-9,40.747478,-73.985040,07/01/2024,115096,2024-10-16 16:58:41,P,,,01/21/2016,J1772 TESLA
ELEC,Hampton Inn & Suites Yonkers - Westchester,559 Tuckahoe Rd,,Yonkers,NY,10710,,844-798-2438,E,,Public - Credit card at all times,24 hours daily,A D Debit M V,,6,,,SWTCH,https://swtchenergy.com/,GPS,40.954279,-73.848490,05/03/2023,257691,2024-01-31 22:07:01,P,,,03/30/2023,J1772
ELEC,Saratoga Automobile Museum,110 Avenue of the Pines,,Saratoga Springs,NY,12866,,1-844-623-1001,E,,Public,24 hours daily,,,2,,,LIVINGSTON,https://www.solution.energy,GPS,43.057340,-73.804740,10/29/2024,334507,2024-10-29 04:05:29,,,,05/02/2024,J1772
ELEC,The Kensington at Halfmoon,1 Kensington Court,,Clifton Park,NY,12065,,1-844-623-1001,E,,Public,24 hours daily,,,4,,,LIVINGSTON,https://www.solution.energy,GPS,42.831720,-73.738920,10/29/2024,223243,2024-10-29 04:04:47,,,,01/07/2022,J1772
ELEC,WEST HERR AUTO WH FH L3-1 EXPP,5025 Camp Road,,Hamburg,NY,14075,,888-758-4389,E,,Public,24 hours daily,,,,2,,ChargePoint Network,http://www.chargepoint.com/,GPS,42.751578,-78.854438,10/29/2024,355524,2024-10-29 02:24:23,,,,09/12/2024,J1772COMBO
ELEC,MALTA STATION5,2540 State Hwy 9,Back parking lot,Malta,NY,12020,,888-758-4389,E,,Public,24 hours daily,,,2,,,ChargePoint Network,http://www.chargepoint.com/,GPS,42.975735,-73.791770,10/29/2024,259684,2024-10-29 02:00:09,,,,04/21/2023,J1772
ELEC,4 W 21st St.,4 W 21st St.,,New York,NY,10010,,1-844-623-1001,E,,Public,24 hours daily,,,4,,,LIVINGSTON,https://www.solution.energy,GPS,40.740570,-73.991470,10/29/2024,223265,2024-10-29 04:04:41,,,,02/15/2022,J1772
ELEC,799 SENECA STATION 12,799 Seneca St,,Buffalo,NY,14210,,888-758-4389,E,,Public,Mon 5:00pm - 10:00pm; Tue 5:00pm - 10:00pm; Wed 5:00pm - 10:00pm; Thu 5:00pm - 10:00pm; Fri 5:00pm - 10:00pm; Sat 8:00am - 10:00pm; Sun 8:00am - 10:00pm,,,1,,,ChargePoint Network,http://www.chargepoint.com/,GPS,42.875115,-78.847525,10/29/2024,191448,2024-10-29 01:30:04,,,,06/24/2021,J1772
ELEC,Holiday Inn - Tesla Supercharger,441 Electronics Parkway,,Liverpool,NY,13088,,877-798-3752,E,,Public,24 hours daily. Please check Tesla's online station map to see if an adapter is required at this location.,,,,8,,Tesla,https://www.tesla.com/supercharger,200-8,43.102424,-76.187446,07/01/2024,102332,2024-08-14 18:58:22,P,,,03/01/2015,TESLA
ELEC,BRUNSWICK HD BRUNSWICK HD2,1130 Hoosick Rd,,Troy,NY,12180,,888-758-4389,E,,Public,24 hours daily,,,2,,,ChargePoint Network,http://www.chargepoint.com/,GPS,42.758880,-73.602280,10/29/2024,150341,2024-10-29 01:09:38,,,,12/19/2019,J1772
ELEC,NY STATE PARKS BAYARD SP 3,440 Montauk Hwy,Parking Lot,Great River,NY,11739,,888-758-4389,E,,Public,24 hours daily,,,2,,,ChargePoint Network,http://www.chargepoint.com/,GPS,40.739462,-73.162945,10/29/2024,354815,2024-10-29 02:20:16,,,,09/05/2024,J1772
ELEC,RXR REALTY STATION 1,625 RXR Plaza,In rxr main floor garage in the back left once you drive in,Uniondale,NY,11556,,888-758-4389,E,,Public,24 hours daily,,,2,,,ChargePoint Network,http://www.chargepoint.com/,GPS,40.720162,-73.581960,10/29/2024,229414,2024-10-29 01:40:02,,,,09/28/2022,J1772
ELEC,Icon Parking 990 Ave of the Americas - Tesla Destination,990 Avenue of the Americas,,New York,NY,10018,,877-798-3752,E,,Public,,,,3,,,Tesla Destination,https://www.tesla.com/destination-charging,200-9,40.750844,-73.986188,07/01/2024,115198,2024-10-16 16:58:41,P,,,05/03/2016,J1772 TESLA
ELEC,iPark NYU 377 E 33rd Street - Tesla Destination,377 E 33rd St,,New York,NY,10016,,877-798-3752,E,,Public,,,,3,,,Tesla Destination,https://www.tesla.com/destination-charging,200-9,40.743405,-73.974735,07/01/2024,115113,2024-10-16 16:58:41,P,,,08/23/2017,J1772 TESLA
ELEC,Geneva on the Lake Resort,1001 Lochland Rd,,New York,NY,14456,,888-356-8911,E,,Public,24 hours daily,,,4,,,FLO,https://flo.ca/,GPS,42.848887,-76.980257,10/29/2024,235134,2024-10-29 03:33:21,,,,10/26/2022,J1772
ELEC,SOUTHAMPTON HOS MAIN ENTRANCE,240 Meeting House Ln,,Southampton,NY,11968,,888-758-4389,E,,Public,24 hours daily,,,2,,,ChargePoint Network,http://www.chargepoint.com/,GPS,40.885480,-72.380628,10/29/2024,158485,2024-10-29 01:16:03,,,,06/03/2020,J1772
ELEC,SIDNEYFCU CICERO 2,8062 Brewerton Rd,,Cicero,NY,13039,,888-758-4389,E,,Public,24 hours daily,,,,1,,ChargePoint Network,http://www.chargepoint.com/,GPS,43.159505,-76.120806,10/29/2024,335517,2024-10-29 02:18:33,,,,05/04/2024,CHADEMO J1772COMBO
ELEC,Main Place Parking Garage,221 Pearl St,,Buffalo,NY,14202,,866-816-7584,E,,Public,24 hours daily,,,4,,,EV Connect,http://evconnect.com/,GPS,42.885259,-78.875361,10/29/2024,104727,2024-10-29 03:08:56,,,,04/01/2018,J1772
ELEC,Laureate Garage,2148 Broadway,,New York,NY,10023,,888-998-2546,E,,Public,24 hours daily,,,2,,,Blink Network,http://www.blinkcharging.com/,GPS,40.781310,-73.980834,10/29/2024,189363,2024-10-29 00:13:35,,,,05/07/2021,J1772
ELEC,MONROE COUNTY DURAND E1,1200 Kings Hwy N Durand Eastman Golf - Club H,Parking Lot West End at Durand Eastman Golf Course Club House,Rochester,NY,14617,,888-758-4389,E,,Public,24 hours daily,,,2,,,ChargePoint Network,http://www.chargepoint.com/,GPS,43.233265,-77.569110,10/29/2024,261522,2024-10-29 02:03:21,,,,05/27/2023,J1772
ELEC,FOODBANK LATHAM PARKING ONE,959 Albany Shaker Rd Regional Food Bank - Lat,,Latham,NY,12110,,888-758-4389,E,,Public,24 hours daily,,,2,,,ChargePoint Network,http://www.chargepoint.com/,GPS,42.764454,-73.814410,10/29/2024,180889,2024-10-29 01:17:12,,,,01/27/2021,J1772
ELEC,Foster Supply Hospitality,7491 State Rte 55,,Neversink,NY,12765,,1-844-623-1001,E,,Public,24 hours daily,,,4,,,LIVINGSTON,https://www.solution.energy,GPS,41.849750,-74.617930,10/29/2024,324807,2024-10-29 04:05:47,,,,11/07/2023,J1772
ELEC,57ALEXANDER SPACE 442,57 Alexander Street,2nd floor garage,Yonkers,NY,10701,,888-758-4389,E,,Public,24 hours daily,,,1,,,ChargePoint Network,http://www.chargepoint.com/,GPS,40.938958,-73.901717,10/29/2024,349466,2024-10-29 02:10:09,,,,06/27/2024,J1772
ELEC,Long Island Welcome Center,I-495 E,Between exits 51 and 52,Dix Hills,NY,11746,,631-254-0414,E,,Public,24 hours daily,,,,2,,Non-Networked,,GPS,40.802658,-73.316725,03/07/2022,87914,2024-10-07 15:29:56,SG,,,10/01/2016,CHADEMO
ELEC,GGMC Parking Union Square Parking Garage - Tesla Destination,100 E 15th St,,New York,NY,10003,,877-798-3752,E,,Public,,,,6,,,Tesla Destination,https://www.tesla.com/destination-charging,200-8,40.734939,-73.989409,07/01/2024,114988,2024-10-16 16:58:41,P,,,11/13/2015,J1772 TESLA
ELEC,BEST WESTERN PL BEST 1.1,6605 Old Collamer Rd S,,East Syracuse,NY,13057,,888-758-4389,E,,Public,24 hours daily,,,2,,,ChargePoint Network,http://www.chargepoint.com/,GPS,43.090446,-76.086580,10/29/2024,169911,2024-10-29 01:21:59,,,,12/04/2020,J1772
ELEC,Capitaland Subaru,47 Saratoga Road,,Glenville,NY,12302,,888-998-2546,E,,Public,24 hours daily,,,1,,,Blink Network,http://www.blinkcharging.com/,GPS,42.852956,-73.942404,10/29/2024,226618,2024-10-29 00:20:04,,,,08/26/2022,J1772
ELEC,211 EV STATIONS STATION-1,211 North Main Street,,Mechanicville,NY,12118,,888-758-4389,E,,Public,24 hours daily,,,2,,,ChargePoint Network,http://www.chargepoint.com/,GPS,42.910761,-73.684297,10/29/2024,350650,2024-10-29 02:21:42,,,,07/17/2024,J1772
ELEC,Mike Barney Nissan,3676 Sheridan Dr,,Amherst,NY,14226,,716-833-9888,E,,Public - Call ahead,Dealership business hours,,,2,,,Non-Networked,,200-9,42.979725,-78.797346,02/12/2024,44319,2024-02-12 15:25:05,P,,,11/30/2011,J1772
ELEC,SAREMBAS STATION 1,86 Congress St,Against wall,Saratoga Springs,NY,12866,,888-758-4389,E,,Public,24 hours daily,,,2,,,ChargePoint Network,http://www.chargepoint.com/,GPS,43.078560,-73.790320,10/29/2024,227530,2024-10-29 01:48:08,,,,09/14/2022,J1772
ELEC,799 SENECA STATION 3,799 Seneca St,,Buffalo,NY,14210,,888-758-4389,E,,Public,Mon 5:00pm - 10:00pm; Tue 5:00pm - 10:00pm; Wed 5:00pm - 10:00pm; Thu 5:00pm - 10:00pm; Fri 5:00pm - 10:00pm; Sat 8:00am - 10:00pm; Sun 8:00am - 10:00pm,,,1,,,ChargePoint Network,http://www.chargepoint.com/,GPS,42.875076,-78.847665,10/29/2024,191248,2024-10-29 01:30:05,,,,06/19/2021,J1772
ELEC,Flying J 693,8484 Allegheny Road,,Pembroke,NY,14036,,877-455-3833,E,,Public,24 hours daily,,,,4,,eVgo Network,https://www.evgo.com/,GPS,43.000805,-78.406920,10/28/2024,347297,2024-10-28 23:59:31,,,,06/01/2024,J1772COMBO
ELEC,DeNooyer Chevrolet,127 Wolf Rd,,Albany,NY,12205,,,E,,Public - Call ahead,Dealership business hours; 518-458-7700,,,,1,,Non-Networked,,GPS,42.717867,-73.806317,08/15/2024,117741,2024-08-15 19:57:12,P,,,01/01/2019,J1772COMBO
ELEC,The Byram Armonk,585 Main Street,,Armonk,NY,10570,,1-800-636-0986,E,,Public,,,,2,,,CHARGELAB,http://www.chargelab.co/,GPS,41.135271,-73.711364,10/25/2024,360215,2024-10-25 03:58:32,,,,10/17/2024,J1772
ELEC,Quaker Ridge Golf Club,146 Griffen Ave,,Scarsdale,NY,10583,,1-844-623-1001,E,,Public,24 hours daily,,,4,,,LIVINGSTON,https://www.solution.energy,GPS,40.966360,-73.764800,10/29/2024,223231,2024-10-29 04:06:09,,,,02/08/2022,J1772
ELEC,11 East 86th Street,11 East 86th Street,,New York,NY,10028,,1-844-623-1001,E,,Public,24 hours daily,,,2,,,LIVINGSTON,https://www.solution.energy,GPS,40.781470,-73.959860,10/29/2024,223278,2024-10-29 04:04:30,,,,03/16/2022,J1772
ELEC,Dryland Gannett LLC,4 Westchester Park Dr,,White Plains,NY,10604,,888-998-2546,E,,Public,24 hours daily,,,6,,,Blink Network,http://www.blinkcharging.com/,GPS,41.022780,-73.724320,10/29/2024,308874,2024-10-29 00:05:36,,,,08/24/2017,J1772
ELEC,BURNS MGT EMPIRE RUN 2,130 Excelsior Ave,Side parking lot of empire run apartments,Saratoga Springs,NY,12866,,888-758-4389,E,,Public,24 hours daily,,,2,,,ChargePoint Network,http://www.chargepoint.com/,GPS,43.089855,-73.767276,10/29/2024,193184,2024-10-29 01:29:44,,,,07/27/2021,J1772
ELEC,TOWN OF CHESTER SENIORCENTEREV2,81 Laroe Rd,,Chester,NY,10918,,888-758-4389,E,,Public,24 hours daily,,,2,,,ChargePoint Network,http://www.chargepoint.com/,GPS,41.343440,-74.267411,10/29/2024,253801,2024-10-29 01:51:42,,,,02/09/2023,J1772
ELEC,MILTON NY STATION 3,503 Geyser Rd,Town Hall Parking Lot,Ballston Spa,NY,12020,,888-758-4389,E,,Public,24 hours daily,,,2,,,ChargePoint Network,http://www.chargepoint.com/,GPS,43.045131,-73.851210,10/29/2024,225382,2024-10-29 01:46:51,,,,08/11/2022,J1772
ELEC,The Caledonia,450 W 17th Street,,New York,NY,10011,,888-998-2546,E,,Public,24 hours daily,,,2,,,Blink Network,http://www.blinkcharging.com/,GPS,40.743832,-74.006578,10/29/2024,259812,2024-10-29 00:26:19,,,,07/19/2022,J1772
ELEC,IMPark 92-77 Queens Blvd - Tesla Destination,92-77 Queens Blvd,,Rego Park,NY,11374,,877-798-3752,E,,Public,,,,4,,,Tesla Destination,https://www.tesla.com/destination-charging,200-8,40.732255,-73.866674,07/01/2024,150587,2024-10-16 16:58:41,P,,,03/30/2019,TESLA
ELEC,iPark NYC 455 Central Park West - Tesla Destination,27 West 105th St,,New York,NY,10025,,877-798-3752,E,,Public,,,,3,,,Tesla Destination,https://www.tesla.com/destination-charging,200-8,40.797771,-73.961420,07/01/2024,150521,2024-10-16 16:58:41,P,,,07/19/2016,J1772 TESLA
ELEC,Massena Municipal Parking,25 Andrews St,,Massena,NY,13662,,315-769-5431,E,,Public - Credit card at all times,24 hours daily,A D Debit M V,,2,,,Non-Networked,,GPS,44.931766,-74.893994,05/09/2024,227094,2024-05-09 20:32:20,P,,,08/29/2022,J1772
ELEC,RXR REALTY 58 SSR,5868 S Service Rd,,Melville,NY,11747,,888-758-4389,E,,Public,24 hours daily,,,2,,,ChargePoint Network,http://www.chargepoint.com/,GPS,40.782217,-73.439925,10/29/2024,180107,2024-10-29 00:56:26,,,,01/27/2021,J1772
ELEC,LACROIX COURT LACROIX APTS 1,12 Lacroix Ct Dr,,Irondequoit,NY,14609,,888-758-4389,E,,Public,24 hours daily,,,2,,,ChargePoint Network,http://www.chargepoint.com/,GPS,43.195473,-77.566644,10/29/2024,220520,2024-10-29 01:44:39,,,,06/03/2022,J1772
ELEC,Jeff's Attic @ Harbor Towne,1765 Baseline Rd,,Grand Island,NY,14072,,866-816-7584,E,,Public,24 hours daily,,,6,,,EV Connect,http://evconnect.com/,GPS,43.009875,-78.964561,10/29/2024,230969,2024-10-29 03:10:36,,,,09/30/2022,J1772
ELEC,Poughkeepsie - Town Hall,1 Overocker Road,,Poughkeepsie,NY,12603,,888-356-8911,E,,Public,24 hours daily,,,10,,,FLO,https://flo.ca/,GPS,41.693948,-73.888648,10/29/2024,349837,2024-10-29 03:34:35,,,,07/02/2024,J1772
ELEC,Icon 299 Peal Street Seaport Parking - Tesla Destination,238 Pearl St,,New York,NY,10069,,877-798-3752,E,,Public,,,,3,,,Tesla Destination,https://www.tesla.com/destination-charging,200-8,40.707679,-74.004687,07/01/2024,115063,2024-10-16 16:58:41,P,,,06/30/2016,J1772 TESLA
ELEC,PFIZER PR EV 01,401 N Middletown Rd,,Pearl River,NY,10965,,888-758-4389,E,,Public,24 hours daily,,,2,,,ChargePoint Network,http://www.chargepoint.com/,GPS,41.076754,-74.018091,10/29/2024,294833,2024-10-29 01:43:54,,,,06/23/2023,J1772
ELEC,C&C Parking Lot - Tesla Destination,3580 Webster Ave,,New York,NY,10467,,877-798-3752,E,,Public,,,,1,,,Tesla Destination,https://www.tesla.com/destination-charging,GPS,40.881544,-73.870115,07/01/2024,358745,2024-10-16 16:58:41,P,,,,TESLA
ELEC,Sydor Optics,31 Jet View Dr,,Rochester,NY,14624,,866-816-7584,E,,Public,Mon 6:00am - 10:30pm; Tue 6:00am - 10:30pm; Wed 6:00am - 10:30pm; Thu 6:00am - 10:30pm; Fri 6:00am - 10:30pm,,,4,,,EV Connect,http://evconnect.com/,GPS,43.111993,-77.698446,10/29/2024,230947,2024-10-29 03:10:17,,,,09/30/2022,J1772
ELEC,Matthews Cadillac,3721 OLD VESTAL RD,,VESTAL,NY,13850,,866-816-7584,E,,Public,24 hours daily,,,,1,,EV Connect,http://evconnect.com/,GPS,42.096564,-76.032946,10/29/2024,262694,2024-10-29 03:10:16,,,,06/14/2023,J1772COMBO
ELEC,WINDSOR GARDENS WGA LEFT,55 Hobbes Ln,Windsor Garden Left Charging Station,Rochester,NY,14624,,888-758-4389,E,,Public,24 hours daily,,,2,,,ChargePoint Network,http://www.chargepoint.com/,GPS,43.142415,-77.756018,10/29/2024,257167,2024-10-29 01:58:40,,,,03/28/2023,J1772
ELEC,REGENERON CHARGE #4,1 Global View,Building 44,Troy,NY,12180,,888-758-4389,E,,Public,24 hours daily,,,2,,,ChargePoint Network,http://www.chargepoint.com/,GPS,42.682332,-73.704223,10/29/2024,317049,2024-10-29 02:10:34,,,,11/09/2023,J1772
ELEC,IKEA USA BROOKLYN 1,1 Beard St,,Red Hook,NY,11231,,888-758-4389,E,,Public,24 hours daily,,,1,,,ChargePoint Network,http://www.chargepoint.com/,GPS,40.671397,-74.011643,10/29/2024,252884,2024-10-29 01:40:53,,,,02/01/2023,J1772
ELEC,Pilot Travel Center 146,995 US Route 9,,Castleton-On-Hudson,NY,12033,,877-455-3833,E,,Public,24 hours daily,,,,4,,eVgo Network,https://www.evgo.com/,GPS,42.497906,-73.674759,10/28/2024,330033,2024-10-28 23:59:35,,,,03/07/2024,J1772COMBO
ELEC,Swtch Energy,200 E Eckerson Rd,,New City,NY,10956,,844-798-2438,E,,Public,24 hours daily,A D Debit M V,,6,,,SWTCH,https://swtchenergy.com/,GPS,41.125996,-74.024053,08/10/2023,303243,2024-01-31 22:07:01,P,,,04/03/2023,J1772
ELEC,70 Linden Oaks,70 Linden Oaks,,Rochester,NY,14625,,866-816-7584,E,,Public,24 hours daily,,,4,,,EV Connect,http://evconnect.com/,GPS,43.124194,-77.521128,10/29/2024,323094,2024-10-29 03:12:34,,,,12/20/2023,J1772
ELEC,PFIZER PR EV 22,401 N Middletown Rd,,Pearl River,NY,10965,,888-758-4389,E,,Public,24 hours daily,,,2,,,ChargePoint Network,http://www.chargepoint.com/,GPS,41.076756,-74.017992,10/29/2024,323935,2024-10-29 02:13:05,,,,01/05/2024,J1772
ELEC,Courtyard by Marriott Elmira Horseheads - Tesla Destination,202 Colonial Dr,,Horseheads,NY,14845,,877-798-3752,E,,Public,,,,3,,,Tesla Destination,https://www.tesla.com/destination-charging,200-8,42.163352,-76.866382,07/01/2024,114954,2024-10-16 16:58:41,P,,,10/16/2017,J1772 TESLA
ELEC,NATIONAL GRID VENTLATHAM,207 Troy Schenectady Rd,,Watervliet,NY,12189,,888-758-4389,E,,Public,24 hours daily,,,2,,,ChargePoint Network,http://www.chargepoint.com/,GPS,42.740120,-73.731328,10/29/2024,162364,2024-10-29 00:49:56,,,,06/12/2020,J1772
ELEC,COLGATE SAPERSTEIN,Oak Dr,Parking Lot Behind Saperstein Center,Hamilton,NY,13346,,888-758-4389,E,,Public,24 hours daily,,,2,,,ChargePoint Network,http://www.chargepoint.com/,GPS,42.818034,-75.532041,10/29/2024,235124,2024-10-29 01:51:08,,,,10/26/2022,J1772
ELEC,The Mariner - Garage,21 Willett Ave,,Port Chester,NY,10573,,813-492-5220,E,,Public,24 hours daily,A ANDROID_PAY APPLE_PAY D M V,,10,,,EVOKE,https://evokesystems.com/,GPS,41.002600,-73.660200,10/11/2024,356960,2024-10-11 18:09:31,P,,,11/20/2021,J1772
ELEC,VOC STATION 1,106 Union St,,Cobleskill,NY,12043,,888-758-4389,E,,Public,24 hours daily,,,2,,,ChargePoint Network,http://www.chargepoint.com/,GPS,42.678754,-74.483544,10/29/2024,192594,2024-10-29 01:29:31,,,,07/07/2021,J1772
ELEC,KEELER STATION 03,1111 Troy Schenectady Rd,Rear Inventory Lot,Latham,NY,12110,,888-758-4389,E,,Public,24 hours daily,,,2,,,ChargePoint Network,http://www.chargepoint.com/,GPS,42.767352,-73.812499,10/29/2024,190453,2024-10-29 01:28:47,,,,05/31/2021,J1772
ELEC,Oakwood Commons Parking Garage,2507 South Rd,,Poughkeepsie,NY,12601,,845-463-1701,E,,Public,24 hours daily,,,2,,,Non-Networked,,GPS,41.659072,-73.932101,05/09/2024,167129,2024-05-09 20:32:20,P,,,09/21/2020,J1772
ELEC,JGU - Jerome Gun Hill Road Municipal Parking Garage,3510 Jerome Ave,,New York,NY,10467,,866-816-7584,E,,Public,Mon 6:00am - 10:00pm; Tue 6:00am - 10:00pm; Wed 6:00am - 10:00pm; Thu 6:00am - 10:00pm; Fri 6:00am - 10:00pm; Sat 12:00am - 12:00am; Sun 12:00am - 12:00am,,,4,,,EV Connect,http://evconnect.com/,GPS,40.883002,-73.880698,10/29/2024,327023,2024-10-29 03:08:49,,,,01/30/2024,J1772
ELEC,MTP Parking 31-00 47th Ave - Tesla Destination,31-00 47th Ave,,Long Island City,NY,11101,,877-798-3752,E,,Public,,,,4,,,Tesla Destination,https://www.tesla.com/destination-charging,200-8,40.741652,-73.936160,07/01/2024,122487,2024-10-16 16:58:41,P,,,01/17/2019,TESLA
ELEC,Days Inn Wurtsboro,2 Perron Dr,,Wurtsboro,NY,12790,,949-945-2000,E,,Public,24 hours daily,A ACCOUNT_BALANCE ANDROID_PAY APPLE_PAY CREDIT D M V,,6,,,EVGATEWAY,http://evgateway.com/,200-8,41.568560,-74.497050,05/09/2024,334091,2024-05-09 20:32:20,P,,,06/22/2023,J1772
ELEC,Bard College - Sottery Hall,30 Campus Rd,,Annandale-on-Hudson,NY,12504,,1-844-623-1001,E,,Public,24 hours daily,,,4,,,LIVINGSTON,https://www.solution.energy,GPS,42.019990,-73.907070,10/29/2024,324778,2024-10-29 04:05:38,,,,05/16/2023,J1772
ELEC,WHITEFACE MT WHITEFACE MT 3,5021 Route 86,Right Side Bear Den Lot,Wilmington,NY,12997,,888-758-4389,E,,Public,24 hours daily,,,2,,,ChargePoint Network,http://www.chargepoint.com/,GPS,44.359064,-73.858857,10/29/2024,182171,2024-10-29 01:24:22,,,,01/27/2021,J1772
ELEC,BURNS MGT THE SPRINGS #3,60 Weibel Ave,,Saratoga Springs,NY,12866,,888-758-4389,E,,Public,24 hours daily,,,2,,,ChargePoint Network,http://www.chargepoint.com/,GPS,43.093051,-73.743350,10/29/2024,174328,2024-10-29 01:01:33,,,,01/27/2021,J1772
ELEC,532 Neptune Avenue,532 Neptune Ave,,Brooklyn,NY,11224,,949-945-2000,E,,Public,24 hours daily,A ACCOUNT_BALANCE ANDROID_PAY APPLE_PAY CREDIT D M V,,8,,,EVGATEWAY,http://evgateway.com/,200-8,40.579780,-73.974390,05/09/2024,334200,2024-05-09 20:32:20,P,,,06/13/2023,J1772
ELEC,WHITE PLAINS EVSE 3,1 Maple Ave,,White Plains,NY,10605,,888-758-4389,E,,Public,24 hours daily,,,2,,,ChargePoint Network,http://www.chargepoint.com/,GPS,41.029167,-73.759358,10/29/2024,197209,2024-10-29 01:33:43,,,,10/07/2021,J1772
ELEC,Belmont Parking,113 E 84th St,,New York,NY,10028,,888-998-2546,E,,Public,24 hours daily,,,1,,,Blink Network,http://www.blinkcharging.com/,GPS,40.773472,-73.955287,10/29/2024,187814,2024-10-29 00:23:13,,,,04/20/2021,J1772
ELEC,Parker Towers 60 - Garage 60,104-60 Queens Blvd,,Forest Hills,NY,11375,,813-492-5220,E,,Public,24 hours daily,A ANDROID_PAY APPLE_PAY D M V,,20,,,EVOKE,https://evokesystems.com/,GPS,40.723300,-73.849100,10/11/2024,356886,2024-10-11 18:09:31,P,,,11/18/2021,J1772
ELEC,VERONA LA QUINTA 2,5390 Willow Pl,Outside of front entrance of La Quinta hotel,Verona,NY,13478,,888-758-4389,E,,Public,24 hours daily,,,2,,,ChargePoint Network,http://www.chargepoint.com/,GPS,43.122196,-75.592640,10/29/2024,181237,2024-10-29 01:19:21,,,,01/27/2021,J1772
ELEC,Smoky Rock BBQ - Tesla Destination,6367 Mill St,,Rhinebeck,NY,12572,,877-798-3752,E,,Public,,,,3,,,Tesla Destination,https://www.tesla.com/destination-charging,200-9,41.925679,-73.912666,07/01/2024,115217,2024-10-16 16:58:41,P,,,12/02/2016,TESLA
ELEC,SUNY ADMIN LOT,8 Chenango Street (PO Box 901),"Enter from South Street via the service drive between parking lots. The Admin-Lot is just behind the Student Activities Center (STUAC, bldg. 008).",Morrisville,NY,13408,,888-758-4389,E,,Public,24 hours daily,,,2,,,ChargePoint Network,http://www.chargepoint.com/,GPS,42.893032,-75.639661,10/29/2024,206376,2024-10-29 01:39:18,,,,02/15/2022,J1772
ELEC,Van Bortel Ford,71 Marsh Rd,,East Rochester,NY,14445,,585-586-4415,E,,Public - Credit card at all times,24 hours daily; customers only,A D Debit M V,,2,,,Non-Networked,,GPS,43.100283,-77.483323,08/15/2024,226508,2024-08-15 19:57:12,P,,,08/24/2022,J1772
ELEC,MPG 530 West 30th - Tesla Destination,530 W 30th,,New York,NY,10001,,877-798-3752,E,,Public,,,,3,,,Tesla Destination,https://www.tesla.com/destination-charging,200-9,40.752770,-74.002650,07/01/2024,115152,2024-10-16 16:58:41,P,,,05/24/2018,J1772 TESLA
ELEC,MOSEY MOSEY 1,5195 Main St,Inside parking ramp to the left 1st floor,Williamsville,NY,14221,,888-758-4389,E,,Public,24 hours daily,,,2,,,ChargePoint Network,http://www.chargepoint.com/,GPS,42.959881,-78.758655,10/29/2024,149544,2024-10-29 01:08:38,,,,11/27/2019,J1772
ELEC,Westminster Place - East,7475 Morgan Rd,,Westminster,NY,13090,,1-844-623-1001,E,,Public,24 hours daily,,,10,,,LIVINGSTON,https://www.solution.energy,GPS,43.132210,-76.207790,10/29/2024,350597,2024-10-29 04:06:44,,,,07/16/2024,J1772
ELEC,19-80 Steinway - Tesla Destination,1980 Steinway St,,Astoria,NY,11105,,877-798-3752,E,,Public,,,,4,,,Tesla Destination,https://www.tesla.com/destination-charging,200-8,40.776957,-73.901150,07/01/2024,150649,2024-10-16 16:58:41,P,,,07/06/2018,TESLA
ELEC,INN SQ INN SQ GW 2,100-140 S Clinton Ave,NN42 Purple Level Parking Garage,Rochester,NY,14604,,888-758-4389,E,,Public,24 hours daily,,,2,,,ChargePoint Network,http://www.chargepoint.com/,GPS,43.154580,-77.604714,10/29/2024,204918,2024-10-29 01:36:03,,,,01/15/2022,J1772
ELEC,PFIZER PR EV 12,401 N Middletown Rd,,Pearl River,NY,10965,,888-758-4389,E,,Public,24 hours daily,,,2,,,ChargePoint Network,http://www.chargepoint.com/,GPS,41.077399,-74.016436,10/29/2024,322708,2024-10-29 02:12:02,,,,12/14/2023,J1772
ELEC,Mount Saint Mary's College,330 Powell Ave,,Newburgh,NY,12549,,888-356-8911,E,,Public,24 hours daily,,,6,,,FLO,https://flo.ca/,GPS,41.511923,-74.014634,10/29/2024,257367,2024-10-29 03:33:32,,,,03/30/2023,J1772
ELEC,BEDFORDEV MEMORIAL PARK 2,60 Haines Rd.,Bedford Hills Memorial Park (near Soccer Field),Bedford Hills,NY,10507,,888-758-4389,E,,Public,24 hours daily,,,2,,,ChargePoint Network,http://www.chargepoint.com/,GPS,41.234114,-73.706621,10/29/2024,162338,2024-10-29 00:50:55,,,,06/12/2020,J1772
ELEC,Waldorf Astoria New York - Tesla Destination,310 Park Ave,,New York,NY,10022,,877-798-3752,E,,Public,,,,2,,,Tesla Destination,https://www.tesla.com/destination-charging,200-8,40.756722,-73.974060,07/01/2024,115090,2024-10-16 16:58:41,P,,,03/19/2015,TESLA
ELEC,Bical Auto Mall - Bical Parking,2859 Flatbush Ave,,Brooklyn,NY,11234,,813-492-5220,E,,Public,24 hours daily,A ANDROID_PAY APPLE_PAY D M V,,14,,,EVOKE,https://evokesystems.com/,GPS,40.602038,-73.912661,10/11/2024,356983,2024-10-11 18:09:31,P,,,01/16/2023,J1772
ELEC,CLARKSTOWN TOC 5 AND 6,10 Maple Avenue,,New City,NY,10956,,888-758-4389,E,,Public,24 hours daily,,,2,,,ChargePoint Network,http://www.chargepoint.com/,GPS,41.147062,-73.987206,10/29/2024,322228,2024-10-29 02:11:44,,,,12/07/2023,J1772
ELEC,"HAVERSTRAW, NY NS1-STATION#1",48 New Main St,,Haverstraw,NY,10927,,888-758-4389,E,,Public,24 hours daily,,,2,,,ChargePoint Network,http://www.chargepoint.com/,GPS,41.196680,-73.966573,10/29/2024,189325,2024-10-29 01:09:58,,,,05/07/2021,J1772
ELEC,159 WOLF OFFBLD 159 WOLF RIGHT,159 Wolf Rd,,Albany,NY,12205,,888-758-4389,E,,Public,24 hours daily,,,2,,,ChargePoint Network,http://www.chargepoint.com/,GPS,42.721222,-73.801094,10/29/2024,185652,2024-10-29 01:26:05,,,,03/06/2021,J1772
ELEC,INN SQ INN SQ GW 1,86 S Clinton Ave,NN42 Orange Level Parking Garage,Rochester,NY,14604,,888-758-4389,E,,Public,24 hours daily,,,2,,,ChargePoint Network,http://www.chargepoint.com/,GPS,43.155291,-77.605527,10/29/2024,204921,2024-10-29 01:36:29,,,,01/15/2022,J1772
ELEC,Champion Parking 113 LLC - Tesla Destination,400 W 113th St,,New York,NY,10025,,877-798-3752,E,,Public,,,,3,,,Tesla Destination,https://www.tesla.com/destination-charging,200-9,40.804430,-73.961373,07/01/2024,115122,2024-10-16 16:58:41,P,,,02/22/2018,J1772 TESLA
ELEC,PICOTTE 11 CORPORATE 5,11 Corporate Woods Blvd,Behind building 11 east side of parking garage,Albany,NY,12211,,888-758-4389,E,,Public,24 hours daily,,,2,,,ChargePoint Network,http://www.chargepoint.com/,GPS,42.683430,-73.766670,10/29/2024,163514,2024-10-29 01:16:51,,,,06/20/2020,J1772
ELEC,854ELLICOTT 134 HIGH ST 9,134 High St,,Buffalo,NY,14203,,888-758-4389,E,,Public,24 hours daily,,,2,,,ChargePoint Network,http://www.chargepoint.com/,GPS,42.901006,-78.863905,10/29/2024,181848,2024-10-29 01:22:53,,,,01/27/2021,J1772
ELEC,NATIONAL GRID KOHLS AMHERST,3115 Niagara Falls Blvd,Station availability is from 10 AM until 9 PM and not 24 hours a day.,Buffalo,NY,14228,,888-758-4389,E,,Public,24 hours daily,,,2,,,ChargePoint Network,http://www.chargepoint.com/,GPS,43.039273,-78.820953,10/29/2024,162208,2024-10-29 00:56:04,,,,06/12/2020,J1772
ELEC,Village of Churchville,23 E Buffalo St,,Churchville,NY,14428,,585-293-3720,E,,Public,24 hours daily,,,2,,,Non-Networked,,GPS,43.104011,-77.883046,03/14/2024,157966,2024-03-14 18:02:10,P,,,05/15/2020,J1772
ELEC,CMH STATION 5,67 Prospect Ave,Surface Lot,Hudson,NY,12534,,888-758-4389,E,,Public,24 hours daily,,,2,,,ChargePoint Network,http://www.chargepoint.com/,GPS,42.246590,-73.778700,10/29/2024,220317,2024-10-29 01:40:15,,,,05/28/2022,J1772
ELEC,BORO PARK BORO CHARGE 2,4915 10th Ave,,Borough Park,NY,11219,,888-758-4389,E,,Public,24 hours daily,,,2,,,ChargePoint Network,http://www.chargepoint.com/,GPS,40.638594,-73.998676,10/29/2024,206918,2024-10-29 01:40:11,,,,02/23/2022,J1772
ELEC,Town of Somers - Parking Lot,335 Route 202,,Somers,NY,10589,,813-492-5220,E,,Public,24 hours daily,A ANDROID_PAY APPLE_PAY D M V,,4,,,EVOKE,https://evokesystems.com/,GPS,41.328381,-73.685797,10/11/2024,357007,2024-10-11 18:09:31,P,,,05/30/2022,J1772
ELEC,BA #1 11 BRITISH AMER,11 British American Blvd,,Latham,NY,12110,,888-758-4389,E,,Public,24 hours daily,,,2,,,ChargePoint Network,http://www.chargepoint.com/,GPS,42.761303,-73.817540,10/29/2024,143437,2024-10-29 01:03:31,,,,08/15/2019,J1772
ELEC,U OF R AOC 10,10 Miracle Mile Dr,,Rochester,NY,14623,,888-758-4389,E,,Public,24 hours daily,,,2,,,ChargePoint Network,http://www.chargepoint.com/,GPS,43.081526,-77.633530,10/29/2024,251967,2024-10-29 01:55:30,,,,01/25/2023,J1772
ELEC,65 Remsen,65 Remsen St,,Cohoes,NY,12047,,1-844-623-1001,E,,Public,24 hours daily,,,2,,,LIVINGSTON,https://www.solution.energy,GPS,42.775280,-73.701370,10/29/2024,252712,2024-10-29 04:05:53,,,,11/29/2022,J1772
ELEC,GARVEY FRONT 1,257 Dix Ave,,Queensbury,NY,12804,,888-758-4389,E,,Public,24 hours daily,,,,1,,ChargePoint Network,http://www.chargepoint.com/,GPS,43.317330,-73.619144,10/29/2024,221395,2024-10-29 01:44:54,,,,06/16/2022,CHADEMO J1772COMBO
ELEC,351 Southern Blvd,351 Southern Blvd,These stations are located behind Sonic,Albany,NY,12209,,1-844-623-1001,E,,Public,24 hours daily,,,6,,,LIVINGSTON,https://www.solution.energy,GPS,42.630020,-73.774990,10/29/2024,334468,2024-10-29 04:05:38,,,,05/02/2024,J1772
ELEC,520806-Rockefeller Center,55 W 48th St,,New York City,NY,10036,,855-900-7584,E,,Public,24 hours daily,,,8,,,SHELL_RECHARGE,https://www.shell.us/motorist/electric-vehicle-charging.html,200-8,40.758305,-73.980311,10/29/2024,123040,2024-10-29 02:43:08,,,,05/25/2019,J1772
ELEC,GAULT BMW STATION 01,2311 North St,,Endicott,NY,13760,,888-758-4389,E,,Public,24 hours daily,,,2,,,ChargePoint Network,http://www.chargepoint.com/,GPS,42.107059,-76.035088,10/29/2024,162435,2024-10-29 00:33:14,,,,06/12/2020,J1772
ELEC,BORO PARK BORO CHARGE 6,4915 10th Ave,,Borough Park,NY,11219,,888-758-4389,E,,Public,24 hours daily,,,2,,,ChargePoint Network,http://www.chargepoint.com/,GPS,40.638581,-73.998691,10/29/2024,206916,2024-10-29 01:40:11,,,,02/23/2022,J1772
ELEC,MINNEWASKA EV 2,5281 US-44,,Kerhonkson,NY,12446,,888-758-4389,E,,Public,24 hours daily,,,2,,,ChargePoint Network,http://www.chargepoint.com/,GPS,41.730062,-74.234947,10/29/2024,171409,2024-10-29 01:20:39,,,,01/21/2021,J1772
ELEC,Glenwood Plaza,2002 Glenwood Ave,,Oneida,NY,13421,,1-844-623-1001,E,,Public,24 hours daily,,,6,,,LIVINGSTON,https://www.solution.energy,GPS,43.077160,-75.642910,10/29/2024,225117,2024-10-29 04:06:07,,,,07/18/2022,J1772
ELEC,First Avenue Parking,630 1st Avenue,,New York,NY,10016,,888-998-2546,E,,Public,24 hours daily,,,2,,,Blink Network,http://www.blinkcharging.com/,GPS,40.745096,-73.971921,10/29/2024,221326,2024-10-29 00:11:58,,,,06/15/2022,J1772
ELEC,ALBANY COUNTY ST1 208 WASH AV,208 Washington ave,,Albany,NY,12210,,888-758-4389,E,,Public,24 hours daily,,,2,,,ChargePoint Network,http://www.chargepoint.com/,GPS,42.656637,-73.764108,10/29/2024,218497,2024-10-29 01:43:10,,,,05/19/2022,J1772
ELEC,Steet Ponte Chevrolet Herkimer,3036 State Route 28,,Herkimer,NY,13350,,866-816-7584,E,,Public,24 hours daily,,,,1,,EV Connect,http://evconnect.com/,GPS,43.046076,-74.985338,10/29/2024,331330,2024-10-29 03:12:46,,,,03/29/2024,J1772COMBO
ELEC,The Peninsula Hotel New York - Tesla Destination,700 5th Ave,,New York,NY,10019,,877-798-3752,E,,Public,,,,1,,,Tesla Destination,https://www.tesla.com/destination-charging,200-8,40.761589,-73.975211,07/01/2024,115181,2024-10-16 16:58:41,P,,,08/07/2015,TESLA
ELEC,STRAND THEATRE THE STRAND,3092 NY-28,Side of Front Door Diner,Old Forge,NY,13420,,888-758-4389,E,,Public,24 hours daily,,,2,,,ChargePoint Network,http://www.chargepoint.com/,GPS,43.710848,-74.972152,10/29/2024,162293,2024-10-29 00:52:30,,,,06/12/2020,J1772
ELEC,203 E 71st St.,203 E 71st St.,,New York,NY,10021,,1-844-623-1001,E,,Public,24 hours daily,,,4,,,LIVINGSTON,https://www.solution.energy,GPS,40.768940,-73.960470,10/29/2024,223298,2024-10-29 04:04:48,,,,05/17/2022,J1772
ELEC,REGENERON 47G-02,Tempel Ln,Parking Lot,East Greenbush,NY,12061,,888-758-4389,E,,Public,24 hours daily,,,2,,,ChargePoint Network,http://www.chargepoint.com/,GPS,42.637283,-73.711837,10/29/2024,347995,2024-10-29 02:20:14,,,,06/15/2024,J1772
ELEC,CENTERS HEALTHC EV-2,170 Buffalo Avenue,Lot 1,Brooklyn,NY,11213,,888-758-4389,E,,Public,24 hours daily,,,2,,,ChargePoint Network,http://www.chargepoint.com/,GPS,40.673561,-73.926135,10/29/2024,328306,2024-10-29 02:15:03,,,,02/14/2024,J1772
ELEC,Waterloo Premium Outlets,655 New York 318,,Waterloo,NY,13165,,833-632-2778,E,,Public,24 hours daily,,,,4,,Electrify America,https://www.electrifyamerica.com/,GPS,42.955930,-76.920970,10/29/2024,166226,2024-10-29 02:57:25,,,,09/05/2020,CHADEMO J1772COMBO
ELEC,Lia Hyundai Albany,945 Central Ave,,Albany,NY,12205,,518-320-7235,E,,Public - Call ahead,24 hours daily,A D Debit M V,,1,,,Non-Networked,,GPS,42.683474,-73.792411,08/15/2024,229078,2024-08-15 19:57:12,P,,,09/17/2022,J1772
ELEC,HAMPTON INN STATION 2,1120 South Ave,Side of Hampton Inn & Suites,Staten Island,NY,10314,,888-758-4389,E,,Public,24 hours daily,,,2,,,ChargePoint Network,http://www.chargepoint.com/,GPS,40.612688,-74.178948,10/29/2024,181662,2024-10-29 01:21:03,,,,01/27/2021,J1772
ELEC,Quail Run Garage - Garage,63 Quail Run Dr,,Deer Park,NY,11729,,813-492-5220,E,,Public,24 hours daily,A ANDROID_PAY APPLE_PAY D M V,,8,,,EVOKE,https://evokesystems.com/,GPS,40.759039,-73.311639,10/11/2024,357080,2024-10-11 18:09:31,P,,,01/18/2023,J1772
ELEC,WHITEFACE MT WHITEFACE 2,Unnamed Road,Right Side Bear Den Lot,Wilmington,NY,12997,,888-758-4389,E,,Public,24 hours daily,,,2,,,ChargePoint Network,http://www.chargepoint.com/,GPS,44.359129,-73.858775,10/29/2024,170743,2024-10-29 01:24:22,,,,01/01/2021,J1772
ELEC,The Newbury,60 South River St,,Coxsackie,NY,12051,,1-844-623-1001,E,,Public,24 hours daily,,,6,,,LIVINGSTON,https://www.solution.energy,GPS,42.350420,-73.795390,10/29/2024,324877,2024-10-29 04:04:27,,,,08/04/2023,J1772
ELEC,1 WATERLINE STATION#5,10 Riverside Blvd,Waterline 1 garage,New York,NY,10069,,888-758-4389,E,,Public,24 hours daily,,,2,,,ChargePoint Network,http://www.chargepoint.com/,GPS,40.772904,-73.992514,10/29/2024,207796,2024-10-29 01:37:52,,,,03/09/2022,J1772
ELEC,Sand Creek Middle School,329 Sand Creek Road,,Albany,NY,12205,,1-844-623-1001,E,,Public,24 hours daily,,,4,,,LIVINGSTON,https://www.solution.energy,GPS,42.705950,-73.800890,10/29/2024,324851,2024-10-29 04:04:24,,,,09/06/2023,J1772
ELEC,FAIRGROUND VILL STATION 1,36 Lilith Fair,,Ballston Spa,NY,12020,,888-758-4389,E,,Public,24 hours daily,,,2,,,ChargePoint Network,http://www.chargepoint.com/,GPS,43.010630,-73.864400,10/29/2024,201762,2024-10-29 01:32:25,,,,11/30/2021,J1772
ELEC,Staten Island Mall Tommys Tavern and Tap,2655 Richmond Ave.,,Staten Island,NY,10314,,888-264-2208,E,,Public,Mon 6:00am - 11:59pm; Tue 6:00am - 11:59pm; Wed 6:00am - 11:59pm; Thu 6:00am - 11:59pm; Fri 6:00am - 11:59pm; Sat 6:00am - 11:59pm; Sun 6:00am - 11:59pm,,,1,,,SHELL_RECHARGE,https://www.shell.us/motorist/electric-vehicle-charging.html,GPS,40.581128,-74.167923,10/29/2024,166730,2024-10-29 02:51:17,,,,08/31/2020,J1772
ELEC,Bob Johnson Ford Avon,1675 Interstate Drive,,Avon,NY,14414,,1-888-717-4544,E,,Public,24 hours daily,,,6,6,,CHARGESMART_EV,https://chargesmartev.com,GPS,42.908898,-77.697675,10/29/2024,347382,2024-10-29 04:09:41,,,,06/04/2024,J1772 J1772COMBO
ELEC,Cayuga Heights,"836 Hanshaw Rd,",,Ithaca,NY,14850,,866-816-7584,E,,Public,24 hours daily,,,2,,,EV Connect,http://evconnect.com/,GPS,42.469472,-76.478871,10/29/2024,123137,2024-10-29 03:08:16,,,,04/01/2019,J1772
ELEC,Parkright 300 E 77th St - Tesla Destination,300 East 77th St,,New York,NY,10075,,877-798-3752,E,,Public,,,,3,,,Tesla Destination,https://www.tesla.com/destination-charging,200-9,40.771794,-73.955624,07/01/2024,115085,2024-10-16 16:58:41,P,,,11/13/2015,J1772 TESLA
ELEC,Briarwood Meadow Apartments,120 Stone Dr,,Black River,NY,13612,,1-844-623-1001,E,,Public,24 hours daily,,,6,,,LIVINGSTON,https://www.solution.energy,GPS,44.006760,-75.806850,10/29/2024,334474,2024-10-29 04:06:31,,,,05/02/2024,J1772
ELEC,CONNEXTCARE PHC STATION 3-4,61 Delano St,West end of main building,Pulaski,NY,13142,,888-758-4389,E,,Public,24 hours daily,,,2,,,ChargePoint Network,http://www.chargepoint.com/,GPS,43.569412,-76.120331,10/29/2024,252004,2024-10-29 01:55:59,,,,01/25/2023,J1772
ELEC,West Point Motor Pool,1940 Furance Road - Administrative Building,,West Point,NY,10996,,888-998-2546,E,,Public,24 hours daily,,,3,,,Blink Network,http://www.blinkcharging.com/,GPS,41.353157,-74.043969,10/29/2024,309306,2024-10-29 00:11:06,,,,11/16/2022,J1772
ELEC,CAP REP GARAGE 93 NORTH 1.3,93 N Pearl St,"Top floor of parking garage at 93 north pearl street, permit required",Albany,NY,12207,,888-758-4389,E,,Public,24 hours daily,,,2,,,ChargePoint Network,http://www.chargepoint.com/,GPS,42.652683,-73.750480,10/29/2024,183662,2024-10-29 01:25:05,,,,01/30/2021,J1772
ELEC,ShopRite Plaza,3532 North Rd,,Poughkeepsie,NY,12601,,1-844-623-1001,E,,Public,24 hours daily,,,12,,,LIVINGSTON,https://www.solution.energy,GPS,41.728680,-73.930060,10/29/2024,191110,2024-10-29 04:04:56,,,,10/28/2021,J1772
ELEC,WARRENCOUNTY DPW 4,1376 U.S. 9,,Lake George,NY,12845,,888-758-4389,E,,Public,24 hours daily,,,2,,,ChargePoint Network,http://www.chargepoint.com/,GPS,43.359200,-73.701305,10/29/2024,150256,2024-10-29 01:09:27,,,,12/17/2019,J1772
ELEC,Peppermints Restaurant - Tesla Destination,4870 W Henrietta Rd,,Henrietta,NY,14467,,877-798-3752,E,,Public,,,,3,,,Tesla Destination,https://www.tesla.com/destination-charging,200-9,43.055343,-77.653277,07/01/2024,114948,2024-10-16 16:58:41,P,,,12/29/2017,TESLA
ELEC,TOWN OF BABYLON TANNER PARK 2,Tanner Park,West side station,Amityville,NY,11701,,888-758-4389,E,,Public,24 hours daily,,,1,,,ChargePoint Network,http://www.chargepoint.com/,GPS,40.656884,-73.396359,10/29/2024,180136,2024-10-29 00:53:15,,,,01/27/2021,J1772
ELEC,L&L HOLDING CO. STATION 3,425 Park Ave,,New York,NY,10022,,888-758-4389,E,,Public,24 hours daily,,,2,,,ChargePoint Network,http://www.chargepoint.com/,GPS,40.760378,-73.971062,10/29/2024,333406,2024-10-29 00:54:39,,,,04/24/2024,J1772
ELEC,ERIE COUNTY ELLIOTT CREEK,12 Calvert Blvd,,Tonawanda,NY,14150,,888-758-4389,E,,Public,Mon 6:00am - 9:00pm; Tue 6:00am - 9:00pm; Wed 6:00am - 9:00pm; Thu 6:00am - 9:00pm; Fri 6:00am - 9:00pm; Sat 6:00am - 9:00pm; Sun 6:00am - 9:00pm,,,2,,,ChargePoint Network,http://www.chargepoint.com/,GPS,43.022540,-78.826160,10/29/2024,154777,2024-10-29 01:13:56,,,,03/27/2020,J1772
ELEC,2452 Route 9 Malta,2452 Route 9,,Malta,NY,12020,,1-844-623-1001,E,,Public,24 hours daily,,,8,,,LIVINGSTON,https://www.solution.energy,GPS,42.967620,-73.793400,10/29/2024,324764,2024-10-29 04:05:31,,,,09/25/2023,J1772
ELEC,DSL Marketing and Energy Icon Parking,57 W 53rd St,,New York,NY,10019,,833-692-6787,E,,Public - Credit card at all times,Contact station for hours of availability.,A ANDROID_PAY APPLE_PAY CREDIT D M,,4,,,AMPUP,https://ampup.io/,200-8,40.761698,-73.978338,10/11/2022,229921,2023-02-14 15:54:11,P,,,09/15/2022,J1772
ELEC,THE ITHACAN C,210 E Green St,Garage,Ithaca,NY,14850,,888-758-4389,E,,Public,24 hours daily,,,2,,,ChargePoint Network,http://www.chargepoint.com/,GPS,42.438944,-76.496065,10/29/2024,311782,2024-10-29 02:09:15,,,,09/28/2023,J1772
ELEC,"Amada Tool America, INC",4A Treadeasy Ave,,Batavia,NY,14020,,866-816-7584,E,,Public,24 hours daily,,,6,,,EV Connect,http://evconnect.com/,GPS,42.993683,-78.207242,10/29/2024,157943,2024-10-29 03:09:02,,,,05/15/2020,J1772
ELEC,ROCKLAND HYU STATION 1,55 New York 303,Side of Building,West Nyack,NY,10994,,888-758-4389,E,,Public,Mon 5:00pm - 12:00am; Tue 5:00pm - 12:00am; Wed 5:00pm - 12:00am; Thu 5:00pm - 12:00am; Fri 5:00pm - 12:00am; Sat 5:00pm - 12:00am; Sun 5:00pm - 12:00am,,,,1,,ChargePoint Network,http://www.chargepoint.com/,GPS,41.091420,-73.949911,10/29/2024,346710,2024-10-29 02:19:20,,,,05/23/2024,CHADEMO J1772COMBO
ELEC,New Baltimore NB Travel Plaza,Milepost 127 South NY State Thruway,,New Baltimore,NY,12124,,888-557-7099,E,,Public,24 hours daily,A ANDROID_PAY APPLE_PAY CREDIT D M V,,,4,,APPLEGREEN,https://www.applegreenelectric.com/,GPS,42.428571,-73.805581,10/11/2024,356179,2024-10-11 18:09:31,P,,,09/23/2024,CHADEMO J1772COMBO TESLA
ELEC,Lackawanna Train Station,45 Lewis St,,Binghamton,NY,13901,,1-888-717-4544,E,,Public,24 hours daily,,,4,,,CHARGESMART_EV,https://chargesmartev.com,GPS,42.103488,-75.907076,10/29/2024,347358,2024-10-29 04:09:20,,,,06/04/2024,J1772
ELEC,James Mitsubishi,1925 Black River Blvd,,Rome,NY,13440,,315-356-4444,E,,Public - Credit card at all times,24 hours daily,A D Debit M V,,2,,,Non-Networked,,GPS,43.237325,-75.436794,04/14/2024,227083,2024-04-14 22:11:34,P,,,08/26/2022,J1772
ELEC,Park Kwik LLC 50 Washington St. - Tesla Destination,45 Main St,,Brooklyn,NY,11201,,877-798-3752,E,,Public,,,,3,,,Tesla Destination,https://www.tesla.com/destination-charging,200-9,40.702882,-73.990594,07/01/2024,114906,2024-10-16 16:58:41,P,,,08/10/2017,J1772 TESLA
ELEC,North 12 Parking (at the William Vale) - Tesla Supercharger,113 N. 12th Street,,Brooklyn,NY,11249,,877-798-3752,E,,Public,24 hours daily. Please check Tesla's online station map to see if an adapter is required at this location.,,,,4,,Tesla,https://www.tesla.com/supercharger,200-8,40.721853,-73.956658,07/01/2024,102327,2024-08-14 18:58:22,P,,,07/23/2018,TESLA
ELEC,KINGSTON TR GALLO PARK,95 Dock St TR Gallo Waterfront Park,Fees collected at this EV station are for electric usage only. Users must also pay metered parking fee at separate kiosk. Paid Parking $.75 per hour 9am-6pm Mon-Sat,Kingston,NY,12401,,888-758-4389,E,,Public,24 hours daily,,,2,,,ChargePoint Network,http://www.chargepoint.com/,GPS,41.917631,-73.983671,10/29/2024,162262,2024-10-29 00:54:51,,,,06/12/2020,J1772
ELEC,SUNY BUFFALO PARKER 5,185 Hayes Rd,,Buffalo,NY,14214,,888-758-4389,E,,Public,24 hours daily,,,2,,,ChargePoint Network,http://www.chargepoint.com/,GPS,42.951204,-78.822398,10/29/2024,171282,2024-10-29 01:24:31,,,,01/14/2021,J1772
ELEC,CENTERS HEALTHC EV-7,170 Buffalo Avenue,,Brooklyn,NY,11213,,888-758-4389,E,,Public,24 hours daily,,,2,,,ChargePoint Network,http://www.chargepoint.com/,GPS,40.673563,-73.926362,10/29/2024,328312,2024-10-29 02:15:04,,,,02/14/2024,J1772
ELEC,Kendall Square  - Office,4 Ives St,,Delmar,NY,12054,,1-844-623-1001,E,,Public,24 hours daily,,,12,,,LIVINGSTON,https://www.solution.energy,GPS,42.601980,-73.817060,10/29/2024,334522,2024-10-29 04:06:21,,,,05/02/2024,J1772
ELEC,RC Lacy Ford,25 Maple Ave #9w,,Catskill,NY,12414,,1-888-717-4544,E,,Public,24 hours daily,,,4,4,,CHARGESMART_EV,https://chargesmartev.com,GPS,42.216659,-73.876835,10/29/2024,349064,2024-10-29 04:09:39,,,,06/22/2024,J1772 J1772COMBO
ELEC,DEMCO TRUHILTONCHARGE,3512 NY-434,,Vestal,NY,13850,,888-758-4389,E,,Public,24 hours daily,,,2,,,ChargePoint Network,http://www.chargepoint.com/,GPS,42.096362,-75.987614,10/29/2024,169881,2024-10-29 01:17:04,,,,12/03/2020,J1772
ELEC,Stop and Shop 566 - Arverne By-the-sea,70-20 Rockaway Beach Boulevard,,Queens,NY,11692,,888-264-2208,E,,Public,Mon 6:00am - 11:59pm; Tue 6:00am - 11:59pm; Wed 6:00am - 11:59pm; Thu 6:00am - 11:59pm; Fri 6:00am - 11:59pm; Sat 6:00am - 11:59pm; Sun 6:00am - 11:59pm,,,2,,,SHELL_RECHARGE,https://www.shell.us/motorist/electric-vehicle-charging.html,GPS,40.589813,-73.799949,10/29/2024,212485,2024-10-29 02:48:11,,,,03/25/2022,J1772
ELEC,RTS BAYTOWNE 2,Baytowne Plaza 1900 Empire Blvd,WalMart Shelter Location,Webster,NY,14580,,888-758-4389,E,,Public,24 hours daily,,,2,,,ChargePoint Network,http://www.chargepoint.com/,GPS,43.192290,-77.499040,10/29/2024,169289,2024-10-29 01:18:15,,,,11/18/2020,J1772
ELEC,PEAK POINT APT PEAK POINT EV2,1427 Saratoga Rd,Rear parking lot of Peak Point Apartments,Ballston Spa,NY,12020,,888-758-4389,E,,Public,24 hours daily,,,2,,,ChargePoint Network,http://www.chargepoint.com/,GPS,42.978535,-73.861580,10/29/2024,191436,2024-10-29 01:28:47,,,,06/24/2021,J1772
ELEC,Icon Parking 524 East 73rd - Tesla Destination,524 E 73rd St,,New York,NY,10021,,877-798-3752,E,,Public,,,,3,,,Tesla Destination,https://www.tesla.com/destination-charging,200-9,40.766736,-73.951891,07/01/2024,115149,2024-10-16 16:58:41,P,,,10/17/2018,J1772 TESLA
ELEC,20RTAC GARAGE TOP,211 North End Ave,,New York,NY,10282,,888-758-4389,E,,Public,24 hours daily,,,2,,,ChargePoint Network,http://www.chargepoint.com/,GPS,40.716132,-74.015557,10/29/2024,254305,2024-10-29 01:51:38,,,,02/21/2023,J1772
ELEC,SWTCH Energy,25 Forest Dr,,Garnerville,NY,10923,,844-798-2438,E,,Public,24 hours daily,A D Debit M V,,4,,,SWTCH,https://swtchenergy.com/,GPS,41.193673,-74.010766,11/09/2023,313647,2024-01-31 22:07:01,P,,,08/23/2023,J1772
ELEC,KINGSTON BLOCK PARK,302 Abeel St,Center of lot by bathrooms,Kingston,NY,12401,,888-758-4389,E,,Public,24 hours daily,,,2,,,ChargePoint Network,http://www.chargepoint.com/,GPS,41.915285,-73.992614,10/29/2024,325296,2024-10-29 02:12:01,,,,01/12/2024,J1772
ELEC,PICOTTE 11 CORPORATE 4,11 Corporate Woods Blvd,Behind building 11 east side of parking garage,Albany,NY,12211,,888-758-4389,E,,Public,24 hours daily,,,2,,,ChargePoint Network,http://www.chargepoint.com/,GPS,42.683420,-73.766650,10/29/2024,180635,2024-10-29 01:16:51,,,,01/27/2021,J1772
ELEC,TATABROOKFIELD #3,11 E Loop Rd,"Third charger in parking garage, from ""Parking Customer Exit"" gate.",New York,NY,10044,,888-758-4389,E,,Public,24 hours daily,,,1,,,ChargePoint Network,http://www.chargepoint.com/,GPS,40.755093,-73.955605,10/29/2024,143191,2024-10-29 01:03:29,,,,08/15/2019,J1772
ELEC,ALBANY COUNTY STATION 2,570 Hockey Ln,,Loudonville,NY,12211,,888-758-4389,E,,Public,24 hours daily,,,2,,,ChargePoint Network,http://www.chargepoint.com/,GPS,42.747577,-73.814622,10/29/2024,217380,2024-10-29 01:43:08,,,,05/12/2022,J1772
ELEC,NYC FLEET DPRWFMARNA_1_L3,1 Marina Road,,Queens,NY,11369,,888-758-4389,E,,Public,24 hours daily,,,,1,,ChargePoint Network,http://www.chargepoint.com/,GPS,40.760611,-73.856970,10/29/2024,331871,2024-10-29 02:17:29,,,,04/06/2024,CHADEMO J1772COMBO
ELEC,La Belle Vie Bed & Breakfast - Tesla Destination,208 Main St,,Penn Yan,NY,14527,,877-798-3752,E,,Public,,,,2,,,Tesla Destination,https://www.tesla.com/destination-charging,200-9,42.664003,-77.055996,07/01/2024,115210,2024-10-16 16:58:41,P,,,09/02/2015,TESLA
ELEC,Boondocks Restaurant,3954 NY-12,,Lyons Falls,NY,13368,,866-816-7584,E,,Public,24 hours daily,,,2,,,EV Connect,http://evconnect.com/,GPS,43.621010,-75.372871,10/29/2024,123107,2024-10-29 03:08:20,,,,04/01/2019,J1772
ELEC,NATIONAL GRID TOPS WATERTOWN,22050 US-11,"Side of Tops supermarket, spots marked in green",Watertown,NY,13601,,888-758-4389,E,,Public,24 hours daily,,,2,,,ChargePoint Network,http://www.chargepoint.com/,GPS,43.994810,-75.901730,10/29/2024,162231,2024-10-29 00:55:23,,,,06/12/2020,J1772
ELEC,Legoland New York Resort,420 Harriman Dr,,Goshen,NY,10924,,1-844-623-1001,E,,Public,24 hours daily,,,4,,,LIVINGSTON,https://www.solution.energy,GPS,41.379000,-74.315740,10/29/2024,223304,2024-10-29 04:05:19,,,,06/13/2022,J1772
ELEC,Horizon Ridge - South,100 Horizon View,,East Greenbush,NY,12061,,1-844-623-1001,E,,Public,24 hours daily,,,8,,,LIVINGSTON,https://www.solution.energy,GPS,42.586250,-73.693490,10/29/2024,334438,2024-10-29 04:06:22,,,,05/02/2024,J1772
ELEC,PANYNJ LGATCGARAGE 5-5,Taxi Access Rd LaGuardia Airport,Level 5,Queens,NY,11371,,888-758-4389,E,,Public,24 hours daily,,,1,,,ChargePoint Network,http://www.chargepoint.com/,GPS,40.769452,-73.865500,10/29/2024,331867,2024-10-29 02:17:26,,,,04/06/2024,J1772
ELEC,Enclave 50,1443 Saratoga Road,,Ballston Spa,NY,12020,,1-844-623-1001,E,,Public,24 hours daily,,,10,,,LIVINGSTON,https://www.solution.energy,GPS,42.980590,-73.859640,10/29/2024,324802,2024-10-29 04:05:43,,,,10/31/2023,J1772
ELEC,Burger King - LeRoy NY,134 W Main St,,Le Roy,NY,14482,,888-998-2546,E,,Public,24 hours daily,,,2,,,Blink Network,http://www.blinkcharging.com/,GPS,42.978631,-78.005787,10/29/2024,164405,2024-10-29 00:10:10,,,,07/22/2020,J1772
ELEC,MARKET 32 EV BARNEY RD EV3,1 Barney Rd,"To the left of building, poolside",Clifton Park,NY,12065,,888-758-4389,E,,Public,24 hours daily,,,2,,,ChargePoint Network,http://www.chargepoint.com/,GPS,42.845334,-73.807949,10/29/2024,175727,2024-10-29 01:13:09,,,,01/27/2021,J1772
ELEC,BASIL & WICK'S EV1,3195 NY-28,,North Creek,NY,12853,,888-758-4389,E,,Public,24 hours daily,,,2,,,ChargePoint Network,http://www.chargepoint.com/,GPS,43.681446,-73.972710,10/29/2024,193575,2024-10-29 01:31:40,,,,08/07/2021,J1772
ELEC,371 Elmira Rd - Ithaca,371 Elmira Rd,,Ithaca,NY,14850,,949-945-2000,E,,Public,24 hours daily,A ACCOUNT_BALANCE ANDROID_PAY APPLE_PAY CREDIT D M V,,,8,,EVGATEWAY,http://evgateway.com/,200-8,42.421280,-76.517640,05/09/2024,333805,2024-05-09 20:32:20,P,,,12/22/2023,J1772COMBO
ELEC,IPark 255 Schermerhorn - Tesla Destination,255 Schermerhorn St,,Brooklyn,NY,11217,,877-798-3752,E,,Public,,,,4,,,Tesla Destination,https://www.tesla.com/destination-charging,200-9,40.687913,-73.983039,07/01/2024,150582,2024-10-16 16:58:41,P,,,03/31/2019,TESLA
ELEC,OMG EV CHARGER EVCHARGER3,656 Co Hwy 33,,Cooperstown,NY,13326,,888-758-4389,E,,Public,24 hours daily,,,2,,,ChargePoint Network,http://www.chargepoint.com/,GPS,42.626144,-74.945076,10/29/2024,203019,2024-10-29 01:37:44,,,,12/24/2021,J1772
ELEC,Orienta Beach Club,1054 Walton Ave,,Mamaroneck,NY,10543,,1-844-623-1001,E,,Public,24 hours daily,,,4,,,LIVINGSTON,https://www.solution.energy,GPS,40.935940,-73.725390,10/29/2024,233083,2024-10-29 04:05:27,,,,08/02/2022,J1772
ELEC,CHEEKTOWAGA CHEEKTOWAGA,211 Ridge Park Ave,,Cheektowaga,NY,14225,,888-758-4389,E,,Public,24 hours daily,,,2,,,ChargePoint Network,http://www.chargepoint.com/,GPS,42.913478,-78.789878,10/29/2024,162313,2024-10-29 00:51:39,,,,06/12/2020,J1772
ELEC,HYUNDAI1 EV ATLANTA HYU1,193 Sunrise Hwy North Service Rd,,West Islip,NY,11795,,888-758-4389,E,,Public,24 hours daily,,,1,,,ChargePoint Network,http://www.chargepoint.com/,GPS,40.720610,-73.304546,10/29/2024,201778,2024-10-29 01:36:47,,,,11/30/2021,J1772
ELEC,Akorn Operating Company LLC.,219 Dixon Avenue,,Amityville,NY,11701,,866-816-7584,E,,Public,24 hours daily,,,4,,,EV Connect,http://evconnect.com/,GPS,40.683576,-73.408559,10/29/2024,315804,2024-10-29 03:08:44,,,,10/25/2023,J1772
ELEC,RTS IRONDEQUOIT #2,Irondequoit Plaza,,Irondequoit,NY,14617,,888-758-4389,E,,Public,24 hours daily,,,2,,,ChargePoint Network,http://www.chargepoint.com/,GPS,43.209057,-77.601380,10/29/2024,184902,2024-10-29 01:25:39,,,,02/12/2021,J1772
ELEC,MATTHEW IMPORT ABB STATION 1,3013 Vestal Rd,,Vestal,NY,13850,,888-758-4389,E,,Public,24 hours daily,,,,1,,ChargePoint Network,http://www.chargepoint.com/,GPS,42.101725,-76.004078,10/29/2024,223511,2024-10-29 01:43:09,,,,07/15/2022,J1772COMBO
ELEC,Saxon Woods Golf Course,315 Mamaroneck Road,,Scarsdale,NY,10583,,855-900-7584,E,,Public,24 hours daily,,,2,,,SHELL_RECHARGE,https://www.shell.us/motorist/electric-vehicle-charging.html,GPS,40.978092,-73.759020,10/29/2024,261295,2024-10-29 02:46:00,,,,05/24/2023,J1772
ELEC,NYU NYU # 2,2 Washington Square Village,,New York,NY,10012,,888-758-4389,E,,Public,24 hours daily,,,2,,,ChargePoint Network,http://www.chargepoint.com/,GPS,40.728283,-73.997251,10/29/2024,200987,2024-10-29 01:34:33,,,,11/11/2021,J1772
ELEC,Levittown Ford Sales Department,3195 Hempstead Turnpike,,Levittown,NY,11756,,888-998-2546,E,,Public,24 hours daily,,,6,,,Blink Network,http://www.blinkcharging.com/,GPS,40.726421,-73.517905,10/29/2024,309760,2024-10-29 00:18:29,,,,09/01/2023,J1772
ELEC,LIVEWELL GROUP 401 ASTOR CT,401 Astor Ct,Between Bldgs 400 and 500,Delmar,NY,12054,,888-758-4389,E,,Public,24 hours daily,,,2,,,ChargePoint Network,http://www.chargepoint.com/,GPS,42.609180,-73.847380,10/29/2024,165400,2024-10-29 01:17:31,,,,08/22/2020,J1772
ELEC,Galleries of Syracuse,147 Onondaga Ave,,Syracuse,NY,13204,,1-844-623-1001,E,,Public,24 hours daily,,,4,,,LIVINGSTON,https://www.solution.energy,GPS,43.045390,-76.151410,10/29/2024,189515,2024-10-29 04:05:03,,,,06/30/2021,J1772
ELEC,286WAE 49 SHERIDAN AVE,49 Sheridan Ave,,Albany,NY,12210,,888-758-4389,E,,Public,24 hours daily,,,2,,,ChargePoint Network,http://www.chargepoint.com/,GPS,42.654077,-73.752634,10/29/2024,185189,2024-10-29 01:25:38,,,,02/19/2021,J1772
ELEC,ERIE COUNTY SPRAGUE BROOK,9674 Foote Rd,,Glenwood,NY,14069,,888-758-4389,E,,Public,Mon 6:00am - 9:00pm; Tue 6:00am - 9:00pm; Wed 6:00am - 9:00pm; Thu 6:00am - 9:00pm; Fri 6:00am - 9:00pm; Sat 6:00am - 9:00pm; Sun 6:00am - 9:00pm,,,2,,,ChargePoint Network,http://www.chargepoint.com/,GPS,42.587340,-78.638110,10/29/2024,165307,2024-10-29 01:14:01,,,,08/19/2020,J1772
ELEC,Hamlin Beach State Park Camping,1 Hamlin Beach State Park,,Hamlin,NY,14464,,585-964-2462,E,,Public - Credit card at all times,24 hours daily,A D Debit M V,,1,,,Non-Networked,,GPS,43.357296,-77.950809,04/06/2023,256127,2024-01-31 22:07:01,P,,,03/09/2023,J1772
ELEC,EVolve NY Hancock,661 W. Main Street,,Hancock,NY,13783,,833-632-2778,E,,Public,24 hours daily,,,,8,,Electrify America,https://www.electrifyamerica.com/,GPS,41.956150,-75.294390,10/29/2024,237869,2024-10-29 02:56:21,,,,12/13/2022,CHADEMO J1772COMBO
ELEC,WHB LANDINGS STATION 4,3046 Mitchell Rd,parking lot 4,Westhampton Beach,NY,11978,,888-758-4389,E,,Public,Mon 8:00am - 5:00pm; Tue 8:00am - 5:00pm; Wed 8:00am - 5:00pm; Thu 8:00am - 5:00pm; Fri 8:00am - 5:00pm; Sat 8:00am - 5:00pm; Sun 8:00am - 5:00pm,,,2,,,ChargePoint Network,http://www.chargepoint.com/,GPS,40.806446,-72.642414,10/29/2024,241249,2024-10-29 01:46:02,,,,01/06/2023,J1772
ELEC,Sylvan Pinnacle Garage - Tesla Destination,112-01 Queens Blvd,,Forest Hills,NY,11375,,877-798-3752,E,,Public,,,,4,,,Tesla Destination,https://www.tesla.com/destination-charging,200-9,40.718526,-73.836480,07/01/2024,114940,2024-10-16 16:58:41,P,,,07/17/2018,TESLA
ELEC,Rapid Park - 204 W 101st 2nd Floor,204 W 101st Street,,New York,NY,10025,,1-844-623-1001,E,,Public,24 hours daily,,,4,,,LIVINGSTON,https://www.solution.energy,GPS,40.797430,-73.968700,10/29/2024,223088,2024-10-29 04:06:05,,,,01/26/2022,J1772
ELEC,ImPark 500 4th Ave - Tesla Destination,212 12th St,,Brooklyn,NY,11215,,877-798-3752,E,,Public,,,,4,,,Tesla Destination,https://www.tesla.com/destination-charging,200-8,40.668520,-73.990489,07/01/2024,122471,2024-10-16 16:58:41,P,,,12/19/2018,TESLA
ELEC,Town of Andes,242 Main street,,Andes,NY,13731,,866-816-7584,E,,Public,24 hours daily,,,2,,,EV Connect,http://evconnect.com/,GPS,42.190573,-74.781639,10/29/2024,230818,2024-10-29 03:08:59,,,,09/30/2022,J1772
ELEC,TOWN GLENVILLE IM PARK EV3,Indian Meadows Park 1 Jason Morris Way,near playground at bottom of the hill,Glenville,NY,12302,,888-758-4389,E,,Public,24 hours daily,,,2,,,ChargePoint Network,http://www.chargepoint.com/,GPS,42.887598,-73.936759,10/29/2024,175630,2024-10-29 01:14:39,,,,01/27/2021,J1772
ELEC,Village Hall,20 W Summit St,,Lakewood,NY,14750,,716-763-8557,E,,Public,24 hours daily,,,2,,,Non-Networked,,GPS,42.103591,-79.328576,07/11/2024,157955,2024-07-11 19:05:43,P,,,05/15/2020,J1772
ELEC,AECSOLAR STATION 2 AEC,210 Washington Ave Ext,USe chargers furthest away from building first,Albany,NY,12203,,888-758-4389,E,,Public,24 hours daily,,,2,,,ChargePoint Network,http://www.chargepoint.com/,GPS,42.703304,-73.856980,10/29/2024,192610,2024-10-29 01:30:52,,,,07/07/2021,J1772
ELEC,BELL SLIP BELL SLIP,575 Fuhrmann Boulevard,Bell slip restroom,Buffalo,NY,14203,,888-758-4389,E,,Public,24 hours daily,,,2,,,ChargePoint Network,http://www.chargepoint.com/,GPS,42.861438,-78.876215,10/29/2024,357505,2024-10-29 02:25:21,,,,10/04/2024,J1772
ELEC,Strand Center for the Arts,23 Brinkerhoff St,,Plattsburgh,NY,12901,,518-563-7642,E,,Public - Credit card at all times,24 hours daily,A D Debit M V,,2,,,Non-Networked,,GPS,44.696439,-73.454398,03/14/2024,227691,2024-03-14 18:02:10,P,,,09/13/2022,J1772
ELEC,Koester Associates,3101 Seneca Turnpike,,Canastota,NY,13032,,315-697-3800,E,,Public - Card key at all times,Open during business hours 8am -5pm M-F; need to enter building to receive code to use stations,,,2,,,Non-Networked,,GPS,43.067553,-75.771594,03/08/2023,187160,2024-01-31 22:07:01,P,,,03/22/2021,J1772
ELEC,Hampton Inn & Suites Yonkers - Westchester - Tesla Destination,555 Tuckahoe Rd,,Yonkers,NY,10710,,877-798-3752,E,,Public,,,,2,,,Tesla Destination,https://www.tesla.com/destination-charging,200-9,40.952649,-73.850804,07/01/2024,115252,2024-10-16 16:58:41,P,,,09/27/2016,J1772 TESLA
ELEC,QVI Customer Center,850 Hudson Ave,,Rochester,NY,14621,,949-945-2000,E,,Public,24 hours daily,A ACCOUNT_BALANCE ANDROID_PAY APPLE_PAY CREDIT D M V,,2,,,EVGATEWAY,http://evgateway.com/,200-8,43.180330,-77.598940,,333987,2024-04-29 18:47:13,P,,,03/31/2023,J1772
ELEC,FOX CDJR STATION1 L2 HWY,346 Grant Avenue Rd,Main Lot,Auburn,NY,13021,,888-758-4389,E,,Public,24 hours daily,,,2,,,ChargePoint Network,http://www.chargepoint.com/,GPS,42.961056,-76.539700,10/29/2024,235864,2024-10-29 01:50:57,,,,11/09/2022,J1772
ELEC,SHINEMAN SOUTH SHINEMAN CNTR 2,Centennial Drive,South Parking East Border Station 2,Oswego,NY,13126,,888-758-4389,E,,Public,24 hours daily,,,2,,,ChargePoint Network,http://www.chargepoint.com/,GPS,43.454196,-76.538055,10/29/2024,352213,2024-10-29 02:23:00,,,,08/08/2024,J1772
ELEC,LGA Airpark,99-111 Ditmars Blvd,,East Elmhurst,NY,11369,,1-844-623-1001,E,,Public,24 hours daily,,,20,,,LIVINGSTON,https://www.solution.energy,GPS,40.770490,-73.870140,10/29/2024,233084,2024-10-29 04:04:36,,,,08/23/2022,J1772
ELEC,551W21 SR Capital - Tesla Destination,558 West 21st Street,,New York,NY,10011,,877-798-3752,E,,Public,,,,6,,,Tesla Destination,https://www.tesla.com/destination-charging,200-9,40.747437,-74.007111,07/01/2024,168556,2024-10-16 16:58:41,P,,,12/28/2016,TESLA
ELEC,Northeast Industrial Park,Northeast Industrial Park,,Altamont,NY,12009,,1-844-623-1001,E,,Public,24 hours daily,,,2,,,LIVINGSTON,https://www.solution.energy,GPS,42.688040,-73.959870,10/29/2024,348152,2024-10-29 04:06:37,,,,06/19/2024,J1772
ELEC,MAIN STATIONLOT STATION1,205 Sunrise Hwy,,West Islip,NY,11795,,888-758-4389,E,,Public,24 hours daily,,,2,,,ChargePoint Network,http://www.chargepoint.com/,GPS,40.720564,-73.303834,10/29/2024,221992,2024-10-29 01:45:18,,,,06/25/2022,J1772
ELEC,NYC FLEET DPR_ICAHN_1_L3,10 Central Rd,,New York,NY,10035,,888-758-4389,E,,Public,24 hours daily,,,,1,,ChargePoint Network,http://www.chargepoint.com/,GPS,40.792194,-73.924550,10/29/2024,170122,2024-10-29 01:06:54,,,,12/12/2020,CHADEMO J1772COMBO
ELEC,BLOOM CT4K GW1,13 Clinton St,Near front entrance,Tully,NY,13159,,888-758-4389,E,,Public,24 hours daily,,,2,,,ChargePoint Network,http://www.chargepoint.com/,GPS,42.798965,-76.108150,10/29/2024,240876,2024-10-29 01:50:51,,,,01/04/2023,J1772
ELEC,PANYNJ LGA WEST 1,LGA West Garage LaGuardia Airport,Terminal B parking garage,Flushing,NY,11371,,888-758-4389,E,,Public,24 hours daily,,,1,,,ChargePoint Network,http://www.chargepoint.com/,GPS,40.773116,-73.874977,10/29/2024,162285,2024-10-29 00:52:49,,,,06/12/2020,J1772
ELEC,Beach Point Club - Beach Point Club,900 Rushmore Ave,,Mamaroneck,NY,10543,,813-492-5220,E,,Public,24 hours daily,A ANDROID_PAY APPLE_PAY D M V,,6,,,EVOKE,https://evokesystems.com/,GPS,40.938295,-73.723881,10/11/2024,357119,2024-10-11 18:09:31,P,,,05/16/2024,J1772
ELEC,ATRIUM EVCHARGE EV8,451 Clifton Park Center Rd,In parking lot.,Clifton Park,NY,12065,,888-758-4389,E,,Public,24 hours daily,,,2,,,ChargePoint Network,http://www.chargepoint.com/,GPS,42.856313,-73.785630,10/29/2024,225562,2024-10-29 01:41:51,,,,08/16/2022,J1772
ELEC,WEST HERR AUTO WH MR L2-1,4295 W Henrietta Rd,,Rochester,NY,14623,,888-758-4389,E,,Public,24 hours daily,,,2,,,ChargePoint Network,http://www.chargepoint.com/,GPS,43.066208,-77.648914,10/29/2024,307651,2024-10-29 02:06:19,,,,08/23/2023,J1772
ELEC,VILLAGEHALL VILLAGE HALL,76 E Market St,-Behind the Firehouse,Rhinebeck,NY,12572,,888-758-4389,E,,Public,24 hours daily,,,2,,,ChargePoint Network,http://www.chargepoint.com/,GPS,41.926403,-73.909853,10/29/2024,162181,2024-10-29 00:56:40,,,,06/12/2020,J1772
ELEC,NORTHLAND 2,683 Northland Ave,,Buffalo,NY,14211,,888-758-4389,E,,Public,24 hours daily,,,2,,,ChargePoint Network,http://www.chargepoint.com/,GPS,42.917819,-78.834371,10/29/2024,162269,2024-10-29 00:54:23,,,,06/12/2020,J1772
ELEC,AT LABS ATL STATION 2,22 Corporate Dr,Main Parking Lot,Clifton Park,NY,12065,,888-758-4389,E,,Public,24 hours daily,,,2,,,ChargePoint Network,http://www.chargepoint.com/,GPS,42.848347,-73.758180,10/29/2024,227846,2024-10-29 01:35:35,,,,09/20/2022,J1772
ELEC,BURNS MGT EMPIRE RUN 4,130 Excelsior Ave,Side parking lot of empire run apartments,Saratoga Springs,NY,12866,,888-758-4389,E,,Public,24 hours daily,,,2,,,ChargePoint Network,http://www.chargepoint.com/,GPS,43.089897,-73.767280,10/29/2024,193187,2024-10-29 01:29:44,,,,07/27/2021,J1772
ELEC,SAVARINO COMPAN BRL #1,"BRL Covered Lot, single charger 1 South Stree",,Buffalo,NY,14204,,888-758-4389,E,,Public,24 hours daily,,,1,,,ChargePoint Network,http://www.chargepoint.com/,GPS,42.864134,-78.868096,10/29/2024,164159,2024-10-29 01:17:29,,,,07/11/2020,J1772
ELEC,BOB JOHNSON BOB JOHNSONKIA2,3817 W Henrietta Rd,,Rochester,NY,14623,,888-758-4389,E,,Public,24 hours daily,,,,1,,ChargePoint Network,http://www.chargepoint.com/,GPS,43.078085,-77.643174,10/29/2024,260370,2024-10-29 01:45:45,,,,05/06/2023,CHADEMO J1772COMBO
ELEC,REGENERON 17-JB-G3-01,Tempel Ln,,East Greenbush,NY,12061,,888-758-4389,E,,Public,24 hours daily,,,2,,,ChargePoint Network,http://www.chargepoint.com/,GPS,42.637254,-73.711512,10/29/2024,347261,2024-10-29 02:19:16,,,,06/01/2024,J1772
ELEC,Revel - Queens,28-17 42nd Rd,,Queens,NY,11101,,949-945-2000,E,,Public,24 hours daily,A D Debit M V,,,7,,REVEL,https://gorevel.com,GPS,40.748857,-73.939357,,358439,2024-10-15 18:09:47,P,,,10/08/2024,J1772COMBO TESLA
ELEC,Mansion Square,441 Balltown Rd,,Schenectady,NY,12309,,1-844-623-1001,E,,Public,24 hours daily,,,8,,,LIVINGSTON,https://www.solution.energy,GPS,42.774100,-73.894750,10/29/2024,189520,2024-10-29 04:05:28,,,,09/17/2020,J1772
ELEC,411 Theodore - Outdoor,411 Theodore Fremd Ave,,Rye,NY,10580,,813-492-5220,E,,Public,24 hours daily,A ANDROID_PAY APPLE_PAY D M V,,10,,,EVOKE,https://evokesystems.com/,GPS,40.973587,-73.700617,10/11/2024,357028,2024-10-11 18:09:31,P,,,10/20/2023,J1772
ELEC,LPCL STATION1,30 Lake Placid Club Way,Behind Registration Building,Lake Placid,NY,12946,,888-758-4389,E,,Public,24 hours daily,,,2,,,ChargePoint Network,http://www.chargepoint.com/,GPS,44.283206,-73.979572,10/29/2024,123468,2024-10-29 01:02:33,,,,06/01/2019,J1772
ELEC,Adirondack Pub & Brewery,33 Canada street,,Lake George,NY,12845,,866-816-7584,E,,Public,24 hours daily,,,3,,,EV Connect,http://evconnect.com/,GPS,43.418575,-73.713812,10/29/2024,155025,2024-10-29 03:08:52,,,,08/07/2019,J1772
ELEC,169 West 95th St - Tesla Destination,169 W 95th St,,New York,NY,10025,,877-798-3752,E,,Public,,,,2,,,Tesla Destination,https://www.tesla.com/destination-charging,200-9,40.793234,-73.970236,07/01/2024,115030,2024-10-16 16:58:41,P,,,04/30/2016,J1772 TESLA
ELEC,TPWC TPWC 1,2594 Western Av,Bldg 1,Altamont,NY,12009,,888-758-4389,E,,Public,24 hours daily,,,1,,,ChargePoint Network,http://www.chargepoint.com/,GPS,42.714979,-73.935166,10/29/2024,227761,2024-10-29 01:31:59,,,,09/17/2022,J1772
ELEC,NEW HARTFORD GW-1 1.4,8635 Clinton St,,New Hartford,NY,13413,,888-758-4389,E,,Public,24 hours daily,,,2,,,ChargePoint Network,http://www.chargepoint.com/,GPS,43.092920,-75.316210,10/29/2024,174765,2024-10-29 01:06:34,,,,01/27/2021,J1772
ELEC,PANYNJ LGA E GARAGE W1,East Garage E End Rd LaGuardia Airport,"LGA East Garage, West End",New York,NY,11371,,888-758-4389,E,,Public,24 hours daily,,,2,,,ChargePoint Network,http://www.chargepoint.com/,GPS,40.770752,-73.866327,10/29/2024,180166,2024-10-29 00:35:03,,,,01/27/2021,J1772
ELEC,TPWC TPWC 3,2594 Western Av,Bldg 2,Altamont,NY,12009,,888-758-4389,E,,Public,24 hours daily,,,1,,,ChargePoint Network,http://www.chargepoint.com/,GPS,42.714647,-73.935708,10/29/2024,227763,2024-10-29 01:31:59,,,,09/17/2022,J1772
ELEC,Fairfield Inn - Binghamton,864 Upper Front Street,,Binghamton,NY,13905,,1-888-717-4544,E,,Public,24 hours daily,,,10,,,CHARGESMART_EV,https://chargesmartev.com,GPS,42.130516,-75.905101,10/29/2024,357887,2024-10-29 04:09:42,,,,10/11/2024,J1772
ELEC,BURNS MGT OXFORD 5,6203 Johnston Rd,"Derbyshire building, Oxford Heights",Albany,NY,12203,,888-758-4389,E,,Public,24 hours daily,,,2,,,ChargePoint Network,http://www.chargepoint.com/,GPS,42.685246,-73.870747,10/29/2024,173863,2024-10-29 00:55:31,,,,01/27/2021,J1772
ELEC,NATIONAL GRID RIVERVIEW SOLAR,600 Riverwalk Pkwy,Side of the 600 building,Tonawanda,NY,14150,,888-758-4389,E,,Public,24 hours daily,,,2,,,ChargePoint Network,http://www.chargepoint.com/,GPS,43.000068,-78.910950,10/29/2024,162247,2024-10-29 00:55:17,,,,06/12/2020,J1772
ELEC,Romeo Chevrolet,1665 Ulster Ave,,Lake Katrine,NY,12449,,845-943-4374,E,,Public,24 hours daily,,,2,1,,Non-Networked,,200-9,41.980335,-73.990256,03/08/2023,85682,2024-01-31 22:07:01,P,,,06/01/2017,J1772 J1772COMBO
ELEC,VOEASTROCHESTER EYER PARK,200 Wilson Ave.,Eyer Park Parking Lot,East Rochester,NY,14445,,888-758-4389,E,,Public,24 hours daily,,,2,,,ChargePoint Network,http://www.chargepoint.com/,GPS,43.110207,-77.474785,10/29/2024,223423,2024-10-29 01:45:50,,,,07/13/2022,J1772
ELEC,Empire State Plaza P2N,S Mall Arterial,,Albany,NY,12207,,866-816-7584,E,,Public,24 hours daily,,,2,,,EV Connect,http://evconnect.com/,GPS,42.647454,-73.754851,10/29/2024,254237,2024-10-29 03:08:53,,,,02/18/2023,J1772
ELEC,Dunkin',405 W Main St,,Batavia,NY,14020,,585-219-4015,E,,Public,24 hours daily,,,1,,,Non-Networked,,GPS,43.004421,-78.203921,05/09/2024,157965,2024-05-09 20:32:20,P,,,05/15/2020,J1772
ELEC,VASSAR COLLEGE STATION 1,165 College Avenue,,Arlington,NY,12603,,888-758-4389,E,,Public,24 hours daily,,,2,,,ChargePoint Network,http://www.chargepoint.com/,GPS,41.690379,-73.901281,10/29/2024,352058,2024-10-29 02:22:02,,,,08/03/2024,J1772
ELEC,2 WEST AVE 2 WEST 1.1,2 West Ave,,Saratoga Springs,NY,12866,,888-758-4389,E,,Public,24 hours daily,,,2,,,ChargePoint Network,http://www.chargepoint.com/,GPS,43.084297,-73.803154,10/29/2024,182002,2024-10-29 01:23:39,,,,01/27/2021,J1772
ELEC,SWTCH Energy Inc.,1275 Gerling St W,,Schenectady,NY,12308,,844-798-2438,E,,Public,24 hours daily,A D Debit M V,,8,,,SWTCH,https://swtchenergy.com/,GPS,42.824300,-73.909400,02/12/2024,325985,2024-02-12 21:24:44,P,,,01/04/2024,J1772
ELEC,MARKET 32 EV BARNEY RD EV2,1 S Barney Rd,"To the left of building, poolside",Clifton Park,NY,12065,,888-758-4389,E,,Public,24 hours daily,,,2,,,ChargePoint Network,http://www.chargepoint.com/,GPS,42.845306,-73.807870,10/29/2024,175726,2024-10-29 01:13:10,,,,01/27/2021,J1772
ELEC,RRH PORTLAND G1,Rochester General Hospital Dr,Left side just beyond entrance,Rochester,NY,14621,,888-758-4389,E,,Public,24 hours daily,,,2,,,ChargePoint Network,http://www.chargepoint.com/,GPS,43.193340,-77.585720,10/29/2024,156615,2024-10-29 01:08:19,,,,05/22/2020,J1772
ELEC,6386 Transit Rd. Midtown,6386 Transit Road,,Depew,NY,14043,,888-998-2546,E,,Public,24 hours daily,,,4,,,Blink Network,http://www.blinkcharging.com/,GPS,42.932516,-78.699246,10/29/2024,320491,2024-10-29 00:18:39,,,,08/17/2023,J1772
ELEC,The Woodbine Inn,144 Malden Ave,,Palenville,NY,12463,,1-844-623-1001,E,,Public,24 hours daily,,,2,,,LIVINGSTON,https://www.solution.energy,GPS,42.170670,-74.021410,10/29/2024,334514,2024-10-29 04:06:22,,,,05/02/2024,J1772
ELEC,Icon Parking OMNI - Tesla Destination,143-159 W 68th St,,New York,NY,10023,,877-798-3752,E,,Public,,,,3,,,Tesla Destination,https://www.tesla.com/destination-charging,200-8,40.775920,-73.983130,07/01/2024,115015,2024-10-16 16:58:41,P,,,10/17/2018,J1772 TESLA
ELEC,2112-2124 NY 7 EV3,2114 NY-7,Main Parking Lot EV 3,Troy,NY,12180,,888-758-4389,E,,Public,24 hours daily,,,2,,,ChargePoint Network,http://www.chargepoint.com/,GPS,42.807058,-73.545238,10/29/2024,190054,2024-10-29 01:28:46,,,,05/25/2021,J1772
ELEC,Parks Dept (Public),285 Nepperhan Ave,,Yonkers,NY,10701,,866-816-7584,E,,Public,24 hours daily,,,2,,,EV Connect,http://evconnect.com/,GPS,40.936659,-73.889828,10/29/2024,307983,2024-10-29 03:11:56,,,,08/26/2023,J1772
ELEC,Putnam Plaza Shopping Center,1872 Route 6,,Carmel,NY,10512,,877-455-3833,E,,Public,24 hours daily,,,,1,,eVgo Network,https://www.evgo.com/,GPS,41.412844,-73.667098,10/28/2024,228618,2024-10-28 23:59:42,,,,03/07/2018,CHADEMO J1772COMBO
ELEC,35 Red Cross Pl,35 Red Cross Pl,,Brooklyn,NY,11201,,888-356-8911,E,,Public,24 hours daily,,,6,,,FLO,https://flo.ca/,GPS,40.699487,-73.989516,10/29/2024,226846,2024-10-29 03:32:21,,,,09/01/2022,J1772
ELEC,Riverhead Auto Mall,1800 Old Country Rd,,Riverhead,NY,11901,,631-369-0600,E,,Public - Call ahead,Dealership business hours,,,2,2,,Non-Networked,,200-8,40.924230,-72.704790,02/12/2024,44186,2024-02-12 15:25:05,P,,,11/30/2011,CHADEMO J1772 J1772COMBO
ELEC,DMV PARKING LOT JOHNSTOWN,227 W Main St,Back left of lot,Johnstown,NY,12095,,888-758-4389,E,,Public,24 hours daily,,,2,,,ChargePoint Network,http://www.chargepoint.com/,GPS,43.006616,-74.375423,10/29/2024,162306,2024-10-29 00:52:17,,,,06/12/2020,J1772
ELEC,Staples Plaza,3379 Crompond Rd,,Yorktown Heights,NY,10598,,877-455-3833,E,,Public,24 hours daily,,,,1,,eVgo Network,https://www.evgo.com/,GPS,41.289986,-73.830730,10/28/2024,228598,2024-10-28 23:59:40,,,,03/07/2018,CHADEMO J1772COMBO
ELEC,SCHD DCFAST HOG,4020 Sunrise Hwy,South Service Rd,Oakdale,NY,11769,,888-758-4389,E,,Public,Mon 9:00am - 5:00pm; Tue 9:00am - 6:00pm; Wed 9:00am - 6:00pm; Thu 9:00am - 6:00pm; Fri 9:00am - 8:00pm; Sat 9:00am - 5:00pm,,,,1,,ChargePoint Network,http://www.chargepoint.com/,GPS,40.748166,-73.139644,10/29/2024,183103,2024-10-29 01:04:28,,,,01/27/2021,J1772COMBO
ELEC,M Hotel Buffalo,2040 Walden Ave,,Cheektowaga,NY,14225,,1-888-717-4544,E,,Public,24 hours daily,,,10,,,CHARGESMART_EV,https://chargesmartev.com,GPS,42.908828,-78.759731,10/29/2024,351779,2024-10-29 04:09:34,,,,07/30/2024,J1772
ELEC,MPG 10 E 102nd Street - Tesla Destination,10 E 102nd St,,New York,NY,10029,,877-798-3752,E,,Public,,,,3,,,Tesla Destination,https://www.tesla.com/destination-charging,200-9,40.791360,-73.952155,07/01/2024,114983,2024-10-16 16:58:41,P,,,08/30/2017,J1772 TESLA
ELEC,TMD MAIN LOT CT4000-2,179 Halbert St,,Buffalo,NY,14214,,888-758-4389,E,,Public,24 hours daily,,,2,,,ChargePoint Network,http://www.chargepoint.com/,GPS,42.935327,-78.841612,10/29/2024,233153,2024-10-29 01:49:57,,,,10/08/2022,J1772
ELEC,QT STATION 1,62-10 Northern Blvd,visitor parking,Woodside,NY,11377,,888-758-4389,E,,Public,24 hours daily,,,2,,,ChargePoint Network,http://www.chargepoint.com/,GPS,40.753602,-73.899789,10/29/2024,224507,2024-10-29 01:45:21,,,,07/28/2022,J1772
ELEC,Lake George RV Park,74 NY-149,,Lake George,NY,12845,,1-844-623-1001,E,,Public,24 hours daily,,,4,,,LIVINGSTON,https://www.solution.energy,GPS,43.370720,-73.690830,10/29/2024,324833,2024-10-29 04:06:13,,,,11/02/2023,J1772
ELEC,SUNY ONEONTA SUNY ONEONTA,24-26 Ravine Pkwy N,,Oneonta,NY,13820,,888-758-4389,E,,Public,24 hours daily,,,2,,,ChargePoint Network,http://www.chargepoint.com/,GPS,42.469481,-75.065723,10/29/2024,71024,2024-10-29 01:12:10,,,,11/10/2015,J1772
ELEC,Labor Temple Associates,890 3rd Street,,Albany,NY,12206,,1-844-623-1001,E,,Public,24 hours daily,,,4,,,LIVINGSTON,https://www.solution.energy,GPS,42.678940,-73.785980,10/29/2024,347941,2024-10-29 04:06:36,,,,06/14/2024,J1772
ELEC,HOSELTON TOYOTA TOYOTA- EV 1,50 Marsh Rd,,East Rochester,NY,14445,,888-758-4389,E,,Public,24 hours daily,,,2,,,ChargePoint Network,http://www.chargepoint.com/,GPS,43.100956,-77.480872,10/29/2024,255582,2024-10-29 01:56:15,,,,03/06/2023,J1772
ELEC,HOMEWOOD ALBANY HOMEWOOD #1,216 Wolf Road,Station Located in Rear Left Side of Building (SW),Albany,NY,12205,,888-758-4389,E,,Public,24 hours daily,,,2,,,ChargePoint Network,http://www.chargepoint.com/,GPS,42.725766,-73.799445,10/29/2024,329811,2024-10-29 02:15:35,,,,03/05/2024,J1772
ELEC,Wegmans 675 Alberta Drive DCFC,675 Alberta Drive,,Amherst,NY,14226,,888-264-2208,E,,Public,Mon 6:00am - 11:59pm; Tue 6:00am - 11:59pm; Wed 6:00am - 11:59pm; Thu 6:00am - 11:59pm; Fri 6:00am - 11:59pm; Sat 6:00am - 11:59pm; Sun 6:00am - 11:59pm,,,,2,,SHELL_RECHARGE,https://www.shell.us/motorist/electric-vehicle-charging.html,GPS,42.988964,-78.815500,10/29/2024,253574,2024-10-29 02:52:20,,,,02/08/2023,J1772COMBO
ELEC,"Home2 Suites by Hilton Rochester Henrietta, NY - Tesla Destination",999 Jefferson Rd,,Rochester,NY,14623,,877-798-3752,E,,Public,,,,3,,,Tesla Destination,https://www.tesla.com/destination-charging,200-9,43.086614,-77.611179,07/01/2024,115228,2024-10-16 16:58:41,P,,,12/01/2017,J1772 TESLA
ELEC,South Colonie High School,1 Raider Boulevard,,Albany,NY,12205,,1-844-623-1001,E,,Public,24 hours daily,,,4,,,LIVINGSTON,https://www.solution.energy,GPS,42.707970,-73.810810,10/29/2024,324858,2024-10-29 04:06:12,,,,10/24/2023,J1772
ELEC,MPG Parking 98-41 Queens Blvd - Tesla Destination,98-59 65th Rd,,Rego Park,NY,11374,,877-798-3752,E,,Public,,,,4,,,Tesla Destination,https://www.tesla.com/destination-charging,200-8,40.728618,-73.856054,07/01/2024,150577,2024-10-16 16:58:41,P,,,03/31/2019,TESLA
ELEC,AMPHENOL 191 STATION 1,191 Delaware Ave,Parking lot of Amphenol Aerospace,Sidney,NY,13838,,888-758-4389,E,,Public,24 hours daily,,,2,,,ChargePoint Network,http://www.chargepoint.com/,GPS,42.307167,-75.400803,10/29/2024,346480,2024-10-29 01:38:18,,,,05/18/2024,J1772
ELEC,Kendall Square - Wayland,4 Ives St,,Delmar,NY,12054,,1-844-623-1001,E,,Public,24 hours daily,,,10,,,LIVINGSTON,https://www.solution.energy,GPS,42.602480,-73.816640,10/29/2024,334447,2024-10-29 04:06:21,,,,05/02/2024,J1772
ELEC,FISHKILL SUMONE,1 Summit Ct,,Fishkill,NY,12524,,888-758-4389,E,,Public,24 hours daily,,,2,,,ChargePoint Network,http://www.chargepoint.com/,GPS,41.539801,-73.885734,10/29/2024,261050,2024-10-29 01:44:25,,,,05/19/2023,J1772
ELEC,Dune Deck - Tesla Destination,379 Dune Rd,,Westhampton Beach,NY,11978,,877-798-3752,E,,Public,,,,2,,,Tesla Destination,https://www.tesla.com/destination-charging,200-9,40.789476,-72.662817,07/01/2024,115247,2024-10-16 16:58:41,P,,,05/25/2018,TESLA
ELEC,CHEEKTOWAGA ALEXANDER #4,275 Alexander Ave,,Buffalo,NY,14211,,888-758-4389,E,,Public,24 hours daily,,,1,,,ChargePoint Network,http://www.chargepoint.com/,GPS,42.913030,-78.791232,10/29/2024,183769,2024-10-29 01:25:04,,,,02/04/2021,J1772
ELEC,One Overlook Ave,1 Overlook Ave,,Great Neck,NY,11021,,1-844-623-1001,E,,Public,24 hours daily,,,2,,,LIVINGSTON,https://www.solution.energy,GPS,40.785080,-73.721790,10/29/2024,334486,2024-10-29 04:06:26,,,,05/02/2024,J1772
ELEC,U.S.B.STATION#1 ULSTER SAVINGS,180 Schwenk Dr,,Kingston,NY,12401,,888-758-4389,E,,Public,24 hours daily,,,2,,,ChargePoint Network,http://www.chargepoint.com/,GPS,41.937650,-74.025314,10/29/2024,145543,2024-10-29 01:04:22,,,,09/26/2019,J1772
ELEC,Binghamton University Smart Energy Building,25 Murray Hill Rd,,Vestal,NY,13850,,607-777-2517,E,,Public - Credit card at all times,24 hours daily,A D Debit M V,,6,,,Non-Networked,,GPS,42.094240,-75.960493,10/11/2024,227068,2024-10-11 18:09:31,P,,,08/26/2022,J1772
ELEC,Park Ford of Mahopac,276 US 6,,Mahopac,NY,10541,,1-888-717-4544,E,,Public,Mon 5:00am - 12:00am; Tue 5:00am - 12:00am; Wed 5:00am - 12:00am; Thu 5:00am - 12:00am; Fri 5:00am - 12:00am; Sat 5:00am - 12:00am,,,,4,,CHARGESMART_EV,https://chargesmartev.com,GPS,41.354085,-73.748188,10/29/2024,348208,2024-10-29 04:09:40,,,,06/20/2024,J1772COMBO
ELEC,Rapidpark 204 W 101st Street - Tesla Destination,204 W 101st St,,New York,NY,10025,,877-798-3752,E,,Public,,,,3,,,Tesla Destination,https://www.tesla.com/destination-charging,200-9,40.797359,-73.968718,07/01/2024,115047,2024-10-16 16:58:41,P,,,08/17/2017,J1772 TESLA
ELEC,Centereach Park,284 Hawkins Road,,Centereach,NY,11720,,866-816-7584,E,,Public,24 hours daily,,,4,,,EV Connect,http://evconnect.com/,GPS,40.881372,-73.075896,10/29/2024,123094,2024-10-29 03:08:22,,,,04/01/2019,J1772
ELEC,TOWN OF BABYLON OVERLOOK 2,100 Ocean Pkwy,,Babylon,NY,11702,,888-758-4389,E,,Public,24 hours daily,,,1,,,ChargePoint Network,http://www.chargepoint.com/,GPS,40.633720,-73.333663,10/29/2024,162279,2024-10-29 00:53:15,,,,06/12/2020,J1772
ELEC,JAMESTOWN BPU 1 W 2ND ST #1,1 W 2ND ST,Near parking lot exit. Also on a one way road going east.,Jamestown,NY,14701,,888-758-4389,E,,Public,24 hours daily,,,,1,,ChargePoint Network,http://www.chargepoint.com/,GPS,42.095284,-79.241570,10/29/2024,213901,2024-10-29 01:42:35,,,,04/13/2022,CHADEMO J1772COMBO
ELEC,Cambria Niagara Falls.,333 Rainbow Boulevard,,Niagara Falls,NY,14303,,888-998-2546,E,,Public,24 hours daily,,,4,,,Blink Network,http://www.blinkcharging.com/,GPS,43.083013,-79.057885,10/29/2024,311686,2024-10-29 00:17:12,,,,06/26/2023,J1772
ELEC,COLE GROUP HIGHLAND 3,20 Eastview Dr,,Watervliet,NY,12189,,888-758-4389,E,,Public,24 hours daily,,,2,,,ChargePoint Network,http://www.chargepoint.com/,GPS,42.736157,-73.718150,10/29/2024,260036,2024-10-29 02:01:10,,,,04/28/2023,J1772
ELEC,Icon Parking Sutton 53 - Tesla Destination,417 E 53rd St,,New York,NY,10022,,877-798-3752,E,,Public,,,,3,,,Tesla Destination,https://www.tesla.com/destination-charging,200-8,40.755363,-73.963841,07/01/2024,115128,2024-10-16 16:58:41,P,,,01/09/2018,J1772 TESLA
ELEC,HAMMOCKS CANAND HATC 4000 LEFT,4000 Hammocks Drive,West Parking Border,Canandaigua,NY,14424,,888-758-4389,E,,Public,24 hours daily,,,2,,,ChargePoint Network,http://www.chargepoint.com/,GPS,42.880063,-77.298475,10/29/2024,351555,2024-10-29 02:22:03,,,,07/26/2024,J1772
ELEC,U OF R AOC 7,10 Miracle Mile Dr,,Rochester,NY,14623,,888-758-4389,E,,Public,24 hours daily,,,2,,,ChargePoint Network,http://www.chargepoint.com/,GPS,43.081549,-77.633504,10/29/2024,250579,2024-10-29 01:55:31,,,,01/12/2023,J1772
ELEC,MUNICIPAL EVSE YMCA GLENN ST,635 Upper Glen St,,Queensbury,NY,12804,,888-758-4389,E,,Public,24 hours daily,,,2,,,ChargePoint Network,http://www.chargepoint.com/,GPS,43.323772,-73.662550,10/29/2024,155246,2024-10-29 01:14:12,,,,04/08/2020,J1772
ELEC,Vision Sports Club,37  Jefferson Ave,,Pearl River,NY,10965,,1-844-623-1001,E,,Public,24 hours daily,,,6,,,LIVINGSTON,https://www.solution.energy,GPS,41.056780,-74.023250,10/29/2024,252727,2024-10-29 04:05:31,,,,12/29/2022,J1772
ELEC,MILTON NY CCENTER5,310 Northline Rd,Parking Lot,Ballston Spa,NY,12020,,888-758-4389,E,,Public,24 hours daily,,,2,,,ChargePoint Network,http://www.chargepoint.com/,GPS,43.024878,-73.851155,10/29/2024,258943,2024-10-29 01:55:57,,,,04/11/2023,J1772
ELEC,New York State Labor Management,1105 Vine St,,Liverpool,NY,13088,,855-885-9571,E,,Public,,,,26,,,OpConnect,http://www.opconnect.com/,GPS,43.112588,-76.195090,10/29/2024,253740,2024-10-29 03:04:44,,,,02/09/2023,J1772
ELEC,KINGSTON CORNELL ST. LOT,Saccoman Ln,,Kingston,NY,12401,,888-758-4389,E,,Public,24 hours daily,,,2,,,ChargePoint Network,http://www.chargepoint.com/,GPS,41.929587,-74.002941,10/29/2024,251715,2024-10-29 00:54:53,,,,01/24/2023,J1772
ELEC,506 W 181 St Garage-PARK-it - Tesla Destination,506 W 181 St,,Manhattan,NY,10033,,877-798-3752,E,,Public,,,,4,,,Tesla Destination,https://www.tesla.com/destination-charging,200-9,40.848358,-73.931743,07/01/2024,150535,2024-10-16 16:58:41,P,,,08/28/2019,TESLA
ELEC,BETHLEHEM EV ELM PARK PUBLIC,261 Elm Ave,,Delmar,NY,12054,,888-758-4389,E,,Public,24 hours daily,,,2,,,ChargePoint Network,http://www.chargepoint.com/,GPS,42.599927,-73.839915,10/29/2024,171218,2024-10-29 01:22:41,,,,01/09/2021,J1772
ELEC,DPW Highway Department Town of Ramapo,16 Pioneer Ave,,Suffern,NY,10901,,1-844-623-1001,E,,Public,24 hours daily,,,8,,,LIVINGSTON,https://www.solution.energy,GPS,41.118700,-74.099920,10/29/2024,353122,2024-10-29 04:06:55,,,,08/20/2024,J1772
ELEC,Fairfield Inn & Suites by Marriott Elmira Corning - Tesla Destination,1600 County Rd 64,,Horseheads,NY,14845,,877-798-3752,E,,Public,,,,3,,,Tesla Destination,https://www.tesla.com/destination-charging,200-9,42.158638,-76.856484,07/01/2024,114953,2024-10-16 16:58:41,P,,,10/23/2017,J1772 TESLA
ELEC,PPC STATION 1,Point Place Casino 450 St Route 31,Rear parking lot,Bridgeport,NY,13030,,888-758-4389,E,,Public,24 hours daily,,,2,,,ChargePoint Network,http://www.chargepoint.com/,GPS,43.153633,-75.965896,10/29/2024,180130,2024-10-29 00:53:24,,,,01/27/2021,J1772
ELEC,Apple Parking 332 W 11th Street - Tesla Destination,332 W 11th St,,New York,NY,10014,,877-798-3752,E,,Public,,,,3,,,Tesla Destination,https://www.tesla.com/destination-charging,200-9,40.735597,-74.007693,07/01/2024,115100,2024-10-16 16:58:41,P,,,03/10/2017,TESLA
ELEC,TownePlace Suites - Buffalo Airport,4265 Genesee St,,Buffalo,NY,14225,,716-839-1880,E,,Public,24 hours daily; chargers for guest use only,,,4,,,Non-Networked,,GPS,42.930570,-78.728499,03/14/2024,104733,2024-03-14 18:02:10,P,,,11/01/2018,J1772
ELEC,BURDICK BMW CP6K1,5947 E Circle Drive,,Cicero,NY,13039,,888-758-4389,E,,Public,24 hours daily,,,1,,,ChargePoint Network,http://www.chargepoint.com/,GPS,43.147719,-76.116936,10/29/2024,355920,2024-10-29 02:24:10,,,,09/19/2024,J1772
ELEC,Waterside Plaza Garage,30 Waterside Plaza,,New York,NY,19104,,855-223-5351,E,,Public,24 hours daily,A D M V,,24,,,FLASH,https://www.flashparking.com/products/diversify-parking-revenue/ev-charging-as-a-revenue-stream/,GPS,40.737210,-73.974085,10/29/2024,355464,2024-10-29 03:20:58,,,,09/11/2024,J1772
ELEC,Hyatt Place Malta,20 State Farm Place,,Ballston Spa,NY,12020,,1-844-623-1001,E,,Public,24 hours daily,,,4,,,LIVINGSTON,https://www.solution.energy,GPS,42.969330,-73.804480,10/29/2024,223259,2024-10-29 04:05:29,,,,04/04/2022,J1772
ELEC,HARMONY MILLS 1 WEST 2 2.2,100 N Mohawk St,,Cohoes,NY,12047,,888-758-4389,E,,Public,24 hours daily,,,2,,,ChargePoint Network,http://www.chargepoint.com/,GPS,42.778507,-73.702840,10/29/2024,174732,2024-10-29 01:07:55,,,,01/27/2021,J1772
ELEC,The Ocean - 1 West St Garage,1 West St,,New York,NY,10004,,813-492-5220,E,,Public,24 hours daily,A ANDROID_PAY APPLE_PAY D M V,,20,,,EVOKE,https://evokesystems.com/,GPS,40.705242,-74.016123,10/11/2024,356876,2024-10-11 18:09:31,P,,,09/29/2023,J1772
ELEC,Sleepy Hollow Public Parking,55 Elm St,,Sleepy Hollow,NY,10591,,866-816-7584,E,,Public,24 hours daily,,,2,,,EV Connect,http://evconnect.com/,GPS,41.085732,-73.865476,10/29/2024,230803,2024-10-29 03:08:52,,,,09/30/2022,J1772
ELEC,OLYMPIC SPORTS SPORTS 5,Bob Run Rd,,Lake Placid,NY,12946,,888-758-4389,E,,Public,24 hours daily,,,2,,,ChargePoint Network,http://www.chargepoint.com/,GPS,44.220483,-73.923765,10/29/2024,182114,2024-10-29 01:23:59,,,,01/27/2021,J1772
ELEC,Admirals Cove - Building 1,"1100 Admirals Cove Blvd, Bldg 1",,Haverstraw,NY,10927,,813-492-5220,E,,Public,24 hours daily,A ANDROID_PAY APPLE_PAY D M V,,6,,,EVOKE,https://evokesystems.com/,GPS,41.191569,-73.958774,10/11/2024,356896,2024-10-11 18:09:31,P,,,02/16/2024,J1772
ELEC,Village Green Apartments 500  B,100 Village Blvd S,,Baldswinsville,NY,13027,,1-844-623-1001,E,,Public,24 hours daily,,,8,,,LIVINGSTON,https://www.solution.energy,GPS,43.130140,-76.311560,10/29/2024,334502,2024-10-29 04:06:28,,,,05/02/2024,J1772
ELEC,REGENERON 17-J-G3-03,Tempel Ln,,East Greenbush,NY,12061,,888-758-4389,E,,Public,24 hours daily,,,2,,,ChargePoint Network,http://www.chargepoint.com/,GPS,42.637238,-73.711402,10/29/2024,347262,2024-10-29 02:19:16,,,,06/01/2024,J1772
ELEC,ProPark 110-45 Queens Blvd - Tesla Destination,110-45 Queens Blvd,,Forest Hills,NY,11375,,877-798-3752,E,,Public,,,,4,,,Tesla Destination,https://www.tesla.com/destination-charging,200-9,40.719885,-73.838570,07/01/2024,150614,2024-10-16 16:58:41,P,,,01/18/2019,TESLA
ELEC,577 Baltic Street - Adam America Real Estate - Tesla Destination,577 Baltic Street,,Brooklyn,NY,11217,,877-798-3752,E,,Public,,,,4,,,Tesla Destination,https://www.tesla.com/destination-charging,200-9,40.681151,-73.982101,07/01/2024,168557,2024-10-16 16:58:41,P,,,04/12/2017,TESLA
ELEC,BEDFORD_EV KATONAH LOT 1,70 Katonah Ave.  Lot 1,Kotanah Train Metro North - Parking Lot 1,Katonah,NY,10536,,888-758-4389,E,,Public,24 hours daily,,,2,,,ChargePoint Network,http://www.chargepoint.com/,GPS,41.259809,-73.683831,10/29/2024,162339,2024-10-29 00:50:55,,,,06/12/2020,J1772
ELEC,Orangetown Town Hall,26 Orangeburg Rd,,Orangeburg,NY,10962,,866-816-7584,E,,Public,24 hours daily,,,8,,,EV Connect,http://evconnect.com/,GPS,41.046157,-73.956649,10/29/2024,331668,2024-10-29 03:12:29,,,,04/04/2024,J1772
ELEC,WESTBROOKE WBC GOLDENROD,133 Golden Rod Ln,Near Front Entrance,Henrietta,NY,14623,,888-758-4389,E,,Public,24 hours daily,,,2,,,ChargePoint Network,http://www.chargepoint.com/,GPS,43.077842,-77.647183,10/29/2024,257250,2024-10-29 01:57:48,,,,03/29/2023,J1772
ELEC,Alexander Apartments 5-8,225 Patroon Creek Blvd,,Albany,NY,12206,,1-844-623-1001,E,,Public,24 hours daily,,,4,,,LIVINGSTON,https://www.solution.energy,GPS,42.683090,-73.805400,10/29/2024,334500,2024-10-29 04:05:27,,,,05/02/2024,J1772
ELEC,EVolve NY Friendship,2 Pennsylvania Ave,,Friendship,NY,14739,,833-632-2778,E,,Public,24 hours daily,,,,4,,Electrify America,https://www.electrifyamerica.com/,GPS,42.202580,-78.145750,10/29/2024,279389,2024-10-29 02:56:08,,,,06/22/2023,CHADEMO J1772COMBO
ELEC,FC1225 2144 S#1,2144 Brighton Henrietta Town Line Rd,West Parking Area,Rochester,NY,14623,,888-758-4389,E,,Public,24 hours daily,,,2,,,ChargePoint Network,http://www.chargepoint.com/,GPS,43.095137,-77.619942,10/29/2024,235344,2024-10-29 01:50:12,,,,10/28/2022,J1772
ELEC,Village of Spencerport - Port Museum,16 East Ave,,Spencerport,NY,14559,,585-352-4771,E,,Public,24 hours daily,,,1,,,Non-Networked,,GPS,43.191902,-77.799795,03/14/2024,157967,2024-03-14 18:02:10,P,,,05/15/2020,J1772
ELEC,RRH 2,8103 Oak Orchard Rd,Near shipping and receiving rear,Batavia,NY,14020,,888-758-4389,E,,Public,24 hours daily,,,2,,,ChargePoint Network,http://www.chargepoint.com/,GPS,43.020200,-78.190758,10/29/2024,357642,2024-10-29 02:09:08,,,,10/08/2024,J1772
ELEC,NATIONAL GRID ONONDAGA LAKE,104 Lake Dr,In front of Onondaga County Parks Main Office,Liverpool,NY,13088,,888-758-4389,E,,Public,24 hours daily,,,2,,,ChargePoint Network,http://www.chargepoint.com/,GPS,43.100499,-76.206647,10/29/2024,162213,2024-10-29 00:56:03,,,,06/12/2020,J1772
ELEC,Spin Test Facility,1 Research Cir.,,Niskayuna,NY,12309,,800-663-5633,E,,Public,24 hours daily,,,12,,,Blink Network,http://www.blinkcharging.com/,GPS,42.831453,-73.880977,10/29/2024,195162,2024-10-29 00:10:52,,,,11/05/2018,J1772
ELEC,123 Leonard St,123 Leonard S,,New York,NY,10013,,888-356-8911,E,,Public,24 hours daily,,,4,,,FLO,https://flo.ca/,GPS,40.716079,-74.002165,10/29/2024,298593,2024-10-29 03:33:31,,,,06/28/2023,J1772
ELEC,HIDDEN CREEK HC 150 LEFT,150 Charwood Cir,,Irondequoit,NY,14609,,888-758-4389,E,,Public,24 hours daily,,,2,,,ChargePoint Network,http://www.chargepoint.com/,GPS,43.183364,-77.559942,10/29/2024,257255,2024-10-29 01:59:00,,,,03/29/2023,J1772
ELEC,GGMC Parking Carnegie Garage - Tesla Destination,40 E 94th St,,New York,NY,10128,,877-798-3752,E,,Public,,,,3,,,Tesla Destination,https://www.tesla.com/destination-charging,200-9,40.785670,-73.954593,07/01/2024,115117,2024-10-16 16:58:41,P,,,08/21/2015,J1772 TESLA
ELEC,854ELLICOTT 589 ELLICOTT 7,589 Ellicott St,,Buffalo,NY,14203,,888-758-4389,E,,Public,24 hours daily,,,2,,,ChargePoint Network,http://www.chargepoint.com/,GPS,42.895780,-78.868307,10/29/2024,169907,2024-10-29 01:24:31,,,,12/04/2020,J1772
ELEC,Rochester Institute of Technology - Lot T,1 Lomb Memorial Dr,Located across from the GIS building,Rochester,NY,14623,,585-475-5000,E,,Public,24 hours daily; access restricted to students and staff 5am-5pm; parking pass required,,,6,,,Non-Networked,,200-9,43.087790,-77.674413,03/08/2023,63988,2024-01-31 22:07:01,P,,,10/01/2013,J1772
ELEC,4 W 93rd St,4 W 93rd St,,New York,NY,10025,,888-356-8911,E,,Public,24 hours daily,,,2,,,FLO,https://flo.ca/,GPS,40.789958,-73.966488,10/29/2024,192949,2024-10-29 03:32:20,,,,07/17/2021,J1772
ELEC,5935 Broadway,5935 Broadway,,Bronx,NY,10463,,888-356-8911,E,,Public,24 hours daily,,,4,,,FLO,https://flo.ca/,GPS,40.888461,-73.899119,10/29/2024,191505,2024-10-29 03:33:19,,,,06/25/2021,J1772
ELEC,Shops at Main / Transit - Tesla Supercharger,4455 Transit Road,,Buffalo,NY,14221,,877-798-3752,E,,Public,24 hours daily. Please check Tesla's online station map to see if an adapter is required at this location.,,,,8,,Tesla,https://www.tesla.com/supercharger,200-9,42.968675,-78.695680,07/01/2024,102328,2024-08-14 18:58:22,P,,,06/01/2015,TESLA
ELEC,WHDHIEXWEBSTER NORTH BORDER 1,860 Holt Road,North Parking Border Station 5 (Right),Webster,NY,14580,,888-758-4389,E,,Public,24 hours daily,,,2,,,ChargePoint Network,http://www.chargepoint.com/,GPS,43.217289,-77.444931,10/29/2024,353987,2024-10-29 02:23:45,,,,08/27/2024,J1772
ELEC,TCR TOWNE EV STATION 2,12 California ave,,Albany,NY,12205,,888-758-4389,E,,Public,24 hours daily,,,2,,,ChargePoint Network,http://www.chargepoint.com/,GPS,42.704044,-73.813849,10/29/2024,181866,2024-10-29 01:23:28,,,,01/27/2021,J1772
ELEC,Ledges Apartments,26686 Boyer Cicle,,Evans Mills,NY,13637,,1-844-623-1001,E,,Public,24 hours daily,,,8,,,LIVINGSTON,https://www.solution.energy,GPS,44.053970,-75.838030,10/29/2024,334458,2024-10-29 04:06:32,,,,05/02/2024,J1772
ELEC,U OF R AOC 5,10 Miracle Mile Dr,,Rochester,NY,14623,,888-758-4389,E,,Public,24 hours daily,,,2,,,ChargePoint Network,http://www.chargepoint.com/,GPS,43.081549,-77.633457,10/29/2024,250577,2024-10-29 01:55:30,,,,01/12/2023,J1772
ELEC,School House Manor Apartments,1 north pearl street,,Oakfield,NY,14125,,1-888-222-6618,E,,Public,,,,2,,,NOODOE,https://www.noodoe.com,GPS,43.065619,-78.269090,10/29/2024,359971,2024-10-29 03:59:06,,,,10/17/2024,J1772
ELEC,Stop and Shop 559 530 West Old Country Road,530 West Old Country Road,,Hicksville,NY,11801,,888-264-2208,E,,Public,Mon 6:00am - 11:59pm; Tue 6:00am - 11:59pm; Wed 6:00am - 11:59pm; Thu 6:00am - 11:59pm; Fri 6:00am - 11:59pm; Sat 6:00am - 11:59pm; Sun 6:00am - 11:59pm,,,2,,,SHELL_RECHARGE,https://www.shell.us/motorist/electric-vehicle-charging.html,GPS,40.758454,-73.545894,10/29/2024,220207,2024-10-29 02:49:42,,,,05/20/2022,J1772
ELEC,Harriman Ave,45 Harriman Ave,,Yonkers,NY,10701,,866-816-7584,E,,Public,24 hours daily,,,4,,,EV Connect,http://evconnect.com/,GPS,40.972128,-73.889165,10/29/2024,258971,2024-10-29 03:11:24,,,,04/11/2023,J1772
ELEC,Best Western Adirondack Inn - Tesla Destination,2625 Main St,,Lake Placid,NY,12946,,877-798-3752,E,,Public,,,,3,,,Tesla Destination,https://www.tesla.com/destination-charging,200-9,44.283968,-73.983714,07/01/2024,114965,2024-10-16 16:58:41,P,,,05/01/2015,J1772 TESLA
ELEC,Saint Joseph Medical Center Garage,104 S Broadway,,Yonkers,NY,10701,,949-945-2000,E,,Public,24 hours daily,A ACCOUNT_BALANCE ANDROID_PAY APPLE_PAY CREDIT D M V,,3,,,EVGATEWAY,http://evgateway.com/,200-8,40.930420,-73.896770,05/09/2024,333862,2024-05-09 20:32:20,P,,,06/21/2023,J1772
ELEC,BETHLEHEM EV TOWNHALL PUBLIC,445 Delaware Ave.,,Delmar,NY,12054,,888-758-4389,E,,Public,24 hours daily,,,2,,,ChargePoint Network,http://www.chargepoint.com/,GPS,42.620461,-73.839323,10/29/2024,166770,2024-10-29 01:19:39,,,,09/10/2020,J1772
ELEC,Brookfield Place - Tesla Supercharger,250 Vesey Street,,New York City,NY,10080,,877-798-3752,E,,Public,6am-10pm daily. Please check Tesla's online station map to see if an adapter is required at this location.,,,,4,,Tesla,https://www.tesla.com/supercharger,GPS,40.714177,-74.016332,07/01/2024,153434,2024-08-14 18:58:22,P,,,01/31/2020,TESLA
ELEC,Kingston Nissan,140 Route 28,,Kingston,NY,12401,,845-338-3100,E,,Public - Call ahead,Dealership business hours,,,1,1,,Non-Networked,,200-8,41.949090,-74.031850,02/12/2024,44352,2024-02-12 15:25:05,P,,,11/30/2011,CHADEMO J1772
ELEC,Patriot Square,451 Rudy Chase Drive,,Glenville,NY,12302,,1-844-623-1001,E,,Public,24 hours daily,,,10,,,LIVINGSTON,https://www.solution.energy,GPS,42.863850,-73.928840,10/29/2024,324819,2024-10-29 04:06:14,,,,10/25/2023,J1772
ELEC,Bill Rapp Subaru - Norwich,4814 RT-23,,Norwich,NY,13815,,888-998-2546,E,,Public,24 hours daily,,,2,,,Blink Network,http://www.blinkcharging.com/,GPS,42.539069,-75.509964,10/29/2024,309225,2024-10-29 00:10:22,,,,06/07/2022,J1772
ELEC,Icon Parking 70 Gold Street - Tesla Destination,80 Gold St,,New York,NY,10038,,877-798-3752,E,,Public,,,,3,,,Tesla Destination,https://www.tesla.com/destination-charging,200-9,40.710019,-74.004385,07/01/2024,115186,2024-10-16 16:58:41,P,,,02/28/2018,J1772 TESLA
ELEC,TOM TOWN CENTER,740 W Boston Post Rd,Near Town Offices Entrance,Mamaroneck,NY,10543,,888-758-4389,E,,Public,24 hours daily,,,2,,,ChargePoint Network,http://www.chargepoint.com/,GPS,40.943074,-73.741147,10/29/2024,143287,2024-10-29 01:04:15,,,,08/15/2019,J1772
ELEC,TOWNE HYUNDAI 3A,3525 Southwestern Blvd,"North side, right charger",Orchard Park,NY,14127,,888-758-4389,E,,Public,24 hours daily,,,,1,,ChargePoint Network,http://www.chargepoint.com/,GPS,42.788209,-78.759475,10/29/2024,225169,2024-10-29 01:47:03,,,,08/09/2022,CHADEMO J1772COMBO
ELEC,75 Park Place,75 Park Place,,New York,NY,10007,,888-998-2546,E,,Public,24 hours daily,,,1,,,Blink Network,http://www.blinkcharging.com/,GPS,40.714463,-74.010980,10/29/2024,260078,2024-10-29 00:20:18,,,,04/28/2023,J1772
ELEC,Lake Taghkanic State Park,1528 State Route 82,,Ancram,NY,12502,,866-816-7584,E,,Public,24 hours daily,,,2,,,EV Connect,http://evconnect.com/,GPS,42.090936,-73.720106,10/29/2024,231041,2024-10-29 03:11:04,,,,09/30/2022,J1772
ELEC,COMMCTR NEW PALTZ TOWN,Veterans Dr,Near front entrance,New Paltz,NY,12561,,888-758-4389,E,,Public,24 hours daily,,,2,,,ChargePoint Network,http://www.chargepoint.com/,GPS,41.756382,-74.081041,10/29/2024,162372,2024-10-29 00:48:39,,,,06/12/2020,J1772
ELEC,BILLY AUTO CT4K,632 Broadway,,Amityville,NY,11701,,888-758-4389,E,,Public,24 hours daily,,,2,,,ChargePoint Network,http://www.chargepoint.com/,GPS,40.697607,-73.425838,10/29/2024,253853,2024-10-29 01:56:37,,,,02/10/2023,J1772
ELEC,Econo Lodge Brockport,6575 4th Section Road,,Brockport,NY,14420,,1-888-717-4544,E,,Public,24 hours daily,,,10,,,CHARGESMART_EV,https://chargesmartev.com,GPS,43.197899,-77.946869,10/29/2024,350287,2024-10-29 04:09:31,,,,07/10/2024,J1772
ELEC,SRYMCASSB BATTENKILL 1.1,15 Van Ness Ave,,Greenwich,NY,12834,,888-758-4389,E,,Public,24 hours daily,,,2,,,ChargePoint Network,http://www.chargepoint.com/,GPS,43.093964,-73.506775,10/29/2024,183460,2024-10-29 01:22:59,,,,01/27/2021,J1772
ELEC,City of Binghamton - Recreation Park,88 Beethoven St,,Binghamton,NY,13901,,607-772-7017,E,,Public,24 hours daily,,,2,,,Non-Networked,,200-8,42.099763,-75.935148,03/14/2024,86715,2024-03-14 18:02:10,LG,,,08/10/2017,J1772
ELEC,RRH CLIFTON LEFT 1,2 Coulter Rd,Right side of Emergency Entrance in front of retaining wall,Clifton Springs,NY,14432,,888-758-4389,E,,Public,24 hours daily,,,2,,,ChargePoint Network,http://www.chargepoint.com/,GPS,42.959843,-77.135293,10/29/2024,174408,2024-10-29 01:04:46,,,,01/27/2021,J1772
ELEC,Champion Parking 90 LLC - Tesla Destination,60 E 90th St,,New York,NY,10028,,877-798-3752,E,,Public,,,,3,,,Tesla Destination,https://www.tesla.com/destination-charging,GPS,40.783085,-73.956304,07/01/2024,115167,2024-10-16 16:58:41,P,,,12/28/2016,J1772 TESLA
ELEC,60 East 94th Street - Upper Floor,40 E 94th St,,New York,NY,10128,,813-492-5220,E,,Public,24 hours daily,A ANDROID_PAY APPLE_PAY D M V,,10,,,EVOKE,https://evokesystems.com/,GPS,40.785615,-73.954764,10/11/2024,357019,2024-10-11 18:09:31,P,,,01/11/2024,J1772
ELEC,CORNELL STATION9,527 College Ave,Hollister hall,Ithaca,NY,14853,,888-758-4389,E,,Public,24 hours daily,,,2,,,ChargePoint Network,http://www.chargepoint.com/,GPS,42.443926,-76.484361,10/29/2024,326448,2024-10-29 02:13:57,,,,01/24/2024,J1772
ELEC,"Country Inn & Suites by Radisson, Lake George - Tesla Destination",1130 U.S. 9,,Queensbury,NY,12804,,877-798-3752,E,,Public,,,,4,,,Tesla Destination,https://www.tesla.com/destination-charging,200-9,43.348898,-73.688830,07/01/2024,122495,2024-10-16 16:58:41,P,,,06/18/2018,J1772 TESLA
ELEC,CENTERS HEALTHC EV-3,170 Buffalo Avenue,Lot 1,Brooklyn,NY,11213,,888-758-4389,E,,Public,24 hours daily,,,2,,,ChargePoint Network,http://www.chargepoint.com/,GPS,40.673561,-73.926143,10/29/2024,328307,2024-10-29 02:15:03,,,,02/14/2024,J1772
ELEC,MEM. PLZ STATION 1,46 Memorial Plaza,,Pleasantville,NY,10570,,888-758-4389,E,,Public,24 hours daily,,,2,,,ChargePoint Network,http://www.chargepoint.com/,GPS,41.134476,-73.792840,10/29/2024,234634,2024-10-29 01:50:53,,,,10/19/2022,J1772
ELEC,ULSTER COUNTY PUBLIC WORKS,317 shamrock lane,,Kingston,NY,12401,,888-758-4389,E,,Public,24 hours daily,,,2,,,ChargePoint Network,http://www.chargepoint.com/,GPS,41.936001,-74.028210,10/29/2024,212141,2024-10-29 01:41:23,,,,03/22/2022,J1772
ELEC,Yorkville Towers - Garage,230 E 92nd St,,New York,NY,10128,,813-492-5220,E,,Public,24 hours daily,A ANDROID_PAY APPLE_PAY D M V,,10,,,EVOKE,https://evokesystems.com/,GPS,40.781919,-73.950508,10/11/2024,356966,2024-10-11 18:09:31,P,,,01/12/2024,J1772
ELEC,800 Westchester,800 Westchester Avenue,,Rye Brook,NY,10573,,1-844-623-1001,E,,Public,24 hours daily,,,2,,,LIVINGSTON,https://www.solution.energy,GPS,41.006560,-73.690200,10/29/2024,324770,2024-10-29 04:05:15,,,,05/11/2023,J1772
ELEC,REIKART HOUSE JAZZBOLINE 1,5000-5010 Main St,,Buffalo,NY,14226,,888-758-4389,E,,Public,24 hours daily,,,2,,,ChargePoint Network,http://www.chargepoint.com/,GPS,42.960140,-78.769770,10/29/2024,150825,2024-10-29 01:10:02,,,,12/28/2019,J1772
ELEC,High Falls Parking Garage,240 State Street,,Rochester,NY,14614,,866-816-7584,E,,Public,24 hours daily,,,4,,,EV Connect,http://evconnect.com/,GPS,43.159975,-77.616663,10/29/2024,123086,2024-10-29 03:08:46,,,,04/01/2019,J1772
ELEC,The Summit Top of Hill,1 Summit Way,,Troy,NY,12180,,1-844-623-1001,E,,Public,24 hours daily,,,4,,,LIVINGSTON,https://www.solution.energy,GPS,42.744560,-73.630060,10/29/2024,223140,2024-10-29 04:05:52,,,,11/05/2021,J1772
ELEC,NATIONAL GRID COVANTA ENERGY,5801 Rock Cut Rd,Near main entrance of Covanta Energy,Jamesville,NY,13078,,888-758-4389,E,,Public,24 hours daily,,,2,,,ChargePoint Network,http://www.chargepoint.com/,GPS,43.005040,-76.116311,10/29/2024,162204,2024-10-29 00:56:04,,,,06/12/2020,J1772
ELEC,iPark NYC 345 East Garage - Tesla Destination,345 East 80th St,,New York,NY,10075,,877-798-3752,E,,Public,,,,3,,,Tesla Destination,https://www.tesla.com/destination-charging,200-9,40.773225,-73.952643,07/01/2024,115105,2024-10-16 16:58:41,P,,,11/13/2015,J1772 TESLA
ELEC,Kilbourn Pl on East - Parking Lot,3500 East Ave,,Rochester,NY,14618,,813-492-5220,E,,Public,24 hours daily,A ANDROID_PAY APPLE_PAY D M V,,4,,,EVOKE,https://evokesystems.com/,GPS,43.120540,-77.518768,10/11/2024,357011,2024-10-11 18:09:31,P,,,06/01/2023,J1772
ELEC,New Baltimore SB Travel Plaza,Milepost 127 South NY State Thruway,,New Baltimore,NY,12124,,888-557-7099,E,,Public,24 hours daily,A ANDROID_PAY APPLE_PAY CREDIT D M V,,,4,,APPLEGREEN,https://www.applegreenelectric.com/,GPS,42.428571,-73.805581,10/11/2024,356178,2024-10-11 18:09:31,P,,,09/23/2024,CHADEMO J1772COMBO TESLA
ELEC,WCS NS1 ASIA,Boston Rd,,Bronx,NY,10460,,888-758-4389,E,,Public,24 hours daily,,,2,,,ChargePoint Network,http://www.chargepoint.com/,GPS,40.846612,-73.876323,10/29/2024,173506,2024-10-29 00:57:32,,,,01/27/2021,J1772
ELEC,DBI PROPERTIES GTOWN PK RIGHT,410 Degeorge Cir,Right Charger Near Fitness Center Main Entrance,Greece,NY,14626,,888-758-4389,E,,Public,24 hours daily,,,2,,,ChargePoint Network,http://www.chargepoint.com/,GPS,43.240784,-77.717569,10/29/2024,311768,2024-10-29 02:09:12,,,,09/28/2023,J1772
ELEC,RRH STATION 3,7 Ambulance Dr,Far right unit,Clifton Springs,NY,14432,,888-758-4389,E,,Public,24 hours daily,,,2,,,ChargePoint Network,http://www.chargepoint.com/,GPS,42.959347,-77.135350,10/29/2024,218483,2024-10-29 01:37:54,,,,05/19/2022,J1772
ELEC,GGMC 91 E 9th Street - Tesla Destination,91 East 9th Street,,New York,NY,10003,,877-798-3752,E,,Public,,,,3,,,Tesla Destination,https://www.tesla.com/destination-charging,GPS,40.730723,-73.990854,07/01/2024,250852,2024-10-16 16:58:41,P,,,11/14/2016,J1772 TESLA
ELEC,Rotterdam Branch Library,1110 North Westcott Rd,,Schenectady,NY,12306,,1-844-623-1001,E,,Public,24 hours daily,,,4,,,LIVINGSTON,https://www.solution.energy,GPS,42.787210,-73.979830,10/29/2024,223253,2024-10-29 04:04:50,,,,03/01/2022,J1772
ELEC,Revel - Pier 36,299 South St,,New York,NY,10002,,949-945-2000,E,,Public,24 hours daily,A D Debit M V,,,5,,REVEL,https://gorevel.com,GPS,40.710294,-73.984768,,358440,2024-10-15 18:09:47,P,,,10/08/2024,J1772COMBO TESLA
ELEC,SKICENTER EVSE3,1562 Osceola Rd,front parking lot pf osceola ski resort,Camden,NY,13316,,888-758-4389,E,,Public,24 hours daily,,,2,,,ChargePoint Network,http://www.chargepoint.com/,GPS,43.504780,-75.700470,10/29/2024,197866,2024-10-29 01:32:11,,,,10/17/2021,J1772
ELEC,RPI 1 OFF CAMPUS S1,1525 15th St,,Troy,NY,12180,,888-758-4389,E,,Public,24 hours daily,,,2,,,ChargePoint Network,http://www.chargepoint.com/,GPS,42.726645,-73.678464,10/29/2024,121237,2024-10-29 01:01:15,,,,04/06/2019,J1772
ELEC,ADELPHI UNIV STATION 03,1 South Ave,,Garden City,NY,11530,,888-758-4389,E,,Public,24 hours daily,,,2,,,ChargePoint Network,http://www.chargepoint.com/,GPS,40.719561,-73.650096,10/29/2024,171554,2024-10-29 01:11:06,,,,01/27/2021,J1772
ELEC,NYC FLEET DCASCSTHSE_1_L3,6626 Metropolitan Ave,FOR CITY VEHICLE USE,Middle Village,NY,11379,,888-758-4389,E,,Public,24 hours daily,,,,1,,ChargePoint Network,http://www.chargepoint.com/,GPS,40.711327,-73.892290,10/29/2024,196564,2024-10-29 01:18:12,,,,10/01/2021,CHADEMO J1772COMBO
ELEC,MB OF BUFFALO EV MERC BUFF 2,8185 Main St In front of delivery buidling,,Williamsville,NY,14221,,888-758-4389,E,,Public,24 hours daily,,,2,,,ChargePoint Network,http://www.chargepoint.com/,GPS,42.964750,-78.689098,10/29/2024,205855,2024-10-29 01:37:41,,,,02/04/2022,J1772
ELEC,Loews Regency New York - Tesla Destination,540 Park Ave,,New York,NY,10065,,877-798-3752,E,,Public,,,,3,,,Tesla Destination,https://www.tesla.com/destination-charging,200-9,40.764423,-73.968865,07/01/2024,115156,2024-10-16 16:58:41,P,,,10/13/2016,J1772 TESLA
ELEC,Prime Properties,621 Columbia St Ext.,,Cohoes,NY,12047,,1-844-623-1001,E,,Public,24 hours daily,,,4,,,LIVINGSTON,https://www.solution.energy,GPS,42.763610,-73.749490,10/29/2024,189504,2024-10-29 04:05:29,,,,10/29/2020,J1772
ELEC,300 West End Ave - Basement Garage,300 W End Ave,,New York,NY,10023,,813-492-5220,E,,Public,24 hours daily,A ANDROID_PAY APPLE_PAY D M V,,14,,,EVOKE,https://evokesystems.com/,GPS,40.781139,-73.983118,10/11/2024,356990,2024-10-11 18:09:31,P,,,08/09/2023,J1772
ELEC,ROSENBLUM300 100 GREAT OAKS,100 Great Oaks Blvd,,Albany,NY,12203,,888-758-4389,E,,Public,24 hours daily,,,2,,,ChargePoint Network,http://www.chargepoint.com/,GPS,42.683264,-73.846461,10/29/2024,120975,2024-10-29 01:00:35,,,,03/27/2019,J1772
ELEC,SUNY NIAGARA STATION 2,3111 Saunders Settlement Road,,Sanborn,NY,14132,,888-758-4389,E,,Public,24 hours daily,,,2,,,ChargePoint Network,http://www.chargepoint.com/,GPS,43.146981,-78.878701,10/29/2024,350626,2024-10-29 02:20:42,,,,07/17/2024,J1772
ELEC,RIT EV CHARGING ADMIN LOT,Clark Drive,,Rochester,NY,14623,,888-758-4389,E,,Public,24 hours daily,,,2,,,ChargePoint Network,http://www.chargepoint.com/,GPS,43.086112,-77.673738,10/29/2024,180153,2024-10-29 00:33:15,,,,01/27/2021,J1772
ELEC,"Harriman Office Campus, O Lot - Building 7A",7 Harriman Campus Rd,,Albany,NY,12206,,866-816-7584,E,,Public,24 hours daily,,,2,,,EV Connect,http://evconnect.com/,GPS,42.678042,-73.809921,10/29/2024,357586,2024-10-29 03:09:07,,,,10/05/2024,J1772
ELEC,SUNY BUFFALO JACOBS 2,50 Augspurger Rd,Jacobs A lot,Buffalo,NY,14228,,888-758-4389,E,,Public,24 hours daily,,,2,,,ChargePoint Network,http://www.chargepoint.com/,GPS,42.998854,-78.787388,10/29/2024,182260,2024-10-29 01:24:28,,,,01/27/2021,J1772
ELEC,City Parking RL Mercer Street - Tesla Destination,40 Mercer St,,New York,NY,10013,,877-798-3752,E,,Public,,,,3,,,Tesla Destination,https://www.tesla.com/destination-charging,200-9,40.721437,-74.001238,07/01/2024,115118,2024-10-16 16:58:41,P,,,06/16/2017,J1772 TESLA
ELEC,Van Bortel Chevrolet,1338 Pittsford Palmyra Rd,,Macedon,NY,14502,,315-333-2627,E,,Public - Credit card at all times,24 hours daily; customers only,A D Debit M V,,2,,,Non-Networked,,GPS,43.064835,-77.312464,08/15/2024,226514,2024-08-15 19:57:12,P,,,08/25/2022,J1772
ELEC,THE STANTON HADDON,505 University Ave,West Parking Near Entrance,Rochester,NY,14607,,888-758-4389,E,,Public,24 hours daily,,,2,,,ChargePoint Network,http://www.chargepoint.com/,GPS,43.156822,-77.589410,10/29/2024,251985,2024-10-29 01:55:47,,,,01/25/2023,J1772
ELEC,PEAK POINT APT PEAK POINT EV1,1427 Saratoga Rd,Rear parking lot of Peak Point Apartments,Ballston Spa,NY,12020,,888-758-4389,E,,Public,24 hours daily,,,2,,,ChargePoint Network,http://www.chargepoint.com/,GPS,42.978574,-73.861651,10/29/2024,191437,2024-10-29 01:28:47,,,,06/24/2021,J1772
ELEC,PISO OFFICE 1,2880 U.S. 9,,Valatie,NY,12184,,888-758-4389,E,,Public,24 hours daily,,,2,,,ChargePoint Network,http://www.chargepoint.com/,GPS,42.423592,-73.684568,10/29/2024,187342,2024-10-29 01:26:49,,,,04/10/2021,J1772
ELEC,CNDL - E. SYR CANDLEWOOD 1.2,6550 Baptist Way,Near main entrance of candlewood suites,East Syracuse,NY,13057,,888-758-4389,E,,Public,24 hours daily,,,2,,,ChargePoint Network,http://www.chargepoint.com/,GPS,43.088660,-76.088300,10/29/2024,186132,2024-10-29 01:26:06,,,,03/12/2021,J1772
ELEC,GHMC PARKINGGARAGE8,707 E Main St,PARKING GARAGE 8,Middletown,NY,10940,,888-758-4389,E,,Public,24 hours daily,,,2,,,ChargePoint Network,http://www.chargepoint.com/,GPS,41.441863,-74.366593,10/29/2024,204670,2024-10-29 01:37:17,,,,01/12/2022,J1772
ELEC,White Plains Honda,61 Bank Street,,White Plains,NY,10606,,888-998-2546,E,,Public,24 hours daily,,,,1,,Blink Network,http://www.blinkcharging.com/,GPS,41.028927,-73.774964,10/29/2024,347309,2024-10-29 00:25:02,,,,05/31/2024,J1772COMBO
ELEC,HOTEL LOCATION HI&S CENTER,101 S Union St,Hampton Inn Center Charger Near Main Entrance,Rochester,NY,14607,,888-758-4389,E,,Public,24 hours daily,,,2,,,ChargePoint Network,http://www.chargepoint.com/,GPS,43.152093,-77.599345,10/29/2024,310624,2024-10-29 02:08:17,,,,09/14/2023,J1772
ELEC,Amagansett Village Parking Lot,Main Street,,Amagansett,NY,11954,,866-816-7584,E,,Public,24 hours daily,,,4,,,EV Connect,http://evconnect.com/,GPS,40.975968,-72.140007,10/29/2024,163946,2024-10-29 03:08:58,,,,06/26/2020,J1772
ELEC,MALTA STATION6,2540 State Hwy 9,Back parking lot,Malta,NY,12020,,888-758-4389,E,,Public,24 hours daily,,,2,,,ChargePoint Network,http://www.chargepoint.com/,GPS,42.975780,-73.791750,10/29/2024,259688,2024-10-29 02:00:10,,,,04/21/2023,J1772
ELEC,HCBR STATION 1,9013 4th Ave,,Brooklyn,NY,11209,,888-758-4389,E,,Public,24 hours daily,,,1,,,ChargePoint Network,http://www.chargepoint.com/,GPS,40.619335,-74.029466,10/29/2024,221556,2024-10-29 01:42:59,,,,06/21/2022,J1772
ELEC,STONY BROOK UNV ADMIN GAR-PRES,Admin Garage,Located in the Administration Parking Garage at Stony Brook University.,Stony Brook,NY,11790,,888-758-4389,E,,Public,24 hours daily,,,1,,,ChargePoint Network,http://www.chargepoint.com/,GPS,40.914787,-73.119613,10/29/2024,201581,2024-10-29 00:31:02,,,,11/25/2021,J1772
ELEC,WATERVLIET DOME 4,1300 2nd Ave,Far right unit,Watervliet,NY,12189,,888-758-4389,E,,Public,24 hours daily,,,2,,,ChargePoint Network,http://www.chargepoint.com/,GPS,42.724046,-73.702833,10/29/2024,195912,2024-10-29 01:32:51,,,,09/15/2021,J1772
ELEC,NYS ORDA GORE MOUNTAIN 2,793 Peaceful Valley Rd,,North Creek,NY,12853,,888-758-4389,E,,Public,24 hours daily,,,2,,,ChargePoint Network,http://www.chargepoint.com/,GPS,43.671176,-74.007611,10/29/2024,174096,2024-10-29 01:02:38,,,,01/27/2021,J1772
ELEC,Rulf's Orchard,531 Bear Swamp Road,,Peru,NY,12972,,1-844-623-1001,E,,Public,24 hours daily,,,4,,,LIVINGSTON,https://www.solution.energy,GPS,44.578370,-73.496350,10/29/2024,225121,2024-10-29 04:05:37,,,,06/30/2022,J1772
ELEC,Town of Elmira,1255 W. Water Street,,Elmira,NY,14905,,866-816-7584,E,,Public,24 hours daily,,,2,,,EV Connect,http://evconnect.com/,GPS,42.077637,-76.844603,10/29/2024,157947,2024-10-29 03:08:57,,,,05/15/2020,J1772
ELEC,BARD ALMNCT NS1-ALMNCT,New York 9G,Located in parking lot of Alumni Canter at intersection of Entrance Road and 9G,Red Hook,NY,12504,,888-758-4389,E,,Public,24 hours daily,,,2,,,ChargePoint Network,http://www.chargepoint.com/,GPS,42.023436,-73.902037,10/29/2024,162492,2024-10-29 00:30:53,,,,06/12/2020,J1772
ELEC,"Country Inn & Suites by Radisson, Rochester Airport - Tesla Destination",797 E Henrietta Rd,,Rochester,NY,14623,,877-798-3752,E,,Public,,,,3,,,Tesla Destination,https://www.tesla.com/destination-charging,200-9,43.104222,-77.617088,07/01/2024,115225,2024-10-16 16:58:41,P,,,05/29/2018,J1772 TESLA
ELEC,Town of Washington,10 Reservoir Drive,,Millbrook,NY,12545,,1-844-623-1001,E,,Public,24 hours daily,,,4,,,LIVINGSTON,https://www.solution.energy,GPS,41.783800,-73.692540,10/29/2024,324881,2024-10-29 04:04:27,,,,07/24/2023,J1772
ELEC,167-149 Meeker Ave,167-149 Meeker Ave,,Brooklyn,NY,11211,,888-356-8911,E,,Public,24 hours daily,,,6,,,FLO,https://flo.ca/,GPS,40.714318,-73.953186,10/29/2024,199108,2024-10-29 03:32:59,,,,10/26/2021,J1772
ELEC,MONROE COUNTY WEBSTER N1,1105 Lake Rd Webster Park,Southwest Area of Parking Lot at SW corner of Lake Road and Holt Road,Webster,NY,14580,,888-758-4389,E,,Public,24 hours daily,,,2,,,ChargePoint Network,http://www.chargepoint.com/,GPS,43.259732,-77.448224,10/29/2024,327570,2024-10-29 02:14:41,,,,02/06/2024,J1772
ELEC,Rodeway Inn & Suites New Paltz,601 Main Street,,New Paltz,NY,12561,,1-844-623-1001,E,,Public,24 hours daily,,,4,,,LIVINGSTON,https://www.solution.energy,GPS,41.738560,-74.038030,10/29/2024,324847,2024-10-29 04:04:24,,,,08/24/2023,J1772
ELEC,5-19 Borden Ave - Garage 1st Floor,5-19 Borden Ave,,Long Island City,NY,11101,,813-492-5220,E,,Public,24 hours daily,A ANDROID_PAY APPLE_PAY D M V,,38,,,EVOKE,https://evokesystems.com/,GPS,40.741944,-73.955850,10/11/2024,357051,2024-10-11 18:09:31,P,,,01/08/2023,J1772
ELEC,ELLIS CHEVY ELLISDCFC,551 E Main St,Side of building out front,Malone,NY,12953,,888-758-4389,E,,Public,24 hours daily,,,,1,,ChargePoint Network,http://www.chargepoint.com/,GPS,44.849995,-74.284294,10/29/2024,227128,2024-10-29 01:45:34,,,,09/03/2022,CHADEMO J1772COMBO
ELEC,KEELER STATION 02,1111 Troy-Schenectady Rd,Front Visitor Parking,Latham,NY,12110,,888-758-4389,E,,Public,24 hours daily,,,2,,,ChargePoint Network,http://www.chargepoint.com/,GPS,42.766510,-73.813143,10/29/2024,190454,2024-10-29 01:28:47,,,,05/31/2021,J1772
ELEC,Alumni Hall,51 South West Dorm Drive,,Oneonta,NY,13820,,888-998-2546,E,,Public,24 hours daily,,,4,,,Blink Network,http://www.blinkcharging.com/,GPS,42.464875,-75.065693,10/29/2024,323009,2024-10-29 00:16:59,,,,10/16/2023,J1772
ELEC,Sky Apts - Garage 1st Floor,605 W 42nd St,,New York,NY,10036,,813-492-5220,E,,Public,24 hours daily,A ANDROID_PAY APPLE_PAY D M V,,20,,,EVOKE,https://evokesystems.com/,GPS,40.761949,-73.998880,10/11/2024,357075,2024-10-11 18:09:31,P,,,07/23/2022,J1772
ELEC,SWL SARANAC 1.2,234 Lake Flower Ave,Lake side in new parking lot of hotel,Saranac Lake,NY,12983,,888-758-4389,E,,Public,24 hours daily,,,2,,,ChargePoint Network,http://www.chargepoint.com/,GPS,44.322770,-74.123220,10/29/2024,181790,2024-10-29 01:21:37,,,,01/27/2021,J1772
ELEC,SUNY BROOME SUNY BROOME #2,907 Front St,Ice rink,Binghamton,NY,13905,,888-758-4389,E,,Public,24 hours daily,,,2,,,ChargePoint Network,http://www.chargepoint.com/,GPS,42.135464,-75.912721,10/29/2024,181006,2024-10-29 01:18:29,,,,01/27/2021,J1772
ELEC,HOTEL LOCATION MTFRM 2 LEFT,1299 NY-332,North end of Microtel,Farmington,NY,14425,,888-758-4389,E,,Public,24 hours daily,,,2,,,ChargePoint Network,http://www.chargepoint.com/,GPS,42.972739,-77.352357,10/29/2024,240963,2024-10-29 01:54:22,,,,01/06/2023,J1772
ELEC,225 W 49th St,225 W 49th St,,New York,NY,10019,,1-844-623-1001,E,,Public,24 hours daily,,,4,,,LIVINGSTON,https://www.solution.energy,GPS,40.761540,-73.985180,10/29/2024,223273,2024-10-29 04:05:38,,,,02/17/2022,J1772
ELEC,Servomation Refreshments Inc,7098 Mt Pleasant Dr,,Canastota,NY,13032,,888-363-7662,E,,Public - Credit card at all times,24 hours daily,A D Debit M V,,2,,,Non-Networked,,GPS,43.065836,-75.754474,04/14/2024,227079,2024-04-14 22:11:34,P,,,08/26/2022,J1772
ELEC,SUNY NEW PALTZ INTERNATIONAL,S. Manheim Blvd.,,New Paltz,NY,12561,,888-758-4389,E,,Public,24 hours daily,,,2,,,ChargePoint Network,http://www.chargepoint.com/,GPS,41.741984,-74.080814,10/29/2024,122790,2024-10-29 01:02:12,,,,05/16/2019,J1772
ELEC,Gravity Charging Center,401-471 W 42nd St,W 42nd Street & Dyer Avenue,New York,NY,10036,,646-371-9157,E,,Public,9am-9pm M-Sun,A ANDROID_PAY APPLE_PAY D M V,,,24,,GRAVITY_CHARGING_CENTER,https://gravitytechnologies.com/,200-8,40.758780,-73.992930,,350559,2024-10-14 13:22:49,P,,,03/04/2024,J1772COMBO TESLA
ELEC,EVCS@MUNI LOT KINDERHOOK VILL,7 Hudson St,,Kinderhook,NY,12106,,888-758-4389,E,,Public,24 hours daily,,,2,,,ChargePoint Network,http://www.chargepoint.com/,GPS,42.394810,-73.697553,10/29/2024,162131,2024-10-29 00:59:38,,,,06/12/2020,J1772
ELEC,VIC AND CAMPUS SUGAR SHACK 1.1,8023 NY-30,Next to sugar shack and VIC center,Paul Smiths,NY,12970,,888-758-4389,E,,Public,24 hours daily,,,2,,,ChargePoint Network,http://www.chargepoint.com/,GPS,44.448635,-74.258150,10/29/2024,154724,2024-10-29 01:13:57,,,,03/26/2020,J1772
ELEC,Energy Plus Site 8,11 Riverside Dr,,New York,NY,10023,,888-998-2546,E,,Public,24 hours daily,,,1,,,Blink Network,http://www.blinkcharging.com/,GPS,40.781104,-73.984478,10/29/2024,219453,2024-10-29 00:15:26,,,,05/22/2022,J1772
ELEC,ADVCHARGER FAST CHARGER,440 Plainview Rd,,Hicksville,NY,11801,,888-758-4389,E,,Public,24 hours daily,,,,1,,ChargePoint Network,http://www.chargepoint.com/,GPS,40.770015,-73.502680,10/29/2024,262554,2024-10-29 02:04:02,,,,06/11/2023,CHADEMO J1772COMBO
ELEC,PARKING GARAGE1 PARKING GARAGE,1 Lincoln St,First floor north,Auburn,NY,13021,,888-758-4389,E,,Public,24 hours daily,,,2,,,ChargePoint Network,http://www.chargepoint.com/,GPS,42.930293,-76.567186,10/29/2024,162333,2024-10-29 00:51:03,,,,06/12/2020,J1772
ELEC,Icon Parking University 10 Parking - Tesla Destination,63 E 9th St,,New York,NY,10003,,877-798-3752,E,,Public,,,,3,,,Tesla Destination,https://www.tesla.com/destination-charging,200-9,40.731887,-73.991906,07/01/2024,115177,2024-10-16 16:58:41,P,,,04/30/2016,J1772 TESLA
ELEC,SRYMCASSB WILTON 1.1,20 Old Gick Rd,Rear parking lot of wilton YMCA,Saratoga Springs,NY,12866,,888-758-4389,E,,Public,24 hours daily,,,2,,,ChargePoint Network,http://www.chargepoint.com/,GPS,43.105774,-73.749300,10/29/2024,183721,2024-10-29 01:25:02,,,,02/02/2021,J1772
ELEC,540 WAVERLY 1,540 Waverly Ave,In ground floor parking garage,Brooklyn,NY,11238,,888-758-4389,E,,Public,24 hours daily,,,2,,,ChargePoint Network,http://www.chargepoint.com/,GPS,40.682176,-73.965850,10/29/2024,323904,2024-10-29 01:47:41,,,,01/05/2024,J1772
ELEC,Village of Marcellus,6 Slocombe Ave,,Marcellus,NY,13108,,866-816-7584,E,,Public,24 hours daily,,,2,,,EV Connect,http://evconnect.com/,GPS,42.982700,-76.341480,10/29/2024,94849,2024-10-29 03:08:11,,,,04/12/2017,J1772
ELEC,Village of Jordan,7 Mechanic Street,,Jordan,NY,13080,,866-816-7584,E,,Public,24 hours daily,,,2,,,EV Connect,http://evconnect.com/,GPS,43.065635,-76.472281,10/29/2024,123129,2024-10-29 03:08:23,,,,04/01/2019,J1772
ELEC,TUV Rheinland,710 Resende Rd,,Webster,NY,14580,,833-692-6787,E,,Public - Credit card at all times,Contact station for hours of availability,A ANDROID_PAY APPLE_PAY CREDIT D M,,2,,,AMPUP,https://ampup.io/,200-8,43.231320,-77.415010,11/10/2022,230456,2023-02-14 15:54:11,P,,,09/15/2022,J1772
ELEC,Ford Charge - Morris Ford,872 Saratoga Rd,,Burnt Hills,NY,12019,,888-357-1009,E,,Public,24 hours daily,A D Debit M V,,,6,,FORD_CHARGE,https://www.ford.com/support/category/electric-vehicle/charging/public-charging/,GPS,42.920705,-73.884952,,358293,2024-10-15 18:05:30,P,,,10/08/2024,J1772COMBO
ELEC,Tradition Chevrolet,847 Canandaidua Rd,,Geneva,NY,14456,,1-844-623-1001,E,,Public,24 hours daily,,,,4,,LIVINGSTON,https://www.solution.energy,GPS,42.856650,-77.018110,10/29/2024,334480,2024-10-29 04:04:30,,,,05/02/2024,J1772COMBO
ELEC,ROCHESTER NY WASH SQ GARAGE1,"111 Woodbury Blvd,",,Rochester,NY,14607,,888-758-4389,E,,Public,24 hours daily,,,2,,,ChargePoint Network,http://www.chargepoint.com/,GPS,43.152730,-77.603845,10/29/2024,171692,2024-10-29 01:01:33,,,,01/27/2021,J1772
ELEC,Seneca Allegany Resort & Casino - Tesla Supercharger,777 Seneca Allegany Boulevard,,Salamanca,NY,14779,,877-798-3752,E,,Public,24 hours daily. Please check Tesla's online station map to see if an adapter is required at this location.,A D Debit M V,,,8,,Tesla,https://www.tesla.com/supercharger,GPS,42.153337,-78.747913,07/01/2024,117729,2024-08-14 18:58:22,P,,,12/01/2018,TESLA
ELEC,TONAWANDA YPR GOLF DOME 1,175 Brompton Rd,,Tonawanda,NY,14150,,888-758-4389,E,,Public,24 hours daily,,,2,,,ChargePoint Network,http://www.chargepoint.com/,GPS,43.002586,-78.840640,10/29/2024,149727,2024-10-29 01:08:08,,,,12/05/2019,J1772
ELEC,PBMC NE CAMPUS 2,1235 Ostrander Ave,,Riverhead,NY,11901,,888-758-4389,E,,Public,24 hours daily,,,2,,,ChargePoint Network,http://www.chargepoint.com/,GPS,40.935921,-72.672341,10/29/2024,261060,2024-10-29 02:01:47,,,,05/19/2023,J1772
ELEC,SWTCH Energy Inc.,4 W Red Oak,,Harrison,NY,10604,,844-798-2438,E,,Public,24 hours daily,A D Debit M V,,4,,,SWTCH,https://swtchenergy.com/,GPS,41.017400,-73.723700,02/12/2024,325978,2024-02-12 21:24:44,P,,,01/08/2024,J1772
ELEC,HARLEY SCHOOL HARLEY 2,1981 Clover St,Near Peckham wellness entrance,Rochester,NY,14618,,888-758-4389,E,,Public,24 hours daily,,,2,,,ChargePoint Network,http://www.chargepoint.com/,GPS,43.120601,-77.549060,10/29/2024,188100,2024-10-29 01:27:33,,,,04/29/2021,J1772
ELEC,Rose Hill Shopping Center,600 Columbus Ave,,Thornwood,NY,10594,,877-455-3833,E,,Public,24 hours daily,,,,4,,eVgo Network,https://www.evgo.com/,GPS,41.114440,-73.771500,10/29/2024,240745,2024-10-29 00:01:26,,,,12/31/2022,CHADEMO J1772COMBO
ELEC,STATION 4TH FL MOTORGATE 3,680 Main St,Motorgate Garage -Fourth Level,New York,NY,10044,,888-758-4389,E,,Public,24 hours daily,,,2,,,ChargePoint Network,http://www.chargepoint.com/,GPS,40.764464,-73.946924,10/29/2024,168524,2024-10-29 01:22:21,,,,11/17/2020,J1772
ELEC,RIVERHEADMOTORS STATION 1,1423 Old Country Rd,,Riverhead,NY,11901,,888-758-4389,E,,Public,24 hours daily,,,,1,,ChargePoint Network,http://www.chargepoint.com/,GPS,40.925903,-72.688850,10/29/2024,215087,2024-10-29 01:43:05,,,,04/28/2022,CHADEMO J1772COMBO
ELEC,FETZNER STATION 4,2487 Dewey Ave,South side of parking lot,Rochester,NY,14616,,888-758-4389,E,,Public,24 hours daily,,,2,,,ChargePoint Network,http://www.chargepoint.com/,GPS,43.213754,-77.639907,10/29/2024,223412,2024-10-29 01:41:02,,,,07/13/2022,J1772
ELEC,Rapidpark 150 East 77th Street - Tesla Destination,150 E 77th St,,New York,NY,10021,,877-798-3752,E,,Public,,,,3,,,Tesla Destination,https://www.tesla.com/destination-charging,200-8,40.773256,-73.959334,07/01/2024,115020,2024-10-16 16:58:41,P,,,04/19/2018,J1772 TESLA
ELEC,SU COE #1,727-799 E Washington St,Station access subject to lot hours.,Syracuse,NY,13244,,888-758-4389,E,,Public,24 hours daily,,,2,,,ChargePoint Network,http://www.chargepoint.com/,GPS,43.049634,-76.141079,10/29/2024,162275,2024-10-29 00:53:20,,,,06/12/2020,J1772
ELEC,Brooklyn Museum - Tesla Supercharger,878 Washington Avenue,,Brooklyn,NY,11225,,877-798-3752,E,,Public,24 hours daily. Please check Tesla's online station map to see if an adapter is required at this location.,,,,10,,Tesla,https://www.tesla.com/supercharger,200-8,40.669936,-73.963069,07/01/2024,122247,2024-08-14 18:58:22,P,,,03/01/2019,TESLA
ELEC,SAMARITAN TROY FLR 1 EV 2,2215 Burdett Ave,1st Floor - Left Side - Public Lot,Troy,NY,12180,,888-758-4389,E,,Public,24 hours daily,,,2,,,ChargePoint Network,http://www.chargepoint.com/,GPS,42.734481,-73.673165,10/29/2024,185306,2024-10-29 01:23:43,,,,02/23/2021,J1772
ELEC,LIVEWELL GROUP 708 CATLYN CT,708 Catlyn Ct,Bldg 701-708,Delmar,NY,12054,,888-758-4389,E,,Public,24 hours daily,,,2,,,ChargePoint Network,http://www.chargepoint.com/,GPS,42.606503,-73.848000,10/29/2024,165392,2024-10-29 01:17:34,,,,08/22/2020,J1772
ELEC,Depot Square,620 Main Street,,Sparkill,NY,10976,,866-816-7584,E,,Public,24 hours daily,,,4,,,EV Connect,http://evconnect.com/,GPS,41.029458,-73.928967,10/29/2024,155356,2024-10-29 03:08:51,,,,04/01/2020,J1772
ELEC,Forrest Pointe - North,1 Forrest Pointe Dr.,,East Greenbush,NY,12061,,1-844-623-1001,E,,Public,24 hours daily,,,8,,,LIVINGSTON,https://www.solution.energy,GPS,42.610450,-73.716080,10/29/2024,324798,2024-10-29 04:06:11,,,,10/12/2023,J1772
ELEC,TDC Building 10,625 Route 3,,Plattsburgh,NY,12901,,1-844-623-1001,E,,Public,24 hours daily,,,2,,,LIVINGSTON,https://www.solution.energy,GPS,44.695450,-73.509120,10/29/2024,324865,2024-10-29 04:05:51,,,,10/31/2023,J1772
ELEC,Phyllis Bornt Library,948 State St.,,Schenectady,NY,12303,,1-844-623-1001,E,,Public,24 hours daily,,,4,,,LIVINGSTON,https://www.solution.energy,GPS,42.804210,-73.931200,10/29/2024,223248,2024-10-29 04:05:22,,,,03/11/2022,J1772
ELEC,Holiday Inn - Johnstown Side,308 N Comrie Ave,,Johnstown,NY,12095,,1-844-623-1001,E,,Public,24 hours daily,,,4,,,LIVINGSTON,https://www.solution.energy,GPS,43.023060,-74.360160,10/29/2024,236888,2024-10-29 04:05:41,,,,11/01/2022,J1772
ELEC,EVCS1 COY ST LOT 1,1 Coy St,,Canandaigua,NY,14424,,888-758-4389,E,,Public,24 hours daily,,,2,,,ChargePoint Network,http://www.chargepoint.com/,GPS,42.885464,-77.282100,10/29/2024,316218,2024-10-29 02:06:53,,,,10/28/2023,J1772
ELEC,GREIG FARM GREIG FARM 2,227 Pitcher Ln,,Red Hook,NY,12571,,888-758-4389,E,,Public,24 hours daily,,,2,,,ChargePoint Network,http://www.chargepoint.com/,GPS,42.027948,-73.854998,10/29/2024,202139,2024-10-29 01:36:43,,,,12/08/2021,J1772
ELEC,Tennis Courts,1 Chelsea Ridge Dr.,,Wappinger Falls,NY,12590,,1-844-623-1001,E,,Public,24 hours daily,,,10,,,LIVINGSTON,https://www.solution.energy,GPS,41.553060,-73.949990,10/29/2024,324863,2024-10-29 04:05:49,,,,10/26/2023,J1772
ELEC,STONY BROOK UNV ARENA 2,Gymnasium Rd,,Stony Brook,NY,11790,,888-758-4389,E,,Public,24 hours daily,,,2,,,ChargePoint Network,http://www.chargepoint.com/,GPS,40.917206,-73.127283,10/29/2024,180169,2024-10-29 00:31:46,,,,01/27/2021,J1772
ELEC,NATIONAL GRID BISSEL HALL,Bissel Hall,Next to the police building,Buffalo,NY,14228,,888-758-4389,E,,Public,24 hours daily,,,2,,,ChargePoint Network,http://www.chargepoint.com/,GPS,42.998555,-78.781323,10/29/2024,162250,2024-10-29 00:55:17,,,,06/12/2020,J1772
ELEC,DES - Delancey and Essex Municipal Parking Garage,107 Essex Street,,New York,NY,10002,,866-816-7584,E,,Public,24 hours daily,,,8,4,,EV Connect,http://evconnect.com/,GPS,40.719319,-73.988197,10/29/2024,155100,2024-10-29 03:08:48,,,,04/16/2018,CHADEMO J1772 J1772COMBO
ELEC,Selux Office,5 Lumen Lane,,Highland,NY,12528,,866-816-7584,E,,Public,24 hours daily,,,7,,,EV Connect,http://evconnect.com/,GPS,41.739522,-73.960362,10/29/2024,123116,2024-10-29 03:08:13,,,,04/01/2019,J1772
ELEC,GGMC Parking 50 E 79th St Garage - Tesla Destination,50 E 79th St,,New York,NY,10075,,877-798-3752,E,,Public,,,,2,,,Tesla Destination,https://www.tesla.com/destination-charging,200-9,40.776006,-73.961627,07/01/2024,115144,2024-10-16 16:58:41,P,,,08/21/2015,TESLA
ELEC,BETHEL BETHEL,3586 State Rte 55,Behind Town Court,Kauneonga Lake,NY,12749,,888-758-4389,E,,Public,24 hours daily,,,2,,,ChargePoint Network,http://www.chargepoint.com/,GPS,41.685982,-74.830789,10/29/2024,162325,2024-10-29 00:51:28,,,,06/12/2020,J1772
ELEC,STRONG MUSEUM STRONG L1 #2,1 Manhattan Square Dr,Please note: This is a paid garage. Full parking rate is $10 if not visiting the museum. Parking as a museum guest is $7. Station is at Level 1 of the parking garage,Rochester,NY,14607,,888-758-4389,E,,Public,Mon 8:00am - 5:00pm; Tue 8:00am - 5:00pm; Wed 8:00am - 5:00pm; Thu 8:00am - 5:00pm; Fri 8:00am - 8:00pm; Sat 8:00am - 8:00pm; Sun 8:00am - 5:00pm,,,2,,,ChargePoint Network,http://www.chargepoint.com/,GPS,43.152099,-77.600934,10/29/2024,174553,2024-10-29 01:06:56,,,,01/27/2021,J1772
ELEC,CONVENTUS CONVENTUS,1001 Main Street,level P1 of the parking garage,Buffalo,NY,14203,,888-758-4389,E,,Public,24 hours daily,,,2,,,ChargePoint Network,http://www.chargepoint.com/,GPS,42.900489,-78.868369,10/29/2024,165111,2024-10-29 01:16:55,,,,08/11/2020,J1772
ELEC,COURTYARD REPUB STATION 1,2 Marriott Plaza,-Courtyard in the back,Farmingdale,NY,11735,,888-758-4389,E,,Public,24 hours daily,,,2,,,ChargePoint Network,http://www.chargepoint.com/,GPS,40.729075,-73.423159,10/29/2024,223702,2024-10-29 01:42:36,,,,07/19/2022,J1772
ELEC,209-10 41st Ave - Garage,209-10 41st Ave,,Queens,NY,11361,,813-492-5220,E,,Public,24 hours daily,A ANDROID_PAY APPLE_PAY D M V,,32,,,EVOKE,https://evokesystems.com/,GPS,40.762797,-73.776761,10/11/2024,356959,2024-10-11 18:09:31,P,,,05/15/2023,J1772
ELEC,ALBANY COUNTY S PEARL STN 1,722 S Pearl St,,Albany,NY,12202,,888-758-4389,E,,Public,24 hours daily,,,2,,,ChargePoint Network,http://www.chargepoint.com/,GPS,42.627523,-73.767238,10/29/2024,224504,2024-10-29 01:42:12,,,,07/28/2022,J1772
ELEC,Stone Ridge Public Library,3700 Main St,,Stone Ridge,NY,12484,,845-687-7023,E,,Public,24 hours daily,,,2,,,Non-Networked,,GPS,41.849440,-74.142960,03/14/2024,167130,2024-03-14 18:02:10,P,,,09/21/2020,J1772
ELEC,PF DEVELOPMENT PFCHARGE1,660 NY-7,In front of Planet Fitness,Troy,NY,12180,,888-758-4389,E,,Public,24 hours daily,,,2,,,ChargePoint Network,http://www.chargepoint.com/,GPS,42.741695,-73.650806,10/29/2024,256221,2024-10-29 01:56:30,,,,03/11/2023,J1772
ELEC,City Hall of Plattsburgh,41 City Hall Pl,,Plattsburgh,NY,12901,,518-563-7701,E,,Public - Credit card at all times,24 hours daily,A D Debit M V,,2,,,Non-Networked,,GPS,44.699021,-73.451723,03/14/2024,227687,2024-03-14 18:02:10,P,,,09/13/2022,J1772
ELEC,Otto Cadillac,1769 Central Ave,,Albany,NY,12205,,866-816-7584,E,,Public,24 hours daily,,,,1,,EV Connect,http://evconnect.com/,GPS,42.727952,-73.844098,10/29/2024,322353,2024-10-29 03:10:50,,,,12/08/2023,J1772COMBO
ELEC,TATABROOKFIELD #2,11 E Loop Rd,"Second charger in parking garage, from ""Parking Customer Exit"" gate.",New York,NY,10044,,888-758-4389,E,,Public,24 hours daily,,,1,,,ChargePoint Network,http://www.chargepoint.com/,GPS,40.755077,-73.955605,10/29/2024,174179,2024-10-29 01:03:29,,,,01/27/2021,J1772
ELEC,Essex County - Public Safety Building,702 Stowersville Rd,,Lewis,NY,12950,,518-873-3900,E,,Public,24 hours Daily,,,2,,,ChargePoint Network,http://www.chargepoint.com/,200-9,44.281549,-73.536445,03/08/2023,142582,2024-01-31 22:07:01,LG,,,06/01/2019,J1772
ELEC,MOHAWK CHEVY MOHAWKCHEVY1,639 67,,Malta,NY,12020,,888-758-4389,E,,Public,24 hours daily,,,2,,,ChargePoint Network,http://www.chargepoint.com/,GPS,42.968932,-73.811108,10/29/2024,217435,2024-10-29 01:41:40,,,,05/13/2022,J1772
ELEC,KENNETH DR Q KENNETH DR 2,375 Kenneth Drive,Station 2 East Parking,Rochester,NY,14623,,888-758-4389,E,,Public,24 hours daily,,,,1,,ChargePoint Network,http://www.chargepoint.com/,GPS,43.059151,-77.644603,10/29/2024,332467,2024-10-29 02:16:59,,,,04/17/2024,CHADEMO J1772COMBO
ELEC,MARKET 32 EV PEDIATRICEV2,81 Schoolhouse Rd,To the left of building.,Albany,NY,12203,,888-758-4389,E,,Public,24 hours daily,,,2,,,ChargePoint Network,http://www.chargepoint.com/,GPS,42.678982,-73.844918,10/29/2024,175507,2024-10-29 01:13:26,,,,01/27/2021,J1772
ELEC,TOWN GLENVILLE TOWN HALL EV1,Glenville Municipal Center 18 Glenridge Rd,west side of building,Glenville,NY,12302,,888-758-4389,E,,Public,24 hours daily,,,2,,,ChargePoint Network,http://www.chargepoint.com/,GPS,42.868010,-73.928278,10/29/2024,175725,2024-10-29 01:14:01,,,,01/27/2021,J1772
ELEC,LEX COOP WEST STATION,1678 Hertel Ave,Parking Lot,Buffalo,NY,14216,,888-758-4389,E,,Public,24 hours daily,,,2,,,ChargePoint Network,http://www.chargepoint.com/,GPS,42.947966,-78.845429,10/29/2024,232959,2024-10-29 01:49:54,,,,10/06/2022,J1772
ELEC,HUDSON PRESERVE BLDG 22 #2,1901 Beryl Way,,Watervliet,NY,12189,,888-758-4389,E,,Public,24 hours daily,,,2,,,ChargePoint Network,http://www.chargepoint.com/,GPS,42.733055,-73.728065,10/29/2024,174205,2024-10-29 01:04:20,,,,01/27/2021,J1772
ELEC,Homewood Suites Rochester Greece,400 Center Place Drive,,Rochester,NY,14615,,1-888-717-4544,E,,Public,24 hours daily,,,10,,,CHARGESMART_EV,https://chargesmartev.com,GPS,43.208897,-77.672145,10/29/2024,357436,2024-10-29 04:09:33,,,,10/03/2024,J1772
ELEC,"Sam's Club 6428 (Medford, NY)",2950 Horseblock Rd,,Medford,NY,11933,,833-632-2778,E,,Public,24 hours daily,,,,4,,Electrify America,https://www.electrifyamerica.com/,GPS,40.826200,-72.990420,10/29/2024,170300,2024-10-29 02:56:49,,,,12/18/2020,CHADEMO J1772COMBO
ELEC,305 East 80th Street,305 East 80th Street,,New York,NY,10075,,1-844-623-1001,E,,Public,24 hours daily,,,4,,,LIVINGSTON,https://www.solution.energy,GPS,40.773970,-73.953900,10/29/2024,223292,2024-10-29 04:04:54,,,,04/25/2022,J1772
ELEC,254 Rt 6 Gas Station,254 US-6,,Mahopac,NY,10541,,1-844-623-1001,E,,Public,24 hours daily,,,4,,,LIVINGSTON,https://www.solution.energy,GPS,41.352660,-73.749110,10/29/2024,233088,2024-10-29 04:05:50,,,,07/29/2022,J1772
ELEC,Silver Creek Police Department,172 Central Ave,,Silver Creek,NY,14136,,716-934-3036,E,,Public - Credit card at all times,24 hours daily,A D Debit M V,,2,,,Non-Networked,,GPS,42.545154,-79.169726,10/11/2024,226489,2024-10-11 18:09:31,P,,,08/22/2022,J1772
ELEC,Bradford Hill,1045 Floribunda Way,,Webster,NY,14580,,1-844-623-1001,E,,Public,24 hours daily,,,4,,,LIVINGSTON,https://www.solution.energy,GPS,43.212940,-77.441430,10/29/2024,252726,2024-10-29 04:05:53,,,,12/29/2022,J1772
ELEC,LIVEWELL GROUP 701 ELKIN CT,701 Elkin Ct,Bldg 701,Delmar,NY,12054,,888-758-4389,E,,Public,24 hours daily,,,2,,,ChargePoint Network,http://www.chargepoint.com/,GPS,42.607304,-73.850000,10/29/2024,165395,2024-10-29 01:17:33,,,,08/22/2020,J1772
ELEC,KEELER STATION 7,A1111 Troy-Schenectady Rd,,Latham,NY,12110,,888-758-4389,E,,Public,24 hours daily,,,,1,,ChargePoint Network,http://www.chargepoint.com/,GPS,42.766824,-73.813581,10/29/2024,303762,2024-10-29 02:04:56,,,,07/29/2023,CHADEMO J1772COMBO
ELEC,Skidmore College - Hoge Hall,815 N Broadway,,Saratoga Springs,NY,12866,,1-888-717-4544,E,,Public,24 hours daily,,,6,,,CHARGESMART_EV,https://chargesmartev.com,GPS,43.097099,-73.781179,10/29/2024,347363,2024-10-29 04:09:23,,,,06/04/2024,J1772
ELEC,COMMCTR 59 N. PUTT 1,59 N Putt Corners Rd,In center of parking lot outside town court,New Paltz,NY,12561,,888-758-4389,E,,Public,24 hours daily,,,2,,,ChargePoint Network,http://www.chargepoint.com/,GPS,41.747726,-74.064644,10/29/2024,202954,2024-10-29 01:36:55,,,,12/23/2021,J1772
ELEC,TALLYRAND TALLYRAND2,200 White Plains Rd,Public charger in office complex lot,Tarrytown,NY,10591,,888-758-4389,E,,Public,Mon 8:00pm - 12:00am; Tue 8:00pm - 12:00am; Wed 8:00pm - 12:00am; Thu 8:00pm - 12:00am; Fri 8:00pm - 12:00am; Sat 8:00pm - 12:00am; Sun 8:00pm - 12:00am,,,2,,,ChargePoint Network,http://www.chargepoint.com/,GPS,41.063810,-73.852131,10/29/2024,235900,2024-10-29 01:51:35,,,,11/10/2022,J1772
ELEC,100 Linden Oaks,100 Linden Oaks,,Rochester,NY,14625,,1-844-623-1001,E,,Public,24 hours daily,,,4,,,LIVINGSTON,https://www.solution.energy,GPS,43.123560,-77.518770,10/29/2024,223103,2024-10-29 04:05:32,,,,12/07/2021,J1772
ELEC,One City Place Apartments,1 City Pl,,White Plains,NY,10601,,888-998-2546,E,,Public,24 hours daily,,,4,,,Blink Network,http://www.blinkcharging.com/,GPS,41.032755,-73.765280,10/29/2024,189035,2024-10-29 00:08:26,,,,04/30/2021,J1772
ELEC,Burger King Attica NY,130 Prospect St,,Attica,NY,14011,,888-998-2546,E,,Public,24 hours daily,,,2,,,Blink Network,http://www.blinkcharging.com/,GPS,42.871300,-78.276100,10/29/2024,164375,2024-10-29 00:11:44,,,,07/21/2020,J1772
ELEC,OSSINING TOWN LOUIS ENGEL,Louis Engel Park (Waterfront Park) 161-185 We,In parking lot,Ossining,NY,10562,,888-758-4389,E,,Public,24 hours daily,,,2,,,ChargePoint Network,http://www.chargepoint.com/,GPS,41.156094,-73.869640,10/29/2024,162297,2024-10-29 00:52:24,,,,06/12/2020,J1772
ELEC,MTP Parking 363 Bond Street - Tesla Destination,363 Bond St,,Brooklyn,NY,11231,,877-798-3752,E,,Public,,,,4,,,Tesla Destination,https://www.tesla.com/destination-charging,200-9,40.678155,-73.990443,07/01/2024,122476,2024-10-16 16:58:41,P,,,01/18/2019,TESLA
ELEC,C W TOYOTA SERVICE DEPT,3333 Boston Rd,,Williamsbridge,NY,10469,,888-758-4389,E,,Public,24 hours daily,,,1,,,ChargePoint Network,http://www.chargepoint.com/,GPS,40.874265,-73.852887,10/29/2024,329611,2024-10-29 01:43:56,,,,03/01/2024,J1772
ELEC,61 West Post Rd. - White Plains Hospital West Parking Lot,61 West Post Road,,White Plains,NY,10601,,855-223-5351,E,,Public,24 hours daily,A D M V,,8,,,FLASH,https://www.flashparking.com/products/diversify-parking-revenue/ev-charging-as-a-revenue-stream/,GPS,41.020917,-73.775733,10/29/2024,331481,2024-10-29 03:21:14,,,,03/31/2024,J1772
ELEC,NYC FLEET DPR_ICAHN_2_L3,10 Central Rd,,New York,NY,10035,,888-758-4389,E,,Public,24 hours daily,,,,1,,ChargePoint Network,http://www.chargepoint.com/,GPS,40.792370,-73.924644,10/29/2024,181933,2024-10-29 01:16:55,,,,01/27/2021,CHADEMO J1772COMBO
ELEC,ALBANY COUNTY TIMES UNION GAR,100 Beaver St,"Requires $8 fee for garage entry.  Inside parking garage, 2nd floor middle isle",Albany,NY,12207,,888-758-4389,E,,Public,24 hours daily,,,2,,,ChargePoint Network,http://www.chargepoint.com/,GPS,42.649224,-73.756071,10/29/2024,180103,2024-10-29 00:56:49,,,,01/27/2021,J1772
ELEC,Town Center Fayetteville,540 Towne Dr,,Fayetteville,NY,13066,,1-844-623-1001,E,,Public,24 hours daily,,,6,,,LIVINGSTON,https://www.solution.energy,GPS,43.033450,-76.018400,10/29/2024,233098,2024-10-29 04:05:02,,,,08/24/2022,J1772
ELEC,ALBANY COUNTY DOH PUBLIC,175 Green St,Next to Health Department,Albany,NY,12202,,888-758-4389,E,,Public,24 hours daily,,,2,,,ChargePoint Network,http://www.chargepoint.com/,GPS,42.641412,-73.754678,10/29/2024,212210,2024-10-29 01:38:16,,,,03/23/2022,J1772
ELEC,TOY BINGHAMTON CT4020- 1,393 Court St,In front of sales building,Binghamton,NY,13904,,888-758-4389,E,,Public,24 hours daily,,,2,,,ChargePoint Network,http://www.chargepoint.com/,GPS,42.104684,-75.885437,10/29/2024,221912,2024-10-29 01:45:23,,,,06/23/2022,J1772
ELEC,Bully Hill Winery,8843 Greyton H Taylor Memorial Dr,,Hammondsport,NY,14840,,813-492-5220,E,,Public,24 hours daily,A ANDROID_PAY APPLE_PAY D M V,,10,,,EVOKE,https://evokesystems.com/,GPS,42.429253,-77.208890,10/11/2024,357113,2024-10-11 18:09:31,P,,,07/31/2024,J1772
ELEC,PANYNJ LGA E GARAGE C1,East Garage E End Rd LaGuardia Airport,"LGA East garage, center section",New York,NY,11371,,888-758-4389,E,,Public,24 hours daily,,,2,,,ChargePoint Network,http://www.chargepoint.com/,GPS,40.770330,-73.865683,10/29/2024,162407,2024-10-29 00:35:55,,,,06/12/2020,J1772
ELEC,COLLEGIAN HOTEL COLLEGIAN 3:3,1060 E Genesee St,Side parking lot of collegiate suites,Syracuse,NY,13210,,888-758-4389,E,,Public,24 hours daily,,,2,,,ChargePoint Network,http://www.chargepoint.com/,GPS,43.046318,-76.135216,10/29/2024,191388,2024-10-29 01:29:27,,,,06/23/2021,J1772
ELEC,COLGATE LALLY LN 1,Lally Ln,,Hamilton,NY,13346,,888-758-4389,E,,Public,24 hours daily,,,2,,,ChargePoint Network,http://www.chargepoint.com/,GPS,42.817300,-75.539288,10/29/2024,352145,2024-10-29 02:19:59,,,,08/07/2024,J1772
ELEC,ATRIUM EVCHARGE EV3,451 Clifton Park Center Rd,In parking lot.,Clifton Park,NY,12065,,888-758-4389,E,,Public,24 hours daily,,,2,,,ChargePoint Network,http://www.chargepoint.com/,GPS,42.855990,-73.785980,10/29/2024,225609,2024-10-29 01:41:51,,,,08/17/2022,J1772
ELEC,210 W 76th St.,210 W 76th St.,,New York,NY,10023,,1-844-623-1001,E,,Public,24 hours daily,,,4,,,LIVINGSTON,https://www.solution.energy,GPS,40.781260,-73.980440,10/29/2024,223266,2024-10-29 04:05:39,,,,03/18/2022,J1772
ELEC,ALBANY COUNTY TIMES UNION GA2,100 Beaver St,Requires $8 fee for garage entry.  Inside parking garage 3rd floor middle isle,Albany,NY,12207,,888-758-4389,E,,Public,24 hours daily,,,2,,,ChargePoint Network,http://www.chargepoint.com/,GPS,42.649236,-73.756103,10/29/2024,162174,2024-10-29 00:56:49,,,,06/12/2020,J1772
ELEC,MIDDLE COUNTRY SELDEN,575 Middle Country Rd,,Selden,NY,11784,,888-758-4389,E,,Public,24 hours daily,,,2,,,ChargePoint Network,http://www.chargepoint.com/,GPS,40.867476,-73.033034,10/29/2024,162152,2024-10-29 00:57:37,,,,06/12/2020,J1772
ELEC,Icon Parking 301 E 57 Street - Tesla Destination,301 E 57th St,,New York,NY,10022,,877-798-3752,E,,Public,,,,3,,,Tesla Destination,https://www.tesla.com/destination-charging,200-8,40.759127,-73.964684,07/01/2024,115086,2024-10-16 16:58:41,P,,,04/30/2016,J1772 TESLA
ELEC,Maher Lane,100 Maher Lane,,Harriman,NY,10926,,866-816-7584,E,,Public,24 hours daily,,,4,,,EV Connect,http://evconnect.com/,GPS,41.312636,-74.140421,10/29/2024,155099,2024-10-29 03:09:13,,,,08/26/2019,J1772
ELEC,Hampton Inn - Albany,10 Ulenski Dr,,Albany,NY,12205,,518-438-2822,E,,Public,24 hours daily,,,1,,,Non-Networked,,GPS,42.724676,-73.795448,03/08/2023,72909,2024-01-31 22:07:01,P,,,01/25/2016,J1772
ELEC,MARKET 32 EV STORE 181,79 Vandenburgh ave,In front of building,Troy,NY,12180,,888-758-4389,E,,Public,24 hours daily,,,2,,,ChargePoint Network,http://www.chargepoint.com/,GPS,42.697570,-73.690420,10/29/2024,152272,2024-10-29 01:10:27,,,,01/08/2020,J1772
ELEC,FETZNER STATION 3,2487 Dewey Ave,South side of parking lot,Rochester,NY,14616,,888-758-4389,E,,Public,24 hours daily,,,2,,,ChargePoint Network,http://www.chargepoint.com/,GPS,43.213786,-77.639870,10/29/2024,223413,2024-10-29 01:41:02,,,,07/13/2022,J1772
ELEC,Stissing Storage,2818 W Church St,,Pine Plains,NY,12567,,1-888-717-4544,E,,Public,24 hours daily,,,4,,,CHARGESMART_EV,https://chargesmartev.com,GPS,41.981236,-73.663810,10/29/2024,333745,2024-10-29 04:09:17,,,,10/11/2023,J1772
ELEC,HAMMOCKS CANAND HATC 8000 RIGHT,2000 Hammocks Dr,Hammocks at Canandaigua 8000 Right,Canandaigua,NY,14424,,888-758-4389,E,,Public,24 hours daily,,,2,,,ChargePoint Network,http://www.chargepoint.com/,GPS,42.878866,-77.297518,10/29/2024,352069,2024-10-29 02:22:39,,,,08/03/2024,J1772
ELEC,435 W Commercial St,435 W Commercial St,,East Rochester,NY,14445,,866-816-7584,E,,Public,24 hours daily,,,4,,,EV Connect,http://evconnect.com/,GPS,43.116355,-77.494040,10/29/2024,308262,2024-10-29 03:12:07,,,,08/31/2023,J1772
ELEC,KEELER STATION 5,1111 Troy-Schenectady Rd,Mercedes building S.E. MB Showroom parking,Latham,NY,12110,,888-758-4389,E,,Public,24 hours daily,,,,1,,ChargePoint Network,http://www.chargepoint.com/,GPS,42.766300,-73.812609,10/29/2024,260389,2024-10-29 01:59:29,,,,05/06/2023,CHADEMO J1772COMBO
ELEC,Ford Charge - Basil Ford of Niagara Falls,6980 Niagara Falls Blvd,,Niagara Falls,NY,14304,,888-357-1009,E,,Public,7:30am-6:30pm M-Sat,A D Debit M V,,,2,,FORD_CHARGE,https://www.ford.com/support/category/electric-vehicle/charging/public-charging/,GPS,43.088884,-78.984626,,358303,2024-10-15 18:05:30,P,,,10/08/2024,J1772COMBO
ELEC,Days Inn Liberty,52 Sullivan Ave,,Liberty,NY,12754,,1-888-717-4544,E,,Public,24 hours daily,,,6,,,CHARGESMART_EV,https://chargesmartev.com,GPS,41.783836,-74.729460,10/29/2024,322287,2024-10-29 04:09:22,,,,12/07/2023,J1772
ELEC,MB HUNTINGTON MBH 2,1103 E Jericho Turnpike,,Huntington,NY,11743,,888-758-4389,E,,Public,24 hours daily,,,,1,,ChargePoint Network,http://www.chargepoint.com/,GPS,40.834707,-73.366467,10/29/2024,194098,2024-10-29 01:31:36,,,,08/19/2021,CHADEMO J1772COMBO
ELEC,Legoland New York  Lot B,420 Harriman Dr,,Goshen,NY,10924,,1-844-623-1001,E,,Public,24 hours daily,,,4,,,LIVINGSTON,https://www.solution.energy,GPS,41.376480,-74.313930,10/29/2024,223303,2024-10-29 04:06:10,,,,06/14/2022,J1772
ELEC,SUNY NEW PALTZ STATION 2,Service building,,New Paltz,NY,12561,,888-758-4389,E,,Public,24 hours daily,,,2,,,ChargePoint Network,http://www.chargepoint.com/,GPS,41.736732,-74.084307,10/29/2024,123392,2024-10-29 01:02:12,,,,05/29/2019,J1772
ELEC,MILTON NY STATION 2,503 Geyser Rd,Town Hall Parking Lot,Ballston Spa,NY,12020,,888-758-4389,E,,Public,24 hours daily,,,2,,,ChargePoint Network,http://www.chargepoint.com/,GPS,43.044927,-73.851189,10/29/2024,225383,2024-10-29 01:46:51,,,,08/11/2022,J1772
ELEC,VANKAY PUBLIC STATION 1,5 McCrea Hill Rd,,Ballston Spa,NY,12020,,888-758-4389,E,,Public,24 hours daily,,,2,,,ChargePoint Network,http://www.chargepoint.com/,GPS,42.966588,-73.857343,10/29/2024,186632,2024-10-29 01:25:59,,,,03/27/2021,J1772
ELEC,South Colonie High School Faculty Lot,1 Raider Boulevard,,Albany,NY,12205,,1-844-623-1001,E,,Public,24 hours daily,,,4,,,LIVINGSTON,https://www.solution.energy,GPS,42.708280,-73.810900,10/29/2024,334482,2024-10-29 04:05:39,,,,05/02/2024,J1772
ELEC,NEFJ EV 2,1575 Western Ave,,Albany,NY,12203,,888-758-4389,E,,Public,Mon 9:00am - 6:00pm; Tue 9:00am - 6:00pm; Wed 9:00am - 6:00pm; Thu 9:00am - 6:00pm; Fri 9:00am - 6:00pm; Sat 9:00am - 6:00pm,,,2,,,ChargePoint Network,http://www.chargepoint.com/,GPS,42.685026,-73.847941,10/29/2024,191762,2024-10-29 01:30:29,,,,07/03/2021,J1772
ELEC,HAMILTON EDU BABBITT 1,Babbitt Pavilion at Hamilton College,"Charges for use of station will begin on August 12th, 2024. $0.20 Kwh for the first 4 hours. An idling fee of $5.00 will be charged over the 5th hour and every hour after.",Kirkland,NY,13323,,888-758-4389,E,,Public,24 hours daily,,,2,,,ChargePoint Network,http://www.chargepoint.com/,GPS,43.049000,-75.411562,10/29/2024,349029,2024-10-29 02:20:36,,,,06/22/2024,J1772
ELEC,BASIL & WICK'S EV2,3195 NY-28,,North Creek,NY,12853,,888-758-4389,E,,Public,24 hours daily,,,2,,,ChargePoint Network,http://www.chargepoint.com/,GPS,43.681416,-73.972790,10/29/2024,193576,2024-10-29 01:31:40,,,,08/07/2021,J1772
ELEC,Cortland Dodge Jeep Ram,3878 West Road,,Cortland,NY,13045,,1-844-623-1001,E,,Public,24 hours daily,,,4,2,,LIVINGSTON,https://www.solution.energy,GPS,42.594200,-76.206640,10/29/2024,352041,2024-10-29 04:06:52,,,,08/02/2024,J1772 J1772COMBO
ELEC,TOWN GLENVILLE SENIOR CTR EV3,Glenville Senior Center 32 Worden Rd,To the left of the Senior Center,Glenville,NY,12302,,888-758-4389,E,,Public,24 hours daily,,,2,,,ChargePoint Network,http://www.chargepoint.com/,GPS,42.851647,-73.946779,10/29/2024,156057,2024-10-29 01:14:53,,,,05/05/2020,J1772
ELEC,Glennpeter Jewelers,1505 Route 9,,Clifton Park,NY,12065,,1-844-623-1001,E,,Public,24 hours daily,,,4,,,LIVINGSTON,https://www.solution.energy,GPS,42.838790,-73.742660,10/29/2024,189516,2024-10-29 04:04:59,,,,09/25/2020,J1772
ELEC,New York Presbyterian Hospital,510 5th St,,Brooklyn,NY,11215,,866-816-7584,E,,Public,24 hours daily,,,6,,,EV Connect,http://evconnect.com/,GPS,40.668552,-73.978690,10/29/2024,230870,2024-10-29 03:09:38,,,,09/30/2022,J1772
ELEC,PLG 123 Linden Apts - 1st Floor Garage,123 Linden Blvd,,Brooklyn,NY,11226,,813-492-5220,E,,Public,24 hours daily,A ANDROID_PAY APPLE_PAY D M V,,20,,,EVOKE,https://evokesystems.com/,GPS,40.652610,-73.954377,10/11/2024,356915,2024-10-11 18:09:31,P,,,07/20/2023,J1772
ELEC,HVCC STEM Education Center,345 Hermes Road,,Malta,NY,12020,,1-844-623-1001,E,,Public,24 hours daily,,,6,,,LIVINGSTON,https://www.solution.energy,GPS,42.967930,-73.766530,10/29/2024,324828,2024-10-29 04:06:13,,,,10/09/2023,J1772
ELEC,Kew Garage,8002 Kew Gardens Rd,,Kew Gardens,NY,11415,,888-998-2546,E,,Public,24 hours daily,,,1,,,Blink Network,http://www.blinkcharging.com/,GPS,40.713705,-73.831217,10/29/2024,189547,2024-10-29 00:10:13,,,,05/11/2021,J1772
ELEC,The Halden,1137 Westchester Avenue,,White Plains,NY,10605,,800-663-5633,E,,Public,24 hours daily,,,9,,,Blink Network,http://www.blinkcharging.com/,GPS,41.011476,-73.726117,10/29/2024,255231,2024-10-29 00:11:16,,,,04/27/2022,J1772
ELEC,MB OF SH RP DC FAST,575 County Rd 39,,Southampton,NY,11968,,888-758-4389,E,,Public,24 hours daily,,,,1,,ChargePoint Network,http://www.chargepoint.com/,GPS,40.896664,-72.418140,10/29/2024,331104,2024-10-29 01:35:44,,,,03/26/2024,CHADEMO J1772COMBO
ELEC,Great Pines - Tesla Destination,4920 State Route 28,,Old Forge,NY,13420,,877-798-3752,E,,Public,,,,4,,,Tesla Destination,https://www.tesla.com/destination-charging,200-9,43.758776,-74.859149,07/01/2024,115201,2024-10-16 16:58:41,P,,,08/23/2017,TESLA
ELEC,BURNS MGT EXCELSIOR 2,2125 Whistler Ct,,Saratoga Springs,NY,12866,,888-758-4389,E,,Public,24 hours daily,,,2,,,ChargePoint Network,http://www.chargepoint.com/,GPS,43.093545,-73.755342,10/29/2024,173902,2024-10-29 01:00:41,,,,01/27/2021,J1772
ELEC,Country Manor Building 700,100-700 Stratford Ln,,Middletown,NY,10490,,1-844-623-1001,E,,Public,24 hours daily,,,6,,,LIVINGSTON,https://www.solution.energy,GPS,41.460060,-74.394470,10/29/2024,334519,2024-10-29 04:06:28,,,,05/02/2024,J1772
ELEC,THEINN@SARATOGA STATION 1,64 Hamilton St,Out back near parking lot,Saratoga Springs,NY,12866,,888-758-4389,E,,Public,24 hours daily,,,1,,,ChargePoint Network,http://www.chargepoint.com/,GPS,43.075880,-73.787842,10/29/2024,261196,2024-10-29 01:49:25,,,,05/23/2023,J1772
ELEC,Ford Motor Company Buffalo Stamping Plant North West Parking Lot,3663 Lake Shore Road,,Buffalo,NY,14219,,888-998-2546,E,,Public,24 hours daily,,,1,,,Blink Network,http://www.blinkcharging.com/,GPS,42.787692,-78.842511,10/29/2024,309352,2024-10-29 00:09:45,,,,11/21/2022,J1772
ELEC,COLE GROUP RIVERHILL 1,185 Van Renesselaer,,Menands,NY,12204,,888-758-4389,E,,Public,24 hours daily,,,2,,,ChargePoint Network,http://www.chargepoint.com/,GPS,42.683209,-73.740457,10/29/2024,233250,2024-10-29 01:49:21,,,,10/11/2022,J1772
ELEC,57ALEXANDER SPACE 261,57 Alexander St,,Yonkers,NY,10701,,888-758-4389,E,,Public,24 hours daily,,,1,,,ChargePoint Network,http://www.chargepoint.com/,GPS,40.939200,-73.901830,10/29/2024,349461,2024-10-29 02:09:14,,,,06/27/2024,J1772
ELEC,CDPHP,1785 U.S. 9,,Clifton Park,NY,12065,,833-692-6787,E,,Public - Credit card at all times,Contact station for hours of availability.,A ANDROID_PAY APPLE_PAY CREDIT D M,,4,,,AMPUP,https://ampup.io/,200-9,42.879679,-73.772607,10/11/2022,229918,2023-02-14 15:54:11,P,,,09/15/2022,J1772
ELEC,QUICKLEES#32 Q PORTER RD 3,6025 Porter Rd,NW Parking Area,Niagara Falls,NY,14304,,888-758-4389,E,,Public,24 hours daily,,,,1,,ChargePoint Network,http://www.chargepoint.com/,GPS,43.107326,-78.994530,10/29/2024,325073,2024-10-29 02:13:35,,,,01/11/2024,CHADEMO J1772COMBO
ELEC,Motor Parkway Plaza - Tesla Supercharger,694 Motor Parkway,,Hauppauge,NY,11788,,877-798-3752,E,,Public,24 hours daily. Please check Tesla's online station map to see if an adapter is required at this location.,A D Debit M V,,,8,,Tesla,https://www.tesla.com/supercharger,GPS,40.806913,-73.238541,07/01/2024,196519,2024-08-14 18:58:22,P,,,09/25/2021,TESLA
ELEC,55 East End Ave,55 East End Ave,,New York,NY,10028,,1-844-623-1001,E,,Public,24 hours daily,,,6,,,LIVINGSTON,https://www.solution.energy,GPS,40.772000,-73.946390,10/29/2024,223283,2024-10-29 04:04:57,,,,03/24/2022,J1772
ELEC,S.A.N.Y. PARKING THREE,160 School Ln,,Frankfort,NY,13340,,888-758-4389,E,,Public,24 hours daily,,,1,,,ChargePoint Network,http://www.chargepoint.com/,GPS,43.076122,-75.169136,10/29/2024,180879,2024-10-29 01:17:54,,,,01/27/2021,J1772
ELEC,TPWC TPWC 6,2594 Western Av,Bldg 4,Altamont,NY,12009,,888-758-4389,E,,Public,24 hours daily,,,1,,,ChargePoint Network,http://www.chargepoint.com/,GPS,42.714246,-73.936013,10/29/2024,227766,2024-10-29 01:32:00,,,,09/17/2022,J1772
ELEC,Carnegie Hill,215 E 96th St,,New York,NY,10128,,888-998-2546,E,,Public,24 hours daily,,,2,,,Blink Network,http://www.blinkcharging.com/,GPS,40.784865,-73.948526,10/29/2024,164751,2024-10-29 00:11:42,,,,06/26/2019,J1772
